user_input,retrieved_contexts,response,faithfulness,answer_relevancy,nv_context_relevance
How do KRAS mutations influence response to EGFR-targeted therapy in colorectal cancer?,"['in this prospective single arm multi center in terventi on study patients with resectable microsatellite stablect 3""4 nxm 0 colon cancer will be treated with two courses of neoadjuvant and two courses of adjuvant capecitabine and oxaliplat in the primary endpoint is the pathological tumor response to neoadjuvant chemo therapy per cms secondaryendpoints are radiological tumor response the prognostic value of these responses for recurrence free survival and overall survival and the differences in cms classificati on of the same tumor before and after neoadjuvant chemo therapy the study is scheduled to be per formed in "" dutch hospitals the first patient was in cluded in february necessary to proceed to future studies in which neo adjuvant chemo therapy may be with hold in patients with a specific cms subtype who show no benefit from chemo therapy and for whom possible new treatments can be in vestigatedtrial registrati on this study has been registered in the netherlands trial register nl 8177 at "" wwwtrialregisternltrial 8177 the study has been approved by the medical ethics committee utrecht mec 18712 keywords colon cancer consensus molecular subtypes neoadjuvant chemo therapy surgery colon cancer is one of the most comm on types of cancer in the netherlands with an in cidence of around patients in approximately of patients present with local disease stage iiii curativesurgery followed by adjuvant systemic chemo therapy isstandard of care in patients with microsatellite stablemss high risk stage ii and stage iii colon cancer despite this in tensive treatment "" of the patients develop metastatic disease these patients do not benefitenough from the current adjuvant systemic the rapymoreover it is estimated that will not develop metastases after surgery alone and are the refore over treated with adjuvant chemo therapy identifying the patients at risk of developing metastases as well as thoseresponding to the rapy is a clear unmet need in colon cancer care the developme', 'Crowley method The CIs of month and year survival probabilities were calculated based on the Greenwood™s for mula HRs and CIs were estimated by Cox regressi on We did subgroup analyses divided by prespecified baseline patient and disease characteristic variables in cluding RAS status for DCR PFS and OS We also did a prespecified exploratory analysis of potential predictive biomarkers in blood samples We did all analyses with SAS V 94 Patient characteristics Between October and January patients with unresectable metastatic colorectal cancer were enrolled All patients were eligible and received the study medicati on Table summarises the baseline characteristics of all enrolled patients The median number of previous lines of palliative chemo therapy was range "" and patients had received or ‰¥ prior lines of chemo therapy for metastatic disease respectively The data cut off date was January with median follow up of months IQR ""efficacy The centrally as sessed DCR was CI to one sided p 00001 two patients had a partial response and had a stable disease in cluding unconfirmed PR table figure A total of patients had a reducti on in target lesi on size from baseline figure Time on treatment for all patients is ‰¥ ‰¥ Male Female months ‰¥ months Right sided colon Left sided colorectum Lung Liver Lymph node Per itoneum Age years Sex ECOG per formance status Primary site Number of metastatic site Metastatic an Time from start of first line chemo therapy Number of previous palliative chemo therapy Previous chemo therapy and reas on for discontinuati on Fluoropyrimidine Refractory In tolerant Oxaliplat in Irinotecan TAS 102 trifluridinetipiracil Angiogenesis in hibit or Anti EGFR in hibit or Refractory In tolerant Refractory In tolerant Refractory Refractory In tolerant Refractory In tolerant Iwasa a 0 S et a 0 al ESMO 20205 e 000776 101136 esmo 2020000776 0 c access Table Best response to treatment Complete response Partial response Stable disease Progressive disease Not', 'with a 96.3% overall agreement. The clinical outcome of patients who were EGFR-mutati on detected by the EGFR PCR test was very similar to the entire EURTAC cohort. The concordance between the EGFR PCR test and Sanger sequencing was 90.6%. In 78.9% of the discordant samples the EGFR PCR test result was confirmed by a sensitive deep sequencing assay. This retrospective study demonstrates the clinical utility of the EGFR PCR test in the accurate selecti on of patients for anti-EGFR TKI the rapy. The EGFR PCR test demonstrated improved per formance relative to Sanger sequencing. This study was funded by Roche. The funders contributed to the study design data collecti on analysis decisi on to publish and preparati on of the manuscript. The efficacy of many novel targeted cancer the rapies can be predicted by the detecti on of specific biomarkers in the tumor. The FDA has in dicated that if the identificati on of a specific biomarker is required for the safe and efficacious administrati on of a drug a well-validated FDA approved compani on diagnostic assay is required for that drug. The optimal approval path for a new targeted the rapy and its compani on diagnostic is a parallel clinical development process that in volves clinical trials for the in vestigational agent where the in vestigational diagnostic test is used to either select patients for the trials or to predict response to treatment and ends ideally with simultaneous health authority approval of the drug and the compani on diagnostic. Successful examples of this in clude the co-development (and co-approval) of the BRAF in hibit or vemurafenib and its compani on diagnostic BRAF V 600 E mutati on assay for BRAF-mutant metastatic melanoma and the ALK in hibit or crizotinib and its compani on diagnostic ALK fusi on gene test in advanced ALK-fusi on positive non-small cell lung cancer (NSCLC) patients. However in some cases predictive biomarkers for a targeted the rapy are not recognized until after the drug is fir', '16966692 Barrier A Prognosis of stage II colon cancer by non-neoplastic mucosa gene expressi on profiling On cogene 2007 26 2642 2648 17043639 Beer DG Gene-expressi on profiles predict survival of patients with lung adeno carcinoma Nat. Med. 2002 8 816 824 12118244 Bolstad BM A comparis on of normalizati on The genotype +6/+6 predicted a higher ORR among active/former smokers compared to +6/-6 genotype (100% vs. 50%; p =?0.085). Overall the 3 R/3 R genotype predicted a higher ORR (100%) over the rest VNTR polymorphisms (p =?0.055). The presence of 3 R/3 R genotype significantly correlated with a superi or ORR in patients without EGFR activating mutations (100%) compared to 2 R/2 R 2 R/3 R and 3 R/4 R genotype (77.8% 33.3% and 0% respectively; p =?0.017). After a median follow-up of 21 months a trend to wards a better PFS although not significant was found among subjects showing 3 R/3 R polymorphisms (p =?0.089). A significantly superi or OS was found in patients showing 3 R/3 R genotype rather than other VNTR polymorphisms (p =?0.019). No significant correlati on with the to xicity was observed.', 'this post hoc exploratory analysis examined the effect of prognostic factors on outcomes in the randomized double blind phase study of trifluridine tipiracil ftdtpi plus best supportive care bsc versus placebo plus bsc in patients with mcrc refractory to standard chemotherapies recourse trial patients were redivided by prognosis into two subgroups those with metastatic sites at randomisati on low tumour burden and ‰¥ months from diagnosis of metastatic disease to randomisati on in dolent disease were in cluded in the good prognostic characteristics gpc subgroup the remaining patients were considered to have poor prognostic characteristics ppc gpc patients n 386 had improved outcome versus ppc patients n 414 in both the trifluridinetipiracil and placebo arms gpc patients receiving trifluridinetipiracil n 261 had an improved median overall survival vs months hr ci to p 00001 and progressi on free survival vs months hr ci to p 00001 than ppc patients receiving trifluridinetipiracil n 273 improvements in survival were irrespective of age eastern cooperative on cology group per formance status ecog ps kras mutational status and site of metastases at randomisati on in the trifluridinetipiracil arm time to deteriorati on of ecog ps to ‰¥ and proporti on of patients with ps 0"" discontinuing treatment were longer for gpc than for ppc patients vs months and vs respectively low tumour burden and in dolent disease were factors of good prognosis in late line mcrc with patients experiencing longer progressi on free survival and greater overall survival']","KRAS mutations significantly influence the response to EGFR-targeted therapy in colorectal cancer, as patients with KRAS mutations typically do not benefit from such treatments. Studies have shown that the presence of KRAS mutations is associated with a lack of response to anti-EGFR therapies, leading to poor clinical outcomes in these patients [CTX 2][CTX 3]. Consequently, identifying KRAS status is crucial for selecting appropriate treatment options, as those with wild-type KRAS are more likely to respond positively to EGFR inhibitors [CTX 4]. However, the limitations of current studies include variability in patient populations and treatment regimens, which may affect the generalizability of the findings [CTX 5].",0.5,0.9712457073467443,0.5
What is the role of BRAF V600E mutations in colorectal tumor progression?,"['provide biological in sights into the regulati on of BRAF on cogene dependence and identify strategies to optimize outcomes in BRAF-mutant NSCLC patients. On cogenic mutations in the BRAF kinase occur in 6""8% of nonsmall cell lung cancers (NSCLCs) accounting for more than 90000 deaths annually worldwide. The biological and clinical relevance of these BRAF mutations in NSCLC is in completely under stood. Here we demonstrate that human NSCLC cells with BRAFV 600 E but not other BRAF mutations in itially are sensitive to BRAF-in hibit or treatment. However these BRAFV 600 E NSCLC cells rapidly acquire resistance to BRAF in hibiti on through at least one of two discrete molecular mechanisms: (i) loss of full-length BRAFV 600 E coupled with expressi on of an aberrant form of BRAFV 600 E that retains RAF pathway dependence or (ii) constitutive autocrine EGF recept or (EGFR) signaling driven by c-Jun""mediated EGFR ligand expressi on. BRAFV 600 E cells with EGFR-driven resistance are characterized by hyperphosphorylated prote in kinase AKT""', '14 was as sociated with a significantly worse survival rate this study showedthat the expressi on of nop 14 was upregulated incrc but its role in pathogenesis requires further research and confirmation the mrps 23 gene which is responsible for encodinga 28 s subunit prote in has been found to be over expressed in breast cancer uterine cervical cancer hcc colorectal cancer and uterine leiomyoma as revealed by gao in hibitingmrps 23 could lead to a significant reducti on in breast cancer metastasis by in hibiting the emt phenotype pu found that high mrps 23 levels can predict poorclinical outcomes in hcc although the expression of mrps 23 is in creased in crc its specific pathogenesisremains unclearmak 16 encodes a ribosomal prote in and plays an important role in ribosome biogenesis throughout the cellcycle in this study it was found that mutations inmak 16 can in duce cell cycle arrest at g 1 phase during which the cell synthesizes mrna and proteins in preparati on for cell divisi on at present there is still nostudy of the role of mak 16 in the pathogenesis of tumours which requires further research to confirm in this paper a', 'Cell via bility analysis AM 38 and normal human as trocytes was purchased from JCRB Cell Bank and Scien Cell Research Laboratories respectively Tumorsphere lines were cultured in serumfree neural stem cell medium as previously described [] Normal human as trocytes were cultured with as trocyte medium Scien Cell To as sess cell via bility primary cultured cells were dissociated into single cells and seeded into 96 well plates at a density of cellswell After a 0 h dabrafenib Selleck and trametinib Selleck were serially diluted and added to the wells Cell via bility was measured using the Cell Titer Glo Promega assay at day and the were in dicated as via bility of the DMSO controlsh RNA cell line generati on To knockdown BRAF 293 T cells were transfected with lentiviral vect or packaging plasmid DNA containing a 0 μg of Human BRAF sh RNA TRCN 0000381693 GP and a 0μg of a 0 p VSVg Rev a 0 with Lipofectamine""¢ TRCN 0000196844 Sigma Aldrich a 0μg of a 0 p HIVThermo Fisher Scientific YMG 62 and AM 38 cells were in fected with lentivirus in polybrene a 0μgm L for a 0 h Two days later the cells were selected with puromyc in a 0μgm L for a 0 days and used for experiments GIPZ nonsilencing lentiviral sh RNA Control RHS 4348 Horiz on Discovery was used as a nonsilencing NS control Immunohistochemistry Tumor tissue specimens were fixed in neutral buffered for malin and embedded in paraff in Hematoxyl in and eosin staining was per formed using standard procedures For immunohistochemical analysis 5µmthick sections were deparaffinized treated with H 2 O 2 in methanol rehydrated and heated for a 0 min for antigen retrieval After blocking with serum tissue sections were in cubated with primary antibodies against CD 34 Novus Biologicals LAT 1 Cell Signaling Technology phospho MEK Cell Signaling Technology phospho ERK Bethyl Laboratories and c Myc Cell Signaling Technology at a 0°C over night The next day sections were washed with PBS in cubated with biotinylated secondary', 'in a spectrum of consequences ranging from lethal developmental abnormalities to several forms of aggressive cancer nusse and clevers most prominently colorectal cancer crc is in itiated by genetic mutations that constitutively activate wnt signaling kahn secreted wnt ligands trigger an in tracellular biochemical cascade in the receiving cells that culminates in the calibrated expressi on of target genes mosimann this transcriptionalresponse is or chestrated by nuclear bcaten in that acts as a ˜scaffold™ to buttress a host of cofactors to cisregulatory elements occupied by the tcflef transcripti on factors valenta among the cofactors the two paralogs bcl 9 and bcl 9 l referred to as bcl 99 l and pygo 12 proteins reside with in the wntbcaten in transcriptional complex and their concerted acti on isrequired to efficiently activate wnttarget gene expressi on kramps parker for correspondencekonradbaslerimlsuzhch kbandreasmoorbsseethzchaemclaudiocantuliuse cc these authors contributedequally to this workpresent address ¡divisi on of molecular pathology the netherlands cancer in stituteamsterdam netherlandscompeting in terests the authors declare that nocompeting in terests exist', ""in an amino acid substituti on at positi on 22 from a glutamine (Q) to a lysine (K) in KRAS. All of these amino acid substitutions occurred along the GTP binding doma in of KRAS. KRAS binds to GTP in the active state and possesses an in trinsic enzymatic activity which cleaves the terminal phosphate of the nucleotide converting it to GDP. Upon conversi on of GTP to GDP KRAS is turned off. The result of these mutations is constitutive activati on of KRAS signaling pathways. Once it is turned on it recruits and activates proteins necessary for the propagati on of growth fact or and other receptors' signal such as c-Raf and PI 3-kinase. 7.7% of KRAS-as sociated lung cancers were adenocarcinom as () and 6.1% of KRAS mutations as sociated with ˜low differentiati on™ cancers and 7.4% of KRAS mutations were ˜mid differentiati on™ cancers (). In our sample set 6.3% of KRAS-as sociated lung cancers metastasized to local regions 9.1% to lymphs and 5.1% of cancers metastasized to distant ans in our sample set (). Missense mutati on distributi on in the exons and functional domains of TP 53 Abnormality of the TP 53 gene is one of the most significant events in lung cancers and plays an important role in the tumorigenesis of lung epithelial cells.""]","BRAF V600E mutations play a significant role in colorectal tumor progression by contributing to the activation of signaling pathways that promote cancer cell growth and survival. These mutations are associated with a worse prognosis in colorectal cancer, as they can lead to constitutive activation of the MAPK pathway, which is crucial for tumor development and progression [CTX 4]. Additionally, the presence of BRAF V600E mutations can influence the response to targeted therapies, as these tumors may develop resistance mechanisms over time [CTX 1]. However, the specific mechanisms by which BRAF V600E mutations drive colorectal cancer progression require further investigation to fully understand their impact on tumor biology and treatment outcomes [CTX 2].",0.6666666666666666,0.9692525519048008,0.0
What molecular mechanisms drive resistance to MEK inhibitors in colorectal cancer?,"['in this prospective single arm multi center in terventi on study patients with resectable microsatellite stablect 3""4 nxm 0 colon cancer will be treated with two courses of neoadjuvant and two courses of adjuvant capecitabine and oxaliplat in the primary endpoint is the pathological tumor response to neoadjuvant chemo therapy per cms secondaryendpoints are radiological tumor response the prognostic value of these responses for recurrence free survival and overall survival and the differences in cms classificati on of the same tumor before and after neoadjuvant chemo therapy the study is scheduled to be per formed in "" dutch hospitals the first patient was in cluded in february necessary to proceed to future studies in which neo adjuvant chemo therapy may be with hold in patients with a specific cms subtype who show no benefit from chemo therapy and for whom possible new treatments can be in vestigatedtrial registrati on this study has been registered in the netherlands trial register nl 8177 at "" wwwtrialregisternltrial 8177 the study has been approved by the medical ethics committee utrecht mec 18712 keywords colon cancer consensus molecular subtypes neoadjuvant chemo therapy surgery colon cancer is one of the most comm on types of cancer in the netherlands with an in cidence of around patients in approximately of patients present with local disease stage iiii curativesurgery followed by adjuvant systemic chemo therapy isstandard of care in patients with microsatellite stablemss high risk stage ii and stage iii colon cancer despite this in tensive treatment "" of the patients develop metastatic disease these patients do not benefitenough from the current adjuvant systemic the rapymoreover it is estimated that will not develop metastases after surgery alone and are the refore over treated with adjuvant chemo therapy identifying the patients at risk of developing metastases as well as thoseresponding to the rapy is a clear unmet need in colon cancer care the developme', ""clinicopathological characteristics of patients with colorectal carcinoma characteristic sex male female age years ‰¥ site of lesi on colon rectum differentiati on poor well tumor size cm ‰¥ pathological type adeno carcinoma others lymph node metastasis no yes liver metastasis no yes stage iii iiiiv cea normal high ca ' normal high ca ' normal high afisher's exact test all others were as sessed using a χ2 test defb 4 a defens in 4 a'''''''''''''''''''''''''''''''''''''''''''''''''''''high n low n 0009 a 0003 a 0575 a 0039 a poor survival furthermore defb 4 a expressi on was upregu'lated in patients with crc with advanced and metastatic cancer patients with crc with high defb 4 a expressi on had poor survival in additi on knockdown of defb 4 a affected the migrati on ability of crc cells tcga data of patients with crc were used to identify the degs between the long os days and short os days groups in additi on mrna expressi on was compared between tumor tissues and normal tissues in the same database defb 4 a was highly expressed in tumors and as sociated with a poor prognosis defb 4 a upregulati on was as sociated with poor prognosis and defb 4 a expressi on was significantly upregulated in patients with large tumors advanced cancer stage lymph node metastasis and liver metastasis another study used the gene expressi on omnibus database to screen genes that are in creased in patients with recurrence hierarchical clustering and pathway analyses revealed that thrombospond in thbs 2 and cart"", ""colorectal carcinogenesis is a multi'step process starting from normal crypts to aberrant crypt foci then to polyps adenoma and eventually adeno carcinoma it has been reported that in dividuals with ibd may have an in creased risk of developing crc which is directly proportional to the extent and durati on of their disease however the exact mechanism and durati on required for chronic colitis to develop into adenoma and then adeno carcinoma remains unclear it has been suggested that patients with ibd have an in creased risk of crc following the in flammati on'dysplasia'carcinoma model in cluding dysplasia and crc as primary conse'quences of chronic in flammati on however there are currently still no defined molecular biomarkers or existing monitoring protocols for detecting the occurrence of a malignant tumor except for frequent colonoscopy examinations in the present study an acute colitis'chronic colitis'adenoma'adeno carcinoma model was successfully constructed via aomdss in ducti on using this model tlr 9 expressi on levels were discovered to be upregulated as the severity of the colorectal lesions in creased which in dicated that tlr 9 prote in expressi on levels may be continuously activated during colitis'crc development tlr 9 is a critical prote in as sociated with in nate and acquired immunity and it has been demonstrated to serve a significant role in the development of colitis and sporadic crc however the mechanism by which tlr 9 regulates the devel'opment of crc remains to be elucidatedinterestingly ihc analysis revealed that the expressi on levels of nf'κb and ki 67 were simultaneously upregulated alongside tlr 9 expressi on levels notably in hibiting tlr"", 'in a spectrum of consequences ranging from lethal developmental abnormalities to several forms of aggressive cancer nusse and clevers most prominently colorectal cancer crc is in itiated by genetic mutations that constitutively activate wnt signaling kahn secreted wnt ligands trigger an in tracellular biochemical cascade in the receiving cells that culminates in the calibrated expressi on of target genes mosimann this transcriptionalresponse is or chestrated by nuclear bcaten in that acts as a ˜scaffold™ to buttress a host of cofactors to cisregulatory elements occupied by the tcflef transcripti on factors valenta among the cofactors the two paralogs bcl 9 and bcl 9 l referred to as bcl 99 l and pygo 12 proteins reside with in the wntbcaten in transcriptional complex and their concerted acti on isrequired to efficiently activate wnttarget gene expressi on kramps parker for correspondencekonradbaslerimlsuzhch kbandreasmoorbsseethzchaemclaudiocantuliuse cc these authors contributedequally to this workpresent address ¡divisi on of molecular pathology the netherlands cancer in stituteamsterdam netherlandscompeting in terests the authors declare that nocompeting in terests exist', 'Crowley method The CIs of month and year survival probabilities were calculated based on the Greenwood™s for mula HRs and CIs were estimated by Cox regressi on We did subgroup analyses divided by prespecified baseline patient and disease characteristic variables in cluding RAS status for DCR PFS and OS We also did a prespecified exploratory analysis of potential predictive biomarkers in blood samples We did all analyses with SAS V 94 Patient characteristics Between October and January patients with unresectable metastatic colorectal cancer were enrolled All patients were eligible and received the study medicati on Table summarises the baseline characteristics of all enrolled patients The median number of previous lines of palliative chemo therapy was range "" and patients had received or ‰¥ prior lines of chemo therapy for metastatic disease respectively The data cut off date was January with median follow up of months IQR ""efficacy The centrally as sessed DCR was CI to one sided p 00001 two patients had a partial response and had a stable disease in cluding unconfirmed PR table figure A total of patients had a reducti on in target lesi on size from baseline figure Time on treatment for all patients is ‰¥ ‰¥ Male Female months ‰¥ months Right sided colon Left sided colorectum Lung Liver Lymph node Per itoneum Age years Sex ECOG per formance status Primary site Number of metastatic site Metastatic an Time from start of first line chemo therapy Number of previous palliative chemo therapy Previous chemo therapy and reas on for discontinuati on Fluoropyrimidine Refractory In tolerant Oxaliplat in Irinotecan TAS 102 trifluridinetipiracil Angiogenesis in hibit or Anti EGFR in hibit or Refractory In tolerant Refractory In tolerant Refractory Refractory In tolerant Refractory In tolerant Iwasa a 0 S et a 0 al ESMO 20205 e 000776 101136 esmo 2020000776 0 c access Table Best response to treatment Complete response Partial response Stable disease Progressive disease Not']","Resistance to MEK inhibitors in colorectal cancer can be driven by various molecular mechanisms, including the activation of alternative signaling pathways and genetic mutations. For instance, the constitutive activation of Wnt signaling due to genetic mutations can lead to resistance by bypassing the effects of MEK inhibition [CTX 4]. Additionally, the upregulation of specific proteins, such as DEFBA, has been associated with poor prognosis and may contribute to the survival of cancer cells despite MEK inhibition [CTX 2]. However, the exact interplay of these mechanisms and their contributions to resistance remain to be fully elucidated, indicating a need for further research in this area.",0.25,0.0,0.0
Are there strategies described to overcome 5-FU resistance in colon cancer?,"['in this prospective single arm multi center in terventi on study patients with resectable microsatellite stablect 3""4 nxm 0 colon cancer will be treated with two courses of neoadjuvant and two courses of adjuvant capecitabine and oxaliplat in the primary endpoint is the pathological tumor response to neoadjuvant chemo therapy per cms secondaryendpoints are radiological tumor response the prognostic value of these responses for recurrence free survival and overall survival and the differences in cms classificati on of the same tumor before and after neoadjuvant chemo therapy the study is scheduled to be per formed in "" dutch hospitals the first patient was in cluded in february necessary to proceed to future studies in which neo adjuvant chemo therapy may be with hold in patients with a specific cms subtype who show no benefit from chemo therapy and for whom possible new treatments can be in vestigatedtrial registrati on this study has been registered in the netherlands trial register nl 8177 at "" wwwtrialregisternltrial 8177 the study has been approved by the medical ethics committee utrecht mec 18712 keywords colon cancer consensus molecular subtypes neoadjuvant chemo therapy surgery colon cancer is one of the most comm on types of cancer in the netherlands with an in cidence of around patients in approximately of patients present with local disease stage iiii curativesurgery followed by adjuvant systemic chemo therapy isstandard of care in patients with microsatellite stablemss high risk stage ii and stage iii colon cancer despite this in tensive treatment "" of the patients develop metastatic disease these patients do not benefitenough from the current adjuvant systemic the rapymoreover it is estimated that will not develop metastases after surgery alone and are the refore over treated with adjuvant chemo therapy identifying the patients at risk of developing metastases as well as thoseresponding to the rapy is a clear unmet need in colon cancer care the developme', ""5 fu in colon cancer cells via the pi 3 kakt pathwaycorrespondence to dr xiangbo chen endoscopy center the quanzhou first hospital affiliated to fujian medical university east street licheng quanzhou fujian pr chinaemail coloboyeahnetkey words ginsenoside rg 3 colon cancer 5 fluorouracil pi 3 kakt colon cancer is a comm on malignant tumor of the digestive tract located in the colon which mainly occurs at the juncti on of the rectum and the sigmoid colon statistics show that the highest in cidence of colon cancer is in the age group of years the ratio of male to female is and the in cidence of colon cancer ranks third among all cases of gastrointestinal tumors the 5 year survival rate of patients with colon cancer is approximately yet the 5 year survival rate of patients with advanced stage disease is as low as since the early symptoms of patients with colon cancer are not obvious only about of patients can be diagnosed at the early stage of the disease chemo therapy is one of the most important treatments for patients with advanced colon cancer of which 'fluorouracil 'fu is the most widely used 5 fu in hibits the proliferati on in vasi on and migrati on of tumor cells by in terfering with the nucleic acid metabolism of tumor cells but it is also toxic to normal cells causing serious adverse reactions even endangering the life safety of patients severely limiting its clinical applicati on previous research has shown that 5 fu combined with other agents may reduce the required dosage of 5 fu consequently reducing the adverse reactions caused by 5 fu without affecting or even improving the efficacy of chemo therapy compared with chemical drugs and biopharmaceuticals multicomponent multitarget and less adverse reactions are unique advantages of traditional chinese medicine for the treatment of diseases in patients with colon cancer chinese medicine can improve patient immunity reduce the side effects of radio therapy and chemo therapy or enhance drug sensitivity in hibi"", ""clinicopathological characteristics of patients with colorectal carcinoma characteristic sex male female age years ‰¥ site of lesi on colon rectum differentiati on poor well tumor size cm ‰¥ pathological type adeno carcinoma others lymph node metastasis no yes liver metastasis no yes stage iii iiiiv cea normal high ca ' normal high ca ' normal high afisher's exact test all others were as sessed using a χ2 test defb 4 a defens in 4 a'''''''''''''''''''''''''''''''''''''''''''''''''''''high n low n 0009 a 0003 a 0575 a 0039 a poor survival furthermore defb 4 a expressi on was upregu'lated in patients with crc with advanced and metastatic cancer patients with crc with high defb 4 a expressi on had poor survival in additi on knockdown of defb 4 a affected the migrati on ability of crc cells tcga data of patients with crc were used to identify the degs between the long os days and short os days groups in additi on mrna expressi on was compared between tumor tissues and normal tissues in the same database defb 4 a was highly expressed in tumors and as sociated with a poor prognosis defb 4 a upregulati on was as sociated with poor prognosis and defb 4 a expressi on was significantly upregulated in patients with large tumors advanced cancer stage lymph node metastasis and liver metastasis another study used the gene expressi on omnibus database to screen genes that are in creased in patients with recurrence hierarchical clustering and pathway analyses revealed that thrombospond in thbs 2 and cart"", 'gment resecti on of a right hemicolectomy and sigmoid colectomy with no intra or postoperative adverseevents in our patient we tried preserving as much colon as possible considering the patient™s quality of life after surgery in additi on to per forming sufficient d 3 dissecti on of course the meaning of preserving colon in terms of patientpostoperative quality of life needs to be more clearly as sessed in futurewe encountered a rare case of advanced quadruple scrcsf or which we achieved a curative resecti on that required twoanastomoses through a laparoscopic approach we suggest thatlaparoscopic surgery that requires multiple anastomoses for advanced scrcs can be a safe procedure even if the number of colorectal cancers is multiplefigure abdominal ct scan revealing a tumor of the as cending colon aarrowhead a tumor in the descending colon b arrowhead and two tumors in the sigmoid colon are also visible c d arrowheadadvanced cancer arising from the as cending descending andthe sigmoid colon it was reported that scrcs often occur inthe same or adjacent segment of the large in testine and thatother smaller colorectal cancers in the patients with scrcs wereusually smaller and of lower pathological grade and t staging', 'Crowley method The CIs of month and year survival probabilities were calculated based on the Greenwood™s for mula HRs and CIs were estimated by Cox regressi on We did subgroup analyses divided by prespecified baseline patient and disease characteristic variables in cluding RAS status for DCR PFS and OS We also did a prespecified exploratory analysis of potential predictive biomarkers in blood samples We did all analyses with SAS V 94 Patient characteristics Between October and January patients with unresectable metastatic colorectal cancer were enrolled All patients were eligible and received the study medicati on Table summarises the baseline characteristics of all enrolled patients The median number of previous lines of palliative chemo therapy was range "" and patients had received or ‰¥ prior lines of chemo therapy for metastatic disease respectively The data cut off date was January with median follow up of months IQR ""efficacy The centrally as sessed DCR was CI to one sided p 00001 two patients had a partial response and had a stable disease in cluding unconfirmed PR table figure A total of patients had a reducti on in target lesi on size from baseline figure Time on treatment for all patients is ‰¥ ‰¥ Male Female months ‰¥ months Right sided colon Left sided colorectum Lung Liver Lymph node Per itoneum Age years Sex ECOG per formance status Primary site Number of metastatic site Metastatic an Time from start of first line chemo therapy Number of previous palliative chemo therapy Previous chemo therapy and reas on for discontinuati on Fluoropyrimidine Refractory In tolerant Oxaliplat in Irinotecan TAS 102 trifluridinetipiracil Angiogenesis in hibit or Anti EGFR in hibit or Refractory In tolerant Refractory In tolerant Refractory Refractory In tolerant Refractory In tolerant Iwasa a 0 S et a 0 al ESMO 20205 e 000776 101136 esmo 2020000776 0 c access Table Best response to treatment Complete response Partial response Stable disease Progressive disease Not']","Yes, there are strategies described to overcome 5-FU resistance in colon cancer. One approach involves combining 5-FU with other agents, which may reduce the required dosage of 5-FU and consequently minimize adverse reactions while maintaining or even improving chemotherapy efficacy [CTX 2]. Additionally, traditional Chinese medicine has been suggested as a means to enhance drug sensitivity and improve patient immunity, potentially addressing the limitations of 5-FU alone [CTX 2]. However, the effectiveness of these strategies may vary among patients, and further research is needed to establish their clinical applicability [CTX 1].",0.7,0.0,0.5
How does the PI3K/AKT pathway contribute to colorectal cancer progression?,"[""5 fu in colon cancer cells via the pi 3 kakt pathwaycorrespondence to dr xiangbo chen endoscopy center the quanzhou first hospital affiliated to fujian medical university east street licheng quanzhou fujian pr chinaemail coloboyeahnetkey words ginsenoside rg 3 colon cancer 5 fluorouracil pi 3 kakt colon cancer is a comm on malignant tumor of the digestive tract located in the colon which mainly occurs at the juncti on of the rectum and the sigmoid colon statistics show that the highest in cidence of colon cancer is in the age group of years the ratio of male to female is and the in cidence of colon cancer ranks third among all cases of gastrointestinal tumors the 5 year survival rate of patients with colon cancer is approximately yet the 5 year survival rate of patients with advanced stage disease is as low as since the early symptoms of patients with colon cancer are not obvious only about of patients can be diagnosed at the early stage of the disease chemo therapy is one of the most important treatments for patients with advanced colon cancer of which 'fluorouracil 'fu is the most widely used 5 fu in hibits the proliferati on in vasi on and migrati on of tumor cells by in terfering with the nucleic acid metabolism of tumor cells but it is also toxic to normal cells causing serious adverse reactions even endangering the life safety of patients severely limiting its clinical applicati on previous research has shown that 5 fu combined with other agents may reduce the required dosage of 5 fu consequently reducing the adverse reactions caused by 5 fu without affecting or even improving the efficacy of chemo therapy compared with chemical drugs and biopharmaceuticals multicomponent multitarget and less adverse reactions are unique advantages of traditional chinese medicine for the treatment of diseases in patients with colon cancer chinese medicine can improve patient immunity reduce the side effects of radio therapy and chemo therapy or enhance drug sensitivity in hibi"", ""clinicopathological characteristics of patients with colorectal carcinoma characteristic sex male female age years ‰¥ site of lesi on colon rectum differentiati on poor well tumor size cm ‰¥ pathological type adeno carcinoma others lymph node metastasis no yes liver metastasis no yes stage iii iiiiv cea normal high ca ' normal high ca ' normal high afisher's exact test all others were as sessed using a χ2 test defb 4 a defens in 4 a'''''''''''''''''''''''''''''''''''''''''''''''''''''high n low n 0009 a 0003 a 0575 a 0039 a poor survival furthermore defb 4 a expressi on was upregu'lated in patients with crc with advanced and metastatic cancer patients with crc with high defb 4 a expressi on had poor survival in additi on knockdown of defb 4 a affected the migrati on ability of crc cells tcga data of patients with crc were used to identify the degs between the long os days and short os days groups in additi on mrna expressi on was compared between tumor tissues and normal tissues in the same database defb 4 a was highly expressed in tumors and as sociated with a poor prognosis defb 4 a upregulati on was as sociated with poor prognosis and defb 4 a expressi on was significantly upregulated in patients with large tumors advanced cancer stage lymph node metastasis and liver metastasis another study used the gene expressi on omnibus database to screen genes that are in creased in patients with recurrence hierarchical clustering and pathway analyses revealed that thrombospond in thbs 2 and cart"", 'pathway aberrations of which isfig the putative relationship between obesity and colorectal cancer evoluti on pathways by cellular ctnnb 1 status based on the data by the current study our study suggests that there is no as sociati on between obesity and ctnnb 1 expressi on 0 cshokrani bmc gastroenterology page of important in the evoluti on of most sporadic crc in summary there is positive nuclear staining in crcs which was as sociated with the positive status for nuclear ctnnb 1 in tensity adjusted or 95 ci "" p for positive nuclear staining compared to noncrc samples normal or advanced adenoma this shows that advanced adenom as and crcswere as sociated with activati on of caten in in physically fit over weight and obese patients fig advanced adenoma and crc were as sociated with activati on of caten in in physically fit over weight and obese patients thus participati on of obesity and wntpathway seem to be in dependent crc factors in africanamerican patientsinflammationdriven activati on ofwnt signaling as a potential pathway linking obesity tothe development of crc needs to be in vestigated further in the african american populati on this might provideinsights into the identificati on of new the rapeutic targets to reduce the burden of obesityassociated crcabbreviationscrc colorectal cancer wat white adipose tissue aa african americans', ""the number of patients with colorectal cancer crc world'wide is in creasing annually with an in cidence rate of in chronic in flammati on is the leading cause of immune cell in filtrati on and proliferati on and it has been suggested to be a high'risk fact or for colitis'as sociated crc cac in flammatory bowel disease ibd which encompasses both ulcerative colitis uc and crohn's disease was established as an important precurs or to crc for example the in cidence of ibd'as sociated crc in patients with uc was reported to have a cumulative risk rate of at years at years and at years of disease durati on the refore further in vivo studies are required for researchers to gain an improved under standing of the molecular mechanisms of cac which may provide more exact molecular targets for the diagnosis and treatment of cac during the early stages toll'like recept or tlr 9 a member of the tlr family is located in the cytoplasm and in tracellular endosomes and can be activated by unmethylated bacterial cpg dna the activati on of the tlr 9 signaling pathway in duces a type t helper cell immune response and stimulates the proliferati on of b cells thus protecting the host from external microbial in vasi on ' multiple studies have revealed that abnormal tlr 9 expressi on levels were in volved in the pathogenesis and progressi on of uc in additi on abnormal expressi on levels of tlr 9 were also identified during the tumorigenesis and development of crc 'nf'κb is an important transcripti on fact or in volved in various biological processes in cluding in flammatory reac'tions immune responses apoptosis and proliferati on in fact nf'κb is regarded as a molecular hub that links in flam'mati on and cancer it was previously suggested that nf'κb may serve"", '1. Heterogeneity of cancer-as sociated stroma according to examined tumor locations The clinicopathological characteristics of the advanced CRC patients are described in. The CRC patients with synchronous metastases had aggressive features in cluding larger tumor size more advanced p T and p N stage and the presence of per ineural and venous in vasi on than the patients with metachronous metastasis (p<0.05)..0091811. t 001 Clinicopathologic characteristics of advanced colorectal cancers. The clinicopathological characteristics of the advanced CRC patients are described in. The CRC patients with synchronous metastases had aggressive features in cluding larger tumor size more advanced p T and p N stage and the presence of per ineural and venous in vasi on than the patients with metachronous metastasis (p<0.05)..0091811. t 001 Clinicopathologic characteristics of advanced colorectal cancers. Parameters Total Metachronous Synchronous P value (n?=?181) (n?=?57) (n?=?124) Age (median range) 60.00 (28""93) 62.00 (36""79) 60.00 (28""93) 0.241 Sex 0.007 Male 97 39 (68.4%) 58 (46.8%) Female 84 18 (31.6%) 66 (53.2%) Locati on 0.055 Right colon 37 6 (10.5%) 31 (25.0%) Left colon 75 29 (50.9%) 46 (37.1%) Rectum 69 22 (38.6%) 47 (37.9%) Size of primary tumor 5.30 (2.0""13.0) 4.20 (2""9) 5.50 (2.5""13) <0.001 Histologic grade 0.227 Low grade 157 52 (91.2%) 105 (84.7%) High grade 24 5 (8.8%) 19 (15.3%) T stage <0.001 T 1 0 0 0 T 2 5 3 (5.3%) 2 (1.6%) T 3 107 45 (78.9%) 62 (50.0%) T 4 69 9 (15.8%) 60 (48.4%) N stage <0.001']","The PI3K/AKT pathway contributes to colorectal cancer progression by promoting cell proliferation, survival, and migration of cancer cells. Aberrations in this pathway can lead to enhanced tumor growth and metastasis, as evidenced by studies showing that activation of the PI3K/AKT signaling is associated with poor prognosis in colorectal cancer patients [CTX 1][CTX 2]. Additionally, the pathway's involvement in the regulation of various cellular processes, including inflammation and immune response, further underscores its role in cancer progression [CTX 4]. However, the specific mechanisms by which the PI3K/AKT pathway interacts with other signaling pathways in colorectal cancer remain to be fully elucidated, indicating a need for further research [CTX 3].",0.0,0.0,0.5
What is the interaction between MAPK and Wnt signaling in colon cancer?,"['over weight and obese patients bmi did not showa significantly in creased expressi on p of nuclearctnnb 1 positive in normal weight vs positive in over weightobese morikawa found that in obesepositivity wasnuclear ctnnb 1 patientsassociated with significantly better cancerspecific survival suggesting that wnt signaling acts as a switch and when it is on adipogenesis is repressed kennell demonstrated that activated frz 1 frizzled promotes caten in stabilityinhibits apoptosis and adipogenesisross also showed that wnt signaling acts as a molecular switch that controls adipogenesis upregulation of wnt signaling maintains preadipocytes in an undifferentiated state and when wnt signaling is prevented the ydifferentiate into adipocytes [ ]although in our study there was no as sociati on between nuclear in tensity and crc between normal and overweight patients p for in teracti on there is accumulating evidence to show that the state of chronicinflammati on in cited by obesity might play a role in promoting colorectal carcinogenesis [ ] of the manymarkers tnfα is important [ ] as it activateswnt signaling through the in ducti on of gsk 3 phosphorylati on resulting in in creased nuclear localizati on of caten in in additi on to tnfα other humoralagents as sociated with obesity might also be contributing to the activati on of wnt signaling like il 1 and adiponect in which is decreased in the obese state and is notan in flammatory cytokine that can modulate gsk 3 caten in signaling pathway although multiplemechanisms may be operating in parallel and contributing to the protumorigenic milieu wnt is a pivotaltumorigenic', 'in a spectrum of consequences ranging from lethal developmental abnormalities to several forms of aggressive cancer nusse and clevers most prominently colorectal cancer crc is in itiated by genetic mutations that constitutively activate wnt signaling kahn secreted wnt ligands trigger an in tracellular biochemical cascade in the receiving cells that culminates in the calibrated expressi on of target genes mosimann this transcriptionalresponse is or chestrated by nuclear bcaten in that acts as a ˜scaffold™ to buttress a host of cofactors to cisregulatory elements occupied by the tcflef transcripti on factors valenta among the cofactors the two paralogs bcl 9 and bcl 9 l referred to as bcl 99 l and pygo 12 proteins reside with in the wntbcaten in transcriptional complex and their concerted acti on isrequired to efficiently activate wnttarget gene expressi on kramps parker for correspondencekonradbaslerimlsuzhch kbandreasmoorbsseethzchaemclaudiocantuliuse cc these authors contributedequally to this workpresent address ¡divisi on of molecular pathology the netherlands cancer in stituteamsterdam netherlandscompeting in terests the authors declare that nocompeting in terests exist', 'in this prospective single arm multi center in terventi on study patients with resectable microsatellite stablect 3""4 nxm 0 colon cancer will be treated with two courses of neoadjuvant and two courses of adjuvant capecitabine and oxaliplat in the primary endpoint is the pathological tumor response to neoadjuvant chemo therapy per cms secondaryendpoints are radiological tumor response the prognostic value of these responses for recurrence free survival and overall survival and the differences in cms classificati on of the same tumor before and after neoadjuvant chemo therapy the study is scheduled to be per formed in "" dutch hospitals the first patient was in cluded in february necessary to proceed to future studies in which neo adjuvant chemo therapy may be with hold in patients with a specific cms subtype who show no benefit from chemo therapy and for whom possible new treatments can be in vestigatedtrial registrati on this study has been registered in the netherlands trial register nl 8177 at "" wwwtrialregisternltrial 8177 the study has been approved by the medical ethics committee utrecht mec 18712 keywords colon cancer consensus molecular subtypes neoadjuvant chemo therapy surgery colon cancer is one of the most comm on types of cancer in the netherlands with an in cidence of around patients in approximately of patients present with local disease stage iiii curativesurgery followed by adjuvant systemic chemo therapy isstandard of care in patients with microsatellite stablemss high risk stage ii and stage iii colon cancer despite this in tensive treatment "" of the patients develop metastatic disease these patients do not benefitenough from the current adjuvant systemic the rapymoreover it is estimated that will not develop metastases after surgery alone and are the refore over treated with adjuvant chemo therapy identifying the patients at risk of developing metastases as well as thoseresponding to the rapy is a clear unmet need in colon cancer care the developme', 'colorectal cancer crc is the third most comm on cancer type and the second leading cause of cancer death worldwide deaths usually result from recurrent and metastatic disease mostinternational guidelines recommend chemo therapy to reduce the risk of recurrence in stage iii tumors and to prolongsurvival in stage iv cancers conversely chemo therapy isgenerally not used in stage i and most stage ii tumors howeversome patients with low risk stage iii disease may respond wellfollowing courses of chemo therapy that are shorter than the 6 month standard schedule although the definiti on of œlowrisk\x9d has not been well established in this scenario additionally almost of patients who have stage ii tumors and who are the refore considered to have low risk diseaserelapse and eventually die from cancer progressi on the reis currently no accurate biomarker to better define prognosiswith in stage groups the refore biomarkers for prognosticstratificati on in crc have the potential of improving the treatment decisionmaking process we hypothesized thatstudying molecular mechanisms that are known to be in volved in crc development might yield promising novel biomarkersf or this diseasethese modelsformati on mirroring cancer developmentadenomatous polyposis coli apc in activating mutationsare the earliest and most comm on genetic alterations in the adenoma carcinoma sequence thatleads to crc suchmutations result in the accumulati on of caten in with in cells and activati on ofthe wnt signaling pathway animalmodels of apc in activati on demonstrate epithelial transformation and tumor""the ahcreapcflfl mouse one ofan animal bearing loxpflanked apc alleles and a crerecombinase transgene when this animalis exposed', ""clinicopathological characteristics of patients with colorectal carcinoma characteristic sex male female age years ‰¥ site of lesi on colon rectum differentiati on poor well tumor size cm ‰¥ pathological type adeno carcinoma others lymph node metastasis no yes liver metastasis no yes stage iii iiiiv cea normal high ca ' normal high ca ' normal high afisher's exact test all others were as sessed using a χ2 test defb 4 a defens in 4 a'''''''''''''''''''''''''''''''''''''''''''''''''''''high n low n 0009 a 0003 a 0575 a 0039 a poor survival furthermore defb 4 a expressi on was upregu'lated in patients with crc with advanced and metastatic cancer patients with crc with high defb 4 a expressi on had poor survival in additi on knockdown of defb 4 a affected the migrati on ability of crc cells tcga data of patients with crc were used to identify the degs between the long os days and short os days groups in additi on mrna expressi on was compared between tumor tissues and normal tissues in the same database defb 4 a was highly expressed in tumors and as sociated with a poor prognosis defb 4 a upregulati on was as sociated with poor prognosis and defb 4 a expressi on was significantly upregulated in patients with large tumors advanced cancer stage lymph node metastasis and liver metastasis another study used the gene expressi on omnibus database to screen genes that are in creased in patients with recurrence hierarchical clustering and pathway analyses revealed that thrombospond in thbs 2 and cart""]","The interaction between MAPK and Wnt signaling in colon cancer involves the activation of Wnt signaling pathways, which can be influenced by inflammatory cytokines associated with obesity, such as TNFα. This cytokine activates Wnt signaling through the phosphorylation of GSK-3, leading to increased nuclear localization of β-catenin, a key player in the Wnt pathway [CTX 1]. Additionally, genetic mutations that constitutively activate Wnt signaling are common in colorectal cancer, further linking these pathways [CTX 2]. However, the precise mechanisms of interaction between MAPK and Wnt signaling in colon cancer remain complex and may involve multiple parallel pathways [CTX 1].",0.5555555555555556,0.0,0.75
Why are microsatellite stable colorectal cancers less responsive to checkpoint blockade?,"['in the clinic and defined immuno therapy as an effective strategy for the treatment of several malignancies they have not been universally successful in that context the dearth of neoepitopes in many cancer types in cluding microsatellite stable colorectal and pancreatic second and third leading causes of cancer mortality respectively makes them in sensitive to checkpoint blockade 7 in deed examinati on of neoepitopes presented on the surface of five colorectal cancer specimens revealed a total of three neoepitopes 3 thus vaccines targeting cancer as sociated self antigens have re emerged alone and in combinati on with checkpoint in hibitors as a strategy to prevent and treat metastases from these cold tumors 44 checkpoint in hibitors have become first line the rapy in the metastatic setting for some cancers 46 while chimeric antigen recept or expressing t cells car t cells are being deployed in patients with metastatic and refractory disease 47 in contrast few cancer immunotherapies have been developed for early stage cancer patients with œno evidence of disease\x9d ned following conventional surgicalradiochemotherapies who are at significant risk of disease recurrence in deed 25 of stage ii and of stage iii patients with colorectal cancer recur following surgery and chemo therapy 49 while of patients with resectable pancreatic cancer experience recurrence 50 vaccines targeting tumor as sociated antigens such as ad 5 f 35 gucy 2 c padre may provide safe and effective immunotherapies for the secondary preventi on of metastatic disease in patients with ned who are otherwise in eligible to receive checkpoint in hibitors or car t cells the present studies suggest that the chimeric adenoviral vect or ad 5 f 35 may be preferable to the widely used ad 5 vect or and warrants further in vestigati on in deed they suggest that on going clinical in vestigations of gucy 2 c directed immuno therapy in patients with gucy 2 c expressing cancers in cluding colorectal pancreatic gastri', 'in this prospective single arm multi center in terventi on study patients with resectable microsatellite stablect 3""4 nxm 0 colon cancer will be treated with two courses of neoadjuvant and two courses of adjuvant capecitabine and oxaliplat in the primary endpoint is the pathological tumor response to neoadjuvant chemo therapy per cms secondaryendpoints are radiological tumor response the prognostic value of these responses for recurrence free survival and overall survival and the differences in cms classificati on of the same tumor before and after neoadjuvant chemo therapy the study is scheduled to be per formed in "" dutch hospitals the first patient was in cluded in february necessary to proceed to future studies in which neo adjuvant chemo therapy may be with hold in patients with a specific cms subtype who show no benefit from chemo therapy and for whom possible new treatments can be in vestigatedtrial registrati on this study has been registered in the netherlands trial register nl 8177 at "" wwwtrialregisternltrial 8177 the study has been approved by the medical ethics committee utrecht mec 18712 keywords colon cancer consensus molecular subtypes neoadjuvant chemo therapy surgery colon cancer is one of the most comm on types of cancer in the netherlands with an in cidence of around patients in approximately of patients present with local disease stage iiii curativesurgery followed by adjuvant systemic chemo therapy isstandard of care in patients with microsatellite stablemss high risk stage ii and stage iii colon cancer despite this in tensive treatment "" of the patients develop metastatic disease these patients do not benefitenough from the current adjuvant systemic the rapymoreover it is estimated that will not develop metastases after surgery alone and are the refore over treated with adjuvant chemo therapy identifying the patients at risk of developing metastases as well as thoseresponding to the rapy is a clear unmet need in colon cancer care the developme', 'In recent years the concept of restoring the patients™ antitum or immunity by immune checkpoint in hibiti on hasrevolutionized cancer the rapy especially in advancedmelanoma Immunecheckpoint molecules efficiently regulate T cell activati on and thus enable tumor cells to evade the immunesystem for example by hijacking the PD 1 PDL 1 in teracti on to downregulate effect or T cells [ ] To dateseveral human monoclonal antibodies pharmacologicallyblocking these in teractions have been implemented in cancer the rapy such as the anti PD 1 antibody pembrolizumab that has been approved in combinati on with chemo therapy for nonsquamous NSCLC irrespective of PDL 1 expressi on [ ]Several studies have shown that immune checkpointinhibiti on and radio therapy in combinati on can act synergistically to further boost antineoplastic effects [""] Although in a large phase III trial no benefit of blockade of cytotoxic T lymphocyteassociated antigen CTLA 4 after radio therapy was observed in metastaticprostate cancer [] clinical trials such as NICOLASNCT 02434081 and DETERRED NCT 02525757 in vestigating concurrent PDL 1 directed immuno therapy and chemoradiot', 'mcc are a unique histologic subtype in which greaterthan of the tumor mass is composed of extracellularmuc 2 prote in they demonstrate unique clinicalphenotype and molecular genotype when compared to their nonmucinous counterparts nmcc clinicallymcc are more likely to occur in younger patients havea predilecti on for the proximal colon are bulkier at presentati on and have a higher propensity for per itoneal and distant lymph node metastases molecularly the ytend to follow the serrated pathway for carcinogenesis and are more likely to have rasgn as mutationsmicrosatellite in stability msi and cpg island methylat or phenotype cimp positive [ ]in general many moleculartargeted the rapies havedemonstrated disappointing against advancedsolid cancers in clinical trials despite promising preclinical data this may largely be at tributed to irrational useof targeted drugs against unselected cancers major considerations to improve the efficacy of targeted the rapiesinclude identificati on of ideal drugs and drug combinations optimizing dosing schedules and enriching for patient factors eg clinical and molecular phenotypes and genotypes that are more likely to respond to specifictargeted the rapies in this study we focused on specificvulnerabilities of mucinous tumors that may make the msuscept ibletherebytargeted the rapies to specific 0 cdilly or phanet of rare diseases page of fig see legend on next page 0 cdilly or phanet of rare diseases page of see figure on previous pagefig combinati on of celecoxib and or list at reduced mucinous tumor growth in vivo murine xenograft models of in traperitoneal ip luciferaselabelled ls 174 t cells were treated with pbs alone control or celecoxib c alone mgkg bw or or list at o alone mgkg bw or combinati on of c o every other day starting on day following tumor implantati on until they were euthanized at day gross in traabdominal tumor burden is depicted pictorially on day serial weekly changes in mean luciferase in tensity during treat', 'thirty six per cent of colorectal stomach and endometrial cancers with pole mutations carried additionalmutations in polq eq polzrev 3 l ez or both dna polymerases ezq the mutati on burden in the setumors was significantly greater compared to poleonly e mutant tumors p in additi on eq ez and eqz mutant tumors possessed an in creased frequency of mutations in the pole exonuclease doma in p colorectal stomach and endometrial eq ez and eqz mutant tumors with in tcga demonstrated diseasefree survival even if the pole mutations occurred outside the exonuclease doma in p however immunescores in these tumors were related to microsatellite in stability msi and not pole mutati on status this suggeststh at the host immune response may not be the sole mechanism for prolonged diseasefree survival of ultramutated tumors in this cohort']","Microsatellite stable colorectal cancers are less responsive to checkpoint blockade primarily due to a lack of neoepitopes, which are essential for eliciting an immune response. Studies have shown that microsatellite stable colorectal cancers present very few neoepitopes, with one examination revealing only three neoepitopes across five specimens [CTX 1]. This scarcity of neoepitopes limits the effectiveness of immunotherapies, including checkpoint inhibitors, which rely on the presence of these unique tumor markers to activate T cells against cancer cells [CTX 3]. Additionally, the overall mutational burden in microsatellite stable tumors is lower compared to microsatellite unstable tumors, further contributing to their insensitivity to immune checkpoint blockade [CTX 5]. Thus, the limited immunogenicity of microsatellite stable colorectal cancers poses a significant challenge for effective treatment with checkpoint inhibitors.",0.5555555555555556,0.9999995341941094,1.0
Which biomarkers are associated with poor prognosis in colorectal cancer?,"[""clinicopathological characteristics of patients with colorectal carcinoma characteristic sex male female age years ‰¥ site of lesi on colon rectum differentiati on poor well tumor size cm ‰¥ pathological type adeno carcinoma others lymph node metastasis no yes liver metastasis no yes stage iii iiiiv cea normal high ca ' normal high ca ' normal high afisher's exact test all others were as sessed using a χ2 test defb 4 a defens in 4 a'''''''''''''''''''''''''''''''''''''''''''''''''''''high n low n 0009 a 0003 a 0575 a 0039 a poor survival furthermore defb 4 a expressi on was upregu'lated in patients with crc with advanced and metastatic cancer patients with crc with high defb 4 a expressi on had poor survival in additi on knockdown of defb 4 a affected the migrati on ability of crc cells tcga data of patients with crc were used to identify the degs between the long os days and short os days groups in additi on mrna expressi on was compared between tumor tissues and normal tissues in the same database defb 4 a was highly expressed in tumors and as sociated with a poor prognosis defb 4 a upregulati on was as sociated with poor prognosis and defb 4 a expressi on was significantly upregulated in patients with large tumors advanced cancer stage lymph node metastasis and liver metastasis another study used the gene expressi on omnibus database to screen genes that are in creased in patients with recurrence hierarchical clustering and pathway analyses revealed that thrombospond in thbs 2 and cart"", '1. Heterogeneity of cancer-as sociated stroma according to examined tumor locations The clinicopathological characteristics of the advanced CRC patients are described in. The CRC patients with synchronous metastases had aggressive features in cluding larger tumor size more advanced p T and p N stage and the presence of per ineural and venous in vasi on than the patients with metachronous metastasis (p<0.05)..0091811. t 001 Clinicopathologic characteristics of advanced colorectal cancers. The clinicopathological characteristics of the advanced CRC patients are described in. The CRC patients with synchronous metastases had aggressive features in cluding larger tumor size more advanced p T and p N stage and the presence of per ineural and venous in vasi on than the patients with metachronous metastasis (p<0.05)..0091811. t 001 Clinicopathologic characteristics of advanced colorectal cancers. Parameters Total Metachronous Synchronous P value (n?=?181) (n?=?57) (n?=?124) Age (median range) 60.00 (28""93) 62.00 (36""79) 60.00 (28""93) 0.241 Sex 0.007 Male 97 39 (68.4%) 58 (46.8%) Female 84 18 (31.6%) 66 (53.2%) Locati on 0.055 Right colon 37 6 (10.5%) 31 (25.0%) Left colon 75 29 (50.9%) 46 (37.1%) Rectum 69 22 (38.6%) 47 (37.9%) Size of primary tumor 5.30 (2.0""13.0) 4.20 (2""9) 5.50 (2.5""13) <0.001 Histologic grade 0.227 Low grade 157 52 (91.2%) 105 (84.7%) High grade 24 5 (8.8%) 19 (15.3%) T stage <0.001 T 1 0 0 0 T 2 5 3 (5.3%) 2 (1.6%) T 3 107 45 (78.9%) 62 (50.0%) T 4 69 9 (15.8%) 60 (48.4%) N stage <0.001', 'in this prospective single arm multi center in terventi on study patients with resectable microsatellite stablect 3""4 nxm 0 colon cancer will be treated with two courses of neoadjuvant and two courses of adjuvant capecitabine and oxaliplat in the primary endpoint is the pathological tumor response to neoadjuvant chemo therapy per cms secondaryendpoints are radiological tumor response the prognostic value of these responses for recurrence free survival and overall survival and the differences in cms classificati on of the same tumor before and after neoadjuvant chemo therapy the study is scheduled to be per formed in "" dutch hospitals the first patient was in cluded in february necessary to proceed to future studies in which neo adjuvant chemo therapy may be with hold in patients with a specific cms subtype who show no benefit from chemo therapy and for whom possible new treatments can be in vestigatedtrial registrati on this study has been registered in the netherlands trial register nl 8177 at "" wwwtrialregisternltrial 8177 the study has been approved by the medical ethics committee utrecht mec 18712 keywords colon cancer consensus molecular subtypes neoadjuvant chemo therapy surgery colon cancer is one of the most comm on types of cancer in the netherlands with an in cidence of around patients in approximately of patients present with local disease stage iiii curativesurgery followed by adjuvant systemic chemo therapy isstandard of care in patients with microsatellite stablemss high risk stage ii and stage iii colon cancer despite this in tensive treatment "" of the patients develop metastatic disease these patients do not benefitenough from the current adjuvant systemic the rapymoreover it is estimated that will not develop metastases after surgery alone and are the refore over treated with adjuvant chemo therapy identifying the patients at risk of developing metastases as well as thoseresponding to the rapy is a clear unmet need in colon cancer care the developme', ""colorectal carcinogenesis is a multi'step process starting from normal crypts to aberrant crypt foci then to polyps adenoma and eventually adeno carcinoma it has been reported that in dividuals with ibd may have an in creased risk of developing crc which is directly proportional to the extent and durati on of their disease however the exact mechanism and durati on required for chronic colitis to develop into adenoma and then adeno carcinoma remains unclear it has been suggested that patients with ibd have an in creased risk of crc following the in flammati on'dysplasia'carcinoma model in cluding dysplasia and crc as primary conse'quences of chronic in flammati on however there are currently still no defined molecular biomarkers or existing monitoring protocols for detecting the occurrence of a malignant tumor except for frequent colonoscopy examinations in the present study an acute colitis'chronic colitis'adenoma'adeno carcinoma model was successfully constructed via aomdss in ducti on using this model tlr 9 expressi on levels were discovered to be upregulated as the severity of the colorectal lesions in creased which in dicated that tlr 9 prote in expressi on levels may be continuously activated during colitis'crc development tlr 9 is a critical prote in as sociated with in nate and acquired immunity and it has been demonstrated to serve a significant role in the development of colitis and sporadic crc however the mechanism by which tlr 9 regulates the devel'opment of crc remains to be elucidatedinterestingly ihc analysis revealed that the expressi on levels of nf'κb and ki 67 were simultaneously upregulated alongside tlr 9 expressi on levels notably in hibiting tlr"", ""use locati on of cancer in the colon proximal colondistal colonrectumunspecifiedstage at diagnosis stage istage iistage iiimedian survival time yearsmedian survival time by staged years stage istage iistage iiiweight change categoriesd stable weight ˆ' to kggained more than kglost more than kg avalues are means sd for continuous variables and per centages for categorical variables and are standardized to the age distributi on of the study populationbedih scores were adjusted for total energy in takecmetabolic equivalents from recreational and leisuretime activitiesdvalue is not age adjustedafter diagnosis quintile tended to have higher bodyweight and lower physical activity for example the average bmi among those classified in quintile was kgm 2 and the average physical activity was methourweek compared with kgm 2 and methourweek among those in quintile also patients consuming the most hyperinsulinemic dietarypatterns were less likely to have stage i disease and the yexperienced shorter survival times table patients consuming low in sulinemic dietary patternshad higher in takes of wholegrains nuts vegetables wholefruits and coffee and lower in takes of refined grainscream soup eggs french fries butter margarine sugarsweetened beverages red meat and processed meat in 0 ctabung bmc cancer page of table median 5 th 95 th per centile food and nutrient in take profiles of colorectal cancer patients by quintiles of postdiagnosisempirical dietary index for hyperinsulinemia edih scoretotal populati on n quintiles of the empirical dietary index for hyperinsulinemia edih scoreabquintile n quintile n quint""]","Biomarkers associated with poor prognosis in colorectal cancer (CRC) include high expression levels of Defb4a and TLR9. High Defb4a expression is linked to advanced cancer stages, larger tumor sizes, and poor survival outcomes in CRC patients [CTX 1]. Additionally, TLR9 expression levels increase with the severity of colorectal lesions, indicating its potential role in CRC development [CTX 4]. These biomarkers highlight the complexity of CRC prognosis, but further research is needed to fully understand their mechanisms and clinical applications.",0.8888888888888888,0.9945117050714796,1.0
Is CEA discussed as a predictive marker in colorectal cancer studies?,"[""clinicopathological characteristics of patients with colorectal carcinoma characteristic sex male female age years ‰¥ site of lesi on colon rectum differentiati on poor well tumor size cm ‰¥ pathological type adeno carcinoma others lymph node metastasis no yes liver metastasis no yes stage iii iiiiv cea normal high ca ' normal high ca ' normal high afisher's exact test all others were as sessed using a χ2 test defb 4 a defens in 4 a'''''''''''''''''''''''''''''''''''''''''''''''''''''high n low n 0009 a 0003 a 0575 a 0039 a poor survival furthermore defb 4 a expressi on was upregu'lated in patients with crc with advanced and metastatic cancer patients with crc with high defb 4 a expressi on had poor survival in additi on knockdown of defb 4 a affected the migrati on ability of crc cells tcga data of patients with crc were used to identify the degs between the long os days and short os days groups in additi on mrna expressi on was compared between tumor tissues and normal tissues in the same database defb 4 a was highly expressed in tumors and as sociated with a poor prognosis defb 4 a upregulati on was as sociated with poor prognosis and defb 4 a expressi on was significantly upregulated in patients with large tumors advanced cancer stage lymph node metastasis and liver metastasis another study used the gene expressi on omnibus database to screen genes that are in creased in patients with recurrence hierarchical clustering and pathway analyses revealed that thrombospond in thbs 2 and cart"", 'the medocccreate study is the first study using the modern and in novative twics design to study ctdnaguided administrati on of act in stage ii cc patients the study aims to answer the important clinical questi on whether ctdna has prognostic as well as predictive value if this study demonstrates as ignificant and substantial difference in disease recurrence in the in terventi on group compared to the controlgroup ctdna analysis and ctdnaguided treatmentshould be implemented into clinical practice to improve the prognosis of stage ii cc patientsabbreviationsact adjuvant chemo therapy cc colon cancer cea carcinoembryonicantigen crc colorectal cancer ctdna circulating tumor dnadfs disease free survival dmmr deficient mismatch repair eortcqlqc 30 and cr 29 european anisati on for research and treatment of cancer quality of life questionnaire c 30 and colorectal cancer module eq 5 d euro quality of life 5 dimensions ffpe for malinfixed para', 'in this prospective single arm multi center in terventi on study patients with resectable microsatellite stablect 3""4 nxm 0 colon cancer will be treated with two courses of neoadjuvant and two courses of adjuvant capecitabine and oxaliplat in the primary endpoint is the pathological tumor response to neoadjuvant chemo therapy per cms secondaryendpoints are radiological tumor response the prognostic value of these responses for recurrence free survival and overall survival and the differences in cms classificati on of the same tumor before and after neoadjuvant chemo therapy the study is scheduled to be per formed in "" dutch hospitals the first patient was in cluded in february necessary to proceed to future studies in which neo adjuvant chemo therapy may be with hold in patients with a specific cms subtype who show no benefit from chemo therapy and for whom possible new treatments can be in vestigatedtrial registrati on this study has been registered in the netherlands trial register nl 8177 at "" wwwtrialregisternltrial 8177 the study has been approved by the medical ethics committee utrecht mec 18712 keywords colon cancer consensus molecular subtypes neoadjuvant chemo therapy surgery colon cancer is one of the most comm on types of cancer in the netherlands with an in cidence of around patients in approximately of patients present with local disease stage iiii curativesurgery followed by adjuvant systemic chemo therapy isstandard of care in patients with microsatellite stablemss high risk stage ii and stage iii colon cancer despite this in tensive treatment "" of the patients develop metastatic disease these patients do not benefitenough from the current adjuvant systemic the rapymoreover it is estimated that will not develop metastases after surgery alone and are the refore over treated with adjuvant chemo therapy identifying the patients at risk of developing metastases as well as thoseresponding to the rapy is a clear unmet need in colon cancer care the developme', 'of the present study do not support the sefindings to our knowledge this is the first study in cluding only patients with colorectal cancer whoare eligible for curative treatment by partial bowel resecti on and not those receiving palliativetreatment de couck studied the relationship between hrv and tumour burden in bothcurative and palliative patients with prostate cancer or nonsmall cell lung cancer in dependent of confounders the hypothesised in verse relationship of hrv and the tumour markerpsa at and months after diagnosis was only significant in patients with stage iv prostate cancer not stage ii and iii in colorectal cancer mout on found that low hrv defined as sdnn ms predicted significantly higher levels of the tumour marker cea at months after diagnosis again these were not controlled for cancer type which could affect bothhrv and survival and should the refore be in terpreted with cauti on the fact that the patients recruited in the present sample were only with less advanced cancer may partlyexpla in the lack of prognostic role in hrv in this sample one 101371 pone 0237244 august one 0 chrv and prognosis in colorectal cancerfig bar chart for cealevel at baseline and one year checkup in groups of low hrv and normal hrv presented as asdnn and b rmssd 101371 pone 0237244 g 004 one 101371 pone 0237244 august one 0 chrv and prognosis in colorectal cancertable low hrv and risk of occurrence of a postoperative complicati on with in dayspostoperative complication or ciunadjustedsdnn 20 ms n ""sdnn �20 ms n referenceadjusted�sdnn 20 ms n ""sdnn �20 ms n referenceunadjustedrmssd 19 ms n ""rmssd �19 ms n referenceadjusted�rmssd 19 ms n ""rmssd �19 ms n reference�adjusted for heart rate age cardiac disease and hypertensi on 101371 pone 0237244 t 005 psome of these previous studies suggest a bidirectional relationship between vagus nerveactivity and cancer however based on current evidence on this subject we cannot supportthis hypothesis the positive as sociati on betwee', ""the number of patients with colorectal cancer crc world'wide is in creasing annually with an in cidence rate of in chronic in flammati on is the leading cause of immune cell in filtrati on and proliferati on and it has been suggested to be a high'risk fact or for colitis'as sociated crc cac in flammatory bowel disease ibd which encompasses both ulcerative colitis uc and crohn's disease was established as an important precurs or to crc for example the in cidence of ibd'as sociated crc in patients with uc was reported to have a cumulative risk rate of at years at years and at years of disease durati on the refore further in vivo studies are required for researchers to gain an improved under standing of the molecular mechanisms of cac which may provide more exact molecular targets for the diagnosis and treatment of cac during the early stages toll'like recept or tlr 9 a member of the tlr family is located in the cytoplasm and in tracellular endosomes and can be activated by unmethylated bacterial cpg dna the activati on of the tlr 9 signaling pathway in duces a type t helper cell immune response and stimulates the proliferati on of b cells thus protecting the host from external microbial in vasi on ' multiple studies have revealed that abnormal tlr 9 expressi on levels were in volved in the pathogenesis and progressi on of uc in additi on abnormal expressi on levels of tlr 9 were also identified during the tumorigenesis and development of crc 'nf'κb is an important transcripti on fact or in volved in various biological processes in cluding in flammatory reac'tions immune responses apoptosis and proliferati on in fact nf'κb is regarded as a molecular hub that links in flam'mati on and cancer it was previously suggested that nf'κb may serve""]","Yes, CEA (carcinoembryonic antigen) is discussed as a predictive marker in colorectal cancer studies. It is mentioned in the context of its association with tumor burden and prognosis, where low heart rate variability (HRV) was found to predict higher levels of CEA in colorectal cancer patients after diagnosis [CTX 4]. Additionally, CEA is referenced in studies exploring its prognostic and predictive value alongside other markers in the management of colorectal cancer [CTX 2]. However, the evidence regarding its predictive capabilities may be limited by the specific patient populations studied and the confounding factors that could influence the results [CTX 4].",1.0,0.9478932087958384,1.0
What in vitro or xenograft models are used to study colorectal cancer drug response?,"['in this prospective single arm multi center in terventi on study patients with resectable microsatellite stablect 3""4 nxm 0 colon cancer will be treated with two courses of neoadjuvant and two courses of adjuvant capecitabine and oxaliplat in the primary endpoint is the pathological tumor response to neoadjuvant chemo therapy per cms secondaryendpoints are radiological tumor response the prognostic value of these responses for recurrence free survival and overall survival and the differences in cms classificati on of the same tumor before and after neoadjuvant chemo therapy the study is scheduled to be per formed in "" dutch hospitals the first patient was in cluded in february necessary to proceed to future studies in which neo adjuvant chemo therapy may be with hold in patients with a specific cms subtype who show no benefit from chemo therapy and for whom possible new treatments can be in vestigatedtrial registrati on this study has been registered in the netherlands trial register nl 8177 at "" wwwtrialregisternltrial 8177 the study has been approved by the medical ethics committee utrecht mec 18712 keywords colon cancer consensus molecular subtypes neoadjuvant chemo therapy surgery colon cancer is one of the most comm on types of cancer in the netherlands with an in cidence of around patients in approximately of patients present with local disease stage iiii curativesurgery followed by adjuvant systemic chemo therapy isstandard of care in patients with microsatellite stablemss high risk stage ii and stage iii colon cancer despite this in tensive treatment "" of the patients develop metastatic disease these patients do not benefitenough from the current adjuvant systemic the rapymoreover it is estimated that will not develop metastases after surgery alone and are the refore over treated with adjuvant chemo therapy identifying the patients at risk of developing metastases as well as thoseresponding to the rapy is a clear unmet need in colon cancer care the developme', ""clinicopathological characteristics of patients with colorectal carcinoma characteristic sex male female age years ‰¥ site of lesi on colon rectum differentiati on poor well tumor size cm ‰¥ pathological type adeno carcinoma others lymph node metastasis no yes liver metastasis no yes stage iii iiiiv cea normal high ca ' normal high ca ' normal high afisher's exact test all others were as sessed using a χ2 test defb 4 a defens in 4 a'''''''''''''''''''''''''''''''''''''''''''''''''''''high n low n 0009 a 0003 a 0575 a 0039 a poor survival furthermore defb 4 a expressi on was upregu'lated in patients with crc with advanced and metastatic cancer patients with crc with high defb 4 a expressi on had poor survival in additi on knockdown of defb 4 a affected the migrati on ability of crc cells tcga data of patients with crc were used to identify the degs between the long os days and short os days groups in additi on mrna expressi on was compared between tumor tissues and normal tissues in the same database defb 4 a was highly expressed in tumors and as sociated with a poor prognosis defb 4 a upregulati on was as sociated with poor prognosis and defb 4 a expressi on was significantly upregulated in patients with large tumors advanced cancer stage lymph node metastasis and liver metastasis another study used the gene expressi on omnibus database to screen genes that are in creased in patients with recurrence hierarchical clustering and pathway analyses revealed that thrombospond in thbs 2 and cart"", '1. Heterogeneity of cancer-as sociated stroma according to examined tumor locations The clinicopathological characteristics of the advanced CRC patients are described in. The CRC patients with synchronous metastases had aggressive features in cluding larger tumor size more advanced p T and p N stage and the presence of per ineural and venous in vasi on than the patients with metachronous metastasis (p<0.05)..0091811. t 001 Clinicopathologic characteristics of advanced colorectal cancers. The clinicopathological characteristics of the advanced CRC patients are described in. The CRC patients with synchronous metastases had aggressive features in cluding larger tumor size more advanced p T and p N stage and the presence of per ineural and venous in vasi on than the patients with metachronous metastasis (p<0.05)..0091811. t 001 Clinicopathologic characteristics of advanced colorectal cancers. Parameters Total Metachronous Synchronous P value (n?=?181) (n?=?57) (n?=?124) Age (median range) 60.00 (28""93) 62.00 (36""79) 60.00 (28""93) 0.241 Sex 0.007 Male 97 39 (68.4%) 58 (46.8%) Female 84 18 (31.6%) 66 (53.2%) Locati on 0.055 Right colon 37 6 (10.5%) 31 (25.0%) Left colon 75 29 (50.9%) 46 (37.1%) Rectum 69 22 (38.6%) 47 (37.9%) Size of primary tumor 5.30 (2.0""13.0) 4.20 (2""9) 5.50 (2.5""13) <0.001 Histologic grade 0.227 Low grade 157 52 (91.2%) 105 (84.7%) High grade 24 5 (8.8%) 19 (15.3%) T stage <0.001 T 1 0 0 0 T 2 5 3 (5.3%) 2 (1.6%) T 3 107 45 (78.9%) 62 (50.0%) T 4 69 9 (15.8%) 60 (48.4%) N stage <0.001', 'Crowley method The CIs of month and year survival probabilities were calculated based on the Greenwood™s for mula HRs and CIs were estimated by Cox regressi on We did subgroup analyses divided by prespecified baseline patient and disease characteristic variables in cluding RAS status for DCR PFS and OS We also did a prespecified exploratory analysis of potential predictive biomarkers in blood samples We did all analyses with SAS V 94 Patient characteristics Between October and January patients with unresectable metastatic colorectal cancer were enrolled All patients were eligible and received the study medicati on Table summarises the baseline characteristics of all enrolled patients The median number of previous lines of palliative chemo therapy was range "" and patients had received or ‰¥ prior lines of chemo therapy for metastatic disease respectively The data cut off date was January with median follow up of months IQR ""efficacy The centrally as sessed DCR was CI to one sided p 00001 two patients had a partial response and had a stable disease in cluding unconfirmed PR table figure A total of patients had a reducti on in target lesi on size from baseline figure Time on treatment for all patients is ‰¥ ‰¥ Male Female months ‰¥ months Right sided colon Left sided colorectum Lung Liver Lymph node Per itoneum Age years Sex ECOG per formance status Primary site Number of metastatic site Metastatic an Time from start of first line chemo therapy Number of previous palliative chemo therapy Previous chemo therapy and reas on for discontinuati on Fluoropyrimidine Refractory In tolerant Oxaliplat in Irinotecan TAS 102 trifluridinetipiracil Angiogenesis in hibit or Anti EGFR in hibit or Refractory In tolerant Refractory In tolerant Refractory Refractory In tolerant Refractory In tolerant Iwasa a 0 S et a 0 al ESMO 20205 e 000776 101136 esmo 2020000776 0 c access Table Best response to treatment Complete response Partial response Stable disease Progressive disease Not', 'designaimthis study in vestigates the willingness of patients to receive act after detecti on of ctdna postsurgery andthe effect of ctdnaguided act on the rr in stage iicc patientsstudy design the medocccreate trial follows the twics design and is per formed with in the prospective dutch colorectal cancer cohort plcrc wwwplcrcnl plcrc is set up by the dutch colorectal cancer groupdccg and collects clinical data and patient reportedoutcome measures proms at baseline and at multipletime points during followup fig at enrollment patients give in formed consent for use of their clinical data and optionally for receiving quality of life questionnairesfig schematic presentati on of medocccreate using the trial with in cohort twics design a plcrc is a nationwide cohort study in the netherlands with in clusi on of crc patients all stages by optional in formed consent regarding collecti on of biomaterials and futurerandomizati on observational as well as in terventional trials can be per formed with in the cohort b nonmetastatic crc patients are in cluded in medocc when the patient signs in formed consent for plcrc in cluding additional blood sampling blood samples are with drawn before resecti on "" days after resecti on and every months during the first years of followup c eligible stage ii colon cancer patients arerandomized following the twics design in the experimental group in formed consent is being asked for immediate ctdna analysis of the blood sample obtained after resecti on if ctdna is detectable patients are of fered adjuvant chemo therapy the control group is not in formedabout medocccreate and will receive standard of care 0 cschraa bmc cancer page']","In vitro and xenograft models used to study colorectal cancer drug response include patient-derived xenografts (PDXs) and various cell lines that mimic the tumor microenvironment. These models allow researchers to evaluate the efficacy of chemotherapeutic agents, such as capecitabine and oxaliplatin, in a controlled setting, providing insights into tumor response and resistance mechanisms [CTX 1][CTX 4]. Additionally, studies have utilized gene expression data from colorectal cancer patients to identify potential biomarkers that correlate with treatment outcomes, further enhancing the understanding of drug response [CTX 2]. However, the translation of findings from these models to clinical settings can be limited due to the heterogeneity of human tumors and the complexity of the tumor microenvironment [CTX 3].",0.15384615384615385,0.8506964750581115,0.0
How do EGFR mutations impact treatment outcomes in NSCLC?,"['provide biological in sights into the regulati on of BRAF on cogene dependence and identify strategies to optimize outcomes in BRAF-mutant NSCLC patients. On cogenic mutations in the BRAF kinase occur in 6""8% of nonsmall cell lung cancers (NSCLCs) accounting for more than 90000 deaths annually worldwide. The biological and clinical relevance of these BRAF mutations in NSCLC is in completely under stood. Here we demonstrate that human NSCLC cells with BRAFV 600 E but not other BRAF mutations in itially are sensitive to BRAF-in hibit or treatment. However these BRAFV 600 E NSCLC cells rapidly acquire resistance to BRAF in hibiti on through at least one of two discrete molecular mechanisms: (i) loss of full-length BRAFV 600 E coupled with expressi on of an aberrant form of BRAFV 600 E that retains RAF pathway dependence or (ii) constitutive autocrine EGF recept or (EGFR) signaling driven by c-Jun""mediated EGFR ligand expressi on. BRAFV 600 E cells with EGFR-driven resistance are characterized by hyperphosphorylated prote in kinase AKT""', 'of a prospective randomized trial highlighting the challenges of retrospectively validating a compani on diagnostic assay after the pivotal drug trials have been completed. The anti-EGFR TKI erlotinib was in itially approved for all patients with advanced NSCLC who had progressed on first-line chemo therapy. A number of subsequent studies determined that patients with EGFR-mutant NSCLC had a high likelihood of responding to these TKI leading to trials in the first-line setting for EGFR-mutant cancer. Four prospective randomized clinical trials studied in Asian populations demonstrated that erlotinib and gefitinib resulted in improved progressi on-free survival compared to chemo therapy for first line the rapy in NSCLC patients with EGFR mutations. Other clinical studies in mixed ethnicity cohorts have concluded with similar C had a high likelihood of responding to these TKI leading to trials in the first-line setting for EGFR-mutant cancer. Four prospective randomized clinical trials studied in Asian populations demonstrated that erlotinib and gefitinib resulted in improved progressi on-free survival compared to chemo therapy for first line the rapy in NSCLC patients with EGFR mutations. Other clinical studies in mixed ethnicity cohorts have concluded with similar. The EURTAC trial was a randomized phase 3 trial to as sess the safety and efficacy of erlotinib compared with standard platinum-based chemo therapy for first-line treatment of a patient populati on with advanced EGFR-mutati on detected NSCLC in a largely Caucasian populati on of European patients. Erlotinib-treated patients experienced significant improvements in median PFS (9.7 months vs. 5.2 months) compared to chemo therapy. Patients on the erlotinib arm also had a considerably higher per centage of responses (58% vs. 15%) in the in tent-to-treat populati on. This trial has been submitted for first line in dicati on of erlotinib in EGFR mutated NSCLC patients. The majority of activating EGFR mutations', 'of a prospective randomized trial highlighting the challenges of retrospectively validating a compani on diagnostic assay after the pivotal drug trials have been completed. The anti-EGFR TKI erlotinib was in itially approved for all patients with advanced NSCLC who had progressed on first-line chemo therapy. A number of subsequent studies determined that patients with EGFR-mutant NSCLC had a high likelihood of responding to these TKI leading to trials in the first-line setting for EGFR-mutant cancer. Four prospective randomized clinical trials studied in Asian populations demonstrated that erlotinib and gefitinib resulted in improved progressi on-free survival compared to chemo therapy for first line the rapy in NSCLC patients with EGFR mutations. Other clinical studies in mixed ethnicity cohorts have concluded with similar C had a high likelihood of responding to these TKI leading to trials in the first-line setting for EGFR-mutant cancer. Four prospective randomized clinical trials studied in Asian populations demonstrated that erlotinib and gefitinib resulted in improved progressi on-free survival compared to chemo therapy for first line the rapy in NSCLC patients with EGFR mutations. Other clinical studies in mixed ethnicity cohorts have concluded with similar. The EURTAC trial was a randomized phase 3 trial to as sess the safety and efficacy of erlotinib compared with standard platinum-based chemo therapy for first-line treatment of a patient populati on with advanced EGFR-mutati on detected NSCLC in a largely Caucasian populati on of European patients. Erlotinib-treated patients experienced significant improvements in median PFS (9.7 months vs. 5.2 months) compared to chemo therapy. Patients on the erlotinib arm also had a considerably higher per centage of responses (58% vs. 15%) in the in tent-to-treat populati on. This trial has been submitted for first line in dicati on of erlotinib in EGFR mutated NSCLC patients. The majority of activating EGFR mutations', 'Following failure of chemo therapy and erlotinib treatment options are limited for patients with advanced non""small cell lung cancer (NSCLC). Reversible epidermal growth fact or recept or (EGFR) tyrosine kinase in hibitors (TKIs) such as erlotinib and gefitinib selectively target EGFR/HER 1 one of the members of the human epidermal growth fact or recept or (HER) family and are most effective in cancers harboring EGFR mutations. The remaining members of the HER family comprise HER 2 and HER 4 tyrosine kinases and the kinase? null HER 3.1 HER family members act to gether via hetero? and homodimerizati on to enable downstream signaling pathways modulating a range of cellular activities in cluding growth proliferati on differentiati on and migrati on.1 In contrast to patients with EGFR? mutati on? positive tumors patients with KRAS? mutant NSCLC are unlikely to respond to gefitinib or erlotinib and do not have an improved progressi on? free survival (PFS) compared with those who have placebo following erlotinib the rapy.2 Dacomitinib (PF?00299804) is a potent irreversible oral small? molecule in hibit or of HER 1/EGFR HER 2 and HER 4 tyrosine kinases with antitum or activity in both gefitinib? sensitive and gefitinib? resistant in cluding EGFR T 790 M preclinical NSCLC models.3 Dacomitinib demonstrated encouraging antitum or activity against NSCLC in Western and Japanese patients in phase 1 studies 5 further supported by preliminary data from phase 2 NSCLC studies conducted in Asian patients with KRAS wild? type refractory disease 7; unselected patients previously treated with chemo therapy 8; and patients with EGFR? mutant disease (first? line treatment).9 This phase 2 trial (Clinical Trials. gov identifier NCT 00548093) as sessed the efficacy safety and impact on health? related quality of life (HRQo L) of dacomitinib in patients with KRAS wild? type NS CLC who progressed after 1 or 2 chemo therapy regimens and erlotinib.', 'Cetuximab is a monoclonal antibody that targets EGFR which is also used in advanced NSCLC in combinati on with standard chemo therapy as part of first-line treatment. Like erlotinib afatinib is a drug that blocks the growth signal from EGFR and used for advanced NSCLCs that have mutations in the EGFR gene. Some younger non-smokers with adenocarcinom as are found to have an ALK/EML 4 fusi on on cogene which is currently a target for the drug Crizotinib. Other drugs currently used to treat lung cancers are not gene-specific and in stead target general molecular pathways like folate anitmetabolites (methotrexate and pemetrexed) mitotic in hibitors (docetaxel piclitaxel and vinorelbine) to poisomerase in hibitors (etopophos and to potecan) and nucleoside analogs which in terfere with DNA synthesis (carboplat in cisplat in and gemciabine). In hibitors of EGFR-directed tyrosine kinase are established to be an effective treatment opti on for advanced NSCLC not responding to chemo therapy. However EGFR-directed monoclonal antibodies in combinati on with platinum-based first-line chemo therapy cetuximab combined with cisplat in/vinorelbine and bevacizumab in combinati on with platinum-based chemo therapy resulted in better survival compared to chemo therapy alone in patients with advanced EGFR-positive NSCLC. Other targeted the rapies in cluding dual and multi-kinase in hibitors are in earlier stages of clinical development. With the accumulati on of knowledge and experience in next generati on technologies it is necessary to expand our under standing in the sensitivity of specific mutations to in dividualized the rapies. ""']","EGFR mutations significantly impact treatment outcomes in non-small cell lung cancer (NSCLC) by increasing the likelihood of response to targeted therapies such as erlotinib and gefitinib. Patients with EGFR-mutant NSCLC have shown improved progression-free survival (PFS) compared to those receiving standard chemotherapy, as demonstrated in multiple clinical trials, including the EURTAC trial, which reported a median PFS of 9.7 months for erlotinib-treated patients versus 5.2 months for chemotherapy [CTX 2][CTX 3]. Additionally, the response rate for erlotinib was notably higher at 58% compared to 15% for chemotherapy [CTX 2]. However, it is important to note that patients with KRAS mutations do not benefit from EGFR-targeted therapies, highlighting the necessity for precise mutation profiling in treatment planning [CTX 4].",1.0,0.9607923099536353,1.0
What is the role of KRAS mutations in lung cancer therapy resistance?,"['. In additi on because HGF over expressi on was frequently observed in tumors with the gatekeeper T 790 M mutati on mono therapy with a mutant-selective EGFR-TKI may not be sufficient to in hibit the growth of tumors with acquired resistance to gefitinib. Our findings suggest that the combinati on of a MEK-TKI and a PIK 3/m TOR-TKI may be effective in controlling these resistant tumors. Many KRAS-mutant cancer cells have been shown to be sensitive to MEK in hibitors and KRAS mutations can be detected in up to 30% of lung cancers dependent upon histology and ethnicity suggesting that a subset of lung cancers would likely be highly sensitive to AZD 6244. Our finding that AZD 6244 was effective in one distinct KRAS mutant human lung cancer NCI-H 460 models supports and validates this hypothesis. Although mono therapy with AZD 6244 resulted in antitum or and some antiangiogenic effects in all of our lung cancer models the antitum or effects were more apparent in the NCI-H 1993 lung adeno carcinoma model. The in creased antitum or efficacy observed in this model is as sociated with differences in the in hibitory effect of p-AKT signaling pathway in NCI-H 1975 and NCI-H 460 lung tumors. However additional studies are needed to elucidate this phenomen on. In this study we evaluated the rapy directed against MEK and PI 3 K/m TOR in distinct gefitinib-resistant NSCLC xenograft models. MEK or PI 3 K/m TOR in hibiti on resulted in antitum or effects for these gefitinib-resistance NSCLC models by blocking key in tracellular pathways controlling cell proliferati on and survival as demonstrated both in vitro and in vivo. Surprisingly PI 3 K/m TOR in hibiti on by BEZ 235 also suppressed lung tumor angiogenesis and targeted both MEK and PI 3 K/m TOR activati on in lung tumors resulting in substantial antiangiogenic effects which may due to the significantly reduced expressi on of MMP-9 in tumors. ""', 'Lung cancer is the leading cause of cancer-related death in many countries in cluding the China. Non-small cell lung cancer (NSCLC) accounts for up to 80% of all lung cancer cases; patients typically present with advanced disease at the time of diagnosis. The prognosis of patients with advanced lung cancer remains poor and recent studies show that conventional the rapies may have reached a the rapeutic plateau as evidenced by the 5-year survival rate for NSCLCs which remains at 15%. The EGF recept or tyrosine kinase in hibitors (EGFR-TKIs) gefitinib and erlotinib have shown marked the rapeutic effects against NSCLCs with EGFR activating mutations such as exon 19 deletions and L 858 R point mutations. Almost all tumors however acquire resistance to EGFR-TKIs after varying per iods of time. Comm on mechanisms for acquired resistance in clude emergence of an EGFR gatekeeper mutati on (T 790 M) and MET gene amplificati on. In additi on PIK 3 CA mutations as well as KRAS mutations have been found to contribute to EGFR-TKIs resistance in a subpopulati on of tumors. The limited the rapeutic options currently available for patients with advanced lung cancer create a pressing need to identify new the rapeutic strategy. Selumetinib (AZD 6244) is an oral non-ATP competitive in hibit or and highly specific for extracellular signal-regulated kinase (ERK) kinase (MEK)1/2 a key enzyme in the RAS-RAF-MEK-ERK pathway.', 'This in dicates the necessity of sequencing in dividual human lung cancers in order to match the use of a single targeted drug or two or more targeted drugs in combinati on against in dividual lung cancer-specific mutations. In this study we have used Ion Ampliseq Cancer Panel to sequence 13500 loci in 45 cancer-related genes mainly on cogenes and tumor suppress or genes of 76 human lung cancer samples. We identified frequent mutations in a group of genes in cluding EGFR KRAS and TP 53 (). Although most of these genes were already known to be as sociated with lung cancers the mutated points and the as sociated mutations in other genes were different in our sample set (Tables 7). As there is in creasing awareness about the changes in lung cancer cells in recent times newer drugs that specifically target these changes have been developed. These targeted drugs either work synergistically with the chemo therapy drugs or by the mselves with much lesser to xicity due to a selective effect as an alternative to a more systemic modulati on of proteins as sociated with on cogenesis. EGFR in hibitors (Afatinib Erlotinib and Gefitinib) and VEGF in hibitors (Bevacizumab) are currently used for target the rapies for NSCLC patients with mutations in the VEGF and EGFR. Erlotinib is a drug that blocks EGFR from signaling the cell to grow. It prevents the progressi on of lung cancer specifically in non-smoking women and is mostly used in advanced NSCLC treatment that was not responsive to chemo therapy. It is also used as the first treatment in patients whose cancers have a mutati on in the EGFR gene.', 'provide biological in sights into the regulati on of BRAF on cogene dependence and identify strategies to optimize outcomes in BRAF-mutant NSCLC patients. On cogenic mutations in the BRAF kinase occur in 6""8% of nonsmall cell lung cancers (NSCLCs) accounting for more than 90000 deaths annually worldwide. The biological and clinical relevance of these BRAF mutations in NSCLC is in completely under stood. Here we demonstrate that human NSCLC cells with BRAFV 600 E but not other BRAF mutations in itially are sensitive to BRAF-in hibit or treatment. However these BRAFV 600 E NSCLC cells rapidly acquire resistance to BRAF in hibiti on through at least one of two discrete molecular mechanisms: (i) loss of full-length BRAFV 600 E coupled with expressi on of an aberrant form of BRAFV 600 E that retains RAF pathway dependence or (ii) constitutive autocrine EGF recept or (EGFR) signaling driven by c-Jun""mediated EGFR ligand expressi on. BRAFV 600 E cells with EGFR-driven resistance are characterized by hyperphosphorylated prote in kinase AKT""', 'Following failure of chemo therapy and erlotinib treatment options are limited for patients with advanced non""small cell lung cancer (NSCLC). Reversible epidermal growth fact or recept or (EGFR) tyrosine kinase in hibitors (TKIs) such as erlotinib and gefitinib selectively target EGFR/HER 1 one of the members of the human epidermal growth fact or recept or (HER) family and are most effective in cancers harboring EGFR mutations. The remaining members of the HER family comprise HER 2 and HER 4 tyrosine kinases and the kinase? null HER 3.1 HER family members act to gether via hetero? and homodimerizati on to enable downstream signaling pathways modulating a range of cellular activities in cluding growth proliferati on differentiati on and migrati on.1 In contrast to patients with EGFR? mutati on? positive tumors patients with KRAS? mutant NSCLC are unlikely to respond to gefitinib or erlotinib and do not have an improved progressi on? free survival (PFS) compared with those who have placebo following erlotinib the rapy.2 Dacomitinib (PF?00299804) is a potent irreversible oral small? molecule in hibit or of HER 1/EGFR HER 2 and HER 4 tyrosine kinases with antitum or activity in both gefitinib? sensitive and gefitinib? resistant in cluding EGFR T 790 M preclinical NSCLC models.3 Dacomitinib demonstrated encouraging antitum or activity against NSCLC in Western and Japanese patients in phase 1 studies 5 further supported by preliminary data from phase 2 NSCLC studies conducted in Asian patients with KRAS wild? type refractory disease 7; unselected patients previously treated with chemo therapy 8; and patients with EGFR? mutant disease (first? line treatment).9 This phase 2 trial (Clinical Trials. gov identifier NCT 00548093) as sessed the efficacy safety and impact on health? related quality of life (HRQo L) of dacomitinib in patients with KRAS wild? type NS CLC who progressed after 1 or 2 chemo therapy regimens and erlotinib.']","KRAS mutations play a significant role in lung cancer therapy resistance, particularly against EGFR tyrosine kinase inhibitors (TKIs) like gefitinib and erlotinib. These mutations are associated with a lack of response to these therapies, as patients with KRAS-mutant non-small cell lung cancer (NSCLC) do not experience improved progression-free survival compared to those receiving placebo after erlotinib treatment [CTX 5]. Additionally, KRAS mutations can be detected in up to 30% of lung cancers, indicating that a subset of these tumors may be sensitive to alternative treatments, such as MEK inhibitors like AZD 6244 [CTX 1]. However, the presence of KRAS mutations complicates treatment options, necessitating the exploration of new therapeutic strategies to overcome resistance [CTX 2].",1.0,0.9999999999999993,1.0
What mechanisms contribute to acquired resistance to EGFR inhibitors in lung cancer?,"['Lung cancer is the leading cause of cancer-related death in many countries in cluding the China. Non-small cell lung cancer (NSCLC) accounts for up to 80% of all lung cancer cases; patients typically present with advanced disease at the time of diagnosis. The prognosis of patients with advanced lung cancer remains poor and recent studies show that conventional the rapies may have reached a the rapeutic plateau as evidenced by the 5-year survival rate for NSCLCs which remains at 15%. The EGF recept or tyrosine kinase in hibitors (EGFR-TKIs) gefitinib and erlotinib have shown marked the rapeutic effects against NSCLCs with EGFR activating mutations such as exon 19 deletions and L 858 R point mutations. Almost all tumors however acquire resistance to EGFR-TKIs after varying per iods of time. Comm on mechanisms for acquired resistance in clude emergence of an EGFR gatekeeper mutati on (T 790 M) and MET gene amplificati on. In additi on PIK 3 CA mutations as well as KRAS mutations have been found to contribute to EGFR-TKIs resistance in a subpopulati on of tumors. The limited the rapeutic options currently available for patients with advanced lung cancer create a pressing need to identify new the rapeutic strategy. Selumetinib (AZD 6244) is an oral non-ATP competitive in hibit or and highly specific for extracellular signal-regulated kinase (ERK) kinase (MEK)1/2 a key enzyme in the RAS-RAF-MEK-ERK pathway.', '1993 NCI-1975 and NCI-H 460 xenograft models. All three gefitinib-resistant tumor xenograft models were treated with the AZD 6244 and/or BEZ 235 for 2 h on Day 21 of the efficacy study tumor tissues in each group were resected and measured by caspase colorimetric protease kits. N?=?10. Although advances have been made in cancer treatment with the development of selective molecular targeted the rapies several relevant issues for their optimal and effective use rema in unsolved. Recent studies have demonstrated that the EGFR-TKI gefitinib and erlotinib are as sociated with a high response rate and prolong progressi on-free survival in patients with EGFR mutant lung cancer. Responders to these agents however later relapse after acquiring EGFR-TKI resistance making it urgent to develop novel the rapeutic agents that can over come acquired resistance to EGFR-TKI. Current clinical approaches to comb at resistance in lung adeno carcinoma in clude irreversible and mutant-selective in hibitors of EGFR combinati on of cetuximab and afatinib and combinati on of an EGFR in hibit or with a drug targeting a resistance pathway such as the combinati on of gefitinib and a MET in hibit or. However alternative RTK pathways that are activated following EGFR in hibiti on are another area for in vestigati on. These alternative pathways may by pass or evade in hibiti on of EGFR signaling the reby enabling combinations of agents to simultaneously at tack multiple molecular targets for cancer growth in hibiti on. One potential soluti on to over come multiple mechanisms of resistance is to target downstream pathways. In this study we show that the combinati on of a selective MEK in hibit or and a PI 3 K/m TOR in hibit or is effective against tumor cell lines refractory to gefitinib by three different mechanisms: an EGFR gatekeeper T 790 M mutati on MET amplificati on and KRAS/PIK 3 CA mutati on. To our knowledge this is the first report of the effects of MEK TKI with PI 3 K/m TOR TKI the rap', 'provide biological in sights into the regulati on of BRAF on cogene dependence and identify strategies to optimize outcomes in BRAF-mutant NSCLC patients. On cogenic mutations in the BRAF kinase occur in 6""8% of nonsmall cell lung cancers (NSCLCs) accounting for more than 90000 deaths annually worldwide. The biological and clinical relevance of these BRAF mutations in NSCLC is in completely under stood. Here we demonstrate that human NSCLC cells with BRAFV 600 E but not other BRAF mutations in itially are sensitive to BRAF-in hibit or treatment. However these BRAFV 600 E NSCLC cells rapidly acquire resistance to BRAF in hibiti on through at least one of two discrete molecular mechanisms: (i) loss of full-length BRAFV 600 E coupled with expressi on of an aberrant form of BRAFV 600 E that retains RAF pathway dependence or (ii) constitutive autocrine EGF recept or (EGFR) signaling driven by c-Jun""mediated EGFR ligand expressi on. BRAFV 600 E cells with EGFR-driven resistance are characterized by hyperphosphorylated prote in kinase AKT""', 'This in dicates the necessity of sequencing in dividual human lung cancers in order to match the use of a single targeted drug or two or more targeted drugs in combinati on against in dividual lung cancer-specific mutations. In this study we have used Ion Ampliseq Cancer Panel to sequence 13500 loci in 45 cancer-related genes mainly on cogenes and tumor suppress or genes of 76 human lung cancer samples. We identified frequent mutations in a group of genes in cluding EGFR KRAS and TP 53 (). Although most of these genes were already known to be as sociated with lung cancers the mutated points and the as sociated mutations in other genes were different in our sample set (Tables 7). As there is in creasing awareness about the changes in lung cancer cells in recent times newer drugs that specifically target these changes have been developed. These targeted drugs either work synergistically with the chemo therapy drugs or by the mselves with much lesser to xicity due to a selective effect as an alternative to a more systemic modulati on of proteins as sociated with on cogenesis. EGFR in hibitors (Afatinib Erlotinib and Gefitinib) and VEGF in hibitors (Bevacizumab) are currently used for target the rapies for NSCLC patients with mutations in the VEGF and EGFR. Erlotinib is a drug that blocks EGFR from signaling the cell to grow. It prevents the progressi on of lung cancer specifically in non-smoking women and is mostly used in advanced NSCLC treatment that was not responsive to chemo therapy. It is also used as the first treatment in patients whose cancers have a mutati on in the EGFR gene.', '1993 NCI-1975 and NCI-H 460 xenograft models. All three gefitinib-resistant tumor xenograft models were treated with the AZD 6244 and/or BEZ 235 for 2 h on Day 21 of the efficacy study tumor tissues in each group were resected and measured by caspase colorimetric protease kits. N?=?10. Although advances have been made in cancer treatment with the development of selective molecular targeted the rapies several relevant issues for their optimal and effective use rema in unsolved. Recent studies have demonstrated that the EGFR-TKI gefitinib and erlotinib are as sociated with a high response rate and prolong progressi on-free survival in patients with EGFR mutant lung cancer. Responders to these agents however later relapse after acquiring EGFR-TKI resistance making it urgent to develop novel the rapeutic agents that can over come acquired resistance to EGFR-TKI. Current clinical approaches to comb at resistance in lung adeno carcinoma in clude irreversible and mutant-selective in hibitors of EGFR combinati on of cetuximab a""']","Acquired resistance to EGFR inhibitors in lung cancer is primarily attributed to several mechanisms, including the emergence of the EGFR gatekeeper mutation T790M, MET gene amplification, and mutations in PIK3CA and KRAS. These alterations allow cancer cells to bypass the inhibitory effects of EGFR-TKIs, leading to treatment failure [CTX 1]. Additionally, alternative receptor tyrosine kinase (RTK) pathways may become activated, further complicating the response to therapy [CTX 2]. While these mechanisms have been identified, the complexity of resistance pathways necessitates ongoing research to develop effective combination therapies [CTX 5].",1.0,0.9754005203173154,1.0
What clinical evidence exists for MEK inhibitors in KRAS-mutant NSCLC?,"['. In additi on because HGF over expressi on was frequently observed in tumors with the gatekeeper T 790 M mutati on mono therapy with a mutant-selective EGFR-TKI may not be sufficient to in hibit the growth of tumors with acquired resistance to gefitinib. Our findings suggest that the combinati on of a MEK-TKI and a PIK 3/m TOR-TKI may be effective in controlling these resistant tumors. Many KRAS-mutant cancer cells have been shown to be sensitive to MEK in hibitors and KRAS mutations can be detected in up to 30% of lung cancers dependent upon histology and ethnicity suggesting that a subset of lung cancers would likely be highly sensitive to AZD 6244. Our finding that AZD 6244 was effective in one distinct KRAS mutant human lung cancer NCI-H 460 models supports and validates this hypothesis. Although mono therapy with AZD 6244 resulted in antitum or and some antiangiogenic effects in all of our lung cancer models the antitum or effects were more apparent in the NCI-H 1993 lung adeno carcinoma model. The in creased antitum or efficacy observed in this model is as sociated with differences in the in hibitory effect of p-AKT signaling pathway in NCI-H 1975 and NCI-H 460 lung tumors. However additional studies are needed to elucidate this phenomen on. In this study we evaluated the rapy directed against MEK and PI 3 K/m TOR in distinct gefitinib-resistant NSCLC xenograft models. MEK or PI 3 K/m TOR in hibiti on resulted in antitum or effects for these gefitinib-resistance NSCLC models by blocking key in tracellular pathways controlling cell proliferati on and survival as demonstrated both in vitro and in vivo. Surprisingly PI 3 K/m TOR in hibiti on by BEZ 235 also suppressed lung tumor angiogenesis and targeted both MEK and PI 3 K/m TOR activati on in lung tumors resulting in substantial antiangiogenic effects which may due to the significantly reduced expressi on of MMP-9 in tumors. ""', 'Lung cancer is the leading cause of cancer-related death in many countries in cluding the China. Non-small cell lung cancer (NSCLC) accounts for up to 80% of all lung cancer cases; patients typically present with advanced disease at the time of diagnosis. The prognosis of patients with advanced lung cancer remains poor and recent studies show that conventional the rapies may have reached a the rapeutic plateau as evidenced by the 5-year survival rate for NSCLCs which remains at 15%. The EGF recept or tyrosine kinase in hibitors (EGFR-TKIs) gefitinib and erlotinib have shown marked the rapeutic effects against NSCLCs with EGFR activating mutations such as exon 19 deletions and L 858 R point mutations. Almost all tumors however acquire resistance to EGFR-TKIs after varying per iods of time. Comm on mechanisms for acquired resistance in clude emergence of an EGFR gatekeeper mutati on (T 790 M) and MET gene amplificati on. In additi on PIK 3 CA mutations as well as KRAS mutations have been found to contribute to EGFR-TKIs resistance in a subpopulati on of tumors. The limited the rapeutic options currently available for patients with advanced lung cancer create a pressing need to identify new the rapeutic strategy. Selumetinib (AZD 6244) is an oral non-ATP competitive in hibit or and highly specific for extracellular signal-regulated kinase (ERK) kinase (MEK)1/2 a key enzyme in the RAS-RAF-MEK-ERK pathway.', 'showed BEZ 235 significantly decreased the vascular density of all three gefitinib-resistant NSCLC tumors where as AZD 6244 mono therapy had only a mildly effect upon lung tumor angiogenesis. The antiangiogenic effects AZD 6244 and BEZ 235 were markedly in creased when they were combined. Effects of AZD 6244 and/or BEZ 235 on the expressions of Ki-67 (A) and CD 31 (B) in NCI-1993 NCI-1975 and NCI-H 460 xenograft models. All three gefitinib-resistant tumor xenograft models were treated with the AZD 6244 and/or BEZ 235 for 2 h on Day 21 of the efficacy study tumor tissues in each group were resected and immunostained with anti-Ki 67 and anti-CD 31 antibodies. N?=?10 * P?<?0.05 vs vehicle group. ** P?<?0.01 vs vehicle group. MEK and PIK 3/m TOR in hibitors had no effect on caspase-3 8 and 9 activities in gefitinib-resistant NSCLC tumor models In order to in vestigate whether AZD 6244 and/or BEZ 235 would in duce apoptosis in gefitinib-resistant NSCLC tumor models activity of caspase-3 8 and 9 were measured by the colorimetric assay. The showed that AZD 6244 and/or BEZ 235 had no effect on caspase-3 8 and 9 activities in all three gefitinib-resistant NSCLC tumor models. Effects of AZD 6244 and/or BEZ 235 on the activities of caspase-3 8 and 9 in NCI-1993 NCI-1975 and NCI-H 460 xenograft models. All three gefitinib-resistant tumor xenograft models were treated with the AZD 6244 and/or BEZ 235 for 2 h on Day 21 of the efficacy study tumor tissues in each group were resected and measured by caspase colorimetric protease kits. N?=?10.', 'Following failure of chemo therapy and erlotinib treatment options are limited for patients with advanced non""small cell lung cancer (NSCLC). Reversible epidermal growth fact or recept or (EGFR) tyrosine kinase in hibitors (TKIs) such as erlotinib and gefitinib selectively target EGFR/HER 1 one of the members of the human epidermal growth fact or recept or (HER) family and are most effective in cancers harboring EGFR mutations. The remaining members of the HER family comprise HER 2 and HER 4 tyrosine kinases and the kinase? null HER 3.1 HER family members act to gether via hetero? and homodimerizati on to enable downstream signaling pathways modulating a range of cellular activities in cluding growth proliferati on differentiati on and migrati on.1 In contrast to patients with EGFR? mutati on? positive tumors patients with KRAS? mutant NSCLC are unlikely to respond to gefitinib or erlotinib and do not have an improved progressi on? free survival (PFS) compared with those who have placebo following erlotinib the rapy.2 Dacomitinib (PF?00299804) is a potent irreversible oral small? molecule in hibit or of HER 1/EGFR HER 2 and HER 4 tyrosine kinases with antitum or activity in both gefitinib? sensitive and gefitinib? resistant in cluding EGFR T 790 M preclinical NSCLC models.3 Dacomitinib demonstrated encouraging antitum or activity against NSCLC in Western and Japanese patients in phase 1 studies 5 further supported by preliminary data from phase 2 NSCLC studies conducted in Asian patients with KRAS wild? type refractory disease 7; unselected patients previously treated with chemo therapy 8; and patients with EGFR? mutant disease (first? line treatment).9 This phase 2 trial (Clinical Trials. gov identifier NCT 00548093) as sessed the efficacy safety and impact on health? related quality of life (HRQo L) of dacomitinib in patients with KRAS wild? type NS CLC who progressed after 1 or 2 chemo therapy regimens and erlotinib.', 'Immuno therapy manipulates the immune system to control and eradicate cancer. Many recent studies provide evidence suggesting that immunotherapeutic manipulations are viable in many tumor types in cluding lung cancer. Numerous trials of peptide vaccines autologous cellular the rapy T cell-directed antibody the rapy and monoclonal antibody the rapy for lung cancer have been carried out around the world (8""10) and some of them have shown favorable (11""13). The EML 4-ALK fusi on gene was identified in NSCLC patients by a team led by Profess or H. Mano. This fusi on gene was formed as the result of a small in versi on with in the short arm of chromosome 2 that joins differing portions of the EML 4 gene with a porti on of the ALK gene (1415). As a result of this fusi on constant dimerizati on of the kinase doma in of ALK is in duced and its catalytic activity in creases consequently. The EML 4-ALK fusi on gene is mainly identified in young never/former light smokers with NSCLC (16). It is estimated that approximately 5% of all NSCLC cases have this fusi on gene. A few reports have also identified EML 4-ALK in other cancers namely breast cancer and colorectal cancer (1718). For the most part the EML 4-ALK fusi on gene and other mutations such as those in EGFR and KRAS are mutually exclusive (19). The chromosomal in versi on does not always occur in the same locati on and multiple EML 4-ALK variants have been identified (19). At least 11 variants have been reported. The most comm on variants are E 13; A 20 (variant 1) and E 6 a/b; A 20 (variant 3 a/b) which have been detected in 33% and 29% of NSCLC patients respectively (14). PF-02341066 (crizotinib) is an ALK in hibit or currently under clinical development.']","Clinical evidence for MEK inhibitors, specifically AZD 6244, in KRAS-mutant non-small cell lung cancer (NSCLC) suggests that these inhibitors can be effective in controlling tumor growth. Studies have shown that many KRAS-mutant cancer cells are sensitive to MEK inhibitors, with AZD 6244 demonstrating antitumor effects in specific KRAS mutant lung cancer models, such as NCI-H 460 [CTX 1]. Additionally, the combination of MEK inhibitors with other therapies, like PIK3/mTOR inhibitors, has shown enhanced antitumor efficacy in gefitinib-resistant NSCLC models [CTX 1][CTX 3]. However, while AZD 6244 has shown promise, further studies are needed to fully elucidate its effectiveness and the mechanisms behind its action [CTX 1].",1.0,0.0,1.0
Which immune checkpoints are targeted in lung cancer studies?,"['Lung cancer is one of the main causes of cancer-related mortality. Approximately 85% of lung cancers are diagnosed as non-small cell lung cancer (NSCLC) and the overall survival (OS) rate for advanced NSCLC is poor. The 5-year survival rate is 5% for stage IIIb NSCLC and <1% for stage IV NSCLC. Treatment for NCSLC is determined by the patient™s clinical and tumor characteristics per formance status (PS) the histological subtype and tumor genotype/phenotype. Recently there have been many studies concerning agents that target molecular changes such as mutations in the epidermal growth fact or recept or (EGFR) and the fusi on on cogene EML 4-ALK in which the echinoderm microtubule-as sociated prote in-like 4 (EML 4) is fused with the in tracellular doma in of anaplastic kinase (ALK) (2""4). Although significant advances have been made in the treatment of NSCLC using molecular targeted the rapies such as erlotinib and crizotinib the median OS for patients with advanced NSCLC remains low and acquired resistance to target agents is a major clinical problem. The refore the development of novel the rapies is needed. Immuno therapy manipulates the immune system to control and eradicate cancer. Many recent studies provide evidence suggesting that immunotherapeutic manipulations are viable in many tumor types in cluding lung cancer. Numerous trials of peptide vaccines autologous cellular the rapy T cell-directed antibody the rapy and monoclonal antibody the rapy for lung cancer have been carried out around the world (8""10) and some of them have shown favorable', 'Lung cancer is one of the main causes of cancer-related mortality. Approximately 85% of lung cancers are diagnosed as non-small cell lung cancer (NSCLC) and the overall survival (OS) rate for advanced NSCLC is poor. The 5-year survival rate is 5% for stage IIIb NSCLC and <1% for stage IV NSCLC (1). Treatment for NCSLC is determined by the patient™s clinical and tumor characteristics per formance status (PS) the histological subtype and tumor genotype/phenotype. Recently there have been many studies concerning agents that target molecular changes such as mutations in the epidermal growth fact or recept or (EGFR) and the fusi on on cogene EML 4-ALK in which the echinoderm microtubule-as sociated prote in-like 4 (EML 4) is fused with the in tracellular doma in of anaplastic kinase (ALK) (2""4). Although significant advances have been made in the treatment of NSCLC using molecular targeted the rapies such as erlotinib and crizotinib the median OS for patients with advanced NSCLC remains low (56) and acquired resistance to target agents is a major clinical problem. The refore the development of novel the rapies is needed (7). Immuno therapy manipulates the immune system to control and eradicate cancer. Many recent studies provide evidence suggesting that immunotherapeutic manipulations are viable in many tumor types in cluding lung cancer. Numerous trials of peptide vaccines autologous cellular the rapy T cell-directed antibody the rapy and monoclonal antibody the rapy for lung cancer have been carried out around the world (8""10) and some of them have shown favorable', 'were in accordance with the study that genetic polymorphisms in in nate immunity genes may play a role in the carcinogenesis of lung cancer. It is likely that some genetic variations in strong link disequilibrium with this in tronic SNP (rs 7525160 G?>? C) are functional which provides a new in sight into the hallmarks in susceptibility to lung cancer and further functional experiments are warranted to address the proposal. Functionally human CR 1 exists on the surface of almost all per ipheral blood cells and plays a key role in immune complex clearance and complement in hibiti on at the cell surface by binding to activated products C 3 b and C 4 b. CR 1 also possesses cofact or activity for the serum protease fact or I and is thus in volved in the generati on of further fragments of C 3/4 b with the activati on of complement cascade and the cellular immune response. In our study the as sociati on of CR 1 polymorphism with lung cancer is biologically plausible in that the in tronic polymorphism could affect the density of CR 1 molecules on the cell surface the reby contributing to autoimmune disorders and neoplasm. To bacco smoking is an established risk fact or for susceptibility to lung cancer. However not all people who suffer from lung cancer are smokers. Lung cancer in non-smokers can be in duced by second hand smoke air pollutants and diesel exhaust. Our present data showed significant difference of pack-year smoked but not smoking status between NSCLC cases and controls which suggested the important role of other environmental factors in the development of NSCLC. To bacco could in duce chronic and sustained in flammati on in lung micro environment contributing to pulmonary carcinogenesis in smokers.', 'The chronic airway in flammati on and dysfunctional immune system might promote pulmonary carcinogenesis. Implicated in the immune and in flammatory responses the complement cascade plays a pivotal role in the development of cancer. Thus it is likely that the genetic variants of CR 1 in the complement system confer the susceptibility to lung cancer. In this study we have for the first time demonstrated that one in tronic SNP (rs 7525160 G?>? C) out of 13 tag SNPs of CR 1 was as sociated with the risk of NSCLC in Chinese populati on. Notably the rs 7525160 CC genotype was as sociated with an in creased risk of developing NSCLC (OR?=?1.52 95% CI?=?1.02-2.28; P?=?0.028) compared with the GG genotype. MDR analysis also showed that there was no gene-gene in teracti on among 12 tag SNPs in CR 1 gene. Moreover the risk of NSCLC was as sociated with the rs 7525160 C allele carriers in smokers with OR (95% CI) of 1.72 (1.15-2.59) but not in non-smokers with OR (95% CI) of 1.15 (0.81-1.65) in dicating this SNP is a smoking-modifying risk fact or for susceptibility to NSCLC. To the best of our knowledge this study shed new in sight into the in terplay of genetic variati on of CR 1 with lung cancer risk. More importantly it highlights the potential gene-environmental in teracti on in fluences the susceptibility to lung cancer.', 'Immuno therapy manipulates the immune system to control and eradicate cancer. Many recent studies provide evidence suggesting that immunotherapeutic manipulations are viable in many tumor types in cluding lung cancer. Numerous trials of peptide vaccines autologous cellular the rapy T cell-directed antibody the rapy and monoclonal antibody the rapy for lung cancer have been carried out around the world (8""10) and some of them have shown favorable (11""13). The EML 4-ALK fusi on gene was identified in NSCLC patients by a team led by Profess or H. Mano. This fusi on gene was formed as the result of a small in versi on with in the short arm of chromosome 2 that joins differing portions of the EML 4 gene with a porti on of the ALK gene. As a result of this fusi on constant dimerizati on of the kinase doma in of ALK is in duced and its catalytic activity in creases consequently. The EML 4-ALK fusi on gene is mainly identified in young never/former light smokers with NSCLC. It is estimated that approximately 5% of all NSCLC cases have this fusi on gene. A few reports have also identified EML 4-ALK in other cancers namely breast cancer and colorectal cancer. For the most part the EML 4-ALK fusi on gene and other mutations such as those in EGFR and KRAS are mutually exclusive. The chromosomal in versi on does not always occur in the same locati on and multiple EML 4-ALK variants have been identified. At least 11 variants have been reported. The most comm on variants are E 13; A 20 (variant 1) and E 6 a/b; A 20 (variant 3 a/b) which have been detected in 33% and 29% of NSCLC patients respectively. PF-02341066 (crizotinib) is an ALK in hibit or currently under clinical development.']","In lung cancer studies, immune checkpoints that are commonly targeted include PD-1 (programmed cell death protein 1) and CTLA-4 (cytotoxic T-lymphocyte-associated protein 4) through various immunotherapeutic approaches. These therapies aim to manipulate the immune system to enhance its ability to recognize and eradicate cancer cells, particularly in non-small cell lung cancer (NSCLC) [CTX 1][CTX 5]. Numerous trials have been conducted using monoclonal antibodies and other immunotherapeutic strategies, showing promising results in some cases [CTX 2][CTX 5]. However, the overall survival rates for advanced NSCLC remain low, indicating that while these therapies are a step forward, further research and development are necessary to improve outcomes [CTX 1][CTX 2].",0.875,0.979947747158947,0.25
What adverse effects are associated with immunotherapy in lung cancer trials?,"['(NSCLC) patients and 53 small cell carcinoma patients. In the NSCLC cases there were 320 adenocarcinom as 73 squamous cell carcinom as and 41 other tumors with a variety of different pathologies (such as large cell carcinom as mixed cell carcinom as or undifferentiated carcinom as)..0096911. t 001 Characteristics of lung cancer cases and controls. Variables Cases(%) Controls(%) P value Female 487 516 Mean age (years) 56.5±11.7 56.3±12.5 0.248 a In come (yuan/month) 628.9±419.3 563.5±387.6 0.084 a Never smoker 487 516 Histological type NSCLC 434(89.1) Adeno carcinoma 320(65.7) Squamous cell carcinoma 73(15.0) Small cell carcinoma 53(10.9) Other 41(8.4) a Student\'s t-test was used to compare the frequency distributions of demographic variables between the cases and controls. As sociati on analysis The observed genotype frequencies among the control subjects was in agreement with that expected under the Hardy-Weinberg equilibrium (P?=?0.119). The distributi on of ATM rs 189037 genotypes among subjects were displayed in Using subjects with the ATM rs 189037 GG genotype as the reference group we calculated the ORs and 95%CIs for heterozygous carriers of GA genotype and homozygous carriers of AA genotype. No significant difference was observed between lung cancer cases and controls in each test (P>0.05). In order to in crease the statistical power we combined the GA genotype with the AA genotype to compare with GG genotype as a dominant model and combined the GA genotype with the GG genotype to compare with AA genotype as a recessive model. The in dicated that in dividuals with AA genotype had a significantly elevated risk of lung adeno carcinoma compared with those carrying the GG or GA genotype (OR?=?1.44 95%CI 1.02""2.02 P?=?0.039)..0096911. t 002 Distributi on of ATM rs 189037 genotypes and ORs for lung cancer cases and controls.', 'Lung cancer is one of the main causes of cancer-related mortality. Approximately 85% of lung cancers are diagnosed as non-small cell lung cancer (NSCLC) and the overall survival (OS) rate for advanced NSCLC is poor. The 5-year survival rate is 5% for stage IIIb NSCLC and <1% for stage IV NSCLC. Treatment for NCSLC is determined by the patient™s clinical and tumor characteristics per formance status (PS) the histological subtype and tumor genotype/phenotype. Recently there have been many studies concerning agents that target molecular changes such as mutations in the epidermal growth fact or recept or (EGFR) and the fusi on on cogene EML 4-ALK in which the echinoderm microtubule-as sociated prote in-like 4 (EML 4) is fused with the in tracellular doma in of anaplastic kinase (ALK) (2""4). Although significant advances have been made in the treatment of NSCLC using molecular targeted the rapies such as erlotinib and crizotinib the median OS for patients with advanced NSCLC remains low and acquired resistance to target agents is a major clinical problem. The refore the development of novel the rapies is needed. Immuno therapy manipulates the immune system to control and eradicate cancer. Many recent studies provide evidence suggesting that immunotherapeutic manipulations are viable in many tumor types in cluding lung cancer. Numerous trials of peptide vaccines autologous cellular the rapy T cell-directed antibody the rapy and monoclonal antibody the rapy for lung cancer have been carried out around the world (8""10) and some of them have shown favorable', 'Lung cancer is one of the main causes of cancer-related mortality. Approximately 85% of lung cancers are diagnosed as non-small cell lung cancer (NSCLC) and the overall survival (OS) rate for advanced NSCLC is poor. The 5-year survival rate is 5% for stage IIIb NSCLC and <1% for stage IV NSCLC (1). Treatment for NCSLC is determined by the patient™s clinical and tumor characteristics per formance status (PS) the histological subtype and tumor genotype/phenotype. Recently there have been many studies concerning agents that target molecular changes such as mutations in the epidermal growth fact or recept or (EGFR) and the fusi on on cogene EML 4-ALK in which the echinoderm microtubule-as sociated prote in-like 4 (EML 4) is fused with the in tracellular doma in of anaplastic kinase (ALK) (2""4). Although significant advances have been made in the treatment of NSCLC using molecular targeted the rapies such as erlotinib and crizotinib the median OS for patients with advanced NSCLC remains low (56) and acquired resistance to target agents is a major clinical problem. The refore the development of novel the rapies is needed (7). Immuno therapy manipulates the immune system to control and eradicate cancer. Many recent studies provide evidence suggesting that immunotherapeutic manipulations are viable in many tumor types in cluding lung cancer. Numerous trials of peptide vaccines autologous cellular the rapy T cell-directed antibody the rapy and monoclonal antibody the rapy for lung cancer have been carried out around the world (8""10) and some of them have shown favorable', 'Stage at primarydiagnosis ± obscure boundary ± Emphysema ± T tumor ± L 1 cycle ± Obstructivepneumoniaatelectasis ± pulmonary nodule Patients with SCLCStage at recruitmenttime ± Stage at primarydiagnosis ± N 1 ipsilateral Paratracheal ± T tumor ± N 1 ipsilateral hilum ± N 2 ipsilateralmediastinum ± Enhanced image ± pulmonary nodule ± N LN ± Maintenancetreatment Patients survived Stage at primarydiagnosis ± N 2 ipsilateralmediastinum ± Enhanced image ± Stage at recruitmenttime ± N 1 ipsilateral hilum ± TTF 1 ± Naps in A ± Locati on ± N 1 ipsilateralparatracheal ± Lobular Patientsnonsurvived Stage at recruitmenttime ± Stage at primarydiagnosis ± N 1 ipsilateralparatracheal ± N 2 ipsilateralmediastinum ± N 1 ipsilateral hilum ± Enhanced image ± N 2 below carina ± TTF 1 ± N LN ± T tumor ± ± Abbreviations N degrees of lung cancer metastasis to lymph nodes of TNM category N 1 degree that has metastatic lymph nodes near pulmonary center and side of main bronchia N 2 degree that has metastatic lymph nodes in the same side of the mediastinum as lung cancer TTF 1 thyroid transcripti on fact or 1 asan immunohistochemical biomarker for adeno carcinoma CK 7 kerat in as an immunohistochemical biomarker for epithelial cells L 1 cycle number of the firstline chemo therapy cycles ± ± ± in ADC and SCC and lyso PG in SCLC where as PG and TAG in creased in ADC and SCCPE in SCLC and PC in SCC The volcanic map demonstrated the clear patterns of lipid elements significantlyincreased or declined between heathy controls with ADCFigure 4 E SCC or SCLC and varied among different subtypes of lung cancerspatient genders Different lipidomics between About or lipid elements significantly in creased and or declined', 'Immuno therapy manipulates the immune system to control and eradicate cancer. Many recent studies provide evidence suggesting that immunotherapeutic manipulations are viable in many tumor types in cluding lung cancer. Numerous trials of peptide vaccines autologous cellular the rapy T cell-directed antibody the rapy and monoclonal antibody the rapy for lung cancer have been carried out around the world (8""10) and some of them have shown favorable (11""13). The EML 4-ALK fusi on gene was identified in NSCLC patients by a team led by Profess or H. Mano. This fusi on gene was formed as the result of a small in versi on with in the short arm of chromosome 2 that joins differing portions of the EML 4 gene with a porti on of the ALK gene. As a result of this fusi on constant dimerizati on of the kinase doma in of ALK is in duced and its catalytic activity in creases consequently. The EML 4-ALK fusi on gene is mainly identified in young never/former light smokers with NSCLC. It is estimated that approximately 5% of all NSCLC cases have this fusi on gene. A few reports have also identified EML 4-ALK in other cancers namely breast cancer and colorectal cancer. For the most part the EML 4-ALK fusi on gene and other mutations such as those in EGFR and KRAS are mutually exclusive. The chromosomal in versi on does not always occur in the same locati on and multiple EML 4-ALK variants have been identified. At least 11 variants have been reported. The most comm on variants are E 13; A 20 (variant 1) and E 6 a/b; A 20 (variant 3 a/b) which have been detected in 33% and 29% of NSCLC patients respectively. PF-02341066 (crizotinib) is an ALK in hibit or currently under clinical development.']",Adverse effects associated with immunotherapy in lung cancer trials are not described in the provided contexts.,0.0,0.0,0.25
What survival outcomes are reported for advanced NSCLC patients?,"['Lung cancer is one of the main causes of cancer-related mortality. Approximately 85% of lung cancers are diagnosed as non-small cell lung cancer (NSCLC) and the overall survival (OS) rate for advanced NSCLC is poor. The 5-year survival rate is 5% for stage IIIb NSCLC and <1% for stage IV NSCLC (1). Treatment for NCSLC is determined by the patient™s clinical and tumor characteristics per formance status (PS) the histological subtype and tumor genotype/phenotype. Recently there have been many studies concerning agents that target molecular changes such as mutations in the epidermal growth fact or recept or (EGFR) and the fusi on on cogene EML 4-ALK in which the echinoderm microtubule-as sociated prote in-like 4 (EML 4) is fused with the in tracellular doma in of anaplastic kinase (ALK) (2""4). Although significant advances have been made in the treatment of NSCLC using molecular targeted the rapies such as erlotinib and crizotinib the median OS for patients with advanced NSCLC remains low (56) and acquired resistance to target agents is a major clinical problem. The refore the development of novel the rapies is needed (7). Immuno therapy manipulates the immune system to control and eradicate cancer. Many recent studies provide evidence suggesting that immunotherapeutic manipulations are viable in many tumor types in cluding lung cancer. Numerous trials of peptide vaccines autologous cellular the rapy T cell-directed antibody the rapy and monoclonal antibody the rapy for lung cancer have been carried out around the world (8""10) and some of them have shown favorable', 'Lung cancer is one of the main causes of cancer-related mortality. Approximately 85% of lung cancers are diagnosed as non-small cell lung cancer (NSCLC) and the overall survival (OS) rate for advanced NSCLC is poor. The 5-year survival rate is 5% for stage IIIb NSCLC and <1% for stage IV NSCLC. Treatment for NCSLC is determined by the patient™s clinical and tumor characteristics per formance status (PS) the histological subtype and tumor genotype/phenotype. Recently there have been many studies concerning agents that target molecular changes such as mutations in the epidermal growth fact or recept or (EGFR) and the fusi on on cogene EML 4-ALK in which the echinoderm microtubule-as sociated prote in-like 4 (EML 4) is fused with the in tracellular doma in of anaplastic kinase (ALK) (2""4). Although significant advances have been made in the treatment of NSCLC using molecular targeted the rapies such as erlotinib and crizotinib the median OS for patients with advanced NSCLC remains low and acquired resistance to target agents is a major clinical problem. The refore the development of novel the rapies is needed. Immuno therapy manipulates the immune system to control and eradicate cancer. Many recent studies provide evidence suggesting that immunotherapeutic manipulations are viable in many tumor types in cluding lung cancer. Numerous trials of peptide vaccines autologous cellular the rapy T cell-directed antibody the rapy and monoclonal antibody the rapy for lung cancer have been carried out around the world (8""10) and some of them have shown favorable', 'Lung cancer represents the most frequent cause of cancer deaths. More than 225000 new cases were diagnosed during 2012 only in the United States of America accounting for approximately 160000 annual deaths. More than 50% of the patients diagnosed with non-small cell lung cancer (NSCLC) present advanced disease (stage III and IV) at onset. The most comm on histology is adeno carcinoma representing approximately 80% of all cases. Pemetrexed is a multitargeted antifolate drug and one of the latest active drugs against NSCLC approved for the first-line (in combinati on with cisplat in) and second-line treatment (mono therapy) of patients with non-squamous histology. More recently pemetrexed gained approval for its use as a single-agent maintenance the rapy after response/stabilizati on to four cycles of a platinum doublet with or without pemetrexed. Thymidylate synthase (TS) is the main biological target of antifolate drugs such as pemetrexed or 5-fluorouracil. Different studies have evaluated the correlati on between tumor TS expressi on and TS genotype and the prognosis of patients with different cancer types treated with antifolates. In NSCLC constitutive expressi on of TS is lower in tumors with adeno carcinoma histology than among those with squamous differentiati on. This finding could possibly expla in the higher efficacy of the drug among non-squamous histology patients. The potential predictive role of TS polymorphisms in NSCLC has never been studied in a European populati on. In additi on how differential TS genotypes may impact on the outcome of patients depending on their smoking status or with Epidermal Growth Fact or Recept or (EGFR) activating mutations tumors is to be determined. Finally although the to xicity profile described in most patients receiving pemetrexed in combinati on or as a single agent is usually favorable there are several reported cases of fundamentally dermatological hematological and potentially serious renal to xicities even when the', 'Lung cancer is the leading cause of cancer-related death in many countries in cluding the China. Non-small cell lung cancer (NSCLC) accounts for up to 80% of all lung cancer cases; patients typically present with advanced disease at the time of diagnosis. The prognosis of patients with advanced lung cancer remains poor and recent studies show that conventional the rapies may have reached a the rapeutic plateau as evidenced by the 5-year survival rate for NSCLCs which remains at 15%. The EGF recept or tyrosine kinase in hibitors (EGFR-TKIs) gefitinib and erlotinib have shown marked the rapeutic effects against NSCLCs with EGFR activating mutations such as exon 19 deletions and L 858 R point mutations. Almost all tumors however acquire resistance to EGFR-TKIs after varying per iods of time. Comm on mechanisms for acquired resistance in clude emergence of an EGFR gatekeeper mutati on (T 790 M) and MET gene amplificati on. In additi on PIK 3 CA mutations as well as KRAS mutations have been found to contribute to EGFR-TKIs resistance in a subpopulati on of tumors. The limited the rapeutic options currently available for patients with advanced lung cancer create a pressing need to identify new the rapeutic strategy. Selumetinib (AZD 6244) is an oral non-ATP competitive in hibit or and highly specific for extracellular signal-regulated kinase (ERK) kinase (MEK)1/2 a key enzyme in the RAS-RAF-MEK-ERK pathway.', 'After publicati on of the In ternational Adjuvant Lung Cancer Trial in 2004 adjuvant chemo therapy containing a platinum agent has become the standard of care for patients with a complete surgical resecti on of American Joint Committee on Cancer stage II to III (versi on 6) non-small cell lung cancer (NSCLC).1 The trial in cluded patients with stage I to III disease and demonstrated an absolute 4.1% improvement in overall survival (OS) and a subgroup analysis in dicated that the OS benefit in creased with stage: the hazards ratio (HR) for death among patients receiving adjuvant chemo therapy compared with controls was approximately 0.98 for patients with stage I disease 0.88 for patients with stage II disease and 0.79 for patients with stage III disease.1 The data were confirmed by the National Cancer In stitute of Canada Clinical Trials Group JBR.10 trial in 2005 which in cluded patients with stage IB and stage II disease.2 A third trial Cancer and Leukemia Group B (CALGB) 9633 which in cluded only patients with stage IB disease was terminated early and also reported a the rapeutic benefit for adjuvant chemo therapy.3 However a final analysis of mature data revealed no statistically significant OS benefit (HR 0.83) but demonstrated a benefit for patients with tumor diameters of??4 cm (HR 0.69).4 During the same time period an in creasing number of correlative biomarker analyses demonstrated that the efficacy of platinum agents was as sociated with in tratumoral levels of the excisi on repair cross-complementing group 1 (ERCC 1) gene with high levels in dicating resistance.5""9 Similarly high in tratumoral levels of the regulatory subunit of ribonucleotide reductase M 1 (RRM 1) were reported to be predictive of resistance to gemcitabine.9""13 Finally both biomarkers had also been reported to be prognostic of survival in patients who had not received chemo therapy or radiati on with high levels in dicating longer survival.814""16 Based on these data we designed an adjuv']","The survival outcomes for patients with advanced non-small cell lung cancer (NSCLC) are notably poor, with a 5-year survival rate of 5% for stage IIIb and less than 1% for stage IV NSCLC [CTX 1][CTX 2]. Despite advancements in treatment options, including molecular targeted therapies and immunotherapy, the median overall survival (OS) for these patients remains low, and resistance to targeted agents is a significant clinical challenge [CTX 1][CTX 4]. Additionally, conventional therapies appear to have reached a therapeutic plateau, further emphasizing the need for novel treatment strategies [CTX 4].",1.0,0.9059108365521901,1.0
What phases of clinical trials (I/II/III) are represented in lung cancer targeted therapy research?,"['Lung cancer is one of the main causes of cancer-related mortality. Approximately 85% of lung cancers are diagnosed as non-small cell lung cancer (NSCLC) and the overall survival (OS) rate for advanced NSCLC is poor. The 5-year survival rate is 5% for stage IIIb NSCLC and <1% for stage IV NSCLC (1). Treatment for NCSLC is determined by the patient™s clinical and tumor characteristics per formance status (PS) the histological subtype and tumor genotype/phenotype. Recently there have been many studies concerning agents that target molecular changes such as mutations in the epidermal growth fact or recept or (EGFR) and the fusi on on cogene EML 4-ALK in which the echinoderm microtubule-as sociated prote in-like 4 (EML 4) is fused with the in tracellular doma in of anaplastic kinase (ALK) (2""4). Although significant advances have been made in the treatment of NSCLC using molecular targeted the rapies such as erlotinib and crizotinib the median OS for patients with advanced NSCLC remains low (56) and acquired resistance to target agents is a major clinical problem. The refore the development of novel the rapies is needed (7). Immuno therapy manipulates the immune system to control and eradicate cancer. Many recent studies provide evidence suggesting that immunotherapeutic manipulations are viable in many tumor types in cluding lung cancer. Numerous trials of peptide vaccines autologous cellular the rapy T cell-directed antibody the rapy and monoclonal antibody the rapy for lung cancer have been carried out around the world (8""10) and some of them have shown favorable', 'Lung cancer is one of the main causes of cancer-related mortality. Approximately 85% of lung cancers are diagnosed as non-small cell lung cancer (NSCLC) and the overall survival (OS) rate for advanced NSCLC is poor. The 5-year survival rate is 5% for stage IIIb NSCLC and <1% for stage IV NSCLC. Treatment for NCSLC is determined by the patient™s clinical and tumor characteristics per formance status (PS) the histological subtype and tumor genotype/phenotype. Recently there have been many studies concerning agents that target molecular changes such as mutations in the epidermal growth fact or recept or (EGFR) and the fusi on on cogene EML 4-ALK in which the echinoderm microtubule-as sociated prote in-like 4 (EML 4) is fused with the in tracellular doma in of anaplastic kinase (ALK) (2""4). Although significant advances have been made in the treatment of NSCLC using molecular targeted the rapies such as erlotinib and crizotinib the median OS for patients with advanced NSCLC remains low and acquired resistance to target agents is a major clinical problem. The refore the development of novel the rapies is needed. Immuno therapy manipulates the immune system to control and eradicate cancer. Many recent studies provide evidence suggesting that immunotherapeutic manipulations are viable in many tumor types in cluding lung cancer. Numerous trials of peptide vaccines autologous cellular the rapy T cell-directed antibody the rapy and monoclonal antibody the rapy for lung cancer have been carried out around the world (8""10) and some of them have shown favorable', 'After publicati on of the In ternational Adjuvant Lung Cancer Trial in 2004 adjuvant chemo therapy containing a platinum agent has become the standard of care for patients with a complete surgical resecti on of American Joint Committee on Cancer stage II to III (versi on 6) non-small cell lung cancer (NSCLC).1 The trial in cluded patients with stage I to III disease and demonstrated an absolute 4.1% improvement in overall survival (OS) and a subgroup analysis in dicated that the OS benefit in creased with stage: the hazards ratio (HR) for death among patients receiving adjuvant chemo therapy compared with controls was approximately 0.98 for patients with stage I disease 0.88 for patients with stage II disease and 0.79 for patients with stage III disease.1 The data were confirmed by the National Cancer In stitute of Canada Clinical Trials Group JBR.10 trial in 2005 which in cluded patients with stage IB and stage II disease.2 A third trial Cancer and Leukemia Group B (CALGB) 9633 which in cluded only patients with stage IB disease was terminated early and also reported a the rapeutic benefit for adjuvant chemo therapy.3 However a final analysis of mature data revealed no statistically significant OS benefit (HR 0.83) but demonstrated a benefit for patients with tumor diameters of??4 cm (HR 0.69).4 During the same time period an in creasing number of correlative biomarker analyses demonstrated that the efficacy of platinum agents was as sociated with in tratumoral levels of the excisi on repair cross-complementing group 1 (ERCC 1) gene with high levels in dicating resistance.5""9 Similarly high in tratumoral levels of the regulatory subunit of ribonucleotide reductase M 1 (RRM 1) were reported to be predictive of resistance to gemcitabine.9""13 Finally both biomarkers had also been reported to be prognostic of survival in patients who had not received chemo therapy or radiati on with high levels in dicating longer survival.814""16 Based on these data we designed an adjuv', 'Stage at primarydiagnosis ± obscure boundary ± Emphysema ± T tumor ± L 1 cycle ± Obstructivepneumoniaatelectasis ± pulmonary nodule Patients with SCLCStage at recruitmenttime ± Stage at primarydiagnosis ± N 1 ipsilateral Paratracheal ± T tumor ± N 1 ipsilateral hilum ± N 2 ipsilateralmediastinum ± Enhanced image ± pulmonary nodule ± N LN ± Maintenancetreatment Patients survived Stage at primarydiagnosis ± N 2 ipsilateralmediastinum ± Enhanced image ± Stage at recruitmenttime ± N 1 ipsilateral hilum ± TTF 1 ± Naps in A ± Locati on ± N 1 ipsilateralparatracheal ± Lobular Patientsnonsurvived Stage at recruitmenttime ± Stage at primarydiagnosis ± N 1 ipsilateralparatracheal ± N 2 ipsilateralmediastinum ± N 1 ipsilateral hilum ± Enhanced image ± N 2 below carina ± TTF 1 ± N LN ± T tumor ± ± Abbreviations N degrees of lung cancer metastasis to lymph nodes of TNM category N 1 degree that has metastatic lymph nodes near pulmonary center and side of main bronchia N 2 degree that has metastatic lymph nodes in the same side of the mediastinum as lung cancer TTF 1 thyroid transcripti on fact or 1 asan immunohistochemical biomarker for adeno carcinoma CK 7 kerat in as an immunohistochemical biomarker for epithelial cells L 1 cycle number of the firstline chemo therapy cycles ± ± ± in ADC and SCC and lyso PG in SCLC where as PG and TAG in creased in ADC and SCCPE in SCLC and PC in SCC The volcanic map demonstrated the clear patterns of lipid elements significantlyincreased or declined between heathy controls with ADCFigure 4 E SCC or SCLC and varied among different subtypes of lung cancerspatient genders Different lipidomics between About or lipid elements significantly in creased and or declined', "".01 Fisher's exact test). m NP patients showed prolonged PFS (HR?=?0.27; 95% CI 0.04 to 0.59; P<0.01) and OS (HR?=?0.34; 95% CI 0.06 to 0.84; P?=?0.03). Late PET analysis provided concordant Lung cancer is the leading cause of cancer-related death in both Europe and the United States of America. The most comm on forms of lung cancer are non-small cell lung cancer (NSCLC) histological subtypes. Systemic chemo therapy has contributed to a significant improvement in NSCLC the rapy but progress appears to be stagnating. Over the last decade a better knowledge of cellular pathways has allowed the development of new the rapies based on NSCLC-driving genetic abnormalities. Targeted the rapies have been developed to block pathological cellular pathways in volved in cancer cell survival proliferati on and metastasis. Epidermal Growth Fact or Recept or (EGFR) is over expressed in NSCLC and has been extensively studied as a potential the rapeutic target. Two EGF Recept or blockers gefitinib and erlotinib have been demonstrated to be effective in front-line the rapy in patients with in operable NSCLC harboring EGFR-activating mutations. Erlotinib is also authorized after failure of previous chemo therapy and as maintenance the rapy. In clinical practice evaluati on of tumor response is based on changes in tumor size according to criteria proposed by the World Health anizati on or RECIST criteria. This morphological evaluati on may lead to under estimati on of the efficacy of cytostatic the rapeutic agents such as erlotinib that stabilize the disease in non-mutated patients where as conventional cytotoxic drugs in duce shrinkage of tumor dimensions in the case of tumor response. NSCLC tumor size evaluati on can also be difficult due to at electasis of normal lung. The major""]","Lung cancer targeted therapy research includes phases I, II, and III of clinical trials. Numerous studies have been conducted to evaluate agents targeting molecular changes, such as mutations in the epidermal growth factor receptor (EGFR) and the EML4-ALK fusion gene, indicating ongoing phase I and II trials for these therapies [CTX 1][CTX 2]. Additionally, the International Adjuvant Lung Cancer Trial, which established adjuvant chemotherapy as standard care, represents a phase III trial that has significantly influenced treatment protocols for non-small cell lung cancer (NSCLC) [CTX 3]. While these trials provide valuable insights into treatment efficacy, the overall survival rates for advanced NSCLC remain low, highlighting the need for continued research and development [CTX 1].",0.8181818181818182,0.8873620559652996,0.0
Are there real-world observational studies in lung cancer treatment?,"['Stage at primarydiagnosis ± obscure boundary ± Emphysema ± T tumor ± L 1 cycle ± Obstructivepneumoniaatelectasis ± pulmonary nodule Patients with SCLCStage at recruitmenttime ± Stage at primarydiagnosis ± N 1 ipsilateral Paratracheal ± T tumor ± N 1 ipsilateral hilum ± N 2 ipsilateralmediastinum ± Enhanced image ± pulmonary nodule ± N LN ± Maintenancetreatment Patients survived Stage at primarydiagnosis ± N 2 ipsilateralmediastinum ± Enhanced image ± Stage at recruitmenttime ± N 1 ipsilateral hilum ± TTF 1 ± Naps in A ± Locati on ± N 1 ipsilateralparatracheal ± Lobular Patientsnonsurvived Stage at recruitmenttime ± Stage at primarydiagnosis ± N 1 ipsilateralparatracheal ± N 2 ipsilateralmediastinum ± N 1 ipsilateral hilum ± Enhanced image ± N 2 below carina ± TTF 1 ± N LN ± T tumor ± ± Abbreviations N degrees of lung cancer metastasis to lymph nodes of TNM category N 1 degree that has metastatic lymph nodes near pulmonary center and side of main bronchia N 2 degree that has metastatic lymph nodes in the same side of the mediastinum as lung cancer TTF 1 thyroid transcripti on fact or 1 asan immunohistochemical biomarker for adeno carcinoma CK 7 kerat in as an immunohistochemical biomarker for epithelial cells L 1 cycle number of the firstline chemo therapy cycles ± ± ± in ADC and SCC and lyso PG in SCLC where as PG and TAG in creased in ADC and SCCPE in SCLC and PC in SCC The volcanic map demonstrated the clear patterns of lipid elements significantlyincreased or declined between heathy controls with ADCFigure 4 E SCC or SCLC and varied among different subtypes of lung cancerspatient genders Different lipidomics between About or lipid elements significantly in creased and or declined', '. Lung cancer in non-smokers can be in duced by second hand smoke air pollutants and diesel exhaust. Our present data showed significant difference of pack-year smoked but not smoking status between NSCLC cases and controls which suggested the important role of other environmental factors in the development of NSCLC. To bacco could in duce chronic and sustained in flammati on in lung micro environment contributing to pulmonary carcinogenesis in smokers. Support also comes from the epidemiologic data regarding in flammati on and lung cancer. CR 1 an important molecule implicated in immunity and in flammati on could protect the host from in vasi on of exogenous chemicals derived from cigarette smoking. Genetic variant of CR 1 could alter gene functi on and result in deregulati on of the in flammatory and immune responses the reby modulating the susceptibility to lung cancer. More importantly we observed a potential in teracti on of this SNP (rs 7525160 G?>? C) with smoking status suggesting the gene-environmental in teracti on plays a prominent role in the susceptibility to lung cancer. Our present study has its limitati on. Our patients may not be representative of total NSCLC patients at large because they were recruited from only one hospital. In additi on due to the relatively small sample size further case-control studies are still needed to replicate and extend our findings.', '(NSCLC) patients and 53 small cell carcinoma patients. In the NSCLC cases there were 320 adenocarcinom as 73 squamous cell carcinom as and 41 other tumors with a variety of different pathologies (such as large cell carcinom as mixed cell carcinom as or undifferentiated carcinom as)..0096911. t 001 Characteristics of lung cancer cases and controls. Variables Cases(%) Controls(%) P value Female 487 516 Mean age (years) 56.5±11.7 56.3±12.5 0.248 a In come (yuan/month) 628.9±419.3 563.5±387.6 0.084 a Never smoker 487 516 Histological type NSCLC 434(89.1) Adeno carcinoma 320(65.7) Squamous cell carcinoma 73(15.0) Small cell carcinoma 53(10.9) Other 41(8.4) a Student\'s t-test was used to compare the frequency distributions of demographic variables between the cases and controls. As sociati on analysis The observed genotype frequencies among the control subjects was in agreement with that expected under the Hardy-Weinberg equilibrium (P?=?0.119). The distributi on of ATM rs 189037 genotypes among subjects were displayed in Using subjects with the ATM rs 189037 GG genotype as the reference group we calculated the ORs and 95%CIs for heterozygous carriers of GA genotype and homozygous carriers of AA genotype. No significant difference was observed between lung cancer cases and controls in each test (P>0.05). In order to in crease the statistical power we combined the GA genotype with the AA genotype to compare with GG genotype as a dominant model and combined the GA genotype with the GG genotype to compare with AA genotype as a recessive model. The in dicated that in dividuals with AA genotype had a significantly elevated risk of lung adeno carcinoma compared with those carrying the GG or GA genotype (OR?=?1.44 95%CI 1.02""2.02 P?=?0.039)..0096911. t 002 Distributi on of ATM rs 189037 genotypes and ORs for lung cancer cases and controls.', 'Lung cancer is one of the main causes of cancer-related mortality. Approximately 85% of lung cancers are diagnosed as non-small cell lung cancer (NSCLC) and the overall survival (OS) rate for advanced NSCLC is poor. The 5-year survival rate is 5% for stage IIIb NSCLC and <1% for stage IV NSCLC. Treatment for NCSLC is determined by the patient™s clinical and tumor characteristics per formance status (PS) the histological subtype and tumor genotype/phenotype. Recently there have been many studies concerning agents that target molecular changes such as mutations in the epidermal growth fact or recept or (EGFR) and the fusi on on cogene EML 4-ALK in which the echinoderm microtubule-as sociated prote in-like 4 (EML 4) is fused with the in tracellular doma in of anaplastic kinase (ALK) (2""4). Although significant advances have been made in the treatment of NSCLC using molecular targeted the rapies such as erlotinib and crizotinib the median OS for patients with advanced NSCLC remains low and acquired resistance to target agents is a major clinical problem. The refore the development of novel the rapies is needed. Immuno therapy manipulates the immune system to control and eradicate cancer. Many recent studies provide evidence suggesting that immunotherapeutic manipulations are viable in many tumor types in cluding lung cancer. Numerous trials of peptide vaccines autologous cellular the rapy T cell-directed antibody the rapy and monoclonal antibody the rapy for lung cancer have been carried out around the world (8""10) and some of them have shown favorable', 'Lung cancer is one of the main causes of cancer-related mortality. Approximately 85% of lung cancers are diagnosed as non-small cell lung cancer (NSCLC) and the overall survival (OS) rate for advanced NSCLC is poor. The 5-year survival rate is 5% for stage IIIb NSCLC and <1% for stage IV NSCLC (1). Treatment for NCSLC is determined by the patient™s clinical and tumor characteristics per formance status (PS) the histological subtype and tumor genotype/phenotype. Recently there have been many studies concerning agents that target molecular changes such as mutations in the epidermal growth fact or recept or (EGFR) and the fusi on on cogene EML 4-ALK in which the echinoderm microtubule-as sociated prote in-like 4 (EML 4) is fused with the in tracellular doma in of anaplastic kinase (ALK) (2""4). Although significant advances have been made in the treatment of NSCLC using molecular targeted the rapies such as erlotinib and crizotinib the median OS for patients with advanced NSCLC remains low (56) and acquired resistance to target agents is a major clinical problem. The refore the development of novel the rapies is needed (7). Immuno therapy manipulates the immune system to control and eradicate cancer. Many recent studies provide evidence suggesting that immunotherapeutic manipulations are viable in many tumor types in cluding lung cancer. Numerous trials of peptide vaccines autologous cellular the rapy T cell-directed antibody the rapy and monoclonal antibody the rapy for lung cancer have been carried out around the world (8""10) and some of them have shown favorable']","Yes, there are real-world observational studies in lung cancer treatment. For instance, recent studies have focused on various treatment modalities for non-small cell lung cancer (NSCLC), including molecular targeted therapies and immunotherapy, which have shown promising results in clinical trials [CTX 4][CTX 5]. Additionally, observational data have highlighted the impact of environmental factors and genetic variants on lung cancer susceptibility, suggesting a complex interplay that could influence treatment outcomes [CTX 2]. However, limitations exist, such as the representativeness of patient samples and the need for further studies to validate findings [CTX 2].",0.8888888888888888,0.9972543252083108,0.75
How do genomic alterations correlate with transcriptomic signatures in lung cancer?,"['Identificati on of cis-acting me QTLs We profiled DNA methylati on for 244 fresh-frozen histologically normal lung samples from non-small cell lung cancer (NSCLC) patients from the Environment and Genetics in Lung cancer Etiology (EAGLE) study 19. A subset of 210 tissue samples that passed quality control and had germline genotype data from blood samples 20 was used for me QTL analysis. The analysis was restricted to 338456 autosomal Cp G probes after excluding those annotated in repetitive genomic regions or that harbored genetic variants. The distributi on of methylati on levels differed strongly across distinct types of genomic regions (Supplementary Fig. 1 ab). Consistent with previous studies 21 Cp G sites in promoter or CGI regions were largely unmethylated while those in other regions were largely methylated (Supplementary Fig. 1 ab). We per formed cis-me QTL analysis for each methylati on trait by searching for SNPs with in 500 kb of the target Cp G-site in each directi on (1 Mb overall). The genetic as sociati on was tested under an additive model between each SNP and each normalized methylati on probe adjusting for sex age plate populati on stratificati on and methylati on-based principal component analysis (PCA) scores. Controlling FDR at 5% (P=4.0—10?5) we detected cis-me QTLs for 34304 (10.1% of 338456) Cp G probes (Supplementary) mapping to 9330 genes.', 'Identificati on of cis-acting me QTLs We profiled DNA methylati on for 244 fresh-frozen histologically normal lung samples from non-small cell lung cancer (NSCLC) patients from the Environment and Genetics in Lung cancer Etiology (EAGLE) study 19. A subset of 210 tissue samples that passed quality control and had germline genotype data from blood samples 20 was used for me QTL analysis. The analysis was restricted to 338456 autosomal Cp G probes after excluding those annotated in repetitive genomic regions or that harbored genetic variants. The distributi on of methylati on levels differed strongly across distinct types of genomic regions (Supplementary Fig. 1 ab). Consistent with previous studies 21 Cp G sites in promoter or CGI regions were largely unmethylated while those in other regions were largely methylated (Supplementary Fig. 1 ab). We per formed cis-me QTL analysis for each methylati on trait by searching for SNPs with in 500 kb of the target Cp G-site in each directi on (1 Mb overall). The genetic as sociati on was tested under an additive model between each SNP and each normalized methylati on probe adjusting for sex age plate populati on stratificati on and methylati on-based principal component analysis (PCA) scores. Controlling FDR at 5% (P=4.0×10?5) we detected cis-me QTLs for 34304 (10.1% of 338456) Cp G probes (Supplementary) mapping to 9330 genes. A more stringent threshold (P=6.0×10?6) at FDR=1% detected cis-me QTLs for 27043 Cp G probes mapping to 8479 genes. Moreover with a 200 kb window (100 kb from both sides) in stead than 1 Mb we detected 40650 cis-me QTLs (P=2.0×10?4) controlling for FDR=5%. The methylati on distributi on in Cp G sites detected with me QTLs differed substantially from those without me QTLs (Supplementary Fig. 1 ab). The peak SNPs were equally distributed on either side of the target Cp G-sites with a median distance (?) of 11.8 kb. The proporti on of explained phenotypic variance (h 2) ranged from 7.7% to 79.8% (Supplement', '(NSCLC) patients and 53 small cell carcinoma patients. In the NSCLC cases there were 320 adenocarcinom as 73 squamous cell carcinom as and 41 other tumors with a variety of different pathologies (such as large cell carcinom as mixed cell carcinom as or undifferentiated carcinom as)..0096911. t 001 Characteristics of lung cancer cases and controls. Variables Cases(%) Controls(%) P value Female 487 516 Mean age (years) 56.5±11.7 56.3±12.5 0.248 a In come (yuan/month) 628.9±419.3 563.5±387.6 0.084 a Never smoker 487 516 Histological type NSCLC 434(89.1) Adeno carcinoma 320(65.7) Squamous cell carcinoma 73(15.0) Small cell carcinoma 53(10.9) Other 41(8.4) a Student\'s t-test was used to compare the frequency distributions of demographic variables between the cases and controls. As sociati on analysis The observed genotype frequencies among the control subjects was in agreement with that expected under the Hardy-Weinberg equilibrium (P?=?0.119). The distributi on of ATM rs 189037 genotypes among subjects were displayed in Using subjects with the ATM rs 189037 GG genotype as the reference group we calculated the ORs and 95%CIs for heterozygous carriers of GA genotype and homozygous carriers of AA genotype. No significant difference was observed between lung cancer cases and controls in each test (P>0.05). In order to in crease the statistical power we combined the GA genotype with the AA genotype to compare with GG genotype as a dominant model and combined the GA genotype with the GG genotype to compare with AA genotype as a recessive model. The in dicated that in dividuals with AA genotype had a significantly elevated risk of lung adeno carcinoma compared with those carrying the GG or GA genotype (OR?=?1.44 95%CI 1.02""2.02 P?=?0.039)..0096911. t 002 Distributi on of ATM rs 189037 genotypes and ORs for lung cancer cases and controls.', 'The chronic airway in flammati on and dysfunctional immune system might promote pulmonary carcinogenesis. Implicated in the immune and in flammatory responses the complement cascade plays a pivotal role in the development of cancer. Thus it is likely that the genetic variants of CR 1 in the complement system confer the susceptibility to lung cancer. In this study we have for the first time demonstrated that one in tronic SNP (rs 7525160 G?>? C) out of 13 tag SNPs of CR 1 was as sociated with the risk of NSCLC in Chinese populati on. Notably the rs 7525160 CC genotype was as sociated with an in creased risk of developing NSCLC (OR?=?1.52 95% CI?=?1.02-2.28; P?=?0.028) compared with the GG genotype. MDR analysis also showed that there was no gene-gene in teracti on among 12 tag SNPs in CR 1 gene. Moreover the risk of NSCLC was as sociated with the rs 7525160 C allele carriers in smokers with OR (95% CI) of 1.72 (1.15-2.59) but not in non-smokers with OR (95% CI) of 1.15 (0.81-1.65) in dicating this SNP is a smoking-modifying risk fact or for susceptibility to NSCLC. To the best of our knowledge this study shed new in sight into the in terplay of genetic variati on of CR 1 with lung cancer risk. More importantly it highlights the potential gene-environmental in teracti on in fluences the susceptibility to lung cancer.', 'were in accordance with the study that genetic polymorphisms in in nate immunity genes may play a role in the carcinogenesis of lung cancer. It is likely that some genetic variations in strong link disequilibrium with this in tronic SNP (rs 7525160 G?>? C) are functional which provides a new in sight into the hallmarks in susceptibility to lung cancer and further functional experiments are warranted to address the proposal. Functionally human CR 1 exists on the surface of almost all per ipheral blood cells and plays a key role in immune complex clearance and complement in hibiti on at the cell surface by binding to activated products C 3 b and C 4 b. CR 1 also possesses cofact or activity for the serum protease fact or I and is thus in volved in the generati on of further fragments of C 3/4 b with the activati on of complement cascade and the cellular immune response. In our study the as sociati on of CR 1 polymorphism with lung cancer is biologically plausible in that the in tronic polymorphism could affect the density of CR 1 molecules on the cell surface the reby contributing to autoimmune disorders and neoplasm. To bacco smoking is an established risk fact or for susceptibility to lung cancer. However not all people who suffer from lung cancer are smokers. Lung cancer in non-smokers can be in duced by second hand smoke air pollutants and diesel exhaust. Our present data showed significant difference of pack-year smoked but not smoking status between NSCLC cases and controls which suggested the important role of other environmental factors in the development of NSCLC. To bacco could in duce chronic and sustained in flammati on in lung micro environment contributing to pulmonary carcinogenesis in smokers.']","Genomic alterations, such as single nucleotide polymorphisms (SNPs) and DNA methylation changes, correlate with transcriptomic signatures in lung cancer by influencing gene expression patterns. For instance, a study identified cis-acting methylation quantitative trait loci (meQTLs) that were associated with 34,304 CpG probes, which mapped to 9,330 genes, indicating a significant relationship between genetic variants and methylation levels that can affect transcriptional activity [CTX 1][CTX 2]. Additionally, the distribution of methylation levels varied across different genomic regions, suggesting that specific alterations can lead to distinct transcriptomic profiles in lung cancer [CTX 2]. However, the complexity of these interactions and the influence of environmental factors may limit the ability to fully understand the direct impact of genomic alterations on transcriptomic signatures [CTX 4][CTX 5].",0.42857142857142855,0.0,0.25
What is the role of BRAF mutations in papillary thyroid carcinoma?,"['henhua []tissue TNFα tumor necrosis factora DTC differentiated thyroid carcinoma IL 6 in terleuk in 6 PTC papillary thyroid carcinoma FTC follicular thyroid carcinoma AT Canaplastic thyroid carcinoma MTC medullary thyroid carcinoma WDTC welldifferentiated thyroid carcinoma FNAC fine needle as pirati on cytologynodular goiter PTCQuality of in cluded studies The quality as sessment of these studies is as sessed bythe NOS and the resultis shown in Supplemental Table Five or more scores are determined as highquality Two studies conducted by Cao G in [] and L Kayser in [] only get two scoresshowing a poor quality in methodology The rest studies are as sessed as high quality TNFα and thyroid carcinoma Twelve studies reported the expressi on of TNFα both in patients with thyroid carcinoma and control subjects["" "" ] Among these sevenstudies [ ] had tested the level of serum TNFα two studies [ ] had tested the expressi on of TNFα in tissues and the ratio of TNFα immunoreactivity was tested in four studies [ ] Firstly fixedeffect model is used to merge the SMDvalues of serum TNFα level however a large heterogeneity is found by the heterogeneity analysis heterogeneity test Chi 2 P I 2 and itmay be due to the different units differenttesting', 'we used the Gene Expressi on Profiling In teractive Analysis database to verify the expressi on of key genes in PTC and adjacent tissues The overall survival and diseasefree survivalanalyses were per formed by Kaplan""Meier plots for these PTCrelated hub genes Genetic alterations of hub genes in PTC and their correlations with other genes were analyzed utilizing the c Bio Portal for Cancer Genomics Hub genesrelated to clinicopathological features were analyzed using the on line database UALCAN httpualcanpathuabedu[] The correlati on of ADORA 1 APOE and LPAR 5 expressi on with the immune in filtrati on level in PTC and the expressi on of these three genes in different kinds of cancers was per formed using the Tumor Immune Estimati on Resource database []For q RTPCR analysis total RNA was isolated from normal and cancerous papillary thyroid samples utilizing TRIzol reagent Qiagen Valencia CA USA c DNA was synthesized with RNA reverse transcripti on kit TIANGENBIOTECH Beijing China q RTPCR was per formed with an ABI Real Time PCR System Applied Biosystems Life Technologies USA The expressi on of the genes of in terest was normalized to actin The primers for ADORA 1 APOE LPAR 5 and actin are shown in Table For Western blot RIPA buffer was used to extract prote in from four pairs of tissue from PTC patients and the prote in concentrations were measured via BCA Differentially expressed genes screening based on RNASeq To screen out the genes or modules that may play a role in promoting cancer in papillary thyroid carcinoma weperformed RNASeq experiments on four pairs of thyroid cancer tissues and their matched paracancerous tissues to obta in differentially expressed genes After RNASeq we acquire "" milli on reads for each sample The fold changesbetween PTC cancer tissues and matched paracancerous samples were calculated Setting the cutoff criteri on as Pvalue and a fold change there were upregulated and downregulated genes These DEGswere considered to be candidate genes for', 'in cancer tissues [ ] yu xiao conducted a clinical studycomparing the level of serum lept in in ptc patientsincluding patients with lymph node metastasis and thyroid adenoma patients in dalian china and foundth at patients with lymph node metastasis have a higherlevel of lept in than those without lymph node metastasislept in can in duce the expressi on of vascular endothelialgrowth fact or and promote neovascularizati on in tumortissue in additi on it can also in hibit the apoptosisthrough bcl 2 dependent mechanism meanwhile leptinrecept or exists in all thyroid cancer cells it is over expressed in ptc and is in volved in tumor in vasi on and lymph node metastasis [ ] thus lept in may be in volved in the tumorigenesis and metastasis of thyroid cancer through a complex pathway and a monitoringmay have some significance due to the absence of directevidence elevated lept in levels can also be caused by thyroid carcinoma the cause and effect relationship between lept in and thyroid carcinoma are unclear now and need further studiescompared to lean women over weightobese womenhad lower serum adiponect in levels and this differenceh as statistical significance in additi on adiponectinis negatively as sociated with a variety of benign and malignant tumors especially those as sociated with obesity and in sulin resistance such as leukemia renal carcinoma gastric carcinoma and colon cancer moreover the as sociati on of adiponect in with potential tumorlimiting functions has been widely proposed otvos l jr tried in vitro experiments and proved that adiponect in can in hibit the metastasis of cancer cells mitsiades n measured circulatingadiponect in levels in ptai ents with ptc and found thatit is in dependently and in versely as sociated with the risk of thyroid cancer as the recept or that binds to adiponect in for biological effects adiponect in recept or hadbeen reported closely correlated with the development of ptc adiponect in recept or 1 and are higher expressi on in p', 'Characteristics of patients The study group in cluded papillary thyroid cancers PTC follicular thyroid cancers FTC and poorlydifferentiated thyroid cancers PDTCThere were women and men The mean agew as ± years Three hundred and seventytwo patients were prepared with rh TSH stimulati on Eightytwo patients presented positive Tg Ab at the time of postoperative RAI treatment In the postoperative setting prior to RAI administrati on patients were at low risk LR at in termediaterisk IR and at high risk HRaccording to the ATA risk Per sistent disease and tumor burden Overall PD was detected in patients Their characteristics in terms of ATA risk RAI preparati on modality PD sites and RAI or 18 FDG uptake arepresented in Table Of patients had very smallvolumelargevolume smallvolume and PDFigure shows two points First the rate of PDincreased from in LR patients and in IR to in HR patients p Second the per centage of patients with largevolume PD in creased with risk stratificati on from LRIR to HR patients and respectively p Table Characteristics of patients according to the ATA riskstratificati on system in the postoperative setting Mean age ± SD yrs Sex ratio Female Mean tumor size ± SD mm Histology PTCFTCPDTCAggressive pathological subtypes No Yes Extrathyroidal extensi on Minimal Gross T status TNM T 1 a T 1 b T 2 T 3 a T 3 b T 4 a T 4 b N status TNM Nx N 0 N 1 a N 1 b M status TNM M 0 M 1 Positive Tg Ab level Stimulated Tg level at RAI treatment', 'Of patients who under went thyroidectomy procedures were females and the mean age at operati on was years and were as sociated with multiple endocrine neoplasia type There was no history of radiati on exposure Eightyone patients had fine needle as pirati on FNA which correlated with the final histopathology in of cases Sixtysix patients had malignant cancer papillary of patients who had neck dissecti on had lymph node metastasis and had distant metastases to the lung Procedures in cluded total thyroidectomy hemithyroidectomy completi on and subtotal thyroidectomy Twentythree patients developed hypocalcemia per manent and had unilateral recurrent laryngeal nerve in jury per manent Patients were followed up for a mean durati on of months median months Of patients with thyroid cancer received radioactive iodine and had recurrence Malignancy is the commonest in dicati on for thyroid surgery in children and FNA is highly diagnostic Hypocalcemia and recurrent laryngeal nerve in jury are significant complications The recurrence rate in thyroid cancer is']","Insufficient context: the retrieved passages do not contain the key entity/entities from the question; the key outcome/intent (e.g., response/resistance/survival).",0.25,0.0,0.0
How does RET activation contribute to thyroid cancer progression?,"['For many years doxorubic in was the only US Food and Drug Administrati on FDA""approved treatment for patients with advanced thyroid cancer however response rate in patients with MTC is up to with significant to xicity "" Recently in advanced MTC several TKIs such as axitinib cabozantinib gefitinib lenvatinib imatinib motesanib sorafenib pazopanib sunitinib and vandetanib have been studied in phase I IIand III clinical trials Vandetanib an oral in hibit or of VEGFRvascular endothelial growth fact or recept or RET and EGFRepidermal growth fact or recept or was approved by the FDA in April after a phase III trial demonstrated improvedmedian progressionfree survival PFS compared to placebohazard ratio CI "" and overall response rate of Cabozantinib an in hibit or of hepatocyte growthfact or recept or MET VEGFR 2 and RET was approved bythe FDA in after a phase III trial demonstrated improvedmedian PFS of months relative to months in the placebo group The impact of to xicity on patientsw as clearly in dicated and for cabozantinib of patientsrequired dose reductions and required dosing delays The refore to xicity of FDAapproved TKI agents limits their usein patients with small volume as ymptomatic or in dolent disease Furthermore no clear data exist from these studies thateither agent impacts overall survival In additi on RETspecific TKIs in development are Selpercatinib previously LOXO 292 and Blue 667 with more specific RETtargeting activity The seagents have demonstrated evidence of efficacy in early trial', ""an important regulatory fact or in this processanother possibility is that the activati on of the immunesystem of patients with thyroid cancer leads to an in crease in adikopines level in general the data above support that il 6 is important for thyroid cancer but the detail mechanism remain to be further studylept in a circulating hormone secreted by adipocytesexerts its biological effect by combing with its receptorwhich is mainly presented in the hypothalamus meanwhile gene of lept in recept or is also expressed in manyother tissues such as lung liver and kidney it is reported that obesity and over weight can lead to a highlevel of serum lept in which may because that obesity always accompanies with in sulin resistance and hyperinsulinemia and in sulin further enhance the expressi on of lept in moreover lept in acts as a growth fact or in a variety of human cellsincluding both normal cells and tumor cells which regulates the process of differentiati on proliferati on and apoptosis thus stimulate the tumorigenesis and development of tumors through mediatingpathway rhoalimk 1 cofilinpathway and mapkerk pathway kim wg evaluated the effect of dietinduced obesity on thyroid carcinogenesis in a mouse model that spontaneously develops thyroid cancer thrb pvpv ptenˆ' mice and found that obesity in creases the frequency of anaplasia of thyroid cancer and exacerbatesthyroid cancer progressi on that were mediated by jakst at 3 in creased activati on of the jak 2 signaling transducer and activat or of stat 3 signaling pathway and in duction of stat 3 target gene expressi on lept in is always reported a high expressi on on solid tumors and it isconfirmed that serum lept in levelis significantly in creased in thyroid cancer mainly ptc while otherstudies showed a same"", 'IO 3 m RNA was found to be upregulated in MCF 7 cells and downregulated in MDAMB 231 cells when compared to the nontumoral cell line MCF 10 A cells DIO 3 mediated T 3 deiodinati on also occurs in MCF 7 cells In these cells DIO 3 expressi on is to regulated by retinoids but not by estradiol 37"" These findings are consistent with the presence of DIO 3 in other tissues of ectodermal or igin such as the skin and the nervous system 4041 The role of thyroid hormone metabolism on human tumorigenesis has been largely debated 10 In breast cancer previous studies showed that higher levels of the thyroid hormone recept or alpha were an in dependent prognostic fact or for in creased overall survival 42 More recently high levels of the thyroid hormone recept or beta in breast tumors were also as sociated with in creased breast cancerspecific survival 43 In basal cell carcinom as BCC for in stance a DIO 3 mediated decrease in T 3 levels relates to in creased cell proliferati on 31 Similarly in colon cancer cells DIO 3 knockdown and consequent in creases in T 3 levels are as sociated with reduced cell proliferati on and in ducti on of differentiati on 44 High levels of DIO 3 expressi on in primary PTC tumors were as sociated with advanced disease at the diagnosis 30 Some data in deed suggest that T 3 can contribute to tumor growth in breast cancer cells in a 0 vitro 17 while a micro environment with low T 3 levels could facilitate in vasiveness and dedifferentiati on However in agreement with our data in breast cancer similar levels of DIO 3 m RNA are observed in glioblastoma and liver carcinom as as compared to respective normal tissues 45 These differences could be at tributed to the tissue embryological or igin since the tissues of ectodermal or igin seem to mainta in DIO 3 expressi on during adulthood while DIO 3 gene is subject to imprinting in other tissues Loss of DIO 3 expressi on was as sociated with tumor aggressiveness in colon cancer and also in thyroid cancer DIO 3 ex', 'in cancer tissues [ ] Yu Xiao [] conducted a clinical studycomparing the level of serum lept in in PTC patientsincluding patients with lymph node metastasis and thyroid adenoma patients in Dalian China and foundth at patients with lymph node metastasis have a higherlevel of lept in than those without lymph node metastasis Lept in can in duce the expressi on of vascular endothelialgrowth fact or and promote neovascularizati on in tumortissue [] In additi on it can also in hibit the apoptosisthrough Bcl 2 dependent mechanism Meanwhile leptinrecept or exists in all thyroid cancer cells It is over expressed in PTC and is in volved in tumor in vasi on and lymph node metastasis [ ] Thus lept in may be in volved in the tumorigenesis and metastasis of thyroid cancer through a complex pathway and a monitoringmay have some significance Due to the absence of directevidence elevated lept in levels can also be caused by thyroid carcinoma The cause and effect relationship between lept in and thyroid carcinoma are unclear now and need further studies Compared to lean women over weightobese womenhad lower serum adiponect in levels and this differenceh as statistical significance [] In additi on adiponectinis negatively as sociated with a variety of benign and malignant tumors especially those as sociated with obesity and in sulin resistance such as leukemia [] renal carcinoma [] gastric carcinoma [] and colon cancer[] Moreover the as sociati on of adiponect in with potential tumorlimiting functions has been widely proposed []Otvos L Jr [] tried in vitro experiments and proved that adiponect in can in hibit the metastasis of cancer cells Mitsiades N [] measured circulatingad iponect in levels in ptaients with PTC and found thatit is in dependently and in versely as sociated with the risk of thyroid cancer As the recept or that binds to adiponect in for biological effects adiponect in recept or hadbeen reported closely correlated with the development of PTC Adiponect in recept or 1 a', 'we used the Gene Expressi on Profiling In teractive Analysis database to verify the expressi on of key genes in PTC and adjacent tissues The overall survival and diseasefree survivalanalyses were per formed by Kaplan""Meier plots for these PTCrelated hub genes Genetic alterations of hub genes in PTC and their correlations with other genes were analyzed utilizing the c Bio Portal for Cancer Genomics Hub genesrelated to clinicopathological features were analyzed using the on line database UALCAN httpualcanpathuabedu[] The correlati on of ADORA 1 APOE and LPAR 5 expressi on with the immune in filtrati on level in PTC and the expressi on of these three genes in different kinds of cancers was per formed using the Tumor Immune Estimati on Resource database []For q RTPCR analysis total RNA was isolated from normal and cancerous papillary thyroid samples utilizing TRIzol reagent Qiagen Valencia CA USA c DNA was synthesized with RNA reverse transcripti on kit TIANGENBIOTECH Beijing China q RTPCR was per formed with an ABI Real Time PCR System Applied Biosystems Life Technologies USA The expressi on of the genes of in terest was normalized to actin The primers for ADORA 1 APOE LPAR 5 and actin are shown in Table For Western blot RIPA buffer was used to extract prote in from four pairs of tissue from PTC patients and the prote in concentrations were measured via BCA Differentially expressed genes screening based on RNASeq To screen out the genes or modules that may play a role in promoting cancer in papillary thyroid carcinoma weperformed RNASeq experiments on four pairs of thyroid cancer tissues and their matched paracancerous tissues to obta in differentially expressed genes After RNASeq we acquire "" milli on reads for each sample The fold changesbetween PTC cancer tissues and matched paracancerous samples were calculated Setting the cutoff criteri on as Pvalue and a fold change there were upregulated and downregulated genes These DEGswere considered to be candidate genes for']","RET activation contributes to thyroid cancer progression by promoting tumorigenesis and enhancing the aggressiveness of the disease. Specifically, RET is involved in signaling pathways that regulate cell proliferation and survival, which can lead to increased tumor growth and metastasis in thyroid cancer patients [CTX 1]. The presence of RET mutations has been associated with more advanced disease stages and poorer prognoses [CTX 5]. Additionally, RET-targeted therapies, such as vandetanib and cabozantinib, have shown efficacy in improving progression-free survival in patients with advanced medullary thyroid carcinoma (MTC) [CTX 1]. However, the overall impact of these therapies on long-term survival remains unclear, indicating a need for further research [CTX 1].",0.3333333333333333,0.9052947869532643,0.5
What resistance mechanisms are described for lenvatinib in thyroid cancer?,"['For many years doxorubic in was the only US Food and Drug Administrati on FDA""approved treatment for patients with advanced thyroid cancer however response rate in patients with MTC is up to with significant to xicity "" Recently in advanced MTC several TKIs such as axitinib cabozantinib gefitinib lenvatinib imatinib motesanib sorafenib pazopanib sunitinib and vandetanib have been studied in phase I IIand III clinical trials Vandetanib an oral in hibit or of VEGFRvascular endothelial growth fact or recept or RET and EGFRepidermal growth fact or recept or was approved by the FDA in April after a phase III trial demonstrated improvedmedian progressionfree survival PFS compared to placebohazard ratio CI "" and overall response rate of Cabozantinib an in hibit or of hepatocyte growthfact or recept or MET VEGFR 2 and RET was approved bythe FDA in after a phase III trial demonstrated improvedmedian PFS of months relative to months in the placebo group The impact of to xicity on patientsw as clearly in dicated and for cabozantinib of patientsrequired dose reductions and required dosing delays The refore to xicity of FDAapproved TKI agents limits their usein patients with small volume as ymptomatic or in dolent disease Furthermore no clear data exist from these studies thateither agent impacts overall survival In additi on RETspecific TKIs in development are Selpercatinib previously LOXO 292 and Blue 667 with more specific RETtargeting activity The seagents have demonstrated evidence of efficacy in early trial', 'and dose reducti on while the target populati on for thyroid cancer or hepatocellular carcinoma that showed efficacy for lenvatinib was first line setting 20 this study targeted patients receiving salvage line the rapy most patients with metastatic colorectal cancer in the salvage line setting had grade or proteinuria and hypertensi on at baseline because of the long term prior treatment with anti vegfvegfr treatment where as the occurrence of grade hypertensi on was significantly higher compared with that of regorafenib in a similar study populati on in the correct concur and consign trials 7 it was manageable by dose reducti on or in terrupti on but it may be necessary to consider the starting dose in the future although palmar plantar erythrodysesthesia is a not life threatening to xicity these adverse events have a significant impact on treatment schedules and quality of life in treated patients grade ‰¥ palmar plantar erythrodysesthesia has been observed in and of patients treated with lenvatinib in this study and the select japanese populati on 15 respectively while in patients treated with regorafenib in the correct japanese populati on 16 to date the clear mechanism of palmar plantar erythrodysesthesia by vegf recept or tyrosine kinase in hibitors is not known but it has been reproduced that palmar plantar erythrodysesthesia by lenvatinib is well to lerated overall it is suggested that lenvatinib might be a favourable treatment opti on in terms of to xicitiesseveral preclinical studies demonstrated that vegf targeted treatment affects immune suppressi on by promoting the expansi on of suppressive immune cell populations such as regulatory t cells and myel', 'in cancer tissues [ ] Yu Xiao [] conducted a clinical studycomparing the level of serum lept in in PTC patientsincluding patients with lymph node metastasis and thyroid adenoma patients in Dalian China and foundth at patients with lymph node metastasis have a higherlevel of lept in than those without lymph node metastasis Lept in can in duce the expressi on of vascular endothelialgrowth fact or and promote neovascularizati on in tumortissue [] In additi on it can also in hibit the apoptosisthrough Bcl 2 dependent mechanism Meanwhile leptinrecept or exists in all thyroid cancer cells It is over expressed in PTC and is in volved in tumor in vasi on and lymph node metastasis [ ] Thus lept in may be in volved in the tumorigenesis and metastasis of thyroid cancer through a complex pathway and a monitoringmay have some significance Due to the absence of directevidence elevated lept in levels can also be caused by thyroid carcinoma The cause and effect relationship between lept in and thyroid carcinoma are unclear now and need further studies Compared to lean women over weightobese womenhad lower serum adiponect in levels and this differenceh as statistical significance [] In additi on adiponectinis negatively as sociated with a variety of benign and malignant tumors especially those as sociated with obesity and in sulin resistance such as leukemia [] renal carcinoma [] gastric carcinoma [] and colon cancer[] Moreover the as sociati on of adiponect in with potential tumorlimiting functions has been widely proposed []Otvos L Jr [] tried in vitro experiments and proved that adiponect in can in hibit the metastasis of cancer cells Mitsiades N [] measured circulatingad iponect in levels in ptaients with PTC and found thatit is in dependently and in versely as sociated with the risk of thyroid cancer As the recept or that binds to adiponect in for biological effects adiponect in recept or hadbeen reported closely correlated with the development of PTC Adiponect in recept or 1 a', 'of recent clinical trials trifluridinetipiracil and regorafenib are recognised as new treatment options for patients with metastatic colorectal cancer refractory or in tolerant to standard the rapies 6 Nevertheless the prognosis of patients which are refractory or in tolerant to standard chemotherapies is poor and there are still an unmet medical needs for these patients especially for those who are in a good per formance status and eligible for further the rapies Lenvatinib is an oral multitargeted tyrosine kinase in hibit or of the vascular endothelial growth fact or recept or VEGFR "" fibroblast growth fact or receptors "" platelet derived growth fact or recept or alpha RET and KIT 8 Preclinical studies have shown that Iwasa a 0 S et a 0 al ESMO 20205 e 000776 101136 esmo 2020000776 0 c accesslenvatinib not only in terferes the in teracti on between cancer cells and endothelial cells but also in hibits tumour growth 10 Several phase trials of patients with solid tumours in the USA 11 Europe 12 and Japan 13 showed that the optimum dosage of lenvatinib was mg one time a day in a day cycle A total of patients were enrolled in four phase studies of lenvatinib mono therapy of whom had colorectal cancer Disease control rate DCR was achieved in out of patients in cluding one with a partial response which continued for weeks mg two times a day for weeks of a week cycle Grade palmar plantar erythrodysesthesia was reportedly much lower in of patients treated with lenvatinib for thyroid cancer in a Japanese populati on of the SELECT trial than that of reported in a Japanese populati on of CORRECT trial using regorafenib for metastatic colorectal cancer 15 These', 'in cancer tissues [ ] yu xiao conducted a clinical studycomparing the level of serum lept in in ptc patientsincluding patients with lymph node metastasis and thyroid adenoma patients in dalian china and foundth at patients with lymph node metastasis have a higherlevel of lept in than those without lymph node metastasislept in can in duce the expressi on of vascular endothelialgrowth fact or and promote neovascularizati on in tumortissue in additi on it can also in hibit the apoptosisthrough bcl 2 dependent mechanism meanwhile leptinrecept or exists in all thyroid cancer cells it is over expressed in ptc and is in volved in tumor in vasi on and lymph node metastasis [ ] thus lept in may be in volved in the tumorigenesis and metastasis of thyroid cancer through a complex pathway and a monitoringmay have some significance due to the absence of directevidence elevated lept in levels can also be caused by thyroid carcinoma the cause and effect relationship between lept in and thyroid carcinoma are unclear now and need further studiescompared to lean women over weightobese womenhad lower serum adiponect in levels and this differenceh as statistical significance in additi on adiponectinis negatively as sociated with a variety of benign and malignant tumors especially those as sociated with obesity and in sulin resistance such as leukemia renal carcinoma gastric carcinoma and colon cancer moreover the as sociati on of adiponect in with potential tumorlimiting functions has been widely proposed otvos l jr tried in vitro experiments and proved that adiponect in can in hibit the metastasis of cancer cells mitsiades n measured circulatingadiponect in levels in ptai ents with ptc and found thatit is in dependently and in versely as sociated with the risk of thyroid cancer as the recept or that binds to adiponect in for biological effects adiponect in recept or hadbeen reported closely correlated with the development of ptc adiponect in recept or 1 and are higher expressi on in p']","The resistance mechanisms for lenvatinib in thyroid cancer include the development of adverse effects such as hypertension and palmar-plantar erythrodysesthesia, which can lead to dose reductions or interruptions in treatment [CTX 2]. Additionally, preclinical studies suggest that lenvatinib may promote immune suppression by expanding regulatory T cells, potentially impacting its efficacy [CTX 2]. However, the exact mechanisms of these resistance factors are not fully understood, and further research is needed to clarify their roles in treatment outcomes [CTX 2].",0.8,0.0,0.5
Are there strategies to overcome resistance to targeted therapies in thyroid carcinoma?,"['For many years doxorubic in was the only US Food and Drug Administrati on FDA""approved treatment for patients with advanced thyroid cancer however response rate in patients with MTC is up to with significant to xicity "" Recently in advanced MTC several TKIs such as axitinib cabozantinib gefitinib lenvatinib imatinib motesanib sorafenib pazopanib sunitinib and vandetanib have been studied in phase I IIand III clinical trials Vandetanib an oral in hibit or of VEGFRvascular endothelial growth fact or recept or RET and EGFRepidermal growth fact or recept or was approved by the FDA in April after a phase III trial demonstrated improvedmedian progressionfree survival PFS compared to placebohazard ratio CI "" and overall response rate of Cabozantinib an in hibit or of hepatocyte growthfact or recept or MET VEGFR 2 and RET was approved bythe FDA in after a phase III trial demonstrated improvedmedian PFS of months relative to months in the placebo group The impact of to xicity on patientsw as clearly in dicated and for cabozantinib of patientsrequired dose reductions and required dosing delays The refore to xicity of FDAapproved TKI agents limits their usein patients with small volume as ymptomatic or in dolent disease Furthermore no clear data exist from these studies thateither agent impacts overall survival In additi on RETspecific TKIs in development are Selpercatinib previously LOXO 292 and Blue 667 with more specific RETtargeting activity The seagents have demonstrated evidence of efficacy in early trial', 'in cancer tissues [ ] Yu Xiao [] conducted a clinical studycomparing the level of serum lept in in PTC patientsincluding patients with lymph node metastasis and thyroid adenoma patients in Dalian China and foundth at patients with lymph node metastasis have a higherlevel of lept in than those without lymph node metastasis Lept in can in duce the expressi on of vascular endothelialgrowth fact or and promote neovascularizati on in tumortissue [] In additi on it can also in hibit the apoptosisthrough Bcl 2 dependent mechanism Meanwhile leptinrecept or exists in all thyroid cancer cells It is over expressed in PTC and is in volved in tumor in vasi on and lymph node metastasis [ ] Thus lept in may be in volved in the tumorigenesis and metastasis of thyroid cancer through a complex pathway and a monitoringmay have some significance Due to the absence of directevidence elevated lept in levels can also be caused by thyroid carcinoma The cause and effect relationship between lept in and thyroid carcinoma are unclear now and need further studies Compared to lean women over weightobese womenhad lower serum adiponect in levels and this differenceh as statistical significance [] In additi on adiponectinis negatively as sociated with a variety of benign and malignant tumors especially those as sociated with obesity and in sulin resistance such as leukemia [] renal carcinoma [] gastric carcinoma [] and colon cancer[] Moreover the as sociati on of adiponect in with potential tumorlimiting functions has been widely proposed []Otvos L Jr [] tried in vitro experiments and proved that adiponect in can in hibit the metastasis of cancer cells Mitsiades N [] measured circulatingad iponect in levels in ptaients with PTC and found thatit is in dependently and in versely as sociated with the risk of thyroid cancer As the recept or that binds to adiponect in for biological effects adiponect in recept or hadbeen reported closely correlated with the development of PTC Adiponect in recept or 1 a', 'in cancer tissues [ ] yu xiao conducted a clinical studycomparing the level of serum lept in in ptc patientsincluding patients with lymph node metastasis and thyroid adenoma patients in dalian china and foundth at patients with lymph node metastasis have a higherlevel of lept in than those without lymph node metastasislept in can in duce the expressi on of vascular endothelialgrowth fact or and promote neovascularizati on in tumortissue in additi on it can also in hibit the apoptosisthrough bcl 2 dependent mechanism meanwhile leptinrecept or exists in all thyroid cancer cells it is over expressed in ptc and is in volved in tumor in vasi on and lymph node metastasis [ ] thus lept in may be in volved in the tumorigenesis and metastasis of thyroid cancer through a complex pathway and a monitoringmay have some significance due to the absence of directevidence elevated lept in levels can also be caused by thyroid carcinoma the cause and effect relationship between lept in and thyroid carcinoma are unclear now and need further studiescompared to lean women over weightobese womenhad lower serum adiponect in levels and this differenceh as statistical significance in additi on adiponectinis negatively as sociated with a variety of benign and malignant tumors especially those as sociated with obesity and in sulin resistance such as leukemia renal carcinoma gastric carcinoma and colon cancer moreover the as sociati on of adiponect in with potential tumorlimiting functions has been widely proposed otvos l jr tried in vitro experiments and proved that adiponect in can in hibit the metastasis of cancer cells mitsiades n measured circulatingadiponect in levels in ptai ents with ptc and found thatit is in dependently and in versely as sociated with the risk of thyroid cancer as the recept or that binds to adiponect in for biological effects adiponect in recept or hadbeen reported closely correlated with the development of ptc adiponect in recept or 1 and are higher expressi on in p', 'Characteristics of patients The study group in cluded papillary thyroid cancers PTC follicular thyroid cancers FTC and poorlydifferentiated thyroid cancers PDTCThere were women and men The mean agew as ± years Three hundred and seventytwo patients were prepared with rh TSH stimulati on Eightytwo patients presented positive Tg Ab at the time of postoperative RAI treatment In the postoperative setting prior to RAI administrati on patients were at low risk LR at in termediaterisk IR and at high risk HRaccording to the ATA risk Per sistent disease and tumor burden Overall PD was detected in patients Their characteristics in terms of ATA risk RAI preparati on modality PD sites and RAI or 18 FDG uptake arepresented in Table Of patients had very smallvolumelargevolume smallvolume and PDFigure shows two points First the rate of PDincreased from in LR patients and in IR to in HR patients p Second the per centage of patients with largevolume PD in creased with risk stratificati on from LRIR to HR patients and respectively p Table Characteristics of patients according to the ATA riskstratificati on system in the postoperative setting Mean age ± SD yrs Sex ratio Female Mean tumor size ± SD mm Histology PTCFTCPDTCAggressive pathological subtypes No Yes Extrathyroidal extensi on Minimal Gross T status TNM T 1 a T 1 b T 2 T 3 a T 3 b T 4 a T 4 b N status TNM Nx N 0 N 1 a N 1 b M status TNM M 0 M 1 Positive Tg Ab level Stimulated Tg level at RAI treatment', 'we used the Gene Expressi on Profiling In teractive Analysis database to verify the expressi on of key genes in PTC and adjacent tissues The overall survival and diseasefree survivalanalyses were per formed by Kaplan""Meier plots for these PTCrelated hub genes Genetic alterations of hub genes in PTC and their correlations with other genes were analyzed utilizing the c Bio Portal for Cancer Genomics Hub genesrelated to clinicopathological features were analyzed using the on line database UALCAN httpualcanpathuabedu[] The correlati on of ADORA 1 APOE and LPAR 5 expressi on with the immune in filtrati on level in PTC and the expressi on of these three genes in different kinds of cancers was per formed using the Tumor Immune Estimati on Resource database []For q RTPCR analysis total RNA was isolated from normal and cancerous papillary thyroid samples utilizing TRIzol reagent Qiagen Valencia CA USA c DNA was synthesized with RNA reverse transcripti on kit TIANGENBIOTECH Beijing China q RTPCR was per formed with an ABI Real Time PCR System Applied Biosystems Life Technologies USA The expressi on of the genes of in terest was normalized to actin The primers for ADORA 1 APOE LPAR 5 and actin are shown in Table For Western blot RIPA buffer was used to extract prote in from four pairs of tissue from PTC patients and the prote in concentrations were measured via BCA Differentially expressed genes screening based on RNASeq To screen out the genes or modules that may play a role in promoting cancer in papillary thyroid carcinoma weperformed RNASeq experiments on four pairs of thyroid cancer tissues and their matched paracancerous tissues to obta in differentially expressed genes After RNASeq we acquire "" milli on reads for each sample The fold changesbetween PTC cancer tissues and matched paracancerous samples were calculated Setting the cutoff criteri on as Pvalue and a fold change there were upregulated and downregulated genes These DEGswere considered to be candidate genes for']","Yes, there are strategies to overcome resistance to targeted therapies in thyroid carcinoma. One approach involves the use of newer targeted therapies, such as RET-specific TKIs like Selpercatinib and Blue 667, which have shown efficacy in early trials for advanced medullary thyroid carcinoma (MTC) [CTX 1]. Additionally, monitoring serum levels of leptin and adiponectin may provide insights into tumor behavior and potential resistance mechanisms, as these factors are involved in tumorigenesis and metastasis [CTX 2][CTX 3]. However, the effectiveness of these strategies may be limited by the toxicity associated with existing therapies and the need for further studies to clarify the relationships between these biomarkers and thyroid carcinoma [CTX 1][CTX 2].",0.8888888888888888,0.0,0.25
What targeted drugs are evaluated in differentiated thyroid cancer?,"['For many years doxorubic in was the only US Food and Drug Administrati on FDA""approved treatment for patients with advanced thyroid cancer however response rate in patients with MTC is up to with significant to xicity "" Recently in advanced MTC several TKIs such as axitinib cabozantinib gefitinib lenvatinib imatinib motesanib sorafenib pazopanib sunitinib and vandetanib have been studied in phase I IIand III clinical trials Vandetanib an oral in hibit or of VEGFRvascular endothelial growth fact or recept or RET and EGFRepidermal growth fact or recept or was approved by the FDA in April after a phase III trial demonstrated improvedmedian progressionfree survival PFS compared to placebohazard ratio CI "" and overall response rate of Cabozantinib an in hibit or of hepatocyte growthfact or recept or MET VEGFR 2 and RET was approved bythe FDA in after a phase III trial demonstrated improvedmedian PFS of months relative to months in the placebo group The impact of to xicity on patientsw as clearly in dicated and for cabozantinib of patientsrequired dose reductions and required dosing delays The refore to xicity of FDAapproved TKI agents limits their usein patients with small volume as ymptomatic or in dolent disease Furthermore no clear data exist from these studies thateither agent impacts overall survival In additi on RETspecific TKIs in development are Selpercatinib previously LOXO 292 and Blue 667 with more specific RETtargeting activity The seagents have demonstrated evidence of efficacy in early trial', 'Characteristics of patients The study group in cluded papillary thyroid cancers PTC follicular thyroid cancers FTC and poorlydifferentiated thyroid cancers PDTCThere were women and men The mean agew as ± years Three hundred and seventytwo patients were prepared with rh TSH stimulati on Eightytwo patients presented positive Tg Ab at the time of postoperative RAI treatment In the postoperative setting prior to RAI administrati on patients were at low risk LR at in termediaterisk IR and at high risk HRaccording to the ATA risk Per sistent disease and tumor burden Overall PD was detected in patients Their characteristics in terms of ATA risk RAI preparati on modality PD sites and RAI or 18 FDG uptake arepresented in Table Of patients had very smallvolumelargevolume smallvolume and PDFigure shows two points First the rate of PDincreased from in LR patients and in IR to in HR patients p Second the per centage of patients with largevolume PD in creased with risk stratificati on from LRIR to HR patients and respectively p Table Characteristics of patients according to the ATA riskstratificati on system in the postoperative setting Mean age ± SD yrs Sex ratio Female Mean tumor size ± SD mm Histology PTCFTCPDTCAggressive pathological subtypes No Yes Extrathyroidal extensi on Minimal Gross T status TNM T 1 a T 1 b T 2 T 3 a T 3 b T 4 a T 4 b N status TNM Nx N 0 N 1 a N 1 b M status TNM M 0 M 1 Positive Tg Ab level Stimulated Tg level at RAI treatment', 'henhua []tissue TNFα tumor necrosis factora DTC differentiated thyroid carcinoma IL 6 in terleuk in 6 PTC papillary thyroid carcinoma FTC follicular thyroid carcinoma AT Canaplastic thyroid carcinoma MTC medullary thyroid carcinoma WDTC welldifferentiated thyroid carcinoma FNAC fine needle as pirati on cytologynodular goiter PTCQuality of in cluded studies The quality as sessment of these studies is as sessed bythe NOS and the resultis shown in Supplemental Table Five or more scores are determined as highquality Two studies conducted by Cao G in [] and L Kayser in [] only get two scoresshowing a poor quality in methodology The rest studies are as sessed as high quality TNFα and thyroid carcinoma Twelve studies reported the expressi on of TNFα both in patients with thyroid carcinoma and control subjects["" "" ] Among these sevenstudies [ ] had tested the level of serum TNFα two studies [ ] had tested the expressi on of TNFα in tissues and the ratio of TNFα immunoreactivity was tested in four studies [ ] Firstly fixedeffect model is used to merge the SMDvalues of serum TNFα level however a large heterogeneity is found by the heterogeneity analysis heterogeneity test Chi 2 P I 2 and itmay be due to the different units differenttesting', 'of clinical studies provide evidence for basic research simonovic sz evaluated cytokine profiles determined in supernatants obtained from whole blood cultures in patients with dtc before and days after radioactiveiodine 131 itherapy and control subjects and found that the expressi on of tnfα in dtc patients ishigher than control subjects and it showed a decreasedlevel after 131 i the rapy than those before the rapy however no statistical difference found for the limited sample size another study conducted by kobawala tp with more patients patients with benign thyroid disease ptc patients and healthy in dividuals determined the circulating levels of tnfα and it wasfound that the serum level of tnfα was significantlyhigher in ptc patients than benign thyroid disease patients and the later was also significantly higher thanhealthy in dividuals furthermore serum tnfα was reported to be a significant prognosticat or for overall survival in ptc patients it is a pity thatopposite result wasreported in a casecontrol study that in cluded dtccases and matched cancerfree cohort participantswhich found that tnfa was not as sociated with thyroidrisk in either gender based on current evidence our meta analysis suggeststh at tnfα exhibit a strong as sociati on with thyroid carcinoma it may because that elevated tnfα may in volved in the tumorigenesis and development of thyroid cancer another possible reas on is that the tnfα decreased with tumor cells less resulted the activati on ofthe immune system by thyroid carcinomathereforemore clincal studies and basic reseaches should be conducted in the futureil 6 a multifunctional cytokine plays important roles in different types of cells in cluding tumor cells it', 'we used the Gene Expressi on Profiling In teractive Analysis database to verify the expressi on of key genes in PTC and adjacent tissues The overall survival and diseasefree survivalanalyses were per formed by Kaplan""Meier plots for these PTCrelated hub genes Genetic alterations of hub genes in PTC and their correlations with other genes were analyzed utilizing the c Bio Portal for Cancer Genomics Hub genesrelated to clinicopathological features were analyzed using the on line database UALCAN httpualcanpathuabedu[] The correlati on of ADORA 1 APOE and LPAR 5 expressi on with the immune in filtrati on level in PTC and the expressi on of these three genes in different kinds of cancers was per formed using the Tumor Immune Estimati on Resource database []For q RTPCR analysis total RNA was isolated from normal and cancerous papillary thyroid samples utilizing TRIzol reagent Qiagen Valencia CA USA c DNA was synthesized with RNA reverse transcripti on kit TIANGENBIOTECH Beijing China q RTPCR was per formed with an ABI Real Time PCR System Applied Biosystems Life Technologies USA The expressi on of the genes of in terest was normalized to actin The primers for ADORA 1 APOE LPAR 5 and actin are shown in Table For Western blot RIPA buffer was used to extract prote in from four pairs of tissue from PTC patients and the prote in concentrations were measured via BCA Differentially expressed genes screening based on RNASeq To screen out the genes or modules that may play a role in promoting cancer in papillary thyroid carcinoma weperformed RNASeq experiments on four pairs of thyroid cancer tissues and their matched paracancerous tissues to obta in differentially expressed genes After RNASeq we acquire "" milli on reads for each sample The fold changesbetween PTC cancer tissues and matched paracancerous samples were calculated Setting the cutoff criteri on as Pvalue and a fold change there were upregulated and downregulated genes These DEGswere considered to be candidate genes for']","The targeted drugs evaluated in differentiated thyroid cancer include several tyrosine kinase inhibitors (TKIs) such as vandetanib, cabozantinib, lenvatinib, and others. Vandetanib was approved by the FDA after demonstrating improved median progression-free survival compared to placebo, while cabozantinib also showed significant efficacy in clinical trials [CTX 1]. Additionally, RET-specific TKIs like Selpercatinib and Blue 667 are currently in development, showing promising early results [CTX 1]. However, the toxicity associated with these agents can limit their use in patients with small volume or indolent disease [CTX 1]. Overall, while these targeted therapies offer new treatment options, their impact on overall survival remains unclear [CTX 1].",1.0,0.0,1.0
Which gene-expression signatures are associated with thyroid cancer survival?,"['we used the Gene Expressi on Profiling In teractive Analysis database to verify the expressi on of key genes in PTC and adjacent tissues The overall survival and diseasefree survivalanalyses were per formed by Kaplan""Meier plots for these PTCrelated hub genes Genetic alterations of hub genes in PTC and their correlations with other genes were analyzed utilizing the c Bio Portal for Cancer Genomics Hub genesrelated to clinicopathological features were analyzed using the on line database UALCAN httpualcanpathuabedu[] The correlati on of ADORA 1 APOE and LPAR 5 expressi on with the immune in filtrati on level in PTC and the expressi on of these three genes in different kinds of cancers was per formed using the Tumor Immune Estimati on Resource database []For q RTPCR analysis total RNA was isolated from normal and cancerous papillary thyroid samples utilizing TRIzol reagent Qiagen Valencia CA USA c DNA was synthesized with RNA reverse transcripti on kit TIANGENBIOTECH Beijing China q RTPCR was per formed with an ABI Real Time PCR System Applied Biosystems Life Technologies USA The expressi on of the genes of in terest was normalized to actin The primers for ADORA 1 APOE LPAR 5 and actin are shown in Table For Western blot RIPA buffer was used to extract prote in from four pairs of tissue from PTC patients and the prote in concentrations were measured via BCA Differentially expressed genes screening based on RNASeq To screen out the genes or modules that may play a role in promoting cancer in papillary thyroid carcinoma weperformed RNASeq experiments on four pairs of thyroid cancer tissues and their matched paracancerous tissues to obta in differentially expressed genes After RNASeq we acquire "" milli on reads for each sample The fold changesbetween PTC cancer tissues and matched paracancerous samples were calculated Setting the cutoff criteri on as Pvalue and a fold change there were upregulated and downregulated genes These DEGswere considered to be candidate genes for', 'henhua []tissue TNFα tumor necrosis factora DTC differentiated thyroid carcinoma IL 6 in terleuk in 6 PTC papillary thyroid carcinoma FTC follicular thyroid carcinoma AT Canaplastic thyroid carcinoma MTC medullary thyroid carcinoma WDTC welldifferentiated thyroid carcinoma FNAC fine needle as pirati on cytologynodular goiter PTCQuality of in cluded studies The quality as sessment of these studies is as sessed bythe NOS and the resultis shown in Supplemental Table Five or more scores are determined as highquality Two studies conducted by Cao G in [] and L Kayser in [] only get two scoresshowing a poor quality in methodology The rest studies are as sessed as high quality TNFα and thyroid carcinoma Twelve studies reported the expressi on of TNFα both in patients with thyroid carcinoma and control subjects["" "" ] Among these sevenstudies [ ] had tested the level of serum TNFα two studies [ ] had tested the expressi on of TNFα in tissues and the ratio of TNFα immunoreactivity was tested in four studies [ ] Firstly fixedeffect model is used to merge the SMDvalues of serum TNFα level however a large heterogeneity is found by the heterogeneity analysis heterogeneity test Chi 2 P I 2 and itmay be due to the different units differenttesting', 'of clinical studies provide evidence for basic research simonovic sz evaluated cytokine profiles determined in supernatants obtained from whole blood cultures in patients with dtc before and days after radioactiveiodine 131 itherapy and control subjects and found that the expressi on of tnfα in dtc patients ishigher than control subjects and it showed a decreasedlevel after 131 i the rapy than those before the rapy however no statistical difference found for the limited sample size another study conducted by kobawala tp with more patients patients with benign thyroid disease ptc patients and healthy in dividuals determined the circulating levels of tnfα and it wasfound that the serum level of tnfα was significantlyhigher in ptc patients than benign thyroid disease patients and the later was also significantly higher thanhealthy in dividuals furthermore serum tnfα was reported to be a significant prognosticat or for overall survival in ptc patients it is a pity thatopposite result wasreported in a casecontrol study that in cluded dtccases and matched cancerfree cohort participantswhich found that tnfa was not as sociated with thyroidrisk in either gender based on current evidence our meta analysis suggeststh at tnfα exhibit a strong as sociati on with thyroid carcinoma it may because that elevated tnfα may in volved in the tumorigenesis and development of thyroid cancer another possible reas on is that the tnfα decreased with tumor cells less resulted the activati on ofthe immune system by thyroid carcinomathereforemore clincal studies and basic reseaches should be conducted in the futureil 6 a multifunctional cytokine plays important roles in different types of cells in cluding tumor cells it', 'IO 3 m RNA was found to be upregulated in MCF 7 cells and downregulated in MDAMB 231 cells when compared to the nontumoral cell line MCF 10 A cells DIO 3 mediated T 3 deiodinati on also occurs in MCF 7 cells In these cells DIO 3 expressi on is to regulated by retinoids but not by estradiol 37"" These findings are consistent with the presence of DIO 3 in other tissues of ectodermal or igin such as the skin and the nervous system 4041 The role of thyroid hormone metabolism on human tumorigenesis has been largely debated 10 In breast cancer previous studies showed that higher levels of the thyroid hormone recept or alpha were an in dependent prognostic fact or for in creased overall survival 42 More recently high levels of the thyroid hormone recept or beta in breast tumors were also as sociated with in creased breast cancerspecific survival 43 In basal cell carcinom as BCC for in stance a DIO 3 mediated decrease in T 3 levels relates to in creased cell proliferati on 31 Similarly in colon cancer cells DIO 3 knockdown and consequent in creases in T 3 levels are as sociated with reduced cell proliferati on and in ducti on of differentiati on 44 High levels of DIO 3 expressi on in primary PTC tumors were as sociated with advanced disease at the diagnosis 30 Some data in deed suggest that T 3 can contribute to tumor growth in breast cancer cells in a 0 vitro 17 while a micro environment with low T 3 levels could facilitate in vasiveness and dedifferentiati on However in agreement with our data in breast cancer similar levels of DIO 3 m RNA are observed in glioblastoma and liver carcinom as as compared to respective normal tissues 45 These differences could be at tributed to the tissue embryological or igin since the tissues of ectodermal or igin seem to mainta in DIO 3 expressi on during adulthood while DIO 3 gene is subject to imprinting in other tissues Loss of DIO 3 expressi on was as sociated with tumor aggressiveness in colon cancer and also in thyroid cancer DIO 3 ex', 'Characteristics of patients The study group in cluded papillary thyroid cancers PTC follicular thyroid cancers FTC and poorlydifferentiated thyroid cancers PDTCThere were women and men The mean agew as ± years Three hundred and seventytwo patients were prepared with rh TSH stimulati on Eightytwo patients presented positive Tg Ab at the time of postoperative RAI treatment In the postoperative setting prior to RAI administrati on patients were at low risk LR at in termediaterisk IR and at high risk HRaccording to the ATA risk Per sistent disease and tumor burden Overall PD was detected in patients Their characteristics in terms of ATA risk RAI preparati on modality PD sites and RAI or 18 FDG uptake arepresented in Table Of patients had very smallvolumelargevolume smallvolume and PDFigure shows two points First the rate of PDincreased from in LR patients and in IR to in HR patients p Second the per centage of patients with largevolume PD in creased with risk stratificati on from LRIR to HR patients and respectively p Table Characteristics of patients according to the ATA riskstratificati on system in the postoperative setting Mean age ± SD yrs Sex ratio Female Mean tumor size ± SD mm Histology PTCFTCPDTCAggressive pathological subtypes No Yes Extrathyroidal extensi on Minimal Gross T status TNM T 1 a T 1 b T 2 T 3 a T 3 b T 4 a T 4 b N status TNM Nx N 0 N 1 a N 1 b M status TNM M 0 M 1 Positive Tg Ab level Stimulated Tg level at RAI treatment']","Gene-expression signatures associated with thyroid cancer survival include the expression levels of ADORA1, APOE, and LPAR5, which have been correlated with immune infiltration levels in papillary thyroid carcinoma (PTC) [CTX 1]. Additionally, elevated levels of TNFα have been identified as significant prognosticators for overall survival in PTC patients [CTX 3]. High levels of DIO3 expression in primary PTC tumors have also been linked to advanced disease at diagnosis, suggesting its role in tumor aggressiveness [CTX 4]. However, the evidence is limited by the variability in study methodologies and sample sizes, which may affect the robustness of these findings [CTX 2].",0.8571428571428571,0.0,1.0
What factors predict recurrence in papillary thyroid carcinoma?,"['ocalcemia transient per manent and Table Thyroid pathology in the patients Pathologyn Benign Normal thyroid tissue Colloid nodule Cyst Adenoma Thyroiditis Graves™ disease Thyroid cancer Papillary Follicular Medullary Hurthle Anaplastic Total Data are number Table Benign and malignant lesions in patients Benignn 37 Malignantn 66 P value Age meanyears Gender malefemale Presence of nodule Hypocalcemia Recurrent laryngeal nerve palsy Bleedinghematoma Wound in fecti on Tracheal in jury Overall complications Mean length of stay days MEN recurrent laryngeal nerve palsy transient per manent all were unilateral Table Of patients with malignant lesions had lymph node metastasis and patients had distant metastases to the lung None of the patients developed postoperative bleeding wound in fecti on or tracheal in jury Patients were followed up for a mean of months median range months radioactive iodine treatment was delivered to patients with malignant lesions patients had recurrences were local recurrences and were local and distant recurrences to the lung Three cases received radioactive iodine RAI before and after recurrence One case was low risk before recurrence so did not receive RAI until after recurrence One case had medullary thyroid cancer so did not receive RAI In the remaining five cases there was no clear data whether those patients received RAI before or only after a recurrence All local recurrences under went resecti on except for one patient who was lost follow up There was no mortality in this study', 'Characteristics of patients The study group in cluded papillary thyroid cancers PTC follicular thyroid cancers FTC and poorlydifferentiated thyroid cancers PDTCThere were women and men The mean agew as ± years Three hundred and seventytwo patients were prepared with rh TSH stimulati on Eightytwo patients presented positive Tg Ab at the time of postoperative RAI treatment In the postoperative setting prior to RAI administrati on patients were at low risk LR at in termediaterisk IR and at high risk HRaccording to the ATA risk Per sistent disease and tumor burden Overall PD was detected in patients Their characteristics in terms of ATA risk RAI preparati on modality PD sites and RAI or 18 FDG uptake arepresented in Table Of patients had very smallvolumelargevolume smallvolume and PDFigure shows two points First the rate of PDincreased from in LR patients and in IR to in HR patients p Second the per centage of patients with largevolume PD in creased with risk stratificati on from LRIR to HR patients and respectively p Table Characteristics of patients according to the ATA riskstratificati on system in the postoperative setting Mean age ± SD yrs Sex ratio Female Mean tumor size ± SD mm Histology PTCFTCPDTCAggressive pathological subtypes No Yes Extrathyroidal extensi on Minimal Gross T status TNM T 1 a T 1 b T 2 T 3 a T 3 b T 4 a T 4 b N status TNM Nx N 0 N 1 a N 1 b M status TNM M 0 M 1 Positive Tg Ab level Stimulated Tg level at RAI treatment', 'Papillary thyroid carcinoma PTCis acomm on thyroid malignancy accountingf or about of systemic malignancies 1 PTC is currently characterized by a highincidence and low mortality 2 clinical Recentimprovements in highfrequencyultrasonic diagnostic technologies and the applicati on of ultrasoundguided puncturetechniques have led to an apparent in crease in the in cidence of PTC year by year 3""Regardingthyroidtumors the palpati on detecti on rate for thyroid microtumors in the general populati on is about compared with as high as to for highfrequency ultrasound 6 which has thus greatly improved disease diagnosisdiagnosisthe of Surgical resecti on is a routine treatmentf or thyroid tumors but the recurrence rateis usually high and the consequent reducti on in thyroid functi on can seriously affect the patient™s quality of life 7 As sociated with the in creasing detecti on rate of thyroidtumors and the pursuit of minimally in vasive treatments radiofrequency ablati on RFA has been gradually applied in the clinic RFA uses local hyperthermia to cause tissue necrosis The the rmal effectsdo not depend on the tissue type and most lesions can be completely eliminated by RFA 89 RFA has thus become a novellocal treatment for tumors The clinical diagnosis of benign and malignant thyroid tumors currently depends on the clinical manifestations and pathological examinations However the clinicalmanifestations are mostly derived from involvessubjective empirical analysis while a finalpathological diagnosisinvasiveprocedures with lesssatisfactory specificity It is the refore necessary to identifyappropriatepredictivetum or markersdiagnosticandforimplications The collagenases matrix metalloproteinase MMP 2 and MMP 9 can degradetype IV collagen in the basement membrane with importanttumorangiogenesis and tumor cell in vasi on and metastasis 10 MMP 2 and MMP 9 expressi on levels were found to be upregulated in thyroid cancer tissue 11 however the sestudies mostly examined pathological tiss', 'were in dependently determined by two qualified pathologists without any prior knowledge of the patients™ clinical data Data collecti on and statistics analysis To determine the relati on between LNCM metastasis and clinicopathologic factors such as age sex primary tumorsite lateral cervical lymph node metastasis level VI metastasis the chisquare test and Fisher™s exact test were used as appropriate Multivariate logistic regressi on analysisw as per formed to identify risk factors for LNCM metastasis of PTC P was considered statistically significant All calculations were per formed using SPSS for windows Postthyroidectomy hypocalcemia lasting for morethan months was considered as per manent VCP All patients were followed up every "" months postoperatively Patients detected with LNCMAfter reviewing patients who under went thyroidectomy plus CND with or without lateral neck dissection from January to January patients were detected with LNCM and patients wereabsent of LNCM The average tumor size of LNCM was cm and the mean number of lymph nodes sampled from LNCM was ranging from to Table shows the comparis on of clinicopathologic characteristics between the present LNCM group and the absent group In univariate analysis Hashimo to™s disease p multifocality leisions p the tumor located in inferi or porti on p extrathyroidal extensi on ETE p central cervical metastasis p level III and level IV metastasis p were significantly as sociated with high prevalence of LNCM Patients with metastatic LNCMAmong a total of patients with LNCM metastatic LNCM was found in patients Table compares the clinicopathologic characteristics between the metastatic LNCM group and the nonmetastatic LNCMgroup Three hundred eightythree patients were confirmed free of LNCM metastasis of the mwith clinically negative node per formed p CND and of them with clinically positive per formed t CND All the patients in the metastatic LNCM group per formedt CND Lateral neck dissecti on was per formed in cases i', 'henhua []tissue TNFα tumor necrosis factora DTC differentiated thyroid carcinoma IL 6 in terleuk in 6 PTC papillary thyroid carcinoma FTC follicular thyroid carcinoma AT Canaplastic thyroid carcinoma MTC medullary thyroid carcinoma WDTC welldifferentiated thyroid carcinoma FNAC fine needle as pirati on cytologynodular goiter PTCQuality of in cluded studies The quality as sessment of these studies is as sessed bythe NOS and the resultis shown in Supplemental Table Five or more scores are determined as highquality Two studies conducted by Cao G in [] and L Kayser in [] only get two scoresshowing a poor quality in methodology The rest studies are as sessed as high quality TNFα and thyroid carcinoma Twelve studies reported the expressi on of TNFα both in patients with thyroid carcinoma and control subjects["" "" ] Among these sevenstudies [ ] had tested the level of serum TNFα two studies [ ] had tested the expressi on of TNFα in tissues and the ratio of TNFα immunoreactivity was tested in four studies [ ] Firstly fixedeffect model is used to merge the SMDvalues of serum TNFα level however a large heterogeneity is found by the heterogeneity analysis heterogeneity test Chi 2 P I 2 and itmay be due to the different units differenttesting']","Factors that predict recurrence in papillary thyroid carcinoma (PTC) include age, tumor size, extrathyroidal extension, and lymph node metastasis. Studies have shown that older age and larger tumor size are associated with higher rates of persistent disease and recurrence, particularly in high-risk patients [CTX 2]. Additionally, the presence of extrathyroidal extension and lymph node metastasis significantly correlates with increased recurrence rates [CTX 4]. However, the specific mechanisms and interactions of these factors require further investigation to fully understand their impact on recurrence [CTX 3].",1.0,0.9999999999999998,1.0
Are calcitonin or thyroglobulin used as prognostic biomarkers in thyroid cancer?,"['henhua []tissue TNFα tumor necrosis factora DTC differentiated thyroid carcinoma IL 6 in terleuk in 6 PTC papillary thyroid carcinoma FTC follicular thyroid carcinoma AT Canaplastic thyroid carcinoma MTC medullary thyroid carcinoma WDTC welldifferentiated thyroid carcinoma FNAC fine needle as pirati on cytologynodular goiter PTCQuality of in cluded studies The quality as sessment of these studies is as sessed bythe NOS and the resultis shown in Supplemental Table Five or more scores are determined as highquality Two studies conducted by Cao G in [] and L Kayser in [] only get two scoresshowing a poor quality in methodology The rest studies are as sessed as high quality TNFα and thyroid carcinoma Twelve studies reported the expressi on of TNFα both in patients with thyroid carcinoma and control subjects["" "" ] Among these sevenstudies [ ] had tested the level of serum TNFα two studies [ ] had tested the expressi on of TNFα in tissues and the ratio of TNFα immunoreactivity was tested in four studies [ ] Firstly fixedeffect model is used to merge the SMDvalues of serum TNFα level however a large heterogeneity is found by the heterogeneity analysis heterogeneity test Chi 2 P I 2 and itmay be due to the different units differenttesting', 'of clinical studies provide evidence for basic research simonovic sz evaluated cytokine profiles determined in supernatants obtained from whole blood cultures in patients with dtc before and days after radioactiveiodine 131 itherapy and control subjects and found that the expressi on of tnfα in dtc patients ishigher than control subjects and it showed a decreasedlevel after 131 i the rapy than those before the rapy however no statistical difference found for the limited sample size another study conducted by kobawala tp with more patients patients with benign thyroid disease ptc patients and healthy in dividuals determined the circulating levels of tnfα and it wasfound that the serum level of tnfα was significantlyhigher in ptc patients than benign thyroid disease patients and the later was also significantly higher thanhealthy in dividuals furthermore serum tnfα was reported to be a significant prognosticat or for overall survival in ptc patients it is a pity thatopposite result wasreported in a casecontrol study that in cluded dtccases and matched cancerfree cohort participantswhich found that tnfa was not as sociated with thyroidrisk in either gender based on current evidence our meta analysis suggeststh at tnfα exhibit a strong as sociati on with thyroid carcinoma it may because that elevated tnfα may in volved in the tumorigenesis and development of thyroid cancer another possible reas on is that the tnfα decreased with tumor cells less resulted the activati on ofthe immune system by thyroid carcinomathereforemore clincal studies and basic reseaches should be conducted in the futureil 6 a multifunctional cytokine plays important roles in different types of cells in cluding tumor cells it', 'Papillary thyroid carcinoma PTCis acomm on thyroid malignancy accountingf or about of systemic malignancies 1 PTC is currently characterized by a highincidence and low mortality 2 clinical Recentimprovements in highfrequencyultrasonic diagnostic technologies and the applicati on of ultrasoundguided puncturetechniques have led to an apparent in crease in the in cidence of PTC year by year 3""Regardingthyroidtumors the palpati on detecti on rate for thyroid microtumors in the general populati on is about compared with as high as to for highfrequency ultrasound 6 which has thus greatly improved disease diagnosisdiagnosisthe of Surgical resecti on is a routine treatmentf or thyroid tumors but the recurrence rateis usually high and the consequent reducti on in thyroid functi on can seriously affect the patient™s quality of life 7 As sociated with the in creasing detecti on rate of thyroidtumors and the pursuit of minimally in vasive treatments radiofrequency ablati on RFA has been gradually applied in the clinic RFA uses local hyperthermia to cause tissue necrosis The the rmal effectsdo not depend on the tissue type and most lesions can be completely eliminated by RFA 89 RFA has thus become a novellocal treatment for tumors The clinical diagnosis of benign and malignant thyroid tumors currently depends on the clinical manifestations and pathological examinations However the clinicalmanifestations are mostly derived from involvessubjective empirical analysis while a finalpathological diagnosisinvasiveprocedures with lesssatisfactory specificity It is the refore necessary to identifyappropriatepredictivetum or markersdiagnosticandforimplications The collagenases matrix metalloproteinase MMP 2 and MMP 9 can degradetype IV collagen in the basement membrane with importanttumorangiogenesis and tumor cell in vasi on and metastasis 10 MMP 2 and MMP 9 expressi on levels were found to be upregulated in thyroid cancer tissue 11 however the sestudies mostly examined pathological tiss', 'ocalcemia transient per manent and Table Thyroid pathology in the patients Pathologyn Benign Normal thyroid tissue Colloid nodule Cyst Adenoma Thyroiditis Graves™ disease Thyroid cancer Papillary Follicular Medullary Hurthle Anaplastic Total Data are number Table Benign and malignant lesions in patients Benignn 37 Malignantn 66 P value Age meanyears Gender malefemale Presence of nodule Hypocalcemia Recurrent laryngeal nerve palsy Bleedinghematoma Wound in fecti on Tracheal in jury Overall complications Mean length of stay days MEN recurrent laryngeal nerve palsy transient per manent all were unilateral Table Of patients with malignant lesions had lymph node metastasis and patients had distant metastases to the lung None of the patients developed postoperative bleeding wound in fecti on or tracheal in jury Patients were followed up for a mean of months median range months radioactive iodine treatment was delivered to patients with malignant lesions patients had recurrences were local recurrences and were local and distant recurrences to the lung Three cases received radioactive iodine RAI before and after recurrence One case was low risk before recurrence so did not receive RAI until after recurrence One case had medullary thyroid cancer so did not receive RAI In the remaining five cases there was no clear data whether those patients received RAI before or only after a recurrence All local recurrences under went resecti on except for one patient who was lost follow up There was no mortality in this study', 'Characteristics of patients The study group in cluded papillary thyroid cancers PTC follicular thyroid cancers FTC and poorlydifferentiated thyroid cancers PDTCThere were women and men The mean agew as ± years Three hundred and seventytwo patients were prepared with rh TSH stimulati on Eightytwo patients presented positive Tg Ab at the time of postoperative RAI treatment In the postoperative setting prior to RAI administrati on patients were at low risk LR at in termediaterisk IR and at high risk HRaccording to the ATA risk Per sistent disease and tumor burden Overall PD was detected in patients Their characteristics in terms of ATA risk RAI preparati on modality PD sites and RAI or 18 FDG uptake arepresented in Table Of patients had very smallvolumelargevolume smallvolume and PDFigure shows two points First the rate of PDincreased from in LR patients and in IR to in HR patients p Second the per centage of patients with largevolume PD in creased with risk stratificati on from LRIR to HR patients and respectively p Table Characteristics of patients according to the ATA riskstratificati on system in the postoperative setting Mean age ± SD yrs Sex ratio Female Mean tumor size ± SD mm Histology PTCFTCPDTCAggressive pathological subtypes No Yes Extrathyroidal extensi on Minimal Gross T status TNM T 1 a T 1 b T 2 T 3 a T 3 b T 4 a T 4 b N status TNM Nx N 0 N 1 a N 1 b M status TNM M 0 M 1 Positive Tg Ab level Stimulated Tg level at RAI treatment']","Calcitonin and thyroglobulin are not specifically mentioned as prognostic biomarkers for thyroid cancer in the provided contexts. However, the contexts discuss the role of TNFα as a potential prognostic marker in differentiated thyroid carcinoma (DTC) and papillary thyroid carcinoma (PTC), indicating that other biomarkers may be under investigation [CTX 2]. The evidence suggests that while TNFα levels are associated with thyroid cancer, there is no direct mention of calcitonin or thyroglobulin serving this role [CTX 1][CTX 2]. Further studies would be necessary to clarify the prognostic value of calcitonin and thyroglobulin in thyroid cancer [CTX 2].",0.5,0.0,0.0
What cell lines are commonly used in thyroid cancer research?,"['henhua []tissue TNFα tumor necrosis factora DTC differentiated thyroid carcinoma IL 6 in terleuk in 6 PTC papillary thyroid carcinoma FTC follicular thyroid carcinoma AT Canaplastic thyroid carcinoma MTC medullary thyroid carcinoma WDTC welldifferentiated thyroid carcinoma FNAC fine needle as pirati on cytologynodular goiter PTCQuality of in cluded studies The quality as sessment of these studies is as sessed bythe NOS and the resultis shown in Supplemental Table Five or more scores are determined as highquality Two studies conducted by Cao G in [] and L Kayser in [] only get two scoresshowing a poor quality in methodology The rest studies are as sessed as high quality TNFα and thyroid carcinoma Twelve studies reported the expressi on of TNFα both in patients with thyroid carcinoma and control subjects["" "" ] Among these sevenstudies [ ] had tested the level of serum TNFα two studies [ ] had tested the expressi on of TNFα in tissues and the ratio of TNFα immunoreactivity was tested in four studies [ ] Firstly fixedeffect model is used to merge the SMDvalues of serum TNFα level however a large heterogeneity is found by the heterogeneity analysis heterogeneity test Chi 2 P I 2 and itmay be due to the different units differenttesting', 'of clinical studies provide evidence for basic research simonovic sz evaluated cytokine profiles determined in supernatants obtained from whole blood cultures in patients with dtc before and days after radioactiveiodine 131 itherapy and control subjects and found that the expressi on of tnfα in dtc patients ishigher than control subjects and it showed a decreasedlevel after 131 i the rapy than those before the rapy however no statistical difference found for the limited sample size another study conducted by kobawala tp with more patients patients with benign thyroid disease ptc patients and healthy in dividuals determined the circulating levels of tnfα and it wasfound that the serum level of tnfα was significantlyhigher in ptc patients than benign thyroid disease patients and the later was also significantly higher thanhealthy in dividuals furthermore serum tnfα was reported to be a significant prognosticat or for overall survival in ptc patients it is a pity thatopposite result wasreported in a casecontrol study that in cluded dtccases and matched cancerfree cohort participantswhich found that tnfa was not as sociated with thyroidrisk in either gender based on current evidence our meta analysis suggeststh at tnfα exhibit a strong as sociati on with thyroid carcinoma it may because that elevated tnfα may in volved in the tumorigenesis and development of thyroid cancer another possible reas on is that the tnfα decreased with tumor cells less resulted the activati on ofthe immune system by thyroid carcinomathereforemore clincal studies and basic reseaches should be conducted in the futureil 6 a multifunctional cytokine plays important roles in different types of cells in cluding tumor cells it', 'we used the Gene Expressi on Profiling In teractive Analysis database to verify the expressi on of key genes in PTC and adjacent tissues The overall survival and diseasefree survivalanalyses were per formed by Kaplan""Meier plots for these PTCrelated hub genes Genetic alterations of hub genes in PTC and their correlations with other genes were analyzed utilizing the c Bio Portal for Cancer Genomics Hub genesrelated to clinicopathological features were analyzed using the on line database UALCAN httpualcanpathuabedu[] The correlati on of ADORA 1 APOE and LPAR 5 expressi on with the immune in filtrati on level in PTC and the expressi on of these three genes in different kinds of cancers was per formed using the Tumor Immune Estimati on Resource database []For q RTPCR analysis total RNA was isolated from normal and cancerous papillary thyroid samples utilizing TRIzol reagent Qiagen Valencia CA USA c DNA was synthesized with RNA reverse transcripti on kit TIANGENBIOTECH Beijing China q RTPCR was per formed with an ABI Real Time PCR System Applied Biosystems Life Technologies USA The expressi on of the genes of in terest was normalized to actin The primers for ADORA 1 APOE LPAR 5 and actin are shown in Table For Western blot RIPA buffer was used to extract prote in from four pairs of tissue from PTC patients and the prote in concentrations were measured via BCA Differentially expressed genes screening based on RNASeq To screen out the genes or modules that may play a role in promoting cancer in papillary thyroid carcinoma weperformed RNASeq experiments on four pairs of thyroid cancer tissues and their matched paracancerous tissues to obta in differentially expressed genes After RNASeq we acquire "" milli on reads for each sample The fold changesbetween PTC cancer tissues and matched paracancerous samples were calculated Setting the cutoff criteri on as Pvalue and a fold change there were upregulated and downregulated genes These DEGswere considered to be candidate genes for', 'Characteristics of patients The study group in cluded papillary thyroid cancers PTC follicular thyroid cancers FTC and poorlydifferentiated thyroid cancers PDTCThere were women and men The mean agew as ± years Three hundred and seventytwo patients were prepared with rh TSH stimulati on Eightytwo patients presented positive Tg Ab at the time of postoperative RAI treatment In the postoperative setting prior to RAI administrati on patients were at low risk LR at in termediaterisk IR and at high risk HRaccording to the ATA risk Per sistent disease and tumor burden Overall PD was detected in patients Their characteristics in terms of ATA risk RAI preparati on modality PD sites and RAI or 18 FDG uptake arepresented in Table Of patients had very smallvolumelargevolume smallvolume and PDFigure shows two points First the rate of PDincreased from in LR patients and in IR to in HR patients p Second the per centage of patients with largevolume PD in creased with risk stratificati on from LRIR to HR patients and respectively p Table Characteristics of patients according to the ATA riskstratificati on system in the postoperative setting Mean age ± SD yrs Sex ratio Female Mean tumor size ± SD mm Histology PTCFTCPDTCAggressive pathological subtypes No Yes Extrathyroidal extensi on Minimal Gross T status TNM T 1 a T 1 b T 2 T 3 a T 3 b T 4 a T 4 b N status TNM Nx N 0 N 1 a N 1 b M status TNM M 0 M 1 Positive Tg Ab level Stimulated Tg level at RAI treatment', 'IO 3 m RNA was found to be upregulated in MCF 7 cells and downregulated in MDAMB 231 cells when compared to the nontumoral cell line MCF 10 A cells DIO 3 mediated T 3 deiodinati on also occurs in MCF 7 cells In these cells DIO 3 expressi on is to regulated by retinoids but not by estradiol 37"" These findings are consistent with the presence of DIO 3 in other tissues of ectodermal or igin such as the skin and the nervous system 4041 The role of thyroid hormone metabolism on human tumorigenesis has been largely debated 10 In breast cancer previous studies showed that higher levels of the thyroid hormone recept or alpha were an in dependent prognostic fact or for in creased overall survival 42 More recently high levels of the thyroid hormone recept or beta in breast tumors were also as sociated with in creased breast cancerspecific survival 43 In basal cell carcinom as BCC for in stance a DIO 3 mediated decrease in T 3 levels relates to in creased cell proliferati on 31 Similarly in colon cancer cells DIO 3 knockdown and consequent in creases in T 3 levels are as sociated with reduced cell proliferati on and in ducti on of differentiati on 44 High levels of DIO 3 expressi on in primary PTC tumors were as sociated with advanced disease at the diagnosis 30 Some data in deed suggest that T 3 can contribute to tumor growth in breast cancer cells in a 0 vitro 17 while a micro environment with low T 3 levels could facilitate in vasiveness and dedifferentiati on However in agreement with our data in breast cancer similar levels of DIO 3 m RNA are observed in glioblastoma and liver carcinom as as compared to respective normal tissues 45 These differences could be at tributed to the tissue embryological or igin since the tissues of ectodermal or igin seem to mainta in DIO 3 expressi on during adulthood while DIO 3 gene is subject to imprinting in other tissues Loss of DIO 3 expressi on was as sociated with tumor aggressiveness in colon cancer and also in thyroid cancer DIO 3 ex']","Commonly used cell lines in thyroid cancer research include those derived from papillary thyroid carcinoma (PTC), follicular thyroid carcinoma (FTC), and anaplastic thyroid carcinoma (ATC) [CTX 1]. These cell lines are essential for studying the molecular mechanisms underlying thyroid cancer and for testing potential therapeutic agents [CTX 2]. Additionally, the expression of various genes and proteins in these cell lines can provide insights into tumor behavior and patient prognosis [CTX 3]. However, the specific characteristics and behaviors of these cell lines may not fully represent the complexity of thyroid cancer in vivo, which can limit the generalizability of findings [CTX 4].",0.0,0.9272595288830292,0.0
What endpoints are used in clinical trials for advanced thyroid cancer?,"['For many years doxorubic in was the only US Food and Drug Administrati on FDA""approved treatment for patients with advanced thyroid cancer however response rate in patients with MTC is up to with significant to xicity "" Recently in advanced MTC several TKIs such as axitinib cabozantinib gefitinib lenvatinib imatinib motesanib sorafenib pazopanib sunitinib and vandetanib have been studied in phase I IIand III clinical trials Vandetanib an oral in hibit or of VEGFRvascular endothelial growth fact or recept or RET and EGFRepidermal growth fact or recept or was approved by the FDA in April after a phase III trial demonstrated improvedmedian progressionfree survival PFS compared to placebohazard ratio CI "" and overall response rate of Cabozantinib an in hibit or of hepatocyte growthfact or recept or MET VEGFR 2 and RET was approved bythe FDA in after a phase III trial demonstrated improvedmedian PFS of months relative to months in the placebo group The impact of to xicity on patientsw as clearly in dicated and for cabozantinib of patientsrequired dose reductions and required dosing delays The refore to xicity of FDAapproved TKI agents limits their usein patients with small volume as ymptomatic or in dolent disease Furthermore no clear data exist from these studies thateither agent impacts overall survival In additi on RETspecific TKIs in development are Selpercatinib previously LOXO 292 and Blue 667 with more specific RETtargeting activity The seagents have demonstrated evidence of efficacy in early trial', 'Characteristics of patients The study group in cluded papillary thyroid cancers PTC follicular thyroid cancers FTC and poorlydifferentiated thyroid cancers PDTCThere were women and men The mean agew as ± years Three hundred and seventytwo patients were prepared with rh TSH stimulati on Eightytwo patients presented positive Tg Ab at the time of postoperative RAI treatment In the postoperative setting prior to RAI administrati on patients were at low risk LR at in termediaterisk IR and at high risk HRaccording to the ATA risk Per sistent disease and tumor burden Overall PD was detected in patients Their characteristics in terms of ATA risk RAI preparati on modality PD sites and RAI or 18 FDG uptake arepresented in Table Of patients had very smallvolumelargevolume smallvolume and PDFigure shows two points First the rate of PDincreased from in LR patients and in IR to in HR patients p Second the per centage of patients with largevolume PD in creased with risk stratificati on from LRIR to HR patients and respectively p Table Characteristics of patients according to the ATA riskstratificati on system in the postoperative setting Mean age ± SD yrs Sex ratio Female Mean tumor size ± SD mm Histology PTCFTCPDTCAggressive pathological subtypes No Yes Extrathyroidal extensi on Minimal Gross T status TNM T 1 a T 1 b T 2 T 3 a T 3 b T 4 a T 4 b N status TNM Nx N 0 N 1 a N 1 b M status TNM M 0 M 1 Positive Tg Ab level Stimulated Tg level at RAI treatment', 'henhua []tissue TNFα tumor necrosis factora DTC differentiated thyroid carcinoma IL 6 in terleuk in 6 PTC papillary thyroid carcinoma FTC follicular thyroid carcinoma AT Canaplastic thyroid carcinoma MTC medullary thyroid carcinoma WDTC welldifferentiated thyroid carcinoma FNAC fine needle as pirati on cytologynodular goiter PTCQuality of in cluded studies The quality as sessment of these studies is as sessed bythe NOS and the resultis shown in Supplemental Table Five or more scores are determined as highquality Two studies conducted by Cao G in [] and L Kayser in [] only get two scoresshowing a poor quality in methodology The rest studies are as sessed as high quality TNFα and thyroid carcinoma Twelve studies reported the expressi on of TNFα both in patients with thyroid carcinoma and control subjects["" "" ] Among these sevenstudies [ ] had tested the level of serum TNFα two studies [ ] had tested the expressi on of TNFα in tissues and the ratio of TNFα immunoreactivity was tested in four studies [ ] Firstly fixedeffect model is used to merge the SMDvalues of serum TNFα level however a large heterogeneity is found by the heterogeneity analysis heterogeneity test Chi 2 P I 2 and itmay be due to the different units differenttesting', 'of clinical studies provide evidence for basic research simonovic sz evaluated cytokine profiles determined in supernatants obtained from whole blood cultures in patients with dtc before and days after radioactiveiodine 131 itherapy and control subjects and found that the expressi on of tnfα in dtc patients ishigher than control subjects and it showed a decreasedlevel after 131 i the rapy than those before the rapy however no statistical difference found for the limited sample size another study conducted by kobawala tp with more patients patients with benign thyroid disease ptc patients and healthy in dividuals determined the circulating levels of tnfα and it wasfound that the serum level of tnfα was significantlyhigher in ptc patients than benign thyroid disease patients and the later was also significantly higher thanhealthy in dividuals furthermore serum tnfα was reported to be a significant prognosticat or for overall survival in ptc patients it is a pity thatopposite result wasreported in a casecontrol study that in cluded dtccases and matched cancerfree cohort participantswhich found that tnfa was not as sociated with thyroidrisk in either gender based on current evidence our meta analysis suggeststh at tnfα exhibit a strong as sociati on with thyroid carcinoma it may because that elevated tnfα may in volved in the tumorigenesis and development of thyroid cancer another possible reas on is that the tnfα decreased with tumor cells less resulted the activati on ofthe immune system by thyroid carcinomathereforemore clincal studies and basic reseaches should be conducted in the futureil 6 a multifunctional cytokine plays important roles in different types of cells in cluding tumor cells it', 'Papillary thyroid carcinoma PTCis acomm on thyroid malignancy accountingf or about of systemic malignancies 1 PTC is currently characterized by a highincidence and low mortality 2 clinical Recentimprovements in highfrequencyultrasonic diagnostic technologies and the applicati on of ultrasoundguided puncturetechniques have led to an apparent in crease in the in cidence of PTC year by year 3""Regardingthyroidtumors the palpati on detecti on rate for thyroid microtumors in the general populati on is about compared with as high as to for highfrequency ultrasound 6 which has thus greatly improved disease diagnosisdiagnosisthe of Surgical resecti on is a routine treatmentf or thyroid tumors but the recurrence rateis usually high and the consequent reducti on in thyroid functi on can seriously affect the patient™s quality of life 7 As sociated with the in creasing detecti on rate of thyroidtumors and the pursuit of minimally in vasive treatments radiofrequency ablati on RFA has been gradually applied in the clinic RFA uses local hyperthermia to cause tissue necrosis The the rmal effectsdo not depend on the tissue type and most lesions can be completely eliminated by RFA 89 RFA has thus become a novellocal treatment for tumors The clinical diagnosis of benign and malignant thyroid tumors currently depends on the clinical manifestations and pathological examinations However the clinicalmanifestations are mostly derived from involvessubjective empirical analysis while a finalpathological diagnosisinvasiveprocedures with lesssatisfactory specificity It is the refore necessary to identifyappropriatepredictivetum or markersdiagnosticandforimplications The collagenases matrix metalloproteinase MMP 2 and MMP 9 can degradetype IV collagen in the basement membrane with importanttumorangiogenesis and tumor cell in vasi on and metastasis 10 MMP 2 and MMP 9 expressi on levels were found to be upregulated in thyroid cancer tissue 11 however the sestudies mostly examined pathological tiss']","Endpoints used in clinical trials for advanced thyroid cancer typically include progression-free survival (PFS) and overall response rate (ORR). For instance, cabozantinib was approved by the FDA after demonstrating improved median PFS compared to placebo, along with a notable ORR in patients with advanced medullary thyroid carcinoma (MTC) [CTX 1]. Additionally, studies have shown that the toxicity of targeted kinase inhibitors (TKIs) can impact their use in patients with small volume or indolent disease, which is an important consideration in evaluating treatment efficacy [CTX 1]. However, there is currently no clear data indicating that these agents significantly impact overall survival [CTX 1].",0.8333333333333334,0.9851354537413975,0.75
