{"question": "How do KRAS mutations influence response to EGFR-targeted therapy in colorectal cancer?", "contexts": ["in this prospective single arm multi center in terventi on study patients with resectable microsatellite stablect 3\"4 nxm 0 colon cancer will be treated with two courses of neoadjuvant and two courses of adjuvant capecitabine and oxaliplat in the primary endpoint is the pathological tumor response to neoadjuvant chemo therapy per cms secondaryendpoints are radiological tumor response the prognostic value of these responses for recurrence free survival and overall survival and the differences in cms classificati on of the same tumor before and after neoadjuvant chemo therapy the study is scheduled to be per formed in \" dutch hospitals the first patient was in cluded in february necessary to proceed to future studies in which neo adjuvant chemo therapy may be with hold in patients with a specific cms subtype who show no benefit from chemo therapy and for whom possible new treatments can be in vestigatedtrial registrati on this study has been registered in the netherlands trial register nl 8177 at \" wwwtrialregisternltrial 8177 the study has been approved by the medical ethics committee utrecht mec 18712 keywords colon cancer consensus molecular subtypes neoadjuvant chemo therapy surgery colon cancer is one of the most comm on types of cancer in the netherlands with an in cidence of around patients in approximately of patients present with local disease stage iiii curativesurgery followed by adjuvant systemic chemo therapy isstandard of care in patients with microsatellite stablemss high risk stage ii and stage iii colon cancer despite this in tensive treatment \" of the patients develop metastatic disease these patients do not benefitenough from the current adjuvant systemic the rapymoreover it is estimated that will not develop metastases after surgery alone and are the refore over treated with adjuvant chemo therapy identifying the patients at risk of developing metastases as well as thoseresponding to the rapy is a clear unmet need in colon cancer care the developme", "Crowley method The CIs of month and year survival probabilities were calculated based on the Greenwood\u2122s for mula HRs and CIs were estimated by Cox regressi on We did subgroup analyses divided by prespecified baseline patient and disease characteristic variables in cluding RAS status for DCR PFS and OS We also did a prespecified exploratory analysis of potential predictive biomarkers in blood samples We did all analyses with SAS V 94 Patient characteristics Between October and January patients with unresectable metastatic colorectal cancer were enrolled All patients were eligible and received the study medicati on Table summarises the baseline characteristics of all enrolled patients The median number of previous lines of palliative chemo therapy was range \" and patients had received or \u2030\u00a5 prior lines of chemo therapy for metastatic disease respectively The data cut off date was January with median follow up of months IQR \"efficacy The centrally as sessed DCR was CI to one sided p 00001 two patients had a partial response and had a stable disease in cluding unconfirmed PR table figure A total of patients had a reducti on in target lesi on size from baseline figure Time on treatment for all patients is \u2030\u00a5 \u2030\u00a5 Male Female months \u2030\u00a5 months Right sided colon Left sided colorectum Lung Liver Lymph node Per itoneum Age years Sex ECOG per formance status Primary site Number of metastatic site Metastatic an Time from start of first line chemo therapy Number of previous palliative chemo therapy Previous chemo therapy and reas on for discontinuati on Fluoropyrimidine Refractory In tolerant Oxaliplat in Irinotecan TAS 102 trifluridinetipiracil Angiogenesis in hibit or Anti EGFR in hibit or Refractory In tolerant Refractory In tolerant Refractory Refractory In tolerant Refractory In tolerant Iwasa a 0 S et a 0 al ESMO 20205 e 000776 101136 esmo 2020000776 0 c access Table Best response to treatment Complete response Partial response Stable disease Progressive disease Not", "with a 96.3% overall agreement. The clinical outcome of patients who were EGFR-mutati on detected by the EGFR PCR test was very similar to the entire EURTAC cohort. The concordance between the EGFR PCR test and Sanger sequencing was 90.6%. In 78.9% of the discordant samples the EGFR PCR test result was confirmed by a sensitive deep sequencing assay. This retrospective study demonstrates the clinical utility of the EGFR PCR test in the accurate selecti on of patients for anti-EGFR TKI the rapy. The EGFR PCR test demonstrated improved per formance relative to Sanger sequencing. This study was funded by Roche. The funders contributed to the study design data collecti on analysis decisi on to publish and preparati on of the manuscript. The efficacy of many novel targeted cancer the rapies can be predicted by the detecti on of specific biomarkers in the tumor. The FDA has in dicated that if the identificati on of a specific biomarker is required for the safe and efficacious administrati on of a drug a well-validated FDA approved compani on diagnostic assay is required for that drug. The optimal approval path for a new targeted the rapy and its compani on diagnostic is a parallel clinical development process that in volves clinical trials for the in vestigational agent where the in vestigational diagnostic test is used to either select patients for the trials or to predict response to treatment and ends ideally with simultaneous health authority approval of the drug and the compani on diagnostic. Successful examples of this in clude the co-development (and co-approval) of the BRAF in hibit or vemurafenib and its compani on diagnostic BRAF V 600 E mutati on assay for BRAF-mutant metastatic melanoma and the ALK in hibit or crizotinib and its compani on diagnostic ALK fusi on gene test in advanced ALK-fusi on positive non-small cell lung cancer (NSCLC) patients. However in some cases predictive biomarkers for a targeted the rapy are not recognized until after the drug is fir", "16966692 Barrier A Prognosis of stage II colon cancer by non-neoplastic mucosa gene expressi on profiling On cogene 2007 26 2642 2648 17043639 Beer DG Gene-expressi on profiles predict survival of patients with lung adeno carcinoma Nat. Med. 2002 8 816 824 12118244 Bolstad BM A comparis on of normalizati on The genotype +6/+6 predicted a higher ORR among active/former smokers compared to +6/-6 genotype (100% vs. 50%; p =?0.085). Overall the 3 R/3 R genotype predicted a higher ORR (100%) over the rest VNTR polymorphisms (p =?0.055). The presence of 3 R/3 R genotype significantly correlated with a superi or ORR in patients without EGFR activating mutations (100%) compared to 2 R/2 R 2 R/3 R and 3 R/4 R genotype (77.8% 33.3% and 0% respectively; p =?0.017). After a median follow-up of 21 months a trend to wards a better PFS although not significant was found among subjects showing 3 R/3 R polymorphisms (p =?0.089). A significantly superi or OS was found in patients showing 3 R/3 R genotype rather than other VNTR polymorphisms (p =?0.019). No significant correlati on with the to xicity was observed.", "this post hoc exploratory analysis examined the effect of prognostic factors on outcomes in the randomized double blind phase study of trifluridine tipiracil ftdtpi plus best supportive care bsc versus placebo plus bsc in patients with mcrc refractory to standard chemotherapies recourse trial patients were redivided by prognosis into two subgroups those with metastatic sites at randomisati on low tumour burden and \u2030\u00a5 months from diagnosis of metastatic disease to randomisati on in dolent disease were in cluded in the good prognostic characteristics gpc subgroup the remaining patients were considered to have poor prognostic characteristics ppc gpc patients n 386 had improved outcome versus ppc patients n 414 in both the trifluridinetipiracil and placebo arms gpc patients receiving trifluridinetipiracil n 261 had an improved median overall survival vs months hr ci to p 00001 and progressi on free survival vs months hr ci to p 00001 than ppc patients receiving trifluridinetipiracil n 273 improvements in survival were irrespective of age eastern cooperative on cology group per formance status ecog ps kras mutational status and site of metastases at randomisati on in the trifluridinetipiracil arm time to deteriorati on of ecog ps to \u2030\u00a5 and proporti on of patients with ps 0\" discontinuing treatment were longer for gpc than for ppc patients vs months and vs respectively low tumour burden and in dolent disease were factors of good prognosis in late line mcrc with patients experiencing longer progressi on free survival and greater overall survival", "AZD 6244 had minimal effects on the p 38 c-Jun-NH 2-kinase PI 3 K and MEK 5/ERK 5 pathways and is currently in phase II clinical trial in KRAS-mutant NSCLC. In vivo AZD 6244 could in hibit the tumor growth in HT-29 xenograft model which is a colorectal tumor model carrying a BRAF mutati on at a dose of 100 mg/kg and the tumor growth in hibiti on of AZD 6244 is better than gemcitabine. However the in hibiti on of MEK signaling alone may not be sufficient in patients with gefitinib-resistant NSCLC and negative feedback mechanisms in PI 3 K pathway may be problematic when it is used alone. By contrast combined blockade of both pathways was able to over come the reciprocal pathway activati on in duced by in hibit or-mediated release of negative feedback loops and resulted in a significant tumor growth in hibiti on. Thus coinhibiti on of both pathways has shown use in reducing tumor growth in a variety of xenograft models and clinical trials of such combinations are under way in adults. BEZ 235 is an or ally available dual in hibit or of PI 3 K and m TOR that is being evaluated in phase I/II trials. With the aim of developing effective the rapeutic strategy for treatment gefitinib-resistant NSCLCs we have in itially evaluated the antitum or activity of AZD 6244 alone or combinati on with BEZ 235 in a panel of three human NSCLC cell lines which were selected according to their different mutati on status for EGFR-T 790 M MET and KRAS/PIK 3 CA genes. We hypothesized that targeting the MEK pathway in combinati on with selective in hibitors of PI 3 K/m TOR signaling could over come gefitinib-resistant NSCLC and enhance the antitum or efficacy.", "according to the global cancer statistic of colorectal cancer crc is the third most comm on cancer and the second leading cause of cancer'as sociated mortality worldwide crc was reported as the fourth most comm on and fatal cancer in china in patients with crc usually have a low survival rate and poor the rapeutic responses and are susceptible to progressi on and recurrence early diagnosis and effective treatment are critical to improve the survival of patients with crc crc studies have focused on in novative ideas to identify molecular markers used to develop high'precisi on non'in vasive screening tests for crc to in crease populati on compliance and reduce the poten'tially harmful side effects as sociated with more in vasive techniques diagnostic markers will give an in dicati on of the likely progressi on of the disease targeting specific molecules in certa in patients has facilitated more per sonalized treatments that help prevent or decelerate cancer progressi on the present study aimed to determine prognostic factors and novel the rapeutic targets to improve the survival of patients with crcprevious studies have focused on the identificati on of molecules as sociated with tumor progressi on through genetic or mrna profiling and screening of patients with colon cancer ' for example the expressi on profiles of long non'coding rnas lncrn as were compared at specific tumor stages t 0 t 1 t 2 and t 3 in an azoxymethanedextran sodium sulfate'in duced primary colon cancer model and upregulati on of the lncrna h 19 predicted a poor prog'nosis other studies analyzed microrna mir expressi on profiles between tumor tissues and matched non'tumor tissues obtained from patients with crc for example mir' is significantly downregulated in tumor tissues and as sociated with poor survival of patients with crc and may thus be considered to be a poor", "this was an open label single centre single arm phase study eligible patients had unresectable metastatic colorectal adeno carcinoma refractory or in tolerant to fluoropyrimidine irinotecan oxaliplat in trifluridinetipiracil anti vegf the rapy and anti epidermal growth fact or recept or the rapy for tumours with wild type ras patients were treated with oral lenvatinib at mg one time a day in day cycles until disease progressi on or unaccept able to xicity the primary endpoint was centrally as sessed disease control rate secondary endpoints in cluded safety response rate progressi on free survival and overall survival the planned sample size was patients to expect a disease control rate of with a threshold disease control rate of one sided alpha of and power of between october and january patients were enrolled and had received or \u2030\u00a5 lines of prior chemo therapy for metastatic disease respectively the median number of lenvatinib cycles was range \" the centrally as sessed disease control rate was ci to one sided p 00001 patients had a partial response and had a stable disease median progressi on free survival was months ci to median overall survival was months ci to the most comm on grade \u2030\u00a5 adverse events were hypertensi on thrombocytopenia in creased alanine aminotransferase and anorexia eachs lenvatinib showed promising clinical activity and was to lerated in patients with metastatic colorectal cancer after failure of standard chemotherapiestrial registrati on number umin ctr umin 000023446 and jamcct ctr jma iia 00261", "5 fu in colon cancer cells via the pi 3 kakt pathwaycorrespondence to dr xiangbo chen endoscopy center the quanzhou first hospital affiliated to fujian medical university east street licheng quanzhou fujian pr chinaemail coloboyeahnetkey words ginsenoside rg 3 colon cancer 5 fluorouracil pi 3 kakt colon cancer is a comm on malignant tumor of the digestive tract located in the colon which mainly occurs at the juncti on of the rectum and the sigmoid colon statistics show that the highest in cidence of colon cancer is in the age group of years the ratio of male to female is and the in cidence of colon cancer ranks third among all cases of gastrointestinal tumors the 5 year survival rate of patients with colon cancer is approximately yet the 5 year survival rate of patients with advanced stage disease is as low as since the early symptoms of patients with colon cancer are not obvious only about of patients can be diagnosed at the early stage of the disease chemo therapy is one of the most important treatments for patients with advanced colon cancer of which 'fluorouracil 'fu is the most widely used 5 fu in hibits the proliferati on in vasi on and migrati on of tumor cells by in terfering with the nucleic acid metabolism of tumor cells but it is also toxic to normal cells causing serious adverse reactions even endangering the life safety of patients severely limiting its clinical applicati on previous research has shown that 5 fu combined with other agents may reduce the required dosage of 5 fu consequently reducing the adverse reactions caused by 5 fu without affecting or even improving the efficacy of chemo therapy compared with chemical drugs and biopharmaceuticals multicomponent multitarget and less adverse reactions are unique advantages of traditional chinese medicine for the treatment of diseases in patients with colon cancer chinese medicine can improve patient immunity reduce the side effects of radio therapy and chemo therapy or enhance drug sensitivity in hibi", "disease months after diagnosis of regional and lung metastases the other patient was alive without disease at months after diagnosis of regional metastasestwo patients died one of which was due to conjunctival scc described above nine patients experienced local recurrence after curative surgeryall tumors were egfr positive in our cohort twentyone of tumors showed focal egfr staining and seven showed diffuse egfr staining fig analysis of egfr in tracellular staining patterns showed scores of for membrane staining and for cytoplasmic staining no significant difference was found between carcinoma in situ tisand in vasive carcinoma tadv table no significant difference was found in the scoredepending on the stage egfr expressi on in colon cancer was used as a positive control fig 2 aon the other hand seven benign conjunctival lesions three pinguecula three pterygiumone dermoid cyst showed partial weak positive staining in conjunctival squamous epithelialcells especially on the cell membrane in additi on cytoplasmic staining was seen in only one case benign cases showed scores of for membrane staining and for cytoplasmic staining cytoplasmic staining patterns were significantly different in benign compared to scc cases p table the correlati on between egfr staining focal or diffuse and egfr localizati on cytoplasmic staining group was not significantly different one 101371 pone 0238120 august one 0 cegfr in conjunctival squamous cell carcinomafig egfr expressi on in conjunctival scc focal egfr staining a and diffuse egfr staining b scale bar \u03bcm inset corresponding field in ahematoxylineosinstained secti on membrane staining very"], "answer": "Insufficient evidence in provided documents."}
{"question": "What is the role of BRAF V600E mutations in colorectal tumor progression?", "contexts": ["provide biological in sights into the regulati on of BRAF on cogene dependence and identify strategies to optimize outcomes in BRAF-mutant NSCLC patients. On cogenic mutations in the BRAF kinase occur in 6\"8% of nonsmall cell lung cancers (NSCLCs) accounting for more than 90000 deaths annually worldwide. The biological and clinical relevance of these BRAF mutations in NSCLC is in completely under stood. Here we demonstrate that human NSCLC cells with BRAFV 600 E but not other BRAF mutations in itially are sensitive to BRAF-in hibit or treatment. However these BRAFV 600 E NSCLC cells rapidly acquire resistance to BRAF in hibiti on through at least one of two discrete molecular mechanisms: (i) loss of full-length BRAFV 600 E coupled with expressi on of an aberrant form of BRAFV 600 E that retains RAF pathway dependence or (ii) constitutive autocrine EGF recept or (EGFR) signaling driven by c-Jun\"mediated EGFR ligand expressi on. BRAFV 600 E cells with EGFR-driven resistance are characterized by hyperphosphorylated prote in kinase AKT\"", "14 was as sociated with a significantly worse survival rate this study showedthat the expressi on of nop 14 was upregulated incrc but its role in pathogenesis requires further research and confirmation the mrps 23 gene which is responsible for encodinga 28 s subunit prote in has been found to be over expressed in breast cancer uterine cervical cancer hcc colorectal cancer and uterine leiomyoma as revealed by gao in hibitingmrps 23 could lead to a significant reducti on in breast cancer metastasis by in hibiting the emt phenotype pu found that high mrps 23 levels can predict poorclinical outcomes in hcc although the expression of mrps 23 is in creased in crc its specific pathogenesisremains unclearmak 16 encodes a ribosomal prote in and plays an important role in ribosome biogenesis throughout the cellcycle in this study it was found that mutations inmak 16 can in duce cell cycle arrest at g 1 phase during which the cell synthesizes mrna and proteins in preparati on for cell divisi on at present there is still nostudy of the role of mak 16 in the pathogenesis of tumours which requires further research to confirm in this paper a", "Cell via bility analysis AM 38 and normal human as trocytes was purchased from JCRB Cell Bank and Scien Cell Research Laboratories respectively Tumorsphere lines were cultured in serumfree neural stem cell medium as previously described [] Normal human as trocytes were cultured with as trocyte medium Scien Cell To as sess cell via bility primary cultured cells were dissociated into single cells and seeded into 96 well plates at a density of cellswell After a 0 h dabrafenib Selleck and trametinib Selleck were serially diluted and added to the wells Cell via bility was measured using the Cell Titer Glo Promega assay at day and the were in dicated as via bility of the DMSO controlsh RNA cell line generati on To knockdown BRAF 293 T cells were transfected with lentiviral vect or packaging plasmid DNA containing a 0 \u03bcg of Human BRAF sh RNA TRCN 0000381693 GP and a 0\u03bcg of a 0 p VSVg Rev a 0 with Lipofectamine\"\u00a2 TRCN 0000196844 Sigma Aldrich a 0\u03bcg of a 0 p HIVThermo Fisher Scientific YMG 62 and AM 38 cells were in fected with lentivirus in polybrene a 0\u03bcgm L for a 0 h Two days later the cells were selected with puromyc in a 0\u03bcgm L for a 0 days and used for experiments GIPZ nonsilencing lentiviral sh RNA Control RHS 4348 Horiz on Discovery was used as a nonsilencing NS control Immunohistochemistry Tumor tissue specimens were fixed in neutral buffered for malin and embedded in paraff in Hematoxyl in and eosin staining was per formed using standard procedures For immunohistochemical analysis 5\u00b5mthick sections were deparaffinized treated with H 2 O 2 in methanol rehydrated and heated for a 0 min for antigen retrieval After blocking with serum tissue sections were in cubated with primary antibodies against CD 34 Novus Biologicals LAT 1 Cell Signaling Technology phospho MEK Cell Signaling Technology phospho ERK Bethyl Laboratories and c Myc Cell Signaling Technology at a 0\u00b0C over night The next day sections were washed with PBS in cubated with biotinylated secondary", "in a spectrum of consequences ranging from lethal developmental abnormalities to several forms of aggressive cancer nusse and clevers most prominently colorectal cancer crc is in itiated by genetic mutations that constitutively activate wnt signaling kahn secreted wnt ligands trigger an in tracellular biochemical cascade in the receiving cells that culminates in the calibrated expressi on of target genes mosimann this transcriptionalresponse is or chestrated by nuclear bcaten in that acts as a \u02dcscaffold\u2122 to buttress a host of cofactors to cisregulatory elements occupied by the tcflef transcripti on factors valenta among the cofactors the two paralogs bcl 9 and bcl 9 l referred to as bcl 99 l and pygo 12 proteins reside with in the wntbcaten in transcriptional complex and their concerted acti on isrequired to efficiently activate wnttarget gene expressi on kramps parker for correspondencekonradbaslerimlsuzhch kbandreasmoorbsseethzchaemclaudiocantuliuse cc these authors contributedequally to this workpresent address \u00a1divisi on of molecular pathology the netherlands cancer in stituteamsterdam netherlandscompeting in terests the authors declare that nocompeting in terests exist", "in an amino acid substituti on at positi on 22 from a glutamine (Q) to a lysine (K) in KRAS. All of these amino acid substitutions occurred along the GTP binding doma in of KRAS. KRAS binds to GTP in the active state and possesses an in trinsic enzymatic activity which cleaves the terminal phosphate of the nucleotide converting it to GDP. Upon conversi on of GTP to GDP KRAS is turned off. The result of these mutations is constitutive activati on of KRAS signaling pathways. Once it is turned on it recruits and activates proteins necessary for the propagati on of growth fact or and other receptors' signal such as c-Raf and PI 3-kinase. 7.7% of KRAS-as sociated lung cancers were adenocarcinom as () and 6.1% of KRAS mutations as sociated with \u02dclow differentiati on\u2122 cancers and 7.4% of KRAS mutations were \u02dcmid differentiati on\u2122 cancers (). In our sample set 6.3% of KRAS-as sociated lung cancers metastasized to local regions 9.1% to lymphs and 5.1% of cancers metastasized to distant ans in our sample set (). Missense mutati on distributi on in the exons and functional domains of TP 53 Abnormality of the TP 53 gene is one of the most significant events in lung cancers and plays an important role in the tumorigenesis of lung epithelial cells.", "pathway aberrations of which isfig the putative relationship between obesity and colorectal cancer evoluti on pathways by cellular ctnnb 1 status based on the data by the current study our study suggests that there is no as sociati on between obesity and ctnnb 1 expressi on 0 cshokrani bmc gastroenterology page of important in the evoluti on of most sporadic crc in summary there is positive nuclear staining in crcs which was as sociated with the positive status for nuclear ctnnb 1 in tensity adjusted or 95 ci \" p for positive nuclear staining compared to noncrc samples normal or advanced adenoma this shows that advanced adenom as and crcswere as sociated with activati on of caten in in physically fit over weight and obese patients fig advanced adenoma and crc were as sociated with activati on of caten in in physically fit over weight and obese patients thus participati on of obesity and wntpathway seem to be in dependent crc factors in africanamerican patientsinflammationdriven activati on ofwnt signaling as a potential pathway linking obesity tothe development of crc needs to be in vestigated further in the african american populati on this might provideinsights into the identificati on of new the rapeutic targets to reduce the burden of obesityassociated crcabbreviationscrc colorectal cancer wat white adipose tissue aa african americans", "stimulate vegf expressi on by activatingap 1 and the hypoxiainducible factors hif 1 curcum in is an important in hibit or in ap 1 activation and it has recently been shown that curcum in is a directinhibit or of hif 1 transcripti on fact or activity whichcauses the transcripti on of many genes as sociated with curcum in lowers the concentrati on of the cea markertumorcurcum in reduces some skin complicationscurcum in in creased patient survivalcurcum in reduces some skin problemscurcum in in creased the effectiveness of the coloncurcum in reduced glutathione stransferase activitycurcum in reduces prostagland in e 2 productionreduces the number and size of polyps without anysignificant to xicitycurcum in has been shown to improve the over allhealth of patients with colorectal cancercurcum in reduced lipid per oxidati on and in creasedglutathione content in patientswelltolerated limited absorpti on and showedactivity in some patientsreduced the serum prostatespecific antigen content in combinati on with isoflavonesdecreased para prote in load and urinary n telopeptide of type i collagenreduced the urinary excreti on of mutagens in smokersreduced the number of micronuclei in mucosal cells and in circulating lymphocytesimproved the precancerous lesionsincreased vitamins c and e levels decrease dmalondialdehyde and 8 hydroxy deoxy guanosine contents inthe serum and salivano difference in polyp size and number between placebo and curcuminno variati on in tumor size according to recist criteriacurcum in was a safe and to lerable adjunct to folfoxchemo therapy in patients with metastatic colorectal cancerangiogenesis in tumors [ ] it is also shown thatcurcum in will reduce the expressi on of membrane surface moleculesadhesionmolecule 1 vascular cell adhesi on molecule 1 and eselect in which play a role in cellular adhesi on fig in tracellularincludingcurcum in affects a number of adhesive cellular molecules in volved in tumor growth and metastasis processes curcum in caused", "suggest that pancreatic cells bearing Kras mutati on can be in duced to differentiate into quasi-normal cells with suppressed tumorigenicity by selective in hibiti on of the MAPK/ERK/MYC signaling cascade. These findings may have important the rapeutic implications. Pancreatic cancer is one of the deadliest human malignancies. A striking feature of pancreatic cancer is that activating Kras mutations are found in?90% of cases. However apart from a restricted populati on of cells expressing pancreatic and duodenal homeobox 1 (PDX 1) most pancreatic cells are refractory to Kras-driven transformati on. In the present study we sought to determine which subsets of PDX 1+ cells may be responsible for tumor growth. Using the Lox-Stop-Lox\"Kras G 12 D genetic mouse model of pancreatic carcinogenesis we isolated a populati on of Kras G 12 D-expressing PDX 1+ cells with an in herent capacity to metastasize. This populati on of cells bears the surface phenotype of Ep CAM+CD 24+CD 44+CD 133\"SCA 1? and is closer in its properties to stem-like cells than to more mature cell types. We further demonstrate that the tumorigenic capacity of PDX 1+ cells is limited becoming progressively lost as the cells acquire a mature phenotype. These data are consistent with the hypothesis that the adult pancre as harbors a dormant progenit or cell populati on that is capable of in itiating tumor growth under conditions of on cogenic stimulati on. We present evidence that constitutive activati on of the mitogen-activated prote in kinase (MAPK/ERK) signaling and stabilizati on of the MYC prote in are the two main driving forces behind the development of pancreatic cancer cells with stem-cell\"like properties and high metastatic potential. Our", "in the colon the development of adenomatous polyps frequently in volves the in activati on of the apc gatekeeper gene a member of the wntsignaling pathway which represses proliferati on and facilitates or derly cell differentiati on in the luminal part of the crypts barker goss groden as long as this gatekeeper gene is active mutant stem cell progeny with neoplastic potential is likely eliminated from the crypt and clonal expansi on thus averted however when the gatekeeper gene is in activated the brakes on mutant stem proliferati on are removed and mutant cell progeny may undergo focal clonal expansi on the refore we asked the questi on what are the factors that determine the risk of a tsggatekeeper in activati on leading to tumor in itiati on in a compartmentalized tissue a metapopulationour microsimulations in dicate that the base mutati on rate and the in crease in that rate for a mutat or clone are the main driving forces behind tsg in activati on and thus the in itiati on of carcinogenesis the proporti on of deleterious mutations is important for its effect on selecti on of the mutat or clone we find that if most mutations are as sumed to be deleterious then a mutat or clone quickly accumulates a large genetic load of deleterious mutations and tends to be driven to extincti on in competiti on with nonmutat or cells however if mutations are more likely to be beneficial then a mutat or clone can spread more easily which leads to the early in activati on of both alleles of the tumor suppress or gene similarly in creasing turnover of the stem cells effectively in creases the mutati on rate and consequently the rate of in itiati on however when turnover is very high the homeostatic feedback signals cannot mainta in the target number of stem cells and so the total stem cell populati on of the epithelium decreases which in turn decreases the chances for in itiati on figure since the rate of tsg in activati on is trivially relat", "of recent clinical trials trifluridinetipiracil and regorafenib are recognised as new treatment options for patients with metastatic colorectal cancer refractory or in tolerant to standard the rapies 6 Nevertheless the prognosis of patients which are refractory or in tolerant to standard chemotherapies is poor and there are still an unmet medical needs for these patients especially for those who are in a good per formance status and eligible for further the rapies Lenvatinib is an oral multitargeted tyrosine kinase in hibit or of the vascular endothelial growth fact or recept or VEGFR \" fibroblast growth fact or receptors \" platelet derived growth fact or recept or alpha RET and KIT 8 Preclinical studies have shown that Iwasa a 0 S et a 0 al ESMO 20205 e 000776 101136 esmo 2020000776 0 c accesslenvatinib not only in terferes the in teracti on between cancer cells and endothelial cells but also in hibits tumour growth 10 Several phase trials of patients with solid tumours in the USA 11 Europe 12 and Japan 13 showed that the optimum dosage of lenvatinib was mg one time a day in a day cycle A total of patients were enrolled in four phase studies of lenvatinib mono therapy of whom had colorectal cancer Disease control rate DCR was achieved in out of patients in cluding one with a partial response which continued for weeks mg two times a day for weeks of a week cycle Grade palmar plantar erythrodysesthesia was reportedly much lower in of patients treated with lenvatinib for thyroid cancer in a Japanese populati on of the SELECT trial than that of reported in a Japanese populati on of CORRECT trial using regorafenib for metastatic colorectal cancer 15 These"], "answer": "Insufficient evidence in provided documents."}
{"question": "What molecular mechanisms drive resistance to MEK inhibitors in colorectal cancer?", "contexts": ["in this prospective single arm multi center in terventi on study patients with resectable microsatellite stablect 3\"4 nxm 0 colon cancer will be treated with two courses of neoadjuvant and two courses of adjuvant capecitabine and oxaliplat in the primary endpoint is the pathological tumor response to neoadjuvant chemo therapy per cms secondaryendpoints are radiological tumor response the prognostic value of these responses for recurrence free survival and overall survival and the differences in cms classificati on of the same tumor before and after neoadjuvant chemo therapy the study is scheduled to be per formed in \" dutch hospitals the first patient was in cluded in february necessary to proceed to future studies in which neo adjuvant chemo therapy may be with hold in patients with a specific cms subtype who show no benefit from chemo therapy and for whom possible new treatments can be in vestigatedtrial registrati on this study has been registered in the netherlands trial register nl 8177 at \" wwwtrialregisternltrial 8177 the study has been approved by the medical ethics committee utrecht mec 18712 keywords colon cancer consensus molecular subtypes neoadjuvant chemo therapy surgery colon cancer is one of the most comm on types of cancer in the netherlands with an in cidence of around patients in approximately of patients present with local disease stage iiii curativesurgery followed by adjuvant systemic chemo therapy isstandard of care in patients with microsatellite stablemss high risk stage ii and stage iii colon cancer despite this in tensive treatment \" of the patients develop metastatic disease these patients do not benefitenough from the current adjuvant systemic the rapymoreover it is estimated that will not develop metastases after surgery alone and are the refore over treated with adjuvant chemo therapy identifying the patients at risk of developing metastases as well as thoseresponding to the rapy is a clear unmet need in colon cancer care the developme", "clinicopathological characteristics of patients with colorectal carcinoma characteristic sex male female age years \u2030\u00a5 site of lesi on colon rectum differentiati on poor well tumor size cm \u2030\u00a5 pathological type adeno carcinoma others lymph node metastasis no yes liver metastasis no yes stage iii iiiiv cea normal high ca ' normal high ca ' normal high afisher's exact test all others were as sessed using a \u03c72 test defb 4 a defens in 4 a'''''''''''''''''''''''''''''''''''''''''''''''''''''high n low n 0009 a 0003 a 0575 a 0039 a poor survival furthermore defb 4 a expressi on was upregu'lated in patients with crc with advanced and metastatic cancer patients with crc with high defb 4 a expressi on had poor survival in additi on knockdown of defb 4 a affected the migrati on ability of crc cells tcga data of patients with crc were used to identify the degs between the long os days and short os days groups in additi on mrna expressi on was compared between tumor tissues and normal tissues in the same database defb 4 a was highly expressed in tumors and as sociated with a poor prognosis defb 4 a upregulati on was as sociated with poor prognosis and defb 4 a expressi on was significantly upregulated in patients with large tumors advanced cancer stage lymph node metastasis and liver metastasis another study used the gene expressi on omnibus database to screen genes that are in creased in patients with recurrence hierarchical clustering and pathway analyses revealed that thrombospond in thbs 2 and cart", "colorectal carcinogenesis is a multi'step process starting from normal crypts to aberrant crypt foci then to polyps adenoma and eventually adeno carcinoma it has been reported that in dividuals with ibd may have an in creased risk of developing crc which is directly proportional to the extent and durati on of their disease however the exact mechanism and durati on required for chronic colitis to develop into adenoma and then adeno carcinoma remains unclear it has been suggested that patients with ibd have an in creased risk of crc following the in flammati on'dysplasia'carcinoma model in cluding dysplasia and crc as primary conse'quences of chronic in flammati on however there are currently still no defined molecular biomarkers or existing monitoring protocols for detecting the occurrence of a malignant tumor except for frequent colonoscopy examinations in the present study an acute colitis'chronic colitis'adenoma'adeno carcinoma model was successfully constructed via aomdss in ducti on using this model tlr 9 expressi on levels were discovered to be upregulated as the severity of the colorectal lesions in creased which in dicated that tlr 9 prote in expressi on levels may be continuously activated during colitis'crc development tlr 9 is a critical prote in as sociated with in nate and acquired immunity and it has been demonstrated to serve a significant role in the development of colitis and sporadic crc however the mechanism by which tlr 9 regulates the devel'opment of crc remains to be elucidatedinterestingly ihc analysis revealed that the expressi on levels of nf'\u03bab and ki 67 were simultaneously upregulated alongside tlr 9 expressi on levels notably in hibiting tlr", "in a spectrum of consequences ranging from lethal developmental abnormalities to several forms of aggressive cancer nusse and clevers most prominently colorectal cancer crc is in itiated by genetic mutations that constitutively activate wnt signaling kahn secreted wnt ligands trigger an in tracellular biochemical cascade in the receiving cells that culminates in the calibrated expressi on of target genes mosimann this transcriptionalresponse is or chestrated by nuclear bcaten in that acts as a \u02dcscaffold\u2122 to buttress a host of cofactors to cisregulatory elements occupied by the tcflef transcripti on factors valenta among the cofactors the two paralogs bcl 9 and bcl 9 l referred to as bcl 99 l and pygo 12 proteins reside with in the wntbcaten in transcriptional complex and their concerted acti on isrequired to efficiently activate wnttarget gene expressi on kramps parker for correspondencekonradbaslerimlsuzhch kbandreasmoorbsseethzchaemclaudiocantuliuse cc these authors contributedequally to this workpresent address \u00a1divisi on of molecular pathology the netherlands cancer in stituteamsterdam netherlandscompeting in terests the authors declare that nocompeting in terests exist", "Crowley method The CIs of month and year survival probabilities were calculated based on the Greenwood\u2122s for mula HRs and CIs were estimated by Cox regressi on We did subgroup analyses divided by prespecified baseline patient and disease characteristic variables in cluding RAS status for DCR PFS and OS We also did a prespecified exploratory analysis of potential predictive biomarkers in blood samples We did all analyses with SAS V 94 Patient characteristics Between October and January patients with unresectable metastatic colorectal cancer were enrolled All patients were eligible and received the study medicati on Table summarises the baseline characteristics of all enrolled patients The median number of previous lines of palliative chemo therapy was range \" and patients had received or \u2030\u00a5 prior lines of chemo therapy for metastatic disease respectively The data cut off date was January with median follow up of months IQR \"efficacy The centrally as sessed DCR was CI to one sided p 00001 two patients had a partial response and had a stable disease in cluding unconfirmed PR table figure A total of patients had a reducti on in target lesi on size from baseline figure Time on treatment for all patients is \u2030\u00a5 \u2030\u00a5 Male Female months \u2030\u00a5 months Right sided colon Left sided colorectum Lung Liver Lymph node Per itoneum Age years Sex ECOG per formance status Primary site Number of metastatic site Metastatic an Time from start of first line chemo therapy Number of previous palliative chemo therapy Previous chemo therapy and reas on for discontinuati on Fluoropyrimidine Refractory In tolerant Oxaliplat in Irinotecan TAS 102 trifluridinetipiracil Angiogenesis in hibit or Anti EGFR in hibit or Refractory In tolerant Refractory In tolerant Refractory Refractory In tolerant Refractory In tolerant Iwasa a 0 S et a 0 al ESMO 20205 e 000776 101136 esmo 2020000776 0 c access Table Best response to treatment Complete response Partial response Stable disease Progressive disease Not", "s derived from a 549 ddp cells p 005 p 001 chl 1 close homolog of l 1 ddp cisplat in ptx paclitaxel the present study examined the differentially expressed genes in nsclc ddp'resistant cells in a geo dataset chl 1 was demonstrated to be upregulated in ddp'resistant cells compared with parental cells suggesting that chl 1 may be in volved in nsclc chemo therapy resistance similarly a study that compared and analyzed the differentially expressed genes in chemosensitive tumors and chemoresistant ovarian adenocarcinom as tissues reported that the expressi on of chl 1 in chemo therapy'sensitive tumor tissues is higher compared with that in drug'resistant tissues suggesting that chl 1 may help to predict the efficacy of chemo therapy for ovarian cancer in additi on aberrant methylati on of chl 1 may be as sociated with the recurrence of colorectal cancer crc following chemo therapy 'azadc treatment restores 'fluro'uracil sensitivity in vitro which also suggests that chl 1 may be in volved in crc chemo therapy resistance the", "AZD 6244 had minimal effects on the p 38 c-Jun-NH 2-kinase PI 3 K and MEK 5/ERK 5 pathways and is currently in phase II clinical trial in KRAS-mutant NSCLC. In vivo AZD 6244 could in hibit the tumor growth in HT-29 xenograft model which is a colorectal tumor model carrying a BRAF mutati on at a dose of 100 mg/kg and the tumor growth in hibiti on of AZD 6244 is better than gemcitabine. However the in hibiti on of MEK signaling alone may not be sufficient in patients with gefitinib-resistant NSCLC and negative feedback mechanisms in PI 3 K pathway may be problematic when it is used alone. By contrast combined blockade of both pathways was able to over come the reciprocal pathway activati on in duced by in hibit or-mediated release of negative feedback loops and resulted in a significant tumor growth in hibiti on. Thus coinhibiti on of both pathways has shown use in reducing tumor growth in a variety of xenograft models and clinical trials of such combinations are under way in adults. BEZ 235 is an or ally available dual in hibit or of PI 3 K and m TOR that is being evaluated in phase I/II trials. With the aim of developing effective the rapeutic strategy for treatment gefitinib-resistant NSCLCs we have in itially evaluated the antitum or activity of AZD 6244 alone or combinati on with BEZ 235 in a panel of three human NSCLC cell lines which were selected according to their different mutati on status for EGFR-T 790 M MET and KRAS/PIK 3 CA genes. We hypothesized that targeting the MEK pathway in combinati on with selective in hibitors of PI 3 K/m TOR signaling could over come gefitinib-resistant NSCLC and enhance the antitum or efficacy.", "pathway aberrations of which isfig the putative relationship between obesity and colorectal cancer evoluti on pathways by cellular ctnnb 1 status based on the data by the current study our study suggests that there is no as sociati on between obesity and ctnnb 1 expressi on 0 cshokrani bmc gastroenterology page of important in the evoluti on of most sporadic crc in summary there is positive nuclear staining in crcs which was as sociated with the positive status for nuclear ctnnb 1 in tensity adjusted or 95 ci \" p for positive nuclear staining compared to noncrc samples normal or advanced adenoma this shows that advanced adenom as and crcswere as sociated with activati on of caten in in physically fit over weight and obese patients fig advanced adenoma and crc were as sociated with activati on of caten in in physically fit over weight and obese patients thus participati on of obesity and wntpathway seem to be in dependent crc factors in africanamerican patientsinflammationdriven activati on ofwnt signaling as a potential pathway linking obesity tothe development of crc needs to be in vestigated further in the african american populati on this might provideinsights into the identificati on of new the rapeutic targets to reduce the burden of obesityassociated crcabbreviationscrc colorectal cancer wat white adipose tissue aa african americans", "14 was as sociated with a significantly worse survival rate this study showedthat the expressi on of nop 14 was upregulated incrc but its role in pathogenesis requires further research and confirmation the mrps 23 gene which is responsible for encodinga 28 s subunit prote in has been found to be over expressed in breast cancer uterine cervical cancer hcc colorectal cancer and uterine leiomyoma as revealed by gao in hibitingmrps 23 could lead to a significant reducti on in breast cancer metastasis by in hibiting the emt phenotype pu found that high mrps 23 levels can predict poorclinical outcomes in hcc although the expression of mrps 23 is in creased in crc its specific pathogenesisremains unclearmak 16 encodes a ribosomal prote in and plays an important role in ribosome biogenesis throughout the cellcycle in this study it was found that mutations inmak 16 can in duce cell cycle arrest at g 1 phase during which the cell synthesizes mrna and proteins in preparati on for cell divisi on at present there is still nostudy of the role of mak 16 in the pathogenesis of tumours which requires further research to confirm in this paper a", "it is speculated that the high metastatic potential of lovo cells may be as sociated with the expressi on ofmir 200 c in the csc subpopulationwe further in vestigated the role of mir 200 c in regulating crc cell behavi or in particular proliferati on and apoptosis lovo and ht 29 cells were treated with mir 200 c mimics mir 200 cmim or in hibitors mir 200 cinh the transfecti on efficiency was excellent in lovocells where in mir 200 cmim and mir 200 cinh significantly upregulated and downregulated the expression of mir 200 c respectively however in ht 29 cells the inhibit or demonstrated high efficiency where as the efficiency of the mimic was suboptimal after mimic or in hibit or treatment crc apoptosis and cell proliferati on were examined using flow cytometry and mttassay respectively in terms of apoptosis mir 200 cinhinduced an in crease in the per centage of apoptotic lovo and ht 29 cells corresponding flow cytometric analysis of cell cycle progressi on is demonstrated in figure s 3 in additi on in both lovo and ht 29 figure 2 g cells proliferati on was enhanced by mir 200 cmim but suppressed by mir 200 cinh to gether with the previous these findings suggest that mir 200 c confers crc cells with metastatic traits by promoting cellproliferati on and in hibiting apoptosis subsequently weinvestigated whether mir 200 c over expressi on and in terference exert similar effects in colorectal cscs as the ydid in crc cells lovocscs and ht 29 cscs were transfected with mir 200 cmimics or in hibitors and the transfecti on efficiency was validated similar tothe crc cells flow cytometric analysis showed a markedincrease in apoptosis in both types of cscs transfected withmir 200 cinh corresponding flow cytometric analysis of cell cycle progressi on in transfected cscsis demonstrated in figure s 4 this was supported by themtt assay which revealed that the proliferati on of bothtypes of cscs was enhanced by mir 200 cmim but in hibited by mir 200 cinh over a period of h figures 3"], "answer": "Insufficient evidence in provided documents."}
{"question": "Are there strategies described to overcome 5-FU resistance in colon cancer?", "contexts": ["in this prospective single arm multi center in terventi on study patients with resectable microsatellite stablect 3\"4 nxm 0 colon cancer will be treated with two courses of neoadjuvant and two courses of adjuvant capecitabine and oxaliplat in the primary endpoint is the pathological tumor response to neoadjuvant chemo therapy per cms secondaryendpoints are radiological tumor response the prognostic value of these responses for recurrence free survival and overall survival and the differences in cms classificati on of the same tumor before and after neoadjuvant chemo therapy the study is scheduled to be per formed in \" dutch hospitals the first patient was in cluded in february necessary to proceed to future studies in which neo adjuvant chemo therapy may be with hold in patients with a specific cms subtype who show no benefit from chemo therapy and for whom possible new treatments can be in vestigatedtrial registrati on this study has been registered in the netherlands trial register nl 8177 at \" wwwtrialregisternltrial 8177 the study has been approved by the medical ethics committee utrecht mec 18712 keywords colon cancer consensus molecular subtypes neoadjuvant chemo therapy surgery colon cancer is one of the most comm on types of cancer in the netherlands with an in cidence of around patients in approximately of patients present with local disease stage iiii curativesurgery followed by adjuvant systemic chemo therapy isstandard of care in patients with microsatellite stablemss high risk stage ii and stage iii colon cancer despite this in tensive treatment \" of the patients develop metastatic disease these patients do not benefitenough from the current adjuvant systemic the rapymoreover it is estimated that will not develop metastases after surgery alone and are the refore over treated with adjuvant chemo therapy identifying the patients at risk of developing metastases as well as thoseresponding to the rapy is a clear unmet need in colon cancer care the developme", "5 fu in colon cancer cells via the pi 3 kakt pathwaycorrespondence to dr xiangbo chen endoscopy center the quanzhou first hospital affiliated to fujian medical university east street licheng quanzhou fujian pr chinaemail coloboyeahnetkey words ginsenoside rg 3 colon cancer 5 fluorouracil pi 3 kakt colon cancer is a comm on malignant tumor of the digestive tract located in the colon which mainly occurs at the juncti on of the rectum and the sigmoid colon statistics show that the highest in cidence of colon cancer is in the age group of years the ratio of male to female is and the in cidence of colon cancer ranks third among all cases of gastrointestinal tumors the 5 year survival rate of patients with colon cancer is approximately yet the 5 year survival rate of patients with advanced stage disease is as low as since the early symptoms of patients with colon cancer are not obvious only about of patients can be diagnosed at the early stage of the disease chemo therapy is one of the most important treatments for patients with advanced colon cancer of which 'fluorouracil 'fu is the most widely used 5 fu in hibits the proliferati on in vasi on and migrati on of tumor cells by in terfering with the nucleic acid metabolism of tumor cells but it is also toxic to normal cells causing serious adverse reactions even endangering the life safety of patients severely limiting its clinical applicati on previous research has shown that 5 fu combined with other agents may reduce the required dosage of 5 fu consequently reducing the adverse reactions caused by 5 fu without affecting or even improving the efficacy of chemo therapy compared with chemical drugs and biopharmaceuticals multicomponent multitarget and less adverse reactions are unique advantages of traditional chinese medicine for the treatment of diseases in patients with colon cancer chinese medicine can improve patient immunity reduce the side effects of radio therapy and chemo therapy or enhance drug sensitivity in hibi", "clinicopathological characteristics of patients with colorectal carcinoma characteristic sex male female age years \u2030\u00a5 site of lesi on colon rectum differentiati on poor well tumor size cm \u2030\u00a5 pathological type adeno carcinoma others lymph node metastasis no yes liver metastasis no yes stage iii iiiiv cea normal high ca ' normal high ca ' normal high afisher's exact test all others were as sessed using a \u03c72 test defb 4 a defens in 4 a'''''''''''''''''''''''''''''''''''''''''''''''''''''high n low n 0009 a 0003 a 0575 a 0039 a poor survival furthermore defb 4 a expressi on was upregu'lated in patients with crc with advanced and metastatic cancer patients with crc with high defb 4 a expressi on had poor survival in additi on knockdown of defb 4 a affected the migrati on ability of crc cells tcga data of patients with crc were used to identify the degs between the long os days and short os days groups in additi on mrna expressi on was compared between tumor tissues and normal tissues in the same database defb 4 a was highly expressed in tumors and as sociated with a poor prognosis defb 4 a upregulati on was as sociated with poor prognosis and defb 4 a expressi on was significantly upregulated in patients with large tumors advanced cancer stage lymph node metastasis and liver metastasis another study used the gene expressi on omnibus database to screen genes that are in creased in patients with recurrence hierarchical clustering and pathway analyses revealed that thrombospond in thbs 2 and cart", "gment resecti on of a right hemicolectomy and sigmoid colectomy with no intra or postoperative adverseevents in our patient we tried preserving as much colon as possible considering the patient\u2122s quality of life after surgery in additi on to per forming sufficient d 3 dissecti on of course the meaning of preserving colon in terms of patientpostoperative quality of life needs to be more clearly as sessed in futurewe encountered a rare case of advanced quadruple scrcsf or which we achieved a curative resecti on that required twoanastomoses through a laparoscopic approach we suggest thatlaparoscopic surgery that requires multiple anastomoses for advanced scrcs can be a safe procedure even if the number of colorectal cancers is multiplefigure abdominal ct scan revealing a tumor of the as cending colon aarrowhead a tumor in the descending colon b arrowhead and two tumors in the sigmoid colon are also visible c d arrowheadadvanced cancer arising from the as cending descending andthe sigmoid colon it was reported that scrcs often occur inthe same or adjacent segment of the large in testine and thatother smaller colorectal cancers in the patients with scrcs wereusually smaller and of lower pathological grade and t staging", "Crowley method The CIs of month and year survival probabilities were calculated based on the Greenwood\u2122s for mula HRs and CIs were estimated by Cox regressi on We did subgroup analyses divided by prespecified baseline patient and disease characteristic variables in cluding RAS status for DCR PFS and OS We also did a prespecified exploratory analysis of potential predictive biomarkers in blood samples We did all analyses with SAS V 94 Patient characteristics Between October and January patients with unresectable metastatic colorectal cancer were enrolled All patients were eligible and received the study medicati on Table summarises the baseline characteristics of all enrolled patients The median number of previous lines of palliative chemo therapy was range \" and patients had received or \u2030\u00a5 prior lines of chemo therapy for metastatic disease respectively The data cut off date was January with median follow up of months IQR \"efficacy The centrally as sessed DCR was CI to one sided p 00001 two patients had a partial response and had a stable disease in cluding unconfirmed PR table figure A total of patients had a reducti on in target lesi on size from baseline figure Time on treatment for all patients is \u2030\u00a5 \u2030\u00a5 Male Female months \u2030\u00a5 months Right sided colon Left sided colorectum Lung Liver Lymph node Per itoneum Age years Sex ECOG per formance status Primary site Number of metastatic site Metastatic an Time from start of first line chemo therapy Number of previous palliative chemo therapy Previous chemo therapy and reas on for discontinuati on Fluoropyrimidine Refractory In tolerant Oxaliplat in Irinotecan TAS 102 trifluridinetipiracil Angiogenesis in hibit or Anti EGFR in hibit or Refractory In tolerant Refractory In tolerant Refractory Refractory In tolerant Refractory In tolerant Iwasa a 0 S et a 0 al ESMO 20205 e 000776 101136 esmo 2020000776 0 c access Table Best response to treatment Complete response Partial response Stable disease Progressive disease Not", "use locati on of cancer in the colon proximal colondistal colonrectumunspecifiedstage at diagnosis stage istage iistage iiimedian survival time yearsmedian survival time by staged years stage istage iistage iiiweight change categoriesd stable weight \u02c6' to kggained more than kglost more than kg avalues are means sd for continuous variables and per centages for categorical variables and are standardized to the age distributi on of the study populationbedih scores were adjusted for total energy in takecmetabolic equivalents from recreational and leisuretime activitiesdvalue is not age adjustedafter diagnosis quintile tended to have higher bodyweight and lower physical activity for example the average bmi among those classified in quintile was kgm 2 and the average physical activity was methourweek compared with kgm 2 and methourweek among those in quintile also patients consuming the most hyperinsulinemic dietarypatterns were less likely to have stage i disease and the yexperienced shorter survival times table patients consuming low in sulinemic dietary patternshad higher in takes of wholegrains nuts vegetables wholefruits and coffee and lower in takes of refined grainscream soup eggs french fries butter margarine sugarsweetened beverages red meat and processed meat in 0 ctabung bmc cancer page of table median 5 th 95 th per centile food and nutrient in take profiles of colorectal cancer patients by quintiles of postdiagnosisempirical dietary index for hyperinsulinemia edih scoretotal populati on n quintiles of the empirical dietary index for hyperinsulinemia edih scoreabquintile n quintile n quint", "X E Flow cytometry analysis was per formed to as sess apoptosis in resistant A 549 cells transfected with CHL 1 expressi on plasmids in the presence or absence of \u00b5gml DDP or ngml PTX CHL 1 over expressi on enhanced chemosensitivity of A 549 DDP cells to DDP in vivo which was demonstrated by the effect of DDP treatment or CHL 1 over expressi on on the F growth and G weight of xenografts derived from A 549 DDP cells P 005 P 001 CHL 1 close homolog of L 1 DDP cisplat in PTX paclitaxel The present study examined the differentially expressed genes in NSCLC DDP'resistant cells in a GEO dataset CHL 1 was demonstrated to be upregulated in DDP'resistant cells compared with parental cells suggesting that CHL 1 may be in volved in NSCLC chemo therapy resistance Similarly a study that compared and analyzed the differentially expressed genes in chemosensitive tumors and chemoresistant ovarian adenocarcinom as tissues reported that the expressi on of CHL 1 in chemo therapy'sensitive tumor tissues is higher compared with that in drug'resistant tissues suggesting that CHL 1 may help to predict the efficacy of chemo therapy for ovarian cancer In additi on aberrant methylati on of CHL 1 may be as sociated with the recurrence of colorectal cancer CRC following chemo therapy 'azad C treatment restores 'fluro'uracil sensitivity in vitro which also suggests that CHL 1 may be in volved in CRC chemo therapy resistance The", "s derived from a 549 ddp cells p 005 p 001 chl 1 close homolog of l 1 ddp cisplat in ptx paclitaxel the present study examined the differentially expressed genes in nsclc ddp'resistant cells in a geo dataset chl 1 was demonstrated to be upregulated in ddp'resistant cells compared with parental cells suggesting that chl 1 may be in volved in nsclc chemo therapy resistance similarly a study that compared and analyzed the differentially expressed genes in chemosensitive tumors and chemoresistant ovarian adenocarcinom as tissues reported that the expressi on of chl 1 in chemo therapy'sensitive tumor tissues is higher compared with that in drug'resistant tissues suggesting that chl 1 may help to predict the efficacy of chemo therapy for ovarian cancer in additi on aberrant methylati on of chl 1 may be as sociated with the recurrence of colorectal cancer crc following chemo therapy 'azadc treatment restores 'fluro'uracil sensitivity in vitro which also suggests that chl 1 may be in volved in crc chemo therapy resistance the", "of this study revealedth at curcum in in creased the effectiveness of the treatment plan for colorectal cancer in the patients received with curcum in important in bayetrobert conducted a study consists of fourteen patients with advanced breast cancer who werebeing treated with docetaxel chemo therapy and simultaneously received curcum in at different doses up to amaximum dose of g per day for days per each treatment cycle finally patients participated in this studywere able to complete this treatment plan nutropenia and leukopenia were the mosttoxicitiescaused by docetaxel administrati on after days two patients refused to continue treatment because they received curcumintreatment continued by reducing the dosage to a maximum of g per day nine patients were screened for tumor response six weeks after completing the course of treatment patients partially responded well butthree patients still suffered from the disease in thisstudy the ca tumor marker did not decrease butthe cea tumor marker decreased compared to the in itial value prior to the treatment in patients the vegfvascular endothelial growth fact or as a tomur markerwhichandcurcum in capsules howeverindicatestumrowth metastasismalignancy was reduced by compared to the baseline before treatment in the effect of curcum in on reducing the sideeffects of radio therapy and chemo therapy in patients with ovarian lung colon liver kidney and stomach cancers was in vestigated eighty patients received mg of curcum in simultaneously with radio therapy the durati on of this study was days the in cidence of side effects such as nausea diarrhea constipati on and weightloss decreased in patients who treated with both radio therapy and curcum in in the patients who are simultaneously under radio therapy and received curcum in the prevalence of side effects such as skin lesions mouth and thro at ulcers swallowing problems nausea vomitingfatigue weakness and comm on medications required for treating side effects were statist", "it is speculated that the high metastatic potential of lovo cells may be as sociated with the expressi on ofmir 200 c in the csc subpopulationwe further in vestigated the role of mir 200 c in regulating crc cell behavi or in particular proliferati on and apoptosis lovo and ht 29 cells were treated with mir 200 c mimics mir 200 cmim or in hibitors mir 200 cinh the transfecti on efficiency was excellent in lovocells where in mir 200 cmim and mir 200 cinh significantly upregulated and downregulated the expression of mir 200 c respectively however in ht 29 cells the inhibit or demonstrated high efficiency where as the efficiency of the mimic was suboptimal after mimic or in hibit or treatment crc apoptosis and cell proliferati on were examined using flow cytometry and mttassay respectively in terms of apoptosis mir 200 cinhinduced an in crease in the per centage of apoptotic lovo and ht 29 cells corresponding flow cytometric analysis of cell cycle progressi on is demonstrated in figure s 3 in additi on in both lovo and ht 29 figure 2 g cells proliferati on was enhanced by mir 200 cmim but suppressed by mir 200 cinh to gether with the previous these findings suggest that mir 200 c confers crc cells with metastatic traits by promoting cellproliferati on and in hibiting apoptosis subsequently weinvestigated whether mir 200 c over expressi on and in terference exert similar effects in colorectal cscs as the ydid in crc cells lovocscs and ht 29 cscs were transfected with mir 200 cmimics or in hibitors and the transfecti on efficiency was validated similar tothe crc cells flow cytometric analysis showed a markedincrease in apoptosis in both types of cscs transfected withmir 200 cinh corresponding flow cytometric analysis of cell cycle progressi on in transfected cscsis demonstrated in figure s 4 this was supported by themtt assay which revealed that the proliferati on of bothtypes of cscs was enhanced by mir 200 cmim but in hibited by mir 200 cinh over a period of h figures 3"], "answer": "Yes, there are strategies described to overcome 5-FU resistance in colon cancer. One approach involves combining 5-FU with other agents to reduce the required dosage of 5-FU, thereby minimizing adverse reactions while maintaining or improving chemotherapy efficacy. Additionally, the expression of CHL1 has been linked to chemotherapy resistance, and treatments that restore 5-FU sensitivity, such as azad C, have been suggested to be effective in overcoming resistance in colorectal cancer."}
{"question": "How does the PI3K/AKT pathway contribute to colorectal cancer progression?", "contexts": ["5 fu in colon cancer cells via the pi 3 kakt pathwaycorrespondence to dr xiangbo chen endoscopy center the quanzhou first hospital affiliated to fujian medical university east street licheng quanzhou fujian pr chinaemail coloboyeahnetkey words ginsenoside rg 3 colon cancer 5 fluorouracil pi 3 kakt colon cancer is a comm on malignant tumor of the digestive tract located in the colon which mainly occurs at the juncti on of the rectum and the sigmoid colon statistics show that the highest in cidence of colon cancer is in the age group of years the ratio of male to female is and the in cidence of colon cancer ranks third among all cases of gastrointestinal tumors the 5 year survival rate of patients with colon cancer is approximately yet the 5 year survival rate of patients with advanced stage disease is as low as since the early symptoms of patients with colon cancer are not obvious only about of patients can be diagnosed at the early stage of the disease chemo therapy is one of the most important treatments for patients with advanced colon cancer of which 'fluorouracil 'fu is the most widely used 5 fu in hibits the proliferati on in vasi on and migrati on of tumor cells by in terfering with the nucleic acid metabolism of tumor cells but it is also toxic to normal cells causing serious adverse reactions even endangering the life safety of patients severely limiting its clinical applicati on previous research has shown that 5 fu combined with other agents may reduce the required dosage of 5 fu consequently reducing the adverse reactions caused by 5 fu without affecting or even improving the efficacy of chemo therapy compared with chemical drugs and biopharmaceuticals multicomponent multitarget and less adverse reactions are unique advantages of traditional chinese medicine for the treatment of diseases in patients with colon cancer chinese medicine can improve patient immunity reduce the side effects of radio therapy and chemo therapy or enhance drug sensitivity in hibi", "clinicopathological characteristics of patients with colorectal carcinoma characteristic sex male female age years \u2030\u00a5 site of lesi on colon rectum differentiati on poor well tumor size cm \u2030\u00a5 pathological type adeno carcinoma others lymph node metastasis no yes liver metastasis no yes stage iii iiiiv cea normal high ca ' normal high ca ' normal high afisher's exact test all others were as sessed using a \u03c72 test defb 4 a defens in 4 a'''''''''''''''''''''''''''''''''''''''''''''''''''''high n low n 0009 a 0003 a 0575 a 0039 a poor survival furthermore defb 4 a expressi on was upregu'lated in patients with crc with advanced and metastatic cancer patients with crc with high defb 4 a expressi on had poor survival in additi on knockdown of defb 4 a affected the migrati on ability of crc cells tcga data of patients with crc were used to identify the degs between the long os days and short os days groups in additi on mrna expressi on was compared between tumor tissues and normal tissues in the same database defb 4 a was highly expressed in tumors and as sociated with a poor prognosis defb 4 a upregulati on was as sociated with poor prognosis and defb 4 a expressi on was significantly upregulated in patients with large tumors advanced cancer stage lymph node metastasis and liver metastasis another study used the gene expressi on omnibus database to screen genes that are in creased in patients with recurrence hierarchical clustering and pathway analyses revealed that thrombospond in thbs 2 and cart", "pathway aberrations of which isfig the putative relationship between obesity and colorectal cancer evoluti on pathways by cellular ctnnb 1 status based on the data by the current study our study suggests that there is no as sociati on between obesity and ctnnb 1 expressi on 0 cshokrani bmc gastroenterology page of important in the evoluti on of most sporadic crc in summary there is positive nuclear staining in crcs which was as sociated with the positive status for nuclear ctnnb 1 in tensity adjusted or 95 ci \" p for positive nuclear staining compared to noncrc samples normal or advanced adenoma this shows that advanced adenom as and crcswere as sociated with activati on of caten in in physically fit over weight and obese patients fig advanced adenoma and crc were as sociated with activati on of caten in in physically fit over weight and obese patients thus participati on of obesity and wntpathway seem to be in dependent crc factors in africanamerican patientsinflammationdriven activati on ofwnt signaling as a potential pathway linking obesity tothe development of crc needs to be in vestigated further in the african american populati on this might provideinsights into the identificati on of new the rapeutic targets to reduce the burden of obesityassociated crcabbreviationscrc colorectal cancer wat white adipose tissue aa african americans", "the number of patients with colorectal cancer crc world'wide is in creasing annually with an in cidence rate of in chronic in flammati on is the leading cause of immune cell in filtrati on and proliferati on and it has been suggested to be a high'risk fact or for colitis'as sociated crc cac in flammatory bowel disease ibd which encompasses both ulcerative colitis uc and crohn's disease was established as an important precurs or to crc for example the in cidence of ibd'as sociated crc in patients with uc was reported to have a cumulative risk rate of at years at years and at years of disease durati on the refore further in vivo studies are required for researchers to gain an improved under standing of the molecular mechanisms of cac which may provide more exact molecular targets for the diagnosis and treatment of cac during the early stages toll'like recept or tlr 9 a member of the tlr family is located in the cytoplasm and in tracellular endosomes and can be activated by unmethylated bacterial cpg dna the activati on of the tlr 9 signaling pathway in duces a type t helper cell immune response and stimulates the proliferati on of b cells thus protecting the host from external microbial in vasi on ' multiple studies have revealed that abnormal tlr 9 expressi on levels were in volved in the pathogenesis and progressi on of uc in additi on abnormal expressi on levels of tlr 9 were also identified during the tumorigenesis and development of crc 'nf'\u03bab is an important transcripti on fact or in volved in various biological processes in cluding in flammatory reac'tions immune responses apoptosis and proliferati on in fact nf'\u03bab is regarded as a molecular hub that links in flam'mati on and cancer it was previously suggested that nf'\u03bab may serve", "1. Heterogeneity of cancer-as sociated stroma according to examined tumor locations The clinicopathological characteristics of the advanced CRC patients are described in. The CRC patients with synchronous metastases had aggressive features in cluding larger tumor size more advanced p T and p N stage and the presence of per ineural and venous in vasi on than the patients with metachronous metastasis (p<0.05)..0091811. t 001 Clinicopathologic characteristics of advanced colorectal cancers. The clinicopathological characteristics of the advanced CRC patients are described in. The CRC patients with synchronous metastases had aggressive features in cluding larger tumor size more advanced p T and p N stage and the presence of per ineural and venous in vasi on than the patients with metachronous metastasis (p<0.05)..0091811. t 001 Clinicopathologic characteristics of advanced colorectal cancers. Parameters Total Metachronous Synchronous P value (n?=?181) (n?=?57) (n?=?124) Age (median range) 60.00 (28\"93) 62.00 (36\"79) 60.00 (28\"93) 0.241 Sex 0.007 Male 97 39 (68.4%) 58 (46.8%) Female 84 18 (31.6%) 66 (53.2%) Locati on 0.055 Right colon 37 6 (10.5%) 31 (25.0%) Left colon 75 29 (50.9%) 46 (37.1%) Rectum 69 22 (38.6%) 47 (37.9%) Size of primary tumor 5.30 (2.0\"13.0) 4.20 (2\"9) 5.50 (2.5\"13) <0.001 Histologic grade 0.227 Low grade 157 52 (91.2%) 105 (84.7%) High grade 24 5 (8.8%) 19 (15.3%) T stage <0.001 T 1 0 0 0 T 2 5 3 (5.3%) 2 (1.6%) T 3 107 45 (78.9%) 62 (50.0%) T 4 69 9 (15.8%) 60 (48.4%) N stage <0.001", "in this prospective single arm multi center in terventi on study patients with resectable microsatellite stablect 3\"4 nxm 0 colon cancer will be treated with two courses of neoadjuvant and two courses of adjuvant capecitabine and oxaliplat in the primary endpoint is the pathological tumor response to neoadjuvant chemo therapy per cms secondaryendpoints are radiological tumor response the prognostic value of these responses for recurrence free survival and overall survival and the differences in cms classificati on of the same tumor before and after neoadjuvant chemo therapy the study is scheduled to be per formed in \" dutch hospitals the first patient was in cluded in february necessary to proceed to future studies in which neo adjuvant chemo therapy may be with hold in patients with a specific cms subtype who show no benefit from chemo therapy and for whom possible new treatments can be in vestigatedtrial registrati on this study has been registered in the netherlands trial register nl 8177 at \" wwwtrialregisternltrial 8177 the study has been approved by the medical ethics committee utrecht mec 18712 keywords colon cancer consensus molecular subtypes neoadjuvant chemo therapy surgery colon cancer is one of the most comm on types of cancer in the netherlands with an in cidence of around patients in approximately of patients present with local disease stage iiii curativesurgery followed by adjuvant systemic chemo therapy isstandard of care in patients with microsatellite stablemss high risk stage ii and stage iii colon cancer despite this in tensive treatment \" of the patients develop metastatic disease these patients do not benefitenough from the current adjuvant systemic the rapymoreover it is estimated that will not develop metastases after surgery alone and are the refore over treated with adjuvant chemo therapy identifying the patients at risk of developing metastases as well as thoseresponding to the rapy is a clear unmet need in colon cancer care the developme", "in a spectrum of consequences ranging from lethal developmental abnormalities to several forms of aggressive cancer nusse and clevers most prominently colorectal cancer crc is in itiated by genetic mutations that constitutively activate wnt signaling kahn secreted wnt ligands trigger an in tracellular biochemical cascade in the receiving cells that culminates in the calibrated expressi on of target genes mosimann this transcriptionalresponse is or chestrated by nuclear bcaten in that acts as a \u02dcscaffold\u2122 to buttress a host of cofactors to cisregulatory elements occupied by the tcflef transcripti on factors valenta among the cofactors the two paralogs bcl 9 and bcl 9 l referred to as bcl 99 l and pygo 12 proteins reside with in the wntbcaten in transcriptional complex and their concerted acti on isrequired to efficiently activate wnttarget gene expressi on kramps parker for correspondencekonradbaslerimlsuzhch kbandreasmoorbsseethzchaemclaudiocantuliuse cc these authors contributedequally to this workpresent address \u00a1divisi on of molecular pathology the netherlands cancer in stituteamsterdam netherlandscompeting in terests the authors declare that nocompeting in terests exist", "3 kaktmtorsignaling pathway in crc cells the same cocultures wereperformed and the expressi on of phosphorylated pi 3 kakt and mtor was detected relative to the respectivetotal prote in content similar to stemness maintenancepi 3 kaktmt or activati on was promoted in crc cells 0 c of tang f i g u r e isolati on and characterizati on of cscderived evs as a carrier of mir 200 c a expressi on of exosomal markers cd 63 cd 81 and tsg 101 was detected in lovocscs evs isolated from lovocscs and cell lysates after isolati on b expressi on of exosomal markers cd 63 cd 81 and tsg 101 was detected in ht 29 cscs evs isolated from ht 29 cscs and cell lysates after isolati on in both cases the lysates of the cscs showed negligible expressi on of these markers compared to that in cscs and cscderived evs c transmissi on electr on microscopy ofevs derived from lovocscs scale bar nm d comparis on of the relative basal expressi on of mir 200 c in evs derived from nontransfected lovocscs and ht 29 cscs lovocscsevs expressed higher levels of mir 200 c than did ht 29 cscsevs e expressi on of mir 200 cin evs derived from lovocscs or ht 29 cscs that were first transfected with mir 200 c mimics mir 200 cmim or in hibitors mir 200 cinhevs derived from nontransfected cscs are denoted as control mir 200 cmim and mir 200 cinh respectively", "use locati on of cancer in the colon proximal colondistal colonrectumunspecifiedstage at diagnosis stage istage iistage iiimedian survival time yearsmedian survival time by staged years stage istage iistage iiiweight change categoriesd stable weight \u02c6' to kggained more than kglost more than kg avalues are means sd for continuous variables and per centages for categorical variables and are standardized to the age distributi on of the study populationbedih scores were adjusted for total energy in takecmetabolic equivalents from recreational and leisuretime activitiesdvalue is not age adjustedafter diagnosis quintile tended to have higher bodyweight and lower physical activity for example the average bmi among those classified in quintile was kgm 2 and the average physical activity was methourweek compared with kgm 2 and methourweek among those in quintile also patients consuming the most hyperinsulinemic dietarypatterns were less likely to have stage i disease and the yexperienced shorter survival times table patients consuming low in sulinemic dietary patternshad higher in takes of wholegrains nuts vegetables wholefruits and coffee and lower in takes of refined grainscream soup eggs french fries butter margarine sugarsweetened beverages red meat and processed meat in 0 ctabung bmc cancer page of table median 5 th 95 th per centile food and nutrient in take profiles of colorectal cancer patients by quintiles of postdiagnosisempirical dietary index for hyperinsulinemia edih scoretotal populati on n quintiles of the empirical dietary index for hyperinsulinemia edih scoreabquintile n quintile n quint", "colorectal cancer crc is the third most comm on cancer type and the second leading cause of cancer death worldwide deaths usually result from recurrent and metastatic disease mostinternational guidelines recommend chemo therapy to reduce the risk of recurrence in stage iii tumors and to prolongsurvival in stage iv cancers conversely chemo therapy isgenerally not used in stage i and most stage ii tumors howeversome patients with low risk stage iii disease may respond wellfollowing courses of chemo therapy that are shorter than the 6 month standard schedule although the definiti on of \u0153lowrisk\u009d has not been well established in this scenario additionally almost of patients who have stage ii tumors and who are the refore considered to have low risk diseaserelapse and eventually die from cancer progressi on the reis currently no accurate biomarker to better define prognosiswith in stage groups the refore biomarkers for prognosticstratificati on in crc have the potential of improving the treatment decisionmaking process we hypothesized thatstudying molecular mechanisms that are known to be in volved in crc development might yield promising novel biomarkersf or this diseasethese modelsformati on mirroring cancer developmentadenomatous polyposis coli apc in activating mutationsare the earliest and most comm on genetic alterations in the adenoma carcinoma sequence thatleads to crc suchmutations result in the accumulati on of caten in with in cells and activati on ofthe wnt signaling pathway animalmodels of apc in activati on demonstrate epithelial transformation and tumor\"the ahcreapcflfl mouse one ofan animal bearing loxpflanked apc alleles and a crerecombinase transgene when this animalis exposed"], "answer": "The PI3K/AKT pathway contributes to colorectal cancer (CRC) progression by promoting cell proliferation, survival, and migration. Activation of this pathway is associated with the maintenance of cancer stemness in CRC cells, which can lead to enhanced tumor growth and resistance to therapies. Specifically, the expression of phosphorylated PI3K/AKT and mTOR was detected in CRC cells, indicating that this signaling pathway is actively involved in the tumorigenic processes of CRC. Insufficient evidence in provided documents."}
{"question": "What is the interaction between MAPK and Wnt signaling in colon cancer?", "contexts": ["over weight and obese patients bmi did not showa significantly in creased expressi on p of nuclearctnnb 1 positive in normal weight vs positive in over weightobese morikawa found that in obesepositivity wasnuclear ctnnb 1 patientsassociated with significantly better cancerspecific survival suggesting that wnt signaling acts as a switch and when it is on adipogenesis is repressed kennell demonstrated that activated frz 1 frizzled promotes caten in stabilityinhibits apoptosis and adipogenesisross also showed that wnt signaling acts as a molecular switch that controls adipogenesis upregulation of wnt signaling maintains preadipocytes in an undifferentiated state and when wnt signaling is prevented the ydifferentiate into adipocytes [ ]although in our study there was no as sociati on between nuclear in tensity and crc between normal and overweight patients p for in teracti on there is accumulating evidence to show that the state of chronicinflammati on in cited by obesity might play a role in promoting colorectal carcinogenesis [ ] of the manymarkers tnf\u03b1 is important [ ] as it activateswnt signaling through the in ducti on of gsk 3 phosphorylati on resulting in in creased nuclear localizati on of caten in in additi on to tnf\u03b1 other humoralagents as sociated with obesity might also be contributing to the activati on of wnt signaling like il 1 and adiponect in which is decreased in the obese state and is notan in flammatory cytokine that can modulate gsk 3 caten in signaling pathway although multiplemechanisms may be operating in parallel and contributing to the protumorigenic milieu wnt is a pivotaltumorigenic", "in a spectrum of consequences ranging from lethal developmental abnormalities to several forms of aggressive cancer nusse and clevers most prominently colorectal cancer crc is in itiated by genetic mutations that constitutively activate wnt signaling kahn secreted wnt ligands trigger an in tracellular biochemical cascade in the receiving cells that culminates in the calibrated expressi on of target genes mosimann this transcriptionalresponse is or chestrated by nuclear bcaten in that acts as a \u02dcscaffold\u2122 to buttress a host of cofactors to cisregulatory elements occupied by the tcflef transcripti on factors valenta among the cofactors the two paralogs bcl 9 and bcl 9 l referred to as bcl 99 l and pygo 12 proteins reside with in the wntbcaten in transcriptional complex and their concerted acti on isrequired to efficiently activate wnttarget gene expressi on kramps parker for correspondencekonradbaslerimlsuzhch kbandreasmoorbsseethzchaemclaudiocantuliuse cc these authors contributedequally to this workpresent address \u00a1divisi on of molecular pathology the netherlands cancer in stituteamsterdam netherlandscompeting in terests the authors declare that nocompeting in terests exist", "in this prospective single arm multi center in terventi on study patients with resectable microsatellite stablect 3\"4 nxm 0 colon cancer will be treated with two courses of neoadjuvant and two courses of adjuvant capecitabine and oxaliplat in the primary endpoint is the pathological tumor response to neoadjuvant chemo therapy per cms secondaryendpoints are radiological tumor response the prognostic value of these responses for recurrence free survival and overall survival and the differences in cms classificati on of the same tumor before and after neoadjuvant chemo therapy the study is scheduled to be per formed in \" dutch hospitals the first patient was in cluded in february necessary to proceed to future studies in which neo adjuvant chemo therapy may be with hold in patients with a specific cms subtype who show no benefit from chemo therapy and for whom possible new treatments can be in vestigatedtrial registrati on this study has been registered in the netherlands trial register nl 8177 at \" wwwtrialregisternltrial 8177 the study has been approved by the medical ethics committee utrecht mec 18712 keywords colon cancer consensus molecular subtypes neoadjuvant chemo therapy surgery colon cancer is one of the most comm on types of cancer in the netherlands with an in cidence of around patients in approximately of patients present with local disease stage iiii curativesurgery followed by adjuvant systemic chemo therapy isstandard of care in patients with microsatellite stablemss high risk stage ii and stage iii colon cancer despite this in tensive treatment \" of the patients develop metastatic disease these patients do not benefitenough from the current adjuvant systemic the rapymoreover it is estimated that will not develop metastases after surgery alone and are the refore over treated with adjuvant chemo therapy identifying the patients at risk of developing metastases as well as thoseresponding to the rapy is a clear unmet need in colon cancer care the developme", "colorectal cancer crc is the third most comm on cancer type and the second leading cause of cancer death worldwide deaths usually result from recurrent and metastatic disease mostinternational guidelines recommend chemo therapy to reduce the risk of recurrence in stage iii tumors and to prolongsurvival in stage iv cancers conversely chemo therapy isgenerally not used in stage i and most stage ii tumors howeversome patients with low risk stage iii disease may respond wellfollowing courses of chemo therapy that are shorter than the 6 month standard schedule although the definiti on of \u0153lowrisk\u009d has not been well established in this scenario additionally almost of patients who have stage ii tumors and who are the refore considered to have low risk diseaserelapse and eventually die from cancer progressi on the reis currently no accurate biomarker to better define prognosiswith in stage groups the refore biomarkers for prognosticstratificati on in crc have the potential of improving the treatment decisionmaking process we hypothesized thatstudying molecular mechanisms that are known to be in volved in crc development might yield promising novel biomarkersf or this diseasethese modelsformati on mirroring cancer developmentadenomatous polyposis coli apc in activating mutationsare the earliest and most comm on genetic alterations in the adenoma carcinoma sequence thatleads to crc suchmutations result in the accumulati on of caten in with in cells and activati on ofthe wnt signaling pathway animalmodels of apc in activati on demonstrate epithelial transformation and tumor\"the ahcreapcflfl mouse one ofan animal bearing loxpflanked apc alleles and a crerecombinase transgene when this animalis exposed", "clinicopathological characteristics of patients with colorectal carcinoma characteristic sex male female age years \u2030\u00a5 site of lesi on colon rectum differentiati on poor well tumor size cm \u2030\u00a5 pathological type adeno carcinoma others lymph node metastasis no yes liver metastasis no yes stage iii iiiiv cea normal high ca ' normal high ca ' normal high afisher's exact test all others were as sessed using a \u03c72 test defb 4 a defens in 4 a'''''''''''''''''''''''''''''''''''''''''''''''''''''high n low n 0009 a 0003 a 0575 a 0039 a poor survival furthermore defb 4 a expressi on was upregu'lated in patients with crc with advanced and metastatic cancer patients with crc with high defb 4 a expressi on had poor survival in additi on knockdown of defb 4 a affected the migrati on ability of crc cells tcga data of patients with crc were used to identify the degs between the long os days and short os days groups in additi on mrna expressi on was compared between tumor tissues and normal tissues in the same database defb 4 a was highly expressed in tumors and as sociated with a poor prognosis defb 4 a upregulati on was as sociated with poor prognosis and defb 4 a expressi on was significantly upregulated in patients with large tumors advanced cancer stage lymph node metastasis and liver metastasis another study used the gene expressi on omnibus database to screen genes that are in creased in patients with recurrence hierarchical clustering and pathway analyses revealed that thrombospond in thbs 2 and cart", "5 fu in colon cancer cells via the pi 3 kakt pathwaycorrespondence to dr xiangbo chen endoscopy center the quanzhou first hospital affiliated to fujian medical university east street licheng quanzhou fujian pr chinaemail coloboyeahnetkey words ginsenoside rg 3 colon cancer 5 fluorouracil pi 3 kakt colon cancer is a comm on malignant tumor of the digestive tract located in the colon which mainly occurs at the juncti on of the rectum and the sigmoid colon statistics show that the highest in cidence of colon cancer is in the age group of years the ratio of male to female is and the in cidence of colon cancer ranks third among all cases of gastrointestinal tumors the 5 year survival rate of patients with colon cancer is approximately yet the 5 year survival rate of patients with advanced stage disease is as low as since the early symptoms of patients with colon cancer are not obvious only about of patients can be diagnosed at the early stage of the disease chemo therapy is one of the most important treatments for patients with advanced colon cancer of which 'fluorouracil 'fu is the most widely used 5 fu in hibits the proliferati on in vasi on and migrati on of tumor cells by in terfering with the nucleic acid metabolism of tumor cells but it is also toxic to normal cells causing serious adverse reactions even endangering the life safety of patients severely limiting its clinical applicati on previous research has shown that 5 fu combined with other agents may reduce the required dosage of 5 fu consequently reducing the adverse reactions caused by 5 fu without affecting or even improving the efficacy of chemo therapy compared with chemical drugs and biopharmaceuticals multicomponent multitarget and less adverse reactions are unique advantages of traditional chinese medicine for the treatment of diseases in patients with colon cancer chinese medicine can improve patient immunity reduce the side effects of radio therapy and chemo therapy or enhance drug sensitivity in hibi", "the number of patients with colorectal cancer crc world'wide is in creasing annually with an in cidence rate of in chronic in flammati on is the leading cause of immune cell in filtrati on and proliferati on and it has been suggested to be a high'risk fact or for colitis'as sociated crc cac in flammatory bowel disease ibd which encompasses both ulcerative colitis uc and crohn's disease was established as an important precurs or to crc for example the in cidence of ibd'as sociated crc in patients with uc was reported to have a cumulative risk rate of at years at years and at years of disease durati on the refore further in vivo studies are required for researchers to gain an improved under standing of the molecular mechanisms of cac which may provide more exact molecular targets for the diagnosis and treatment of cac during the early stages toll'like recept or tlr 9 a member of the tlr family is located in the cytoplasm and in tracellular endosomes and can be activated by unmethylated bacterial cpg dna the activati on of the tlr 9 signaling pathway in duces a type t helper cell immune response and stimulates the proliferati on of b cells thus protecting the host from external microbial in vasi on ' multiple studies have revealed that abnormal tlr 9 expressi on levels were in volved in the pathogenesis and progressi on of uc in additi on abnormal expressi on levels of tlr 9 were also identified during the tumorigenesis and development of crc 'nf'\u03bab is an important transcripti on fact or in volved in various biological processes in cluding in flammatory reac'tions immune responses apoptosis and proliferati on in fact nf'\u03bab is regarded as a molecular hub that links in flam'mati on and cancer it was previously suggested that nf'\u03bab may serve", "1. Heterogeneity of cancer-as sociated stroma according to examined tumor locations The clinicopathological characteristics of the advanced CRC patients are described in. The CRC patients with synchronous metastases had aggressive features in cluding larger tumor size more advanced p T and p N stage and the presence of per ineural and venous in vasi on than the patients with metachronous metastasis (p<0.05)..0091811. t 001 Clinicopathologic characteristics of advanced colorectal cancers. The clinicopathological characteristics of the advanced CRC patients are described in. The CRC patients with synchronous metastases had aggressive features in cluding larger tumor size more advanced p T and p N stage and the presence of per ineural and venous in vasi on than the patients with metachronous metastasis (p<0.05)..0091811. t 001 Clinicopathologic characteristics of advanced colorectal cancers. Parameters Total Metachronous Synchronous P value (n?=?181) (n?=?57) (n?=?124) Age (median range) 60.00 (28\"93) 62.00 (36\"79) 60.00 (28\"93) 0.241 Sex 0.007 Male 97 39 (68.4%) 58 (46.8%) Female 84 18 (31.6%) 66 (53.2%) Locati on 0.055 Right colon 37 6 (10.5%) 31 (25.0%) Left colon 75 29 (50.9%) 46 (37.1%) Rectum 69 22 (38.6%) 47 (37.9%) Size of primary tumor 5.30 (2.0\"13.0) 4.20 (2\"9) 5.50 (2.5\"13) <0.001 Histologic grade 0.227 Low grade 157 52 (91.2%) 105 (84.7%) High grade 24 5 (8.8%) 19 (15.3%) T stage <0.001 T 1 0 0 0 T 2 5 3 (5.3%) 2 (1.6%) T 3 107 45 (78.9%) 62 (50.0%) T 4 69 9 (15.8%) 60 (48.4%) N stage <0.001", "1 negatively regulates the differentiati on and promotes the proliferati on of colon cancer cells in the absence of 15 pgdh ht 29 cells were either transfected with shctrl alone or cotransfected with shhpgd and pegfphgli 1 followed by ltc 4 stimulati on for h qrtpcr analysis of the differentiati on markers a si b mucin 2 and c cdhr 2 d the differentiati on regulati on marker cdx 2 e the wnt activati on marker axin 2 f the prooncogene cmyc and g the proliferati on marker ccnd 1 h western blot analysis of wholecell lysates for 15 pgdh gli 1 and si expression\u03b1tubulin was used as the loading control i immunofluorescence analysis of gli 1 and mucin 2 in unstimulated or ltc 4 stimulated cells transfected with shhpgd or shgli 1 hprt 1 was used as the housekeeping gene for normalizati on of the qrtpcr gene expressi on data graphs represent data from to in dependent experiments and represent the mean \u00b1 sem p p p \"k supplementary fig s 9 a\"h gli 1 gene and prote in expressi on in ht 29 and caco 2 derived colonospheres was also downregulated after ltc 4 stimulati on we next analysed the mrna expressi on levels in tumour and adjacent mucosa samples from pairedcrc patients which also suggested a significantly positivecorrelati on between gli 1 and the stemness markersdclk 1 and lgr 5 with elevated expressi on of all threegenes in tumour tissues figs 1 l 6 l\"n the normalmucosa as reference set to and the tum our tissue for dclk 1 \u00b1 and lgr 5 \u00b1 mean\u00b1 sem respectively mann\"whitney test p as expected the expressi on level of dclk 1 showed a negative correlati on with cysltr 2 and hpgd expressiononcogenesis 0 csatapathy on cogenesis page of fig see legend on next page from our previously published", "in the colon the development of adenomatous polyps frequently in volves the in activati on of the apc gatekeeper gene a member of the wntsignaling pathway which represses proliferati on and facilitates or derly cell differentiati on in the luminal part of the crypts barker goss groden as long as this gatekeeper gene is active mutant stem cell progeny with neoplastic potential is likely eliminated from the crypt and clonal expansi on thus averted however when the gatekeeper gene is in activated the brakes on mutant stem proliferati on are removed and mutant cell progeny may undergo focal clonal expansi on the refore we asked the questi on what are the factors that determine the risk of a tsggatekeeper in activati on leading to tumor in itiati on in a compartmentalized tissue a metapopulationour microsimulations in dicate that the base mutati on rate and the in crease in that rate for a mutat or clone are the main driving forces behind tsg in activati on and thus the in itiati on of carcinogenesis the proporti on of deleterious mutations is important for its effect on selecti on of the mutat or clone we find that if most mutations are as sumed to be deleterious then a mutat or clone quickly accumulates a large genetic load of deleterious mutations and tends to be driven to extincti on in competiti on with nonmutat or cells however if mutations are more likely to be beneficial then a mutat or clone can spread more easily which leads to the early in activati on of both alleles of the tumor suppress or gene similarly in creasing turnover of the stem cells effectively in creases the mutati on rate and consequently the rate of in itiati on however when turnover is very high the homeostatic feedback signals cannot mainta in the target number of stem cells and so the total stem cell populati on of the epithelium decreases which in turn decreases the chances for in itiati on figure since the rate of tsg in activati on is trivially relat"], "answer": "The interaction between MAPK and Wnt signaling in colon cancer is not explicitly detailed in the provided contexts. However, it is noted that Wnt signaling is a pivotal tumorigenic pathway in colorectal cancer (CRC), often activated by genetic mutations, leading to the accumulation of \u03b2-catenin and subsequent transcriptional activation of target genes. Additionally, chronic inflammation, potentially linked to obesity, may activate Wnt signaling through pathways involving TNF\u03b1 and GSK3 phosphorylation, which could suggest a connection to MAPK signaling. Insufficient evidence in provided documents."}
{"question": "Why are microsatellite stable colorectal cancers less responsive to checkpoint blockade?", "contexts": ["in the clinic and defined immuno therapy as an effective strategy for the treatment of several malignancies they have not been universally successful in that context the dearth of neoepitopes in many cancer types in cluding microsatellite stable colorectal and pancreatic second and third leading causes of cancer mortality respectively makes them in sensitive to checkpoint blockade 7 in deed examinati on of neoepitopes presented on the surface of five colorectal cancer specimens revealed a total of three neoepitopes 3 thus vaccines targeting cancer as sociated self antigens have re emerged alone and in combinati on with checkpoint in hibitors as a strategy to prevent and treat metastases from these cold tumors 44 checkpoint in hibitors have become first line the rapy in the metastatic setting for some cancers 46 while chimeric antigen recept or expressing t cells car t cells are being deployed in patients with metastatic and refractory disease 47 in contrast few cancer immunotherapies have been developed for early stage cancer patients with \u0153no evidence of disease\u009d ned following conventional surgicalradiochemotherapies who are at significant risk of disease recurrence in deed 25 of stage ii and of stage iii patients with colorectal cancer recur following surgery and chemo therapy 49 while of patients with resectable pancreatic cancer experience recurrence 50 vaccines targeting tumor as sociated antigens such as ad 5 f 35 gucy 2 c padre may provide safe and effective immunotherapies for the secondary preventi on of metastatic disease in patients with ned who are otherwise in eligible to receive checkpoint in hibitors or car t cells the present studies suggest that the chimeric adenoviral vect or ad 5 f 35 may be preferable to the widely used ad 5 vect or and warrants further in vestigati on in deed they suggest that on going clinical in vestigations of gucy 2 c directed immuno therapy in patients with gucy 2 c expressing cancers in cluding colorectal pancreatic gastri", "in this prospective single arm multi center in terventi on study patients with resectable microsatellite stablect 3\"4 nxm 0 colon cancer will be treated with two courses of neoadjuvant and two courses of adjuvant capecitabine and oxaliplat in the primary endpoint is the pathological tumor response to neoadjuvant chemo therapy per cms secondaryendpoints are radiological tumor response the prognostic value of these responses for recurrence free survival and overall survival and the differences in cms classificati on of the same tumor before and after neoadjuvant chemo therapy the study is scheduled to be per formed in \" dutch hospitals the first patient was in cluded in february necessary to proceed to future studies in which neo adjuvant chemo therapy may be with hold in patients with a specific cms subtype who show no benefit from chemo therapy and for whom possible new treatments can be in vestigatedtrial registrati on this study has been registered in the netherlands trial register nl 8177 at \" wwwtrialregisternltrial 8177 the study has been approved by the medical ethics committee utrecht mec 18712 keywords colon cancer consensus molecular subtypes neoadjuvant chemo therapy surgery colon cancer is one of the most comm on types of cancer in the netherlands with an in cidence of around patients in approximately of patients present with local disease stage iiii curativesurgery followed by adjuvant systemic chemo therapy isstandard of care in patients with microsatellite stablemss high risk stage ii and stage iii colon cancer despite this in tensive treatment \" of the patients develop metastatic disease these patients do not benefitenough from the current adjuvant systemic the rapymoreover it is estimated that will not develop metastases after surgery alone and are the refore over treated with adjuvant chemo therapy identifying the patients at risk of developing metastases as well as thoseresponding to the rapy is a clear unmet need in colon cancer care the developme", "In recent years the concept of restoring the patients\u2122 antitum or immunity by immune checkpoint in hibiti on hasrevolutionized cancer the rapy especially in advancedmelanoma Immunecheckpoint molecules efficiently regulate T cell activati on and thus enable tumor cells to evade the immunesystem for example by hijacking the PD 1 PDL 1 in teracti on to downregulate effect or T cells [ ] To dateseveral human monoclonal antibodies pharmacologicallyblocking these in teractions have been implemented in cancer the rapy such as the anti PD 1 antibody pembrolizumab that has been approved in combinati on with chemo therapy for nonsquamous NSCLC irrespective of PDL 1 expressi on [ ]Several studies have shown that immune checkpointinhibiti on and radio therapy in combinati on can act synergistically to further boost antineoplastic effects [\"] Although in a large phase III trial no benefit of blockade of cytotoxic T lymphocyteassociated antigen CTLA 4 after radio therapy was observed in metastaticprostate cancer [] clinical trials such as NICOLASNCT 02434081 and DETERRED NCT 02525757 in vestigating concurrent PDL 1 directed immuno therapy and chemoradiot", "mcc are a unique histologic subtype in which greaterthan of the tumor mass is composed of extracellularmuc 2 prote in they demonstrate unique clinicalphenotype and molecular genotype when compared to their nonmucinous counterparts nmcc clinicallymcc are more likely to occur in younger patients havea predilecti on for the proximal colon are bulkier at presentati on and have a higher propensity for per itoneal and distant lymph node metastases molecularly the ytend to follow the serrated pathway for carcinogenesis and are more likely to have rasgn as mutationsmicrosatellite in stability msi and cpg island methylat or phenotype cimp positive [ ]in general many moleculartargeted the rapies havedemonstrated disappointing against advancedsolid cancers in clinical trials despite promising preclinical data this may largely be at tributed to irrational useof targeted drugs against unselected cancers major considerations to improve the efficacy of targeted the rapiesinclude identificati on of ideal drugs and drug combinations optimizing dosing schedules and enriching for patient factors eg clinical and molecular phenotypes and genotypes that are more likely to respond to specifictargeted the rapies in this study we focused on specificvulnerabilities of mucinous tumors that may make the msuscept ibletherebytargeted the rapies to specific 0 cdilly or phanet of rare diseases page of fig see legend on next page 0 cdilly or phanet of rare diseases page of see figure on previous pagefig combinati on of celecoxib and or list at reduced mucinous tumor growth in vivo murine xenograft models of in traperitoneal ip luciferaselabelled ls 174 t cells were treated with pbs alone control or celecoxib c alone mgkg bw or or list at o alone mgkg bw or combinati on of c o every other day starting on day following tumor implantati on until they were euthanized at day gross in traabdominal tumor burden is depicted pictorially on day serial weekly changes in mean luciferase in tensity during treat", "thirty six per cent of colorectal stomach and endometrial cancers with pole mutations carried additionalmutations in polq eq polzrev 3 l ez or both dna polymerases ezq the mutati on burden in the setumors was significantly greater compared to poleonly e mutant tumors p in additi on eq ez and eqz mutant tumors possessed an in creased frequency of mutations in the pole exonuclease doma in p colorectal stomach and endometrial eq ez and eqz mutant tumors with in tcga demonstrated diseasefree survival even if the pole mutations occurred outside the exonuclease doma in p however immunescores in these tumors were related to microsatellite in stability msi and not pole mutati on status this suggeststh at the host immune response may not be the sole mechanism for prolonged diseasefree survival of ultramutated tumors in this cohort", "regs and MDSCs reducedtum or volumes and in creased survival The immunomodulatoryactivity of continuous sunitinib administrati on can create a moreimmunepermissive environment Despite the significant recent advances of anti PD 1 and anti PDL 1 the rapy they still impact only a minority of patientswhose TMEs express those molecules at baseline One hypothesisis that sequential use of vaccine can drive immune cells to the TME resulting in an adaptive reacti on by tumor cells potentially from the presence of cytokines produced by active immune cells in the TME upregulating PDL 1 and per haps defining a rolef or anti PDL 1 PD 1 the rapies in patients who may not haveotherwise benefited from such immunotherapies Based on this per spective combining or sequencing vaccines with anti PDL 1 PD 1 the rapies could broaden the clinical benefit for allpatients with immunologically \u0153cold tumor microenvironments\u009ddevoid of reactive immune cells to enhance the clinical efficacyamong cancer patients with a variety of tumor types This casemay provide an example of how in creasing per ipheral Tcellactivati on with vaccines can enable immune cells to then migrate to the TME and improve response rates to anti PDL 1 PD 1 the rapies In deed existing data with the FDAapprovedtherapeutic cancer vaccine for prostate cancer sipuleucel Tindicate that vaccine did in crease T cells in the TME after treatment In ducti on of CEAspecific T cells was noted in the per ipheralblood of this patient following vaccinati on with yeast CEA butnot at later time points It is possible the CEAspecific cellshomed in on the TME in ducing PDL 1 expressi on subsequently Front", "oid derived suppress or cells 24 several clinical studies suggested that modulati on of vegf mediated immune suppressi on via angiogenesis in hibiti on could potentially augment the immunotherapeutic activity of anti programmed cell death pd 1 antibody 26 regorafenib and nivolumab showed antitumour activity in patients with metastatic colorectal cancer in cluding those with microsatellite stable tumours in a phase study 28 angiopoiet in 2 a relatively novel regulat or of angiogenesis that acts through the tek tyrosine kinase endothelial tie 2 recept or has been identified as a potential prognostic biomarker for some types of cancer although the baseline ang 2 level was a predictive biomarker in patients with thyroid cancer in the select trial 17 it did not become a reliable biomarker of lenvatinib response in this study prior treatment with anti vegfvegfr antibodies probably had an effect on baseline angiopoiet in 2 levels because the study populati on was refractory to standard treatment in this study the decrease in angiopoiet in 2 levels was observed after treatment the refore it may be an in dicat or of treatment response the", "Crowley method The CIs of month and year survival probabilities were calculated based on the Greenwood\u2122s for mula HRs and CIs were estimated by Cox regressi on We did subgroup analyses divided by prespecified baseline patient and disease characteristic variables in cluding RAS status for DCR PFS and OS We also did a prespecified exploratory analysis of potential predictive biomarkers in blood samples We did all analyses with SAS V 94 Patient characteristics Between October and January patients with unresectable metastatic colorectal cancer were enrolled All patients were eligible and received the study medicati on Table summarises the baseline characteristics of all enrolled patients The median number of previous lines of palliative chemo therapy was range \" and patients had received or \u2030\u00a5 prior lines of chemo therapy for metastatic disease respectively The data cut off date was January with median follow up of months IQR \"efficacy The centrally as sessed DCR was CI to one sided p 00001 two patients had a partial response and had a stable disease in cluding unconfirmed PR table figure A total of patients had a reducti on in target lesi on size from baseline figure Time on treatment for all patients is \u2030\u00a5 \u2030\u00a5 Male Female months \u2030\u00a5 months Right sided colon Left sided colorectum Lung Liver Lymph node Per itoneum Age years Sex ECOG per formance status Primary site Number of metastatic site Metastatic an Time from start of first line chemo therapy Number of previous palliative chemo therapy Previous chemo therapy and reas on for discontinuati on Fluoropyrimidine Refractory In tolerant Oxaliplat in Irinotecan TAS 102 trifluridinetipiracil Angiogenesis in hibit or Anti EGFR in hibit or Refractory In tolerant Refractory In tolerant Refractory Refractory In tolerant Refractory In tolerant Iwasa a 0 S et a 0 al ESMO 20205 e 000776 101136 esmo 2020000776 0 c access Table Best response to treatment Complete response Partial response Stable disease Progressive disease Not", "1. Heterogeneity of cancer-as sociated stroma according to examined tumor locations The clinicopathological characteristics of the advanced CRC patients are described in. The CRC patients with synchronous metastases had aggressive features in cluding larger tumor size more advanced p T and p N stage and the presence of per ineural and venous in vasi on than the patients with metachronous metastasis (p<0.05)..0091811. t 001 Clinicopathologic characteristics of advanced colorectal cancers. The clinicopathological characteristics of the advanced CRC patients are described in. The CRC patients with synchronous metastases had aggressive features in cluding larger tumor size more advanced p T and p N stage and the presence of per ineural and venous in vasi on than the patients with metachronous metastasis (p<0.05)..0091811. t 001 Clinicopathologic characteristics of advanced colorectal cancers. Parameters Total Metachronous Synchronous P value (n?=?181) (n?=?57) (n?=?124) Age (median range) 60.00 (28\"93) 62.00 (36\"79) 60.00 (28\"93) 0.241 Sex 0.007 Male 97 39 (68.4%) 58 (46.8%) Female 84 18 (31.6%) 66 (53.2%) Locati on 0.055 Right colon 37 6 (10.5%) 31 (25.0%) Left colon 75 29 (50.9%) 46 (37.1%) Rectum 69 22 (38.6%) 47 (37.9%) Size of primary tumor 5.30 (2.0\"13.0) 4.20 (2\"9) 5.50 (2.5\"13) <0.001 Histologic grade 0.227 Low grade 157 52 (91.2%) 105 (84.7%) High grade 24 5 (8.8%) 19 (15.3%) T stage <0.001 T 1 0 0 0 T 2 5 3 (5.3%) 2 (1.6%) T 3 107 45 (78.9%) 62 (50.0%) T 4 69 9 (15.8%) 60 (48.4%) N stage <0.001", ". In additi on because HGF over expressi on was frequently observed in tumors with the gatekeeper T 790 M mutati on mono therapy with a mutant-selective EGFR-TKI may not be sufficient to in hibit the growth of tumors with acquired resistance to gefitinib. Our findings suggest that the combinati on of a MEK-TKI and a PIK 3/m TOR-TKI may be effective in controlling these resistant tumors. Many KRAS-mutant cancer cells have been shown to be sensitive to MEK in hibitors and KRAS mutations can be detected in up to 30% of lung cancers dependent upon histology and ethnicity suggesting that a subset of lung cancers would likely be highly sensitive to AZD 6244. Our finding that AZD 6244 was effective in one distinct KRAS mutant human lung cancer NCI-H 460 models supports and validates this hypothesis. Although mono therapy with AZD 6244 resulted in antitum or and some antiangiogenic effects in all of our lung cancer models the antitum or effects were more apparent in the NCI-H 1993 lung adeno carcinoma model. The in creased antitum or efficacy observed in this model is as sociated with differences in the in hibitory effect of p-AKT signaling pathway in NCI-H 1975 and NCI-H 460 lung tumors. However additional studies are needed to elucidate this phenomen on. In this study we evaluated the rapy directed against MEK and PI 3 K/m TOR in distinct gefitinib-resistant NSCLC xenograft models. MEK or PI 3 K/m TOR in hibiti on resulted in antitum or effects for these gefitinib-resistance NSCLC models by blocking key in tracellular pathways controlling cell proliferati on and survival as demonstrated both in vitro and in vivo. Surprisingly PI 3 K/m TOR in hibiti on by BEZ 235 also suppressed lung tumor angiogenesis and targeted both MEK and PI 3 K/m TOR activati on in lung tumors resulting in substantial antiangiogenic effects which may due to the significantly reduced expressi on of MMP-9 in tumors. \""], "answer": "Microsatellite stable colorectal cancers are less responsive to checkpoint blockade due to a dearth of neoepitopes, which are critical for eliciting an immune response. In microsatellite stable colorectal cancers, the limited presence of these neoepitopes makes them insensitive to checkpoint inhibitors, as evidenced by the examination of colorectal cancer specimens revealing very few neoepitopes. This lack of immunogenicity contributes to their poor response to immunotherapy strategies like checkpoint blockade."}
{"question": "Which biomarkers are associated with poor prognosis in colorectal cancer?", "contexts": ["clinicopathological characteristics of patients with colorectal carcinoma characteristic sex male female age years \u2030\u00a5 site of lesi on colon rectum differentiati on poor well tumor size cm \u2030\u00a5 pathological type adeno carcinoma others lymph node metastasis no yes liver metastasis no yes stage iii iiiiv cea normal high ca ' normal high ca ' normal high afisher's exact test all others were as sessed using a \u03c72 test defb 4 a defens in 4 a'''''''''''''''''''''''''''''''''''''''''''''''''''''high n low n 0009 a 0003 a 0575 a 0039 a poor survival furthermore defb 4 a expressi on was upregu'lated in patients with crc with advanced and metastatic cancer patients with crc with high defb 4 a expressi on had poor survival in additi on knockdown of defb 4 a affected the migrati on ability of crc cells tcga data of patients with crc were used to identify the degs between the long os days and short os days groups in additi on mrna expressi on was compared between tumor tissues and normal tissues in the same database defb 4 a was highly expressed in tumors and as sociated with a poor prognosis defb 4 a upregulati on was as sociated with poor prognosis and defb 4 a expressi on was significantly upregulated in patients with large tumors advanced cancer stage lymph node metastasis and liver metastasis another study used the gene expressi on omnibus database to screen genes that are in creased in patients with recurrence hierarchical clustering and pathway analyses revealed that thrombospond in thbs 2 and cart", "1. Heterogeneity of cancer-as sociated stroma according to examined tumor locations The clinicopathological characteristics of the advanced CRC patients are described in. The CRC patients with synchronous metastases had aggressive features in cluding larger tumor size more advanced p T and p N stage and the presence of per ineural and venous in vasi on than the patients with metachronous metastasis (p<0.05)..0091811. t 001 Clinicopathologic characteristics of advanced colorectal cancers. The clinicopathological characteristics of the advanced CRC patients are described in. The CRC patients with synchronous metastases had aggressive features in cluding larger tumor size more advanced p T and p N stage and the presence of per ineural and venous in vasi on than the patients with metachronous metastasis (p<0.05)..0091811. t 001 Clinicopathologic characteristics of advanced colorectal cancers. Parameters Total Metachronous Synchronous P value (n?=?181) (n?=?57) (n?=?124) Age (median range) 60.00 (28\"93) 62.00 (36\"79) 60.00 (28\"93) 0.241 Sex 0.007 Male 97 39 (68.4%) 58 (46.8%) Female 84 18 (31.6%) 66 (53.2%) Locati on 0.055 Right colon 37 6 (10.5%) 31 (25.0%) Left colon 75 29 (50.9%) 46 (37.1%) Rectum 69 22 (38.6%) 47 (37.9%) Size of primary tumor 5.30 (2.0\"13.0) 4.20 (2\"9) 5.50 (2.5\"13) <0.001 Histologic grade 0.227 Low grade 157 52 (91.2%) 105 (84.7%) High grade 24 5 (8.8%) 19 (15.3%) T stage <0.001 T 1 0 0 0 T 2 5 3 (5.3%) 2 (1.6%) T 3 107 45 (78.9%) 62 (50.0%) T 4 69 9 (15.8%) 60 (48.4%) N stage <0.001", "in this prospective single arm multi center in terventi on study patients with resectable microsatellite stablect 3\"4 nxm 0 colon cancer will be treated with two courses of neoadjuvant and two courses of adjuvant capecitabine and oxaliplat in the primary endpoint is the pathological tumor response to neoadjuvant chemo therapy per cms secondaryendpoints are radiological tumor response the prognostic value of these responses for recurrence free survival and overall survival and the differences in cms classificati on of the same tumor before and after neoadjuvant chemo therapy the study is scheduled to be per formed in \" dutch hospitals the first patient was in cluded in february necessary to proceed to future studies in which neo adjuvant chemo therapy may be with hold in patients with a specific cms subtype who show no benefit from chemo therapy and for whom possible new treatments can be in vestigatedtrial registrati on this study has been registered in the netherlands trial register nl 8177 at \" wwwtrialregisternltrial 8177 the study has been approved by the medical ethics committee utrecht mec 18712 keywords colon cancer consensus molecular subtypes neoadjuvant chemo therapy surgery colon cancer is one of the most comm on types of cancer in the netherlands with an in cidence of around patients in approximately of patients present with local disease stage iiii curativesurgery followed by adjuvant systemic chemo therapy isstandard of care in patients with microsatellite stablemss high risk stage ii and stage iii colon cancer despite this in tensive treatment \" of the patients develop metastatic disease these patients do not benefitenough from the current adjuvant systemic the rapymoreover it is estimated that will not develop metastases after surgery alone and are the refore over treated with adjuvant chemo therapy identifying the patients at risk of developing metastases as well as thoseresponding to the rapy is a clear unmet need in colon cancer care the developme", "colorectal carcinogenesis is a multi'step process starting from normal crypts to aberrant crypt foci then to polyps adenoma and eventually adeno carcinoma it has been reported that in dividuals with ibd may have an in creased risk of developing crc which is directly proportional to the extent and durati on of their disease however the exact mechanism and durati on required for chronic colitis to develop into adenoma and then adeno carcinoma remains unclear it has been suggested that patients with ibd have an in creased risk of crc following the in flammati on'dysplasia'carcinoma model in cluding dysplasia and crc as primary conse'quences of chronic in flammati on however there are currently still no defined molecular biomarkers or existing monitoring protocols for detecting the occurrence of a malignant tumor except for frequent colonoscopy examinations in the present study an acute colitis'chronic colitis'adenoma'adeno carcinoma model was successfully constructed via aomdss in ducti on using this model tlr 9 expressi on levels were discovered to be upregulated as the severity of the colorectal lesions in creased which in dicated that tlr 9 prote in expressi on levels may be continuously activated during colitis'crc development tlr 9 is a critical prote in as sociated with in nate and acquired immunity and it has been demonstrated to serve a significant role in the development of colitis and sporadic crc however the mechanism by which tlr 9 regulates the devel'opment of crc remains to be elucidatedinterestingly ihc analysis revealed that the expressi on levels of nf'\u03bab and ki 67 were simultaneously upregulated alongside tlr 9 expressi on levels notably in hibiting tlr", "use locati on of cancer in the colon proximal colondistal colonrectumunspecifiedstage at diagnosis stage istage iistage iiimedian survival time yearsmedian survival time by staged years stage istage iistage iiiweight change categoriesd stable weight \u02c6' to kggained more than kglost more than kg avalues are means sd for continuous variables and per centages for categorical variables and are standardized to the age distributi on of the study populationbedih scores were adjusted for total energy in takecmetabolic equivalents from recreational and leisuretime activitiesdvalue is not age adjustedafter diagnosis quintile tended to have higher bodyweight and lower physical activity for example the average bmi among those classified in quintile was kgm 2 and the average physical activity was methourweek compared with kgm 2 and methourweek among those in quintile also patients consuming the most hyperinsulinemic dietarypatterns were less likely to have stage i disease and the yexperienced shorter survival times table patients consuming low in sulinemic dietary patternshad higher in takes of wholegrains nuts vegetables wholefruits and coffee and lower in takes of refined grainscream soup eggs french fries butter margarine sugarsweetened beverages red meat and processed meat in 0 ctabung bmc cancer page of table median 5 th 95 th per centile food and nutrient in take profiles of colorectal cancer patients by quintiles of postdiagnosisempirical dietary index for hyperinsulinemia edih scoretotal populati on n quintiles of the empirical dietary index for hyperinsulinemia edih scoreabquintile n quintile n quint", "Crowley method The CIs of month and year survival probabilities were calculated based on the Greenwood\u2122s for mula HRs and CIs were estimated by Cox regressi on We did subgroup analyses divided by prespecified baseline patient and disease characteristic variables in cluding RAS status for DCR PFS and OS We also did a prespecified exploratory analysis of potential predictive biomarkers in blood samples We did all analyses with SAS V 94 Patient characteristics Between October and January patients with unresectable metastatic colorectal cancer were enrolled All patients were eligible and received the study medicati on Table summarises the baseline characteristics of all enrolled patients The median number of previous lines of palliative chemo therapy was range \" and patients had received or \u2030\u00a5 prior lines of chemo therapy for metastatic disease respectively The data cut off date was January with median follow up of months IQR \"efficacy The centrally as sessed DCR was CI to one sided p 00001 two patients had a partial response and had a stable disease in cluding unconfirmed PR table figure A total of patients had a reducti on in target lesi on size from baseline figure Time on treatment for all patients is \u2030\u00a5 \u2030\u00a5 Male Female months \u2030\u00a5 months Right sided colon Left sided colorectum Lung Liver Lymph node Per itoneum Age years Sex ECOG per formance status Primary site Number of metastatic site Metastatic an Time from start of first line chemo therapy Number of previous palliative chemo therapy Previous chemo therapy and reas on for discontinuati on Fluoropyrimidine Refractory In tolerant Oxaliplat in Irinotecan TAS 102 trifluridinetipiracil Angiogenesis in hibit or Anti EGFR in hibit or Refractory In tolerant Refractory In tolerant Refractory Refractory In tolerant Refractory In tolerant Iwasa a 0 S et a 0 al ESMO 20205 e 000776 101136 esmo 2020000776 0 c access Table Best response to treatment Complete response Partial response Stable disease Progressive disease Not", "poor prognosis of pdac high expression of msi 2 mrna is as sociated with decreased survival in acute myeloid leukaemia furthermore msi 2 mayact as a prognostic biomarker in patients with cervicalcancer bladder cancer and oesophageal squamous cell carcinoma it was also found that its expressi on is upregulated in crc which makesitapplicable as a prognostic marker gene for crcl in 28 an on cofoetal rnabinding prote in modulatesstem cell maintenance somatic reprogramming metabolism anismal growthtissue development and tumourigenesis two paralogues of lin 28 were in cluded lin 28 a and lin 28 b it is well established thatl in 28 a and lin 28 b in hibit let 7 family mirn as and derepress let 7 targets in cluding ras pi 3 kakt mychmga 2 and igf 2 bps thus promoting on cogenesis in liver cancer stem cells fang found thatoverexpressi on of msi 2 resulted in the upregulati on oflin 28 a stemness and chemotherapeutic drug resistance in duced by msi 2 over expressi on were dramaticallyreduced by lin 28 a knockdown moreover msi 2 andl in 28 a levels positively correlated with the clinical severity and prognosis in hcc patients king found that lin 28 b over expressi on is as sociated with reduced survival time and in creased probability of tumour recurrence in patients constitutive lin 28 b expressi on promotes not only tumorigenesis but alsolgr 5 and prom 1 expressi on in colonic epithelial cells in additi on lin 28 b promotes the proliferationcolony for mati on and tumourigenesis of colon cancercells by", "colorectal cancer crc is the third most comm on cancer type and the second leading cause of cancer death worldwide deaths usually result from recurrent and metastatic disease mostinternational guidelines recommend chemo therapy to reduce the risk of recurrence in stage iii tumors and to prolongsurvival in stage iv cancers conversely chemo therapy isgenerally not used in stage i and most stage ii tumors howeversome patients with low risk stage iii disease may respond wellfollowing courses of chemo therapy that are shorter than the 6 month standard schedule although the definiti on of \u0153lowrisk\u009d has not been well established in this scenario additionally almost of patients who have stage ii tumors and who are the refore considered to have low risk diseaserelapse and eventually die from cancer progressi on the reis currently no accurate biomarker to better define prognosiswith in stage groups the refore biomarkers for prognosticstratificati on in crc have the potential of improving the treatment decisionmaking process we hypothesized thatstudying molecular mechanisms that are known to be in volved in crc development might yield promising novel biomarkersf or this diseasethese modelsformati on mirroring cancer developmentadenomatous polyposis coli apc in activating mutationsare the earliest and most comm on genetic alterations in the adenoma carcinoma sequence thatleads to crc suchmutations result in the accumulati on of caten in with in cells and activati on ofthe wnt signaling pathway animalmodels of apc in activati on demonstrate epithelial transformation and tumor\"the ahcreapcflfl mouse one ofan animal bearing loxpflanked apc alleles and a crerecombinase transgene when this animalis exposed", "of the present study do not support the sefindings to our knowledge this is the first study in cluding only patients with colorectal cancer whoare eligible for curative treatment by partial bowel resecti on and not those receiving palliativetreatment de couck studied the relationship between hrv and tumour burden in bothcurative and palliative patients with prostate cancer or nonsmall cell lung cancer in dependent of confounders the hypothesised in verse relationship of hrv and the tumour markerpsa at and months after diagnosis was only significant in patients with stage iv prostate cancer not stage ii and iii in colorectal cancer mout on found that low hrv defined as sdnn ms predicted significantly higher levels of the tumour marker cea at months after diagnosis again these were not controlled for cancer type which could affect bothhrv and survival and should the refore be in terpreted with cauti on the fact that the patients recruited in the present sample were only with less advanced cancer may partlyexpla in the lack of prognostic role in hrv in this sample one 101371 pone 0237244 august one 0 chrv and prognosis in colorectal cancerfig bar chart for cealevel at baseline and one year checkup in groups of low hrv and normal hrv presented as asdnn and b rmssd 101371 pone 0237244 g 004 one 101371 pone 0237244 august one 0 chrv and prognosis in colorectal cancertable low hrv and risk of occurrence of a postoperative complicati on with in dayspostoperative complication or ciunadjustedsdnn 20 ms n \"sdnn \ufffd20 ms n referenceadjusted\ufffdsdnn 20 ms n \"sdnn \ufffd20 ms n referenceunadjustedrmssd 19 ms n \"rmssd \ufffd19 ms n referenceadjusted\ufffdrmssd 19 ms n \"rmssd \ufffd19 ms n reference\ufffdadjusted for heart rate age cardiac disease and hypertensi on 101371 pone 0237244 t 005 psome of these previous studies suggest a bidirectional relationship between vagus nerveactivity and cancer however based on current evidence on this subject we cannot supportthis hypothesis the positive as sociati on betwee", "the medocccreate study is the first study using the modern and in novative twics design to study ctdnaguided administrati on of act in stage ii cc patients the study aims to answer the important clinical questi on whether ctdna has prognostic as well as predictive value if this study demonstrates as ignificant and substantial difference in disease recurrence in the in terventi on group compared to the controlgroup ctdna analysis and ctdnaguided treatmentshould be implemented into clinical practice to improve the prognosis of stage ii cc patientsabbreviationsact adjuvant chemo therapy cc colon cancer cea carcinoembryonicantigen crc colorectal cancer ctdna circulating tumor dnadfs disease free survival dmmr deficient mismatch repair eortcqlqc 30 and cr 29 european anisati on for research and treatment of cancer quality of life questionnaire c 30 and colorectal cancer module eq 5 d euro quality of life 5 dimensions ffpe for malinfixed para"], "answer": "Biomarkers associated with poor prognosis in colorectal cancer include high expression of defb 4 a, which is linked to advanced cancer stages, large tumor size, lymph node metastasis, and liver metastasis. Additionally, high levels of msi 2 mRNA and lin 28 b are also associated with reduced survival and increased tumor recurrence. Insufficient evidence in provided documents."}
{"question": "Is CEA discussed as a predictive marker in colorectal cancer studies?", "contexts": ["clinicopathological characteristics of patients with colorectal carcinoma characteristic sex male female age years \u2030\u00a5 site of lesi on colon rectum differentiati on poor well tumor size cm \u2030\u00a5 pathological type adeno carcinoma others lymph node metastasis no yes liver metastasis no yes stage iii iiiiv cea normal high ca ' normal high ca ' normal high afisher's exact test all others were as sessed using a \u03c72 test defb 4 a defens in 4 a'''''''''''''''''''''''''''''''''''''''''''''''''''''high n low n 0009 a 0003 a 0575 a 0039 a poor survival furthermore defb 4 a expressi on was upregu'lated in patients with crc with advanced and metastatic cancer patients with crc with high defb 4 a expressi on had poor survival in additi on knockdown of defb 4 a affected the migrati on ability of crc cells tcga data of patients with crc were used to identify the degs between the long os days and short os days groups in additi on mrna expressi on was compared between tumor tissues and normal tissues in the same database defb 4 a was highly expressed in tumors and as sociated with a poor prognosis defb 4 a upregulati on was as sociated with poor prognosis and defb 4 a expressi on was significantly upregulated in patients with large tumors advanced cancer stage lymph node metastasis and liver metastasis another study used the gene expressi on omnibus database to screen genes that are in creased in patients with recurrence hierarchical clustering and pathway analyses revealed that thrombospond in thbs 2 and cart", "the medocccreate study is the first study using the modern and in novative twics design to study ctdnaguided administrati on of act in stage ii cc patients the study aims to answer the important clinical questi on whether ctdna has prognostic as well as predictive value if this study demonstrates as ignificant and substantial difference in disease recurrence in the in terventi on group compared to the controlgroup ctdna analysis and ctdnaguided treatmentshould be implemented into clinical practice to improve the prognosis of stage ii cc patientsabbreviationsact adjuvant chemo therapy cc colon cancer cea carcinoembryonicantigen crc colorectal cancer ctdna circulating tumor dnadfs disease free survival dmmr deficient mismatch repair eortcqlqc 30 and cr 29 european anisati on for research and treatment of cancer quality of life questionnaire c 30 and colorectal cancer module eq 5 d euro quality of life 5 dimensions ffpe for malinfixed para", "in this prospective single arm multi center in terventi on study patients with resectable microsatellite stablect 3\"4 nxm 0 colon cancer will be treated with two courses of neoadjuvant and two courses of adjuvant capecitabine and oxaliplat in the primary endpoint is the pathological tumor response to neoadjuvant chemo therapy per cms secondaryendpoints are radiological tumor response the prognostic value of these responses for recurrence free survival and overall survival and the differences in cms classificati on of the same tumor before and after neoadjuvant chemo therapy the study is scheduled to be per formed in \" dutch hospitals the first patient was in cluded in february necessary to proceed to future studies in which neo adjuvant chemo therapy may be with hold in patients with a specific cms subtype who show no benefit from chemo therapy and for whom possible new treatments can be in vestigatedtrial registrati on this study has been registered in the netherlands trial register nl 8177 at \" wwwtrialregisternltrial 8177 the study has been approved by the medical ethics committee utrecht mec 18712 keywords colon cancer consensus molecular subtypes neoadjuvant chemo therapy surgery colon cancer is one of the most comm on types of cancer in the netherlands with an in cidence of around patients in approximately of patients present with local disease stage iiii curativesurgery followed by adjuvant systemic chemo therapy isstandard of care in patients with microsatellite stablemss high risk stage ii and stage iii colon cancer despite this in tensive treatment \" of the patients develop metastatic disease these patients do not benefitenough from the current adjuvant systemic the rapymoreover it is estimated that will not develop metastases after surgery alone and are the refore over treated with adjuvant chemo therapy identifying the patients at risk of developing metastases as well as thoseresponding to the rapy is a clear unmet need in colon cancer care the developme", "of the present study do not support the sefindings to our knowledge this is the first study in cluding only patients with colorectal cancer whoare eligible for curative treatment by partial bowel resecti on and not those receiving palliativetreatment de couck studied the relationship between hrv and tumour burden in bothcurative and palliative patients with prostate cancer or nonsmall cell lung cancer in dependent of confounders the hypothesised in verse relationship of hrv and the tumour markerpsa at and months after diagnosis was only significant in patients with stage iv prostate cancer not stage ii and iii in colorectal cancer mout on found that low hrv defined as sdnn ms predicted significantly higher levels of the tumour marker cea at months after diagnosis again these were not controlled for cancer type which could affect bothhrv and survival and should the refore be in terpreted with cauti on the fact that the patients recruited in the present sample were only with less advanced cancer may partlyexpla in the lack of prognostic role in hrv in this sample one 101371 pone 0237244 august one 0 chrv and prognosis in colorectal cancerfig bar chart for cealevel at baseline and one year checkup in groups of low hrv and normal hrv presented as asdnn and b rmssd 101371 pone 0237244 g 004 one 101371 pone 0237244 august one 0 chrv and prognosis in colorectal cancertable low hrv and risk of occurrence of a postoperative complicati on with in dayspostoperative complication or ciunadjustedsdnn 20 ms n \"sdnn \ufffd20 ms n referenceadjusted\ufffdsdnn 20 ms n \"sdnn \ufffd20 ms n referenceunadjustedrmssd 19 ms n \"rmssd \ufffd19 ms n referenceadjusted\ufffdrmssd 19 ms n \"rmssd \ufffd19 ms n reference\ufffdadjusted for heart rate age cardiac disease and hypertensi on 101371 pone 0237244 t 005 psome of these previous studies suggest a bidirectional relationship between vagus nerveactivity and cancer however based on current evidence on this subject we cannot supportthis hypothesis the positive as sociati on betwee", "the number of patients with colorectal cancer crc world'wide is in creasing annually with an in cidence rate of in chronic in flammati on is the leading cause of immune cell in filtrati on and proliferati on and it has been suggested to be a high'risk fact or for colitis'as sociated crc cac in flammatory bowel disease ibd which encompasses both ulcerative colitis uc and crohn's disease was established as an important precurs or to crc for example the in cidence of ibd'as sociated crc in patients with uc was reported to have a cumulative risk rate of at years at years and at years of disease durati on the refore further in vivo studies are required for researchers to gain an improved under standing of the molecular mechanisms of cac which may provide more exact molecular targets for the diagnosis and treatment of cac during the early stages toll'like recept or tlr 9 a member of the tlr family is located in the cytoplasm and in tracellular endosomes and can be activated by unmethylated bacterial cpg dna the activati on of the tlr 9 signaling pathway in duces a type t helper cell immune response and stimulates the proliferati on of b cells thus protecting the host from external microbial in vasi on ' multiple studies have revealed that abnormal tlr 9 expressi on levels were in volved in the pathogenesis and progressi on of uc in additi on abnormal expressi on levels of tlr 9 were also identified during the tumorigenesis and development of crc 'nf'\u03bab is an important transcripti on fact or in volved in various biological processes in cluding in flammatory reac'tions immune responses apoptosis and proliferati on in fact nf'\u03bab is regarded as a molecular hub that links in flam'mati on and cancer it was previously suggested that nf'\u03bab may serve", "Crowley method The CIs of month and year survival probabilities were calculated based on the Greenwood\u2122s for mula HRs and CIs were estimated by Cox regressi on We did subgroup analyses divided by prespecified baseline patient and disease characteristic variables in cluding RAS status for DCR PFS and OS We also did a prespecified exploratory analysis of potential predictive biomarkers in blood samples We did all analyses with SAS V 94 Patient characteristics Between October and January patients with unresectable metastatic colorectal cancer were enrolled All patients were eligible and received the study medicati on Table summarises the baseline characteristics of all enrolled patients The median number of previous lines of palliative chemo therapy was range \" and patients had received or \u2030\u00a5 prior lines of chemo therapy for metastatic disease respectively The data cut off date was January with median follow up of months IQR \"efficacy The centrally as sessed DCR was CI to one sided p 00001 two patients had a partial response and had a stable disease in cluding unconfirmed PR table figure A total of patients had a reducti on in target lesi on size from baseline figure Time on treatment for all patients is \u2030\u00a5 \u2030\u00a5 Male Female months \u2030\u00a5 months Right sided colon Left sided colorectum Lung Liver Lymph node Per itoneum Age years Sex ECOG per formance status Primary site Number of metastatic site Metastatic an Time from start of first line chemo therapy Number of previous palliative chemo therapy Previous chemo therapy and reas on for discontinuati on Fluoropyrimidine Refractory In tolerant Oxaliplat in Irinotecan TAS 102 trifluridinetipiracil Angiogenesis in hibit or Anti EGFR in hibit or Refractory In tolerant Refractory In tolerant Refractory Refractory In tolerant Refractory In tolerant Iwasa a 0 S et a 0 al ESMO 20205 e 000776 101136 esmo 2020000776 0 c access Table Best response to treatment Complete response Partial response Stable disease Progressive disease Not", "1. Heterogeneity of cancer-as sociated stroma according to examined tumor locations The clinicopathological characteristics of the advanced CRC patients are described in. The CRC patients with synchronous metastases had aggressive features in cluding larger tumor size more advanced p T and p N stage and the presence of per ineural and venous in vasi on than the patients with metachronous metastasis (p<0.05)..0091811. t 001 Clinicopathologic characteristics of advanced colorectal cancers. The clinicopathological characteristics of the advanced CRC patients are described in. The CRC patients with synchronous metastases had aggressive features in cluding larger tumor size more advanced p T and p N stage and the presence of per ineural and venous in vasi on than the patients with metachronous metastasis (p<0.05)..0091811. t 001 Clinicopathologic characteristics of advanced colorectal cancers. Parameters Total Metachronous Synchronous P value (n?=?181) (n?=?57) (n?=?124) Age (median range) 60.00 (28\"93) 62.00 (36\"79) 60.00 (28\"93) 0.241 Sex 0.007 Male 97 39 (68.4%) 58 (46.8%) Female 84 18 (31.6%) 66 (53.2%) Locati on 0.055 Right colon 37 6 (10.5%) 31 (25.0%) Left colon 75 29 (50.9%) 46 (37.1%) Rectum 69 22 (38.6%) 47 (37.9%) Size of primary tumor 5.30 (2.0\"13.0) 4.20 (2\"9) 5.50 (2.5\"13) <0.001 Histologic grade 0.227 Low grade 157 52 (91.2%) 105 (84.7%) High grade 24 5 (8.8%) 19 (15.3%) T stage <0.001 T 1 0 0 0 T 2 5 3 (5.3%) 2 (1.6%) T 3 107 45 (78.9%) 62 (50.0%) T 4 69 9 (15.8%) 60 (48.4%) N stage <0.001", "affecting os and rfs per ineural in vasi on refers to the in vasi on of cancer cells into any of the layers of the nerve sheatha higher grade of per ineural in vasi on was related to local recurrence and metastasis in distant ans such as the liver lung and per itoneum all patients in this study under went radical surgery with lymphnode dissecti on a minimum of harvested lymph nodes is recommended to ensure adequatestaging and on cologic resecti on for colorectal cancer the more lymph nodes harvested the better the prognosis [ ]in this study the average number of harvested lymph nodesw as we found that patients with 15 harvested lymphnodes had better os and rfs than those with harvestedlymph nodes several studies have shown that elevated preoperative cea was a poor prognostic fact or in colorectal cancer[\"] in our study we also found that patients with an elevated preoperative cea had poorer os and rfsour study has several", "14 was as sociated with a significantly worse survival rate this study showedthat the expressi on of nop 14 was upregulated incrc but its role in pathogenesis requires further research and confirmation the mrps 23 gene which is responsible for encodinga 28 s subunit prote in has been found to be over expressed in breast cancer uterine cervical cancer hcc colorectal cancer and uterine leiomyoma as revealed by gao in hibitingmrps 23 could lead to a significant reducti on in breast cancer metastasis by in hibiting the emt phenotype pu found that high mrps 23 levels can predict poorclinical outcomes in hcc although the expression of mrps 23 is in creased in crc its specific pathogenesisremains unclearmak 16 encodes a ribosomal prote in and plays an important role in ribosome biogenesis throughout the cellcycle in this study it was found that mutations inmak 16 can in duce cell cycle arrest at g 1 phase during which the cell synthesizes mrna and proteins in preparati on for cell divisi on at present there is still nostudy of the role of mak 16 in the pathogenesis of tumours which requires further research to confirm in this paper a", "with in verseassociations for allcause mortality but no consistent as sociati on with colorectal cancerspecific mortality [\"]higher adherence to other dietary patterns in cluding the mediterranean diet score dietary approaches to stophypertensi on meal plan american cancer society cancerpreventi on guidelines score healthy eating index scorewere generally as sociated with lower risk of allcausemortality but the as sociations were in consistent acrossstudies [ ]refined grainschronic diseasesfurther research is the refore needed to clarify ifdietary patterns are importantf or colorectal cancerprognosis and if dietary changes can maximally impactoverall and cancerspecific survival biomarkerbaseddietary patterns may be helpful in this regard for example hyperinsulinemia and in sulin resistance areconsidered important under lying mechanisms linkingpo or dietary patterns and lifestyle behaviors to the development of multipleincludingcolorectal cancer [\"] studies have shown positiveassociations between circulating cpeptide concentrations a marker of beta cell secretory activity and colorectal cancer risk and prognosis [\"] the refore adietary pattern as sociated with hyperinsulinemia may bemore predictive of outcomes following colorectal cancerdiagnosis than a dietary pattern not as sociated with thispathway we previously derived the empirical dietaryindex for hyperinsulinemia edih score to as sess the potential of dietary patterns to in fluence in sulinemia which has been extensively applied in large cohortstudies and found to be predictive of nonfasting cpeptide concentrations [ ] longterm weight gain risk of developing colorectal cancer other digestive system cancers and other cancers however the in fluence of dietary in sulinemic potential on cancer survival outcomes has not yet been evaluated the"], "answer": "Yes, CEA (carcinoembryonic antigen) is discussed as a predictive marker in colorectal cancer studies. Elevated preoperative CEA levels have been associated with poorer overall survival (OS) and recurrence-free survival (RFS) in colorectal cancer patients."}
{"question": "What in vitro or xenograft models are used to study colorectal cancer drug response?", "contexts": ["in this prospective single arm multi center in terventi on study patients with resectable microsatellite stablect 3\"4 nxm 0 colon cancer will be treated with two courses of neoadjuvant and two courses of adjuvant capecitabine and oxaliplat in the primary endpoint is the pathological tumor response to neoadjuvant chemo therapy per cms secondaryendpoints are radiological tumor response the prognostic value of these responses for recurrence free survival and overall survival and the differences in cms classificati on of the same tumor before and after neoadjuvant chemo therapy the study is scheduled to be per formed in \" dutch hospitals the first patient was in cluded in february necessary to proceed to future studies in which neo adjuvant chemo therapy may be with hold in patients with a specific cms subtype who show no benefit from chemo therapy and for whom possible new treatments can be in vestigatedtrial registrati on this study has been registered in the netherlands trial register nl 8177 at \" wwwtrialregisternltrial 8177 the study has been approved by the medical ethics committee utrecht mec 18712 keywords colon cancer consensus molecular subtypes neoadjuvant chemo therapy surgery colon cancer is one of the most comm on types of cancer in the netherlands with an in cidence of around patients in approximately of patients present with local disease stage iiii curativesurgery followed by adjuvant systemic chemo therapy isstandard of care in patients with microsatellite stablemss high risk stage ii and stage iii colon cancer despite this in tensive treatment \" of the patients develop metastatic disease these patients do not benefitenough from the current adjuvant systemic the rapymoreover it is estimated that will not develop metastases after surgery alone and are the refore over treated with adjuvant chemo therapy identifying the patients at risk of developing metastases as well as thoseresponding to the rapy is a clear unmet need in colon cancer care the developme", "clinicopathological characteristics of patients with colorectal carcinoma characteristic sex male female age years \u2030\u00a5 site of lesi on colon rectum differentiati on poor well tumor size cm \u2030\u00a5 pathological type adeno carcinoma others lymph node metastasis no yes liver metastasis no yes stage iii iiiiv cea normal high ca ' normal high ca ' normal high afisher's exact test all others were as sessed using a \u03c72 test defb 4 a defens in 4 a'''''''''''''''''''''''''''''''''''''''''''''''''''''high n low n 0009 a 0003 a 0575 a 0039 a poor survival furthermore defb 4 a expressi on was upregu'lated in patients with crc with advanced and metastatic cancer patients with crc with high defb 4 a expressi on had poor survival in additi on knockdown of defb 4 a affected the migrati on ability of crc cells tcga data of patients with crc were used to identify the degs between the long os days and short os days groups in additi on mrna expressi on was compared between tumor tissues and normal tissues in the same database defb 4 a was highly expressed in tumors and as sociated with a poor prognosis defb 4 a upregulati on was as sociated with poor prognosis and defb 4 a expressi on was significantly upregulated in patients with large tumors advanced cancer stage lymph node metastasis and liver metastasis another study used the gene expressi on omnibus database to screen genes that are in creased in patients with recurrence hierarchical clustering and pathway analyses revealed that thrombospond in thbs 2 and cart", "1. Heterogeneity of cancer-as sociated stroma according to examined tumor locations The clinicopathological characteristics of the advanced CRC patients are described in. The CRC patients with synchronous metastases had aggressive features in cluding larger tumor size more advanced p T and p N stage and the presence of per ineural and venous in vasi on than the patients with metachronous metastasis (p<0.05)..0091811. t 001 Clinicopathologic characteristics of advanced colorectal cancers. The clinicopathological characteristics of the advanced CRC patients are described in. The CRC patients with synchronous metastases had aggressive features in cluding larger tumor size more advanced p T and p N stage and the presence of per ineural and venous in vasi on than the patients with metachronous metastasis (p<0.05)..0091811. t 001 Clinicopathologic characteristics of advanced colorectal cancers. Parameters Total Metachronous Synchronous P value (n?=?181) (n?=?57) (n?=?124) Age (median range) 60.00 (28\"93) 62.00 (36\"79) 60.00 (28\"93) 0.241 Sex 0.007 Male 97 39 (68.4%) 58 (46.8%) Female 84 18 (31.6%) 66 (53.2%) Locati on 0.055 Right colon 37 6 (10.5%) 31 (25.0%) Left colon 75 29 (50.9%) 46 (37.1%) Rectum 69 22 (38.6%) 47 (37.9%) Size of primary tumor 5.30 (2.0\"13.0) 4.20 (2\"9) 5.50 (2.5\"13) <0.001 Histologic grade 0.227 Low grade 157 52 (91.2%) 105 (84.7%) High grade 24 5 (8.8%) 19 (15.3%) T stage <0.001 T 1 0 0 0 T 2 5 3 (5.3%) 2 (1.6%) T 3 107 45 (78.9%) 62 (50.0%) T 4 69 9 (15.8%) 60 (48.4%) N stage <0.001", "Crowley method The CIs of month and year survival probabilities were calculated based on the Greenwood\u2122s for mula HRs and CIs were estimated by Cox regressi on We did subgroup analyses divided by prespecified baseline patient and disease characteristic variables in cluding RAS status for DCR PFS and OS We also did a prespecified exploratory analysis of potential predictive biomarkers in blood samples We did all analyses with SAS V 94 Patient characteristics Between October and January patients with unresectable metastatic colorectal cancer were enrolled All patients were eligible and received the study medicati on Table summarises the baseline characteristics of all enrolled patients The median number of previous lines of palliative chemo therapy was range \" and patients had received or \u2030\u00a5 prior lines of chemo therapy for metastatic disease respectively The data cut off date was January with median follow up of months IQR \"efficacy The centrally as sessed DCR was CI to one sided p 00001 two patients had a partial response and had a stable disease in cluding unconfirmed PR table figure A total of patients had a reducti on in target lesi on size from baseline figure Time on treatment for all patients is \u2030\u00a5 \u2030\u00a5 Male Female months \u2030\u00a5 months Right sided colon Left sided colorectum Lung Liver Lymph node Per itoneum Age years Sex ECOG per formance status Primary site Number of metastatic site Metastatic an Time from start of first line chemo therapy Number of previous palliative chemo therapy Previous chemo therapy and reas on for discontinuati on Fluoropyrimidine Refractory In tolerant Oxaliplat in Irinotecan TAS 102 trifluridinetipiracil Angiogenesis in hibit or Anti EGFR in hibit or Refractory In tolerant Refractory In tolerant Refractory Refractory In tolerant Refractory In tolerant Iwasa a 0 S et a 0 al ESMO 20205 e 000776 101136 esmo 2020000776 0 c access Table Best response to treatment Complete response Partial response Stable disease Progressive disease Not", "designaimthis study in vestigates the willingness of patients to receive act after detecti on of ctdna postsurgery andthe effect of ctdnaguided act on the rr in stage iicc patientsstudy design the medocccreate trial follows the twics design and is per formed with in the prospective dutch colorectal cancer cohort plcrc wwwplcrcnl plcrc is set up by the dutch colorectal cancer groupdccg and collects clinical data and patient reportedoutcome measures proms at baseline and at multipletime points during followup fig at enrollment patients give in formed consent for use of their clinical data and optionally for receiving quality of life questionnairesfig schematic presentati on of medocccreate using the trial with in cohort twics design a plcrc is a nationwide cohort study in the netherlands with in clusi on of crc patients all stages by optional in formed consent regarding collecti on of biomaterials and futurerandomizati on observational as well as in terventional trials can be per formed with in the cohort b nonmetastatic crc patients are in cluded in medocc when the patient signs in formed consent for plcrc in cluding additional blood sampling blood samples are with drawn before resecti on \" days after resecti on and every months during the first years of followup c eligible stage ii colon cancer patients arerandomized following the twics design in the experimental group in formed consent is being asked for immediate ctdna analysis of the blood sample obtained after resecti on if ctdna is detectable patients are of fered adjuvant chemo therapy the control group is not in formedabout medocccreate and will receive standard of care 0 cschraa bmc cancer page", "cell culture transfecti on and treatmenttwo human crc cell lines highmetastasis lovo cells and lowmetastasis ht 29 cells were obtained from the cell bank of the chinese academy of sciences shanghai branch shanghai china lovo cells were cultured in f 12 k medium gibco waltham ma containing fetal bovine serum fbs gibco and ht 29 cells were cultured in mccoy\u2122s 5 a medium gibco containing fbs at \u2014\u00a6c in an 0 ctang of at mosphere containing co 2 to isolate cscs from lovo or ht 29 cells denoted as lovocscs and ht 29 cscsrespectively four eppendorf tubes were prepared and \u00b5l of cell suspensi on \u2014 cellsml were added to eachtube then \u00b5l of cd 44 antibody ebioscience waltham ma was added to tube \u00b5l of epithelial cell adhesi on molecule epcam antibody ebioscience was added to tube cd 44 and epcam antibody \u00b5l of each were added to tube and no antibodyw as added to tube empty label after min of in cubati on at \u2014\u00a6c the cells were subjected to flow cytometricsorting the isolated cscs were stored in sterile eppendorftubes until use to over express or silence mir 200 c mimics and in hibitors genepharma shanghai china weretransfected into crc cells or colorectal cscs transfectionw as per formed by in cubating cells with mir 200 c mimics or in hibitors at nm for h for experiments in volving atl 1 treatment mg of atl 1 purity \u2030\u00a5 hplcb", "suggest that gli 1 expressi on is negatively correlated with cyslt 2 r pgdh and mucin 2 expressi on but positively with the mucinous status of the patientscyslt 2 r is essential for differentiati on in a colitisassociated colon cancer\"cac\"mouse model to further validate the role of cyslt 2 r in promotingdifferentiati on in crc we adopted an 'ammatorymouse model that was in duced by azoxymethane aomand dextran sodium sulfate dss briefly c 57 bl 6 nwildtype and cysltr 2\u02c6'\u02c6' mice were subjected to aomand two dss cycles 24 as described in the secti on we found that all miceformed polyps in the colon regardless the phenotype butcysltr 2\u02c6'\u02c6' mice n developed significantlargerpolyps \u2030\u00a5 mm p in the colon compared with their wildtype wt n littermates supplementaryfig s 1 b c this result in dicates that cysltr 2\u02c6'\u02c6' micedevelop a more progressive disease supplementary figs 1 shows a representative image of colon polypsfig s 1 d and a likewise representative haemotoxylin and eosinstained imageshowing premalignant areas aberrant cryptfoci and metaplasiaare as from both wt and cysltr 2\u02c6'\u02c6' mice colonfig s 1 ecol on tissue sections from wt mice showed abundantmuc in 2 expressing cells compared with sections from 0 csatapathy on cogenesis page of fig see legend on next pageoncogenesis 0 csatapathy on cogenesis page of see figure on previous pagefig gli 1 expressi on was negatively correlated with differentiati on a qrtpcr analysis of mucin 2 in matched pairs of normal mucosa mwhite and tumour t black tissues from crc patients n b immunohistochemistry ihc images for gli 1 and mucin 2 expressi on in matchedpaired tissue samples from colorectal cancer crc patients with low and highgli 1 expressi on represented at \u2014 magnificati on c quantificati on ofthe staining immunoreactivity by the mean irs for mucin 2 expressi on according to patients with low and highgli 1 expressi on in crc tissued distributi on of tumour type mucinous adenocarcinom as", "in mice a length of the large bowels of mice in each group at week representative bowels from ' in dependent animals are shown b mean length of large bowel of mice in each group p 005 p 001 p 0001 vs control mice sacrificed in group d at week or group d bottom graph c histological score of severity thickness damage and extent of lesions of the colorectums from mice in groups a and c p 005 d large bowels were retrieved at week and from mice in group a to determine the numbers of tumors formed p 005 p 001 e histological analysis of various pathological changes in the colons of mice in group a were determined using hematoxyl in and eosin staining the control groups represents tissues taken at week from group d scale bars '\u00b5m upper and '\u00b5m lower in flammatory cells green arrows and in testinal epithelial cells red arrows are in dicated group a mgkg azoxymethane and dextran sodium sulfate water group c dextran sodium sulfate water aif acute in flammati on cif chronic in flammationp 00001 respectively moreover nf'\u03bab expressi on levels were significantly upregulated in the adeno carcinoma tissue compared with the aif p 00001 and adenoma p 00161 tissues fig 3 dki 67 expressi on levels were observed in the nuclei of iecs and in flammatory cells the ihc revealed that the ki 67 expressi on levels were gradually upregulated across the in testinal lesions in cluding in the aif cif adenoma and 0 cluo tlr 9 promotes colorectal carcinogenesisfigure tlr 9 and nf'\u03bab are simultaneously upregulated as cac develops a ihc was used to analyze the expressi on levels and localizati on of tlr 9 nf'\u03bab and ki 67 in colorectal sections obtained from mice in group a in flammatory cells green arrows and in testinal epithelial cells red arrows are in dicated ihc staining scores of b tlr 9 c ki 67 and d nf'\u03bab in sections of normal control group d aif cif adenoma and adeno carcinoma tissues which were obtained as described in the", "5 fu in colon cancer cells via the pi 3 kakt pathwaycorrespondence to dr xiangbo chen endoscopy center the quanzhou first hospital affiliated to fujian medical university east street licheng quanzhou fujian pr chinaemail coloboyeahnetkey words ginsenoside rg 3 colon cancer 5 fluorouracil pi 3 kakt colon cancer is a comm on malignant tumor of the digestive tract located in the colon which mainly occurs at the juncti on of the rectum and the sigmoid colon statistics show that the highest in cidence of colon cancer is in the age group of years the ratio of male to female is and the in cidence of colon cancer ranks third among all cases of gastrointestinal tumors the 5 year survival rate of patients with colon cancer is approximately yet the 5 year survival rate of patients with advanced stage disease is as low as since the early symptoms of patients with colon cancer are not obvious only about of patients can be diagnosed at the early stage of the disease chemo therapy is one of the most important treatments for patients with advanced colon cancer of which 'fluorouracil 'fu is the most widely used 5 fu in hibits the proliferati on in vasi on and migrati on of tumor cells by in terfering with the nucleic acid metabolism of tumor cells but it is also toxic to normal cells causing serious adverse reactions even endangering the life safety of patients severely limiting its clinical applicati on previous research has shown that 5 fu combined with other agents may reduce the required dosage of 5 fu consequently reducing the adverse reactions caused by 5 fu without affecting or even improving the efficacy of chemo therapy compared with chemical drugs and biopharmaceuticals multicomponent multitarget and less adverse reactions are unique advantages of traditional chinese medicine for the treatment of diseases in patients with colon cancer chinese medicine can improve patient immunity reduce the side effects of radio therapy and chemo therapy or enhance drug sensitivity in hibi", "colorectal cancer crc is the third most comm on cancer type and the second leading cause of cancer death worldwide deaths usually result from recurrent and metastatic disease mostinternational guidelines recommend chemo therapy to reduce the risk of recurrence in stage iii tumors and to prolongsurvival in stage iv cancers conversely chemo therapy isgenerally not used in stage i and most stage ii tumors howeversome patients with low risk stage iii disease may respond wellfollowing courses of chemo therapy that are shorter than the 6 month standard schedule although the definiti on of \u0153lowrisk\u009d has not been well established in this scenario additionally almost of patients who have stage ii tumors and who are the refore considered to have low risk diseaserelapse and eventually die from cancer progressi on the reis currently no accurate biomarker to better define prognosiswith in stage groups the refore biomarkers for prognosticstratificati on in crc have the potential of improving the treatment decisionmaking process we hypothesized thatstudying molecular mechanisms that are known to be in volved in crc development might yield promising novel biomarkersf or this diseasethese modelsformati on mirroring cancer developmentadenomatous polyposis coli apc in activating mutationsare the earliest and most comm on genetic alterations in the adenoma carcinoma sequence thatleads to crc suchmutations result in the accumulati on of caten in with in cells and activati on ofthe wnt signaling pathway animalmodels of apc in activati on demonstrate epithelial transformation and tumor\"the ahcreapcflfl mouse one ofan animal bearing loxpflanked apc alleles and a crerecombinase transgene when this animalis exposed"], "answer": "In vitro models used to study colorectal cancer drug response include human colorectal cancer cell lines such as high-metastasis Lovo cells and low-metastasis HT-29 cells, which are cultured under specific conditions for experimentation (Context 6). Additionally, xenograft models are utilized, such as the colitis-associated colon cancer mouse model induced by azoxymethane and dextran sodium sulfate, which helps in understanding tumor development and drug response (Context 7)."}
{"question": "How do EGFR mutations impact treatment outcomes in NSCLC?", "contexts": ["provide biological in sights into the regulati on of BRAF on cogene dependence and identify strategies to optimize outcomes in BRAF-mutant NSCLC patients. On cogenic mutations in the BRAF kinase occur in 6\"8% of nonsmall cell lung cancers (NSCLCs) accounting for more than 90000 deaths annually worldwide. The biological and clinical relevance of these BRAF mutations in NSCLC is in completely under stood. Here we demonstrate that human NSCLC cells with BRAFV 600 E but not other BRAF mutations in itially are sensitive to BRAF-in hibit or treatment. However these BRAFV 600 E NSCLC cells rapidly acquire resistance to BRAF in hibiti on through at least one of two discrete molecular mechanisms: (i) loss of full-length BRAFV 600 E coupled with expressi on of an aberrant form of BRAFV 600 E that retains RAF pathway dependence or (ii) constitutive autocrine EGF recept or (EGFR) signaling driven by c-Jun\"mediated EGFR ligand expressi on. BRAFV 600 E cells with EGFR-driven resistance are characterized by hyperphosphorylated prote in kinase AKT\"", "of a prospective randomized trial highlighting the challenges of retrospectively validating a compani on diagnostic assay after the pivotal drug trials have been completed. The anti-EGFR TKI erlotinib was in itially approved for all patients with advanced NSCLC who had progressed on first-line chemo therapy. A number of subsequent studies determined that patients with EGFR-mutant NSCLC had a high likelihood of responding to these TKI leading to trials in the first-line setting for EGFR-mutant cancer. Four prospective randomized clinical trials studied in Asian populations demonstrated that erlotinib and gefitinib resulted in improved progressi on-free survival compared to chemo therapy for first line the rapy in NSCLC patients with EGFR mutations. Other clinical studies in mixed ethnicity cohorts have concluded with similar C had a high likelihood of responding to these TKI leading to trials in the first-line setting for EGFR-mutant cancer. Four prospective randomized clinical trials studied in Asian populations demonstrated that erlotinib and gefitinib resulted in improved progressi on-free survival compared to chemo therapy for first line the rapy in NSCLC patients with EGFR mutations. Other clinical studies in mixed ethnicity cohorts have concluded with similar. The EURTAC trial was a randomized phase 3 trial to as sess the safety and efficacy of erlotinib compared with standard platinum-based chemo therapy for first-line treatment of a patient populati on with advanced EGFR-mutati on detected NSCLC in a largely Caucasian populati on of European patients. Erlotinib-treated patients experienced significant improvements in median PFS (9.7 months vs. 5.2 months) compared to chemo therapy. Patients on the erlotinib arm also had a considerably higher per centage of responses (58% vs. 15%) in the in tent-to-treat populati on. This trial has been submitted for first line in dicati on of erlotinib in EGFR mutated NSCLC patients. The majority of activating EGFR mutations ", "of a prospective randomized trial highlighting the challenges of retrospectively validating a compani on diagnostic assay after the pivotal drug trials have been completed. The anti-EGFR TKI erlotinib was in itially approved for all patients with advanced NSCLC who had progressed on first-line chemo therapy. A number of subsequent studies determined that patients with EGFR-mutant NSCLC had a high likelihood of responding to these TKI leading to trials in the first-line setting for EGFR-mutant cancer. Four prospective randomized clinical trials studied in Asian populations demonstrated that erlotinib and gefitinib resulted in improved progressi on-free survival compared to chemo therapy for first line the rapy in NSCLC patients with EGFR mutations. Other clinical studies in mixed ethnicity cohorts have concluded with similar C had a high likelihood of responding to these TKI leading to trials in the first-line setting for EGFR-mutant cancer. Four prospective randomized clinical trials studied in Asian populations demonstrated that erlotinib and gefitinib resulted in improved progressi on-free survival compared to chemo therapy for first line the rapy in NSCLC patients with EGFR mutations. Other clinical studies in mixed ethnicity cohorts have concluded with similar. The EURTAC trial was a randomized phase 3 trial to as sess the safety and efficacy of erlotinib compared with standard platinum-based chemo therapy for first-line treatment of a patient populati on with advanced EGFR-mutati on detected NSCLC in a largely Caucasian populati on of European patients. Erlotinib-treated patients experienced significant improvements in median PFS (9.7 months vs. 5.2 months) compared to chemo therapy. Patients on the erlotinib arm also had a considerably higher per centage of responses (58% vs. 15%) in the in tent-to-treat populati on. This trial has been submitted for first line in dicati on of erlotinib in EGFR mutated NSCLC patients. The majority of activating EGFR mutations ", "Following failure of chemo therapy and erlotinib treatment options are limited for patients with advanced non\"small cell lung cancer (NSCLC). Reversible epidermal growth fact or recept or (EGFR) tyrosine kinase in hibitors (TKIs) such as erlotinib and gefitinib selectively target EGFR/HER 1 one of the members of the human epidermal growth fact or recept or (HER) family and are most effective in cancers harboring EGFR mutations. The remaining members of the HER family comprise HER 2 and HER 4 tyrosine kinases and the kinase? null HER 3.1 HER family members act to gether via hetero? and homodimerizati on to enable downstream signaling pathways modulating a range of cellular activities in cluding growth proliferati on differentiati on and migrati on.1 In contrast to patients with EGFR? mutati on? positive tumors patients with KRAS? mutant NSCLC are unlikely to respond to gefitinib or erlotinib and do not have an improved progressi on? free survival (PFS) compared with those who have placebo following erlotinib the rapy.2 Dacomitinib (PF?00299804) is a potent irreversible oral small? molecule in hibit or of HER 1/EGFR HER 2 and HER 4 tyrosine kinases with antitum or activity in both gefitinib? sensitive and gefitinib? resistant in cluding EGFR T 790 M preclinical NSCLC models.3 Dacomitinib demonstrated encouraging antitum or activity against NSCLC in Western and Japanese patients in phase 1 studies 5 further supported by preliminary data from phase 2 NSCLC studies conducted in Asian patients with KRAS wild? type refractory disease 7; unselected patients previously treated with chemo therapy 8; and patients with EGFR? mutant disease (first? line treatment).9 This phase 2 trial (Clinical Trials. gov identifier NCT 00548093) as sessed the efficacy safety and impact on health? related quality of life (HRQo L) of dacomitinib in patients with KRAS wild? type NS CLC who progressed after 1 or 2 chemo therapy regimens and erlotinib.", "Cetuximab is a monoclonal antibody that targets EGFR which is also used in advanced NSCLC in combinati on with standard chemo therapy as part of first-line treatment. Like erlotinib afatinib is a drug that blocks the growth signal from EGFR and used for advanced NSCLCs that have mutations in the EGFR gene. Some younger non-smokers with adenocarcinom as are found to have an ALK/EML 4 fusi on on cogene which is currently a target for the drug Crizotinib. Other drugs currently used to treat lung cancers are not gene-specific and in stead target general molecular pathways like folate anitmetabolites (methotrexate and pemetrexed) mitotic in hibitors (docetaxel piclitaxel and vinorelbine) to poisomerase in hibitors (etopophos and to potecan) and nucleoside analogs which in terfere with DNA synthesis (carboplat in cisplat in and gemciabine). In hibitors of EGFR-directed tyrosine kinase are established to be an effective treatment opti on for advanced NSCLC not responding to chemo therapy. However EGFR-directed monoclonal antibodies in combinati on with platinum-based first-line chemo therapy cetuximab combined with cisplat in/vinorelbine and bevacizumab in combinati on with platinum-based chemo therapy resulted in better survival compared to chemo therapy alone in patients with advanced EGFR-positive NSCLC. Other targeted the rapies in cluding dual and multi-kinase in hibitors are in earlier stages of clinical development. With the accumulati on of knowledge and experience in next generati on technologies it is necessary to expand our under standing in the sensitivity of specific mutations to in dividualized the rapies. \"", "Lung cancer is the leading cause of cancer-related death in many countries in cluding the China. Non-small cell lung cancer (NSCLC) accounts for up to 80% of all lung cancer cases; patients typically present with advanced disease at the time of diagnosis. The prognosis of patients with advanced lung cancer remains poor and recent studies show that conventional the rapies may have reached a the rapeutic plateau as evidenced by the 5-year survival rate for NSCLCs which remains at 15%. The EGF recept or tyrosine kinase in hibitors (EGFR-TKIs) gefitinib and erlotinib have shown marked the rapeutic effects against NSCLCs with EGFR activating mutations such as exon 19 deletions and L 858 R point mutations. Almost all tumors however acquire resistance to EGFR-TKIs after varying per iods of time. Comm on mechanisms for acquired resistance in clude emergence of an EGFR gatekeeper mutati on (T 790 M) and MET gene amplificati on. In additi on PIK 3 CA mutations as well as KRAS mutations have been found to contribute to EGFR-TKIs resistance in a subpopulati on of tumors. The limited the rapeutic options currently available for patients with advanced lung cancer create a pressing need to identify new the rapeutic strategy. Selumetinib (AZD 6244) is an oral non-ATP competitive in hibit or and highly specific for extracellular signal-regulated kinase (ERK) kinase (MEK)1/2 a key enzyme in the RAS-RAF-MEK-ERK pathway.", "Lung cancer represents the most frequent cause of cancer deaths. More than 225000 new cases were diagnosed during 2012 only in the United States of America accounting for approximately 160000 annual deaths. More than 50% of the patients diagnosed with non-small cell lung cancer (NSCLC) present advanced disease (stage III and IV) at onset. The most comm on histology is adeno carcinoma representing approximately 80% of all cases. Pemetrexed is a multitargeted antifolate drug and one of the latest active drugs against NSCLC approved for the first-line (in combinati on with cisplat in) and second-line treatment (mono therapy) of patients with non-squamous histology. More recently pemetrexed gained approval for its use as a single-agent maintenance the rapy after response/stabilizati on to four cycles of a platinum doublet with or without pemetrexed. Thymidylate synthase (TS) is the main biological target of antifolate drugs such as pemetrexed or 5-fluorouracil. Different studies have evaluated the correlati on between tumor TS expressi on and TS genotype and the prognosis of patients with different cancer types treated with antifolates. In NSCLC constitutive expressi on of TS is lower in tumors with adeno carcinoma histology than among those with squamous differentiati on. This finding could possibly expla in the higher efficacy of the drug among non-squamous histology patients. The potential predictive role of TS polymorphisms in NSCLC has never been studied in a European populati on. In additi on how differential TS genotypes may impact on the outcome of patients depending on their smoking status or with Epidermal Growth Fact or Recept or (EGFR) activating mutations tumors is to be determined. Finally although the to xicity profile described in most patients receiving pemetrexed in combinati on or as a single agent is usually favorable there are several reported cases of fundamentally dermatological hematological and potentially serious renal to xicities even when the", "This in dicates the necessity of sequencing in dividual human lung cancers in order to match the use of a single targeted drug or two or more targeted drugs in combinati on against in dividual lung cancer-specific mutations. In this study we have used Ion Ampliseq Cancer Panel to sequence 13500 loci in 45 cancer-related genes mainly on cogenes and tumor suppress or genes of 76 human lung cancer samples. We identified frequent mutations in a group of genes in cluding EGFR KRAS and TP 53 (). Although most of these genes were already known to be as sociated with lung cancers the mutated points and the as sociated mutations in other genes were different in our sample set (Tables 7). As there is in creasing awareness about the changes in lung cancer cells in recent times newer drugs that specifically target these changes have been developed. These targeted drugs either work synergistically with the chemo therapy drugs or by the mselves with much lesser to xicity due to a selective effect as an alternative to a more systemic modulati on of proteins as sociated with on cogenesis. EGFR in hibitors (Afatinib Erlotinib and Gefitinib) and VEGF in hibitors (Bevacizumab) are currently used for target the rapies for NSCLC patients with mutations in the VEGF and EGFR. Erlotinib is a drug that blocks EGFR from signaling the cell to grow. It prevents the progressi on of lung cancer specifically in non-smoking women and is mostly used in advanced NSCLC treatment that was not responsive to chemo therapy. It is also used as the first treatment in patients whose cancers have a mutati on in the EGFR gene.", "Our group has under taken a randomized phase 3 trial to compare gefitinib plus carboplat in plus pemetrexed with gefitinib mono therapy for patients with NSCLC with an exon 19 deleti on or an L 858 R G 719 X or L 861 Q EGFR mutati on (NEJ 009; University Hospital Medical In formati on Network Clinical Trials Registry [UMIN-CTR] number UMIN 000006340). The data from this study will advance the treatment of NSCLC with uncomm on EGFR mutations. In our post-hoc analysis clearly demonstrated shorter survival of TKI-treated patients with uncomm on EGFR mutations compared with survival of those with comm on EGFR mutations. Furthermore the data suggest that the first-line chemo therapy may be relatively effective for NSCLC with uncomm on EGFR mutations. ACKNOWLEDGMENTS Special thanks to Hiromi Odagiri for her expert as sistance with data collecti on and management. This study was supported by the Tokyo Cooperative On cology Group. The first two authors contributed equally to this work. Disclosure: Dr. Yoshizawa received grants and lecture fees from Astra Zeneca; Dr. Maemondo received lecture fees from Astra Zeneca and Chugai; Dr. Inoue received lecture fees from Astra Zeneca and Chugai; Dr. Gemma received grants and lecture fees from Astra Zeneca; Dr. Hagiwara received patent fees from Mitsubishi Chemical Medience consulting fees and lecture fees from Astra Zeneca; Dr. Kobayashi received grants from Novartis Nihon Kayaku Chugai Shionogi Kyowa Kirin Yakult Taiho and Astra Zeneca and lecture fees from Astra Zeneca Chugai and Bristol-Myers Squibb. The remaining authors declare no", ". EGFR mutations analysis As per in stitutional protocol all patients with advanced NSCLC were tested for EGFR activating mutations before treatment in itiati on. In brief after having the samples fixed in alcohol and stained by Papanicolau stain DNA was extracted and amplified by PCR technique using EGFR gene exons 1819 20 and 21 specific primers. ABI PRISM\u00ae 310 Genetic Analyzer equipment was used for the analysis of the sequencing reactions with both for ward and reverse primers. Statistical analysis Fisher\u2122s exact test was used to in vestigate the correlati on between each genotype and the response to the treatment and the to xicity presented. Kaplan-Meier curves and log-rank test or Tarone-Ware test when in dicated were calculated to correlate each genotype with the survival outcomes (PFS and OS). For the subgroup analysis EGFR mutati on status and smoking history were considered in order to analyze potential differences in clinical outcome measures (ORR PFS and OS). The SPSS 15.0 software (SPSS Inc. Chicago IL) was employed to per form the statistical analysis. Patients\u2122 characteristics and treatment The clinical and pathological characteristics of the patients in cluded are summarized in. In brief our cohort was mainly composed by males with a median age of 59 years and a past smoking history showing good per formance status. Most of the patients showed adeno carcinoma histology (88%) and showed distant metastasis (M 1) at onset (72%). Most of the patients received a pemetrexed-based regimen in first line (84%). After a median follow up of 21 months 80% of patients have already progressed and 52% of them have died due to disease progressi on ()."], "answer": "EGFR mutations significantly impact treatment outcomes in non-small cell lung cancer (NSCLC). Patients with EGFR-mutant NSCLC have a high likelihood of responding to EGFR tyrosine kinase inhibitors (TKIs) such as erlotinib and gefitinib, leading to improved progression-free survival (PFS) compared to chemotherapy. For instance, the EURTAC trial demonstrated that erlotinib-treated patients had a median PFS of 9.7 months versus 5.2 months for those receiving chemotherapy, with a higher response rate of 58% compared to 15% in the chemotherapy group. However, resistance to EGFR TKIs often develops, commonly due to mutations like T790M or other mechanisms, which limits treatment options after initial therapy. Overall, the presence of EGFR mutations is a critical factor in determining the effectiveness of targeted therapies in NSCLC."}
{"question": "What is the role of KRAS mutations in lung cancer therapy resistance?", "contexts": [". In additi on because HGF over expressi on was frequently observed in tumors with the gatekeeper T 790 M mutati on mono therapy with a mutant-selective EGFR-TKI may not be sufficient to in hibit the growth of tumors with acquired resistance to gefitinib. Our findings suggest that the combinati on of a MEK-TKI and a PIK 3/m TOR-TKI may be effective in controlling these resistant tumors. Many KRAS-mutant cancer cells have been shown to be sensitive to MEK in hibitors and KRAS mutations can be detected in up to 30% of lung cancers dependent upon histology and ethnicity suggesting that a subset of lung cancers would likely be highly sensitive to AZD 6244. Our finding that AZD 6244 was effective in one distinct KRAS mutant human lung cancer NCI-H 460 models supports and validates this hypothesis. Although mono therapy with AZD 6244 resulted in antitum or and some antiangiogenic effects in all of our lung cancer models the antitum or effects were more apparent in the NCI-H 1993 lung adeno carcinoma model. The in creased antitum or efficacy observed in this model is as sociated with differences in the in hibitory effect of p-AKT signaling pathway in NCI-H 1975 and NCI-H 460 lung tumors. However additional studies are needed to elucidate this phenomen on. In this study we evaluated the rapy directed against MEK and PI 3 K/m TOR in distinct gefitinib-resistant NSCLC xenograft models. MEK or PI 3 K/m TOR in hibiti on resulted in antitum or effects for these gefitinib-resistance NSCLC models by blocking key in tracellular pathways controlling cell proliferati on and survival as demonstrated both in vitro and in vivo. Surprisingly PI 3 K/m TOR in hibiti on by BEZ 235 also suppressed lung tumor angiogenesis and targeted both MEK and PI 3 K/m TOR activati on in lung tumors resulting in substantial antiangiogenic effects which may due to the significantly reduced expressi on of MMP-9 in tumors. \"", "Lung cancer is the leading cause of cancer-related death in many countries in cluding the China. Non-small cell lung cancer (NSCLC) accounts for up to 80% of all lung cancer cases; patients typically present with advanced disease at the time of diagnosis. The prognosis of patients with advanced lung cancer remains poor and recent studies show that conventional the rapies may have reached a the rapeutic plateau as evidenced by the 5-year survival rate for NSCLCs which remains at 15%. The EGF recept or tyrosine kinase in hibitors (EGFR-TKIs) gefitinib and erlotinib have shown marked the rapeutic effects against NSCLCs with EGFR activating mutations such as exon 19 deletions and L 858 R point mutations. Almost all tumors however acquire resistance to EGFR-TKIs after varying per iods of time. Comm on mechanisms for acquired resistance in clude emergence of an EGFR gatekeeper mutati on (T 790 M) and MET gene amplificati on. In additi on PIK 3 CA mutations as well as KRAS mutations have been found to contribute to EGFR-TKIs resistance in a subpopulati on of tumors. The limited the rapeutic options currently available for patients with advanced lung cancer create a pressing need to identify new the rapeutic strategy. Selumetinib (AZD 6244) is an oral non-ATP competitive in hibit or and highly specific for extracellular signal-regulated kinase (ERK) kinase (MEK)1/2 a key enzyme in the RAS-RAF-MEK-ERK pathway.", "This in dicates the necessity of sequencing in dividual human lung cancers in order to match the use of a single targeted drug or two or more targeted drugs in combinati on against in dividual lung cancer-specific mutations. In this study we have used Ion Ampliseq Cancer Panel to sequence 13500 loci in 45 cancer-related genes mainly on cogenes and tumor suppress or genes of 76 human lung cancer samples. We identified frequent mutations in a group of genes in cluding EGFR KRAS and TP 53 (). Although most of these genes were already known to be as sociated with lung cancers the mutated points and the as sociated mutations in other genes were different in our sample set (Tables 7). As there is in creasing awareness about the changes in lung cancer cells in recent times newer drugs that specifically target these changes have been developed. These targeted drugs either work synergistically with the chemo therapy drugs or by the mselves with much lesser to xicity due to a selective effect as an alternative to a more systemic modulati on of proteins as sociated with on cogenesis. EGFR in hibitors (Afatinib Erlotinib and Gefitinib) and VEGF in hibitors (Bevacizumab) are currently used for target the rapies for NSCLC patients with mutations in the VEGF and EGFR. Erlotinib is a drug that blocks EGFR from signaling the cell to grow. It prevents the progressi on of lung cancer specifically in non-smoking women and is mostly used in advanced NSCLC treatment that was not responsive to chemo therapy. It is also used as the first treatment in patients whose cancers have a mutati on in the EGFR gene.", "provide biological in sights into the regulati on of BRAF on cogene dependence and identify strategies to optimize outcomes in BRAF-mutant NSCLC patients. On cogenic mutations in the BRAF kinase occur in 6\"8% of nonsmall cell lung cancers (NSCLCs) accounting for more than 90000 deaths annually worldwide. The biological and clinical relevance of these BRAF mutations in NSCLC is in completely under stood. Here we demonstrate that human NSCLC cells with BRAFV 600 E but not other BRAF mutations in itially are sensitive to BRAF-in hibit or treatment. However these BRAFV 600 E NSCLC cells rapidly acquire resistance to BRAF in hibiti on through at least one of two discrete molecular mechanisms: (i) loss of full-length BRAFV 600 E coupled with expressi on of an aberrant form of BRAFV 600 E that retains RAF pathway dependence or (ii) constitutive autocrine EGF recept or (EGFR) signaling driven by c-Jun\"mediated EGFR ligand expressi on. BRAFV 600 E cells with EGFR-driven resistance are characterized by hyperphosphorylated prote in kinase AKT\"", "Following failure of chemo therapy and erlotinib treatment options are limited for patients with advanced non\"small cell lung cancer (NSCLC). Reversible epidermal growth fact or recept or (EGFR) tyrosine kinase in hibitors (TKIs) such as erlotinib and gefitinib selectively target EGFR/HER 1 one of the members of the human epidermal growth fact or recept or (HER) family and are most effective in cancers harboring EGFR mutations. The remaining members of the HER family comprise HER 2 and HER 4 tyrosine kinases and the kinase? null HER 3.1 HER family members act to gether via hetero? and homodimerizati on to enable downstream signaling pathways modulating a range of cellular activities in cluding growth proliferati on differentiati on and migrati on.1 In contrast to patients with EGFR? mutati on? positive tumors patients with KRAS? mutant NSCLC are unlikely to respond to gefitinib or erlotinib and do not have an improved progressi on? free survival (PFS) compared with those who have placebo following erlotinib the rapy.2 Dacomitinib (PF?00299804) is a potent irreversible oral small? molecule in hibit or of HER 1/EGFR HER 2 and HER 4 tyrosine kinases with antitum or activity in both gefitinib? sensitive and gefitinib? resistant in cluding EGFR T 790 M preclinical NSCLC models.3 Dacomitinib demonstrated encouraging antitum or activity against NSCLC in Western and Japanese patients in phase 1 studies 5 further supported by preliminary data from phase 2 NSCLC studies conducted in Asian patients with KRAS wild? type refractory disease 7; unselected patients previously treated with chemo therapy 8; and patients with EGFR? mutant disease (first? line treatment).9 This phase 2 trial (Clinical Trials. gov identifier NCT 00548093) as sessed the efficacy safety and impact on health? related quality of life (HRQo L) of dacomitinib in patients with KRAS wild? type NS CLC who progressed after 1 or 2 chemo therapy regimens and erlotinib.", "Immuno therapy manipulates the immune system to control and eradicate cancer. Many recent studies provide evidence suggesting that immunotherapeutic manipulations are viable in many tumor types in cluding lung cancer. Numerous trials of peptide vaccines autologous cellular the rapy T cell-directed antibody the rapy and monoclonal antibody the rapy for lung cancer have been carried out around the world (8\"10) and some of them have shown favorable (11\"13). The EML 4-ALK fusi on gene was identified in NSCLC patients by a team led by Profess or H. Mano. This fusi on gene was formed as the result of a small in versi on with in the short arm of chromosome 2 that joins differing portions of the EML 4 gene with a porti on of the ALK gene. As a result of this fusi on constant dimerizati on of the kinase doma in of ALK is in duced and its catalytic activity in creases consequently. The EML 4-ALK fusi on gene is mainly identified in young never/former light smokers with NSCLC. It is estimated that approximately 5% of all NSCLC cases have this fusi on gene. A few reports have also identified EML 4-ALK in other cancers namely breast cancer and colorectal cancer. For the most part the EML 4-ALK fusi on gene and other mutations such as those in EGFR and KRAS are mutually exclusive. The chromosomal in versi on does not always occur in the same locati on and multiple EML 4-ALK variants have been identified. At least 11 variants have been reported. The most comm on variants are E 13; A 20 (variant 1) and E 6 a/b; A 20 (variant 3 a/b) which have been detected in 33% and 29% of NSCLC patients respectively. PF-02341066 (crizotinib) is an ALK in hibit or currently under clinical development.", "Immuno therapy manipulates the immune system to control and eradicate cancer. Many recent studies provide evidence suggesting that immunotherapeutic manipulations are viable in many tumor types in cluding lung cancer. Numerous trials of peptide vaccines autologous cellular the rapy T cell-directed antibody the rapy and monoclonal antibody the rapy for lung cancer have been carried out around the world (8\"10) and some of them have shown favorable (11\"13). The EML 4-ALK fusi on gene was identified in NSCLC patients by a team led by Profess or H. Mano. This fusi on gene was formed as the result of a small in versi on with in the short arm of chromosome 2 that joins differing portions of the EML 4 gene with a porti on of the ALK gene (1415). As a result of this fusi on constant dimerizati on of the kinase doma in of ALK is in duced and its catalytic activity in creases consequently. The EML 4-ALK fusi on gene is mainly identified in young never/former light smokers with NSCLC (16). It is estimated that approximately 5% of all NSCLC cases have this fusi on gene. A few reports have also identified EML 4-ALK in other cancers namely breast cancer and colorectal cancer (1718). For the most part the EML 4-ALK fusi on gene and other mutations such as those in EGFR and KRAS are mutually exclusive (19). The chromosomal in versi on does not always occur in the same locati on and multiple EML 4-ALK variants have been identified (19). At least 11 variants have been reported. The most comm on variants are E 13; A 20 (variant 1) and E 6 a/b; A 20 (variant 3 a/b) which have been detected in 33% and 29% of NSCLC patients respectively (14). PF-02341066 (crizotinib) is an ALK in hibit or currently under clinical development.", "with a 96.3% overall agreement. The clinical outcome of patients who were EGFR-mutati on detected by the EGFR PCR test was very similar to the entire EURTAC cohort. The concordance between the EGFR PCR test and Sanger sequencing was 90.6%. In 78.9% of the discordant samples the EGFR PCR test result was confirmed by a sensitive deep sequencing assay. This retrospective study demonstrates the clinical utility of the EGFR PCR test in the accurate selecti on of patients for anti-EGFR TKI the rapy. The EGFR PCR test demonstrated improved per formance relative to Sanger sequencing. This study was funded by Roche. The funders contributed to the study design data collecti on analysis decisi on to publish and preparati on of the manuscript. The efficacy of many novel targeted cancer the rapies can be predicted by the detecti on of specific biomarkers in the tumor. The FDA has in dicated that if the identificati on of a specific biomarker is required for the safe and efficacious administrati on of a drug a well-validated FDA approved compani on diagnostic assay is required for that drug. The optimal approval path for a new targeted the rapy and its compani on diagnostic is a parallel clinical development process that in volves clinical trials for the in vestigational agent where the in vestigational diagnostic test is used to either select patients for the trials or to predict response to treatment and ends ideally with simultaneous health authority approval of the drug and the compani on diagnostic. Successful examples of this in clude the co-development (and co-approval) of the BRAF in hibit or vemurafenib and its compani on diagnostic BRAF V 600 E mutati on assay for BRAF-mutant metastatic melanoma and the ALK in hibit or crizotinib and its compani on diagnostic ALK fusi on gene test in advanced ALK-fusi on positive non-small cell lung cancer (NSCLC) patients. However in some cases predictive biomarkers for a targeted the rapy are not recognized until after the drug is fir", ". Using the Ion To rrent Ampliseq Cancer Panel we sequenced 737 loci from 45 cancer-related genes to identify genetic mutations in 76 human lung cancer samples. The sequencing analysis revealed missense mutations in KRAS EGFR and TP 53 genes in the breast cancer samples of various histologic types. Thus this study demonstrates the necessity of sequencing in dividual human cancers in order to develop per sonalized drugs or combinati on the rapies to effectively target in dividual breast cancer-specific mutations. This research was supported by the grants from National Natural Science Foundati on of China the Wu Jieping Foundati on and the National In stitute of Health (R 01 CA 90427 & R 01 AI 084811 to SY Chen). The funders had no role in study design data collecti on and analysis decisi on to publish or preparati on of the manuscript. Lung cancer is the most comm on malignancy worldwide and also the leading cause of cancer related deaths. In 2008 an estimated 1.61 milli on new cases were reported globally accounting for 12.7% of all new cancers. Additionally roughly 1.38 milli on deaths (18.2% of total cancer deaths) were reported around the world. In China lung cancer has the highest in cidence of all new cancer cases in both men and women (21.7% in 2008) with more than a 24.9% mortality rate. Women in China reported only a slightly higher in cidence of lung cancer over breast cancer this same year; however the mortality rate of lung cancer is more than 3 times higher than that of breast cancer (20.2% vs. 6.1% respectively). Lung cancer often exhibits non-specific symptoms and diagnosis often occurs at an advanced stage or after metastasis has already occurred. While efforts continue to improve early diagnosis and treatment of lung cancer the staggering in cidence poor prognosis and considerable mortality rate prevails. The leading cause of lung cancer is cigarette smoking and in creased exposure is directly correlated with an in creased risk of developing lung can", "Cetuximab is a monoclonal antibody that targets EGFR which is also used in advanced NSCLC in combinati on with standard chemo therapy as part of first-line treatment. Like erlotinib afatinib is a drug that blocks the growth signal from EGFR and used for advanced NSCLCs that have mutations in the EGFR gene. Some younger non-smokers with adenocarcinom as are found to have an ALK/EML 4 fusi on on cogene which is currently a target for the drug Crizotinib. Other drugs currently used to treat lung cancers are not gene-specific and in stead target general molecular pathways like folate anitmetabolites (methotrexate and pemetrexed) mitotic in hibitors (docetaxel piclitaxel and vinorelbine) to poisomerase in hibitors (etopophos and to potecan) and nucleoside analogs which in terfere with DNA synthesis (carboplat in cisplat in and gemciabine). In hibitors of EGFR-directed tyrosine kinase are established to be an effective treatment opti on for advanced NSCLC not responding to chemo therapy. However EGFR-directed monoclonal antibodies in combinati on with platinum-based first-line chemo therapy cetuximab combined with cisplat in/vinorelbine and bevacizumab in combinati on with platinum-based chemo therapy resulted in better survival compared to chemo therapy alone in patients with advanced EGFR-positive NSCLC. Other targeted the rapies in cluding dual and multi-kinase in hibitors are in earlier stages of clinical development. With the accumulati on of knowledge and experience in next generati on technologies it is necessary to expand our under standing in the sensitivity of specific mutations to in dividualized the rapies. \""], "answer": "KRAS mutations contribute to resistance against EGFR tyrosine kinase inhibitors (TKIs) in non-small cell lung cancer (NSCLC). Patients with KRAS-mutant NSCLC are unlikely to respond to treatments like gefitinib or erlotinib, which are effective in cancers with EGFR mutations. Additionally, KRAS mutations can be detected in up to 30% of lung cancers, indicating that a subset of these tumors may be sensitive to MEK inhibitors, such as selumetinib (AZD 6244), which has shown effectiveness in certain KRAS mutant lung cancer models. However, the presence of KRAS mutations generally limits the therapeutic options available for these patients, highlighting the need for alternative strategies in treating advanced lung cancer."}
{"question": "What mechanisms contribute to acquired resistance to EGFR inhibitors in lung cancer?", "contexts": ["Lung cancer is the leading cause of cancer-related death in many countries in cluding the China. Non-small cell lung cancer (NSCLC) accounts for up to 80% of all lung cancer cases; patients typically present with advanced disease at the time of diagnosis. The prognosis of patients with advanced lung cancer remains poor and recent studies show that conventional the rapies may have reached a the rapeutic plateau as evidenced by the 5-year survival rate for NSCLCs which remains at 15%. The EGF recept or tyrosine kinase in hibitors (EGFR-TKIs) gefitinib and erlotinib have shown marked the rapeutic effects against NSCLCs with EGFR activating mutations such as exon 19 deletions and L 858 R point mutations. Almost all tumors however acquire resistance to EGFR-TKIs after varying per iods of time. Comm on mechanisms for acquired resistance in clude emergence of an EGFR gatekeeper mutati on (T 790 M) and MET gene amplificati on. In additi on PIK 3 CA mutations as well as KRAS mutations have been found to contribute to EGFR-TKIs resistance in a subpopulati on of tumors. The limited the rapeutic options currently available for patients with advanced lung cancer create a pressing need to identify new the rapeutic strategy. Selumetinib (AZD 6244) is an oral non-ATP competitive in hibit or and highly specific for extracellular signal-regulated kinase (ERK) kinase (MEK)1/2 a key enzyme in the RAS-RAF-MEK-ERK pathway.", "1993 NCI-1975 and NCI-H 460 xenograft models. All three gefitinib-resistant tumor xenograft models were treated with the AZD 6244 and/or BEZ 235 for 2 h on Day 21 of the efficacy study tumor tissues in each group were resected and measured by caspase colorimetric protease kits. N?=?10. Although advances have been made in cancer treatment with the development of selective molecular targeted the rapies several relevant issues for their optimal and effective use rema in unsolved. Recent studies have demonstrated that the EGFR-TKI gefitinib and erlotinib are as sociated with a high response rate and prolong progressi on-free survival in patients with EGFR mutant lung cancer. Responders to these agents however later relapse after acquiring EGFR-TKI resistance making it urgent to develop novel the rapeutic agents that can over come acquired resistance to EGFR-TKI. Current clinical approaches to comb at resistance in lung adeno carcinoma in clude irreversible and mutant-selective in hibitors of EGFR combinati on of cetuximab and afatinib and combinati on of an EGFR in hibit or with a drug targeting a resistance pathway such as the combinati on of gefitinib and a MET in hibit or. However alternative RTK pathways that are activated following EGFR in hibiti on are another area for in vestigati on. These alternative pathways may by pass or evade in hibiti on of EGFR signaling the reby enabling combinations of agents to simultaneously at tack multiple molecular targets for cancer growth in hibiti on. One potential soluti on to over come multiple mechanisms of resistance is to target downstream pathways. In this study we show that the combinati on of a selective MEK in hibit or and a PI 3 K/m TOR in hibit or is effective against tumor cell lines refractory to gefitinib by three different mechanisms: an EGFR gatekeeper T 790 M mutati on MET amplificati on and KRAS/PIK 3 CA mutati on. To our knowledge this is the first report of the effects of MEK TKI with PI 3 K/m TOR TKI the rap", "provide biological in sights into the regulati on of BRAF on cogene dependence and identify strategies to optimize outcomes in BRAF-mutant NSCLC patients. On cogenic mutations in the BRAF kinase occur in 6\"8% of nonsmall cell lung cancers (NSCLCs) accounting for more than 90000 deaths annually worldwide. The biological and clinical relevance of these BRAF mutations in NSCLC is in completely under stood. Here we demonstrate that human NSCLC cells with BRAFV 600 E but not other BRAF mutations in itially are sensitive to BRAF-in hibit or treatment. However these BRAFV 600 E NSCLC cells rapidly acquire resistance to BRAF in hibiti on through at least one of two discrete molecular mechanisms: (i) loss of full-length BRAFV 600 E coupled with expressi on of an aberrant form of BRAFV 600 E that retains RAF pathway dependence or (ii) constitutive autocrine EGF recept or (EGFR) signaling driven by c-Jun\"mediated EGFR ligand expressi on. BRAFV 600 E cells with EGFR-driven resistance are characterized by hyperphosphorylated prote in kinase AKT\"", "This in dicates the necessity of sequencing in dividual human lung cancers in order to match the use of a single targeted drug or two or more targeted drugs in combinati on against in dividual lung cancer-specific mutations. In this study we have used Ion Ampliseq Cancer Panel to sequence 13500 loci in 45 cancer-related genes mainly on cogenes and tumor suppress or genes of 76 human lung cancer samples. We identified frequent mutations in a group of genes in cluding EGFR KRAS and TP 53 (). Although most of these genes were already known to be as sociated with lung cancers the mutated points and the as sociated mutations in other genes were different in our sample set (Tables 7). As there is in creasing awareness about the changes in lung cancer cells in recent times newer drugs that specifically target these changes have been developed. These targeted drugs either work synergistically with the chemo therapy drugs or by the mselves with much lesser to xicity due to a selective effect as an alternative to a more systemic modulati on of proteins as sociated with on cogenesis. EGFR in hibitors (Afatinib Erlotinib and Gefitinib) and VEGF in hibitors (Bevacizumab) are currently used for target the rapies for NSCLC patients with mutations in the VEGF and EGFR. Erlotinib is a drug that blocks EGFR from signaling the cell to grow. It prevents the progressi on of lung cancer specifically in non-smoking women and is mostly used in advanced NSCLC treatment that was not responsive to chemo therapy. It is also used as the first treatment in patients whose cancers have a mutati on in the EGFR gene.", "1993 NCI-1975 and NCI-H 460 xenograft models. All three gefitinib-resistant tumor xenograft models were treated with the AZD 6244 and/or BEZ 235 for 2 h on Day 21 of the efficacy study tumor tissues in each group were resected and measured by caspase colorimetric protease kits. N?=?10. Although advances have been made in cancer treatment with the development of selective molecular targeted the rapies several relevant issues for their optimal and effective use rema in unsolved. Recent studies have demonstrated that the EGFR-TKI gefitinib and erlotinib are as sociated with a high response rate and prolong progressi on-free survival in patients with EGFR mutant lung cancer. Responders to these agents however later relapse after acquiring EGFR-TKI resistance making it urgent to develop novel the rapeutic agents that can over come acquired resistance to EGFR-TKI. Current clinical approaches to comb at resistance in lung adeno carcinoma in clude irreversible and mutant-selective in hibitors of EGFR combinati on of cetuximab a\"", "of a prospective randomized trial highlighting the challenges of retrospectively validating a compani on diagnostic assay after the pivotal drug trials have been completed. The anti-EGFR TKI erlotinib was in itially approved for all patients with advanced NSCLC who had progressed on first-line chemo therapy. A number of subsequent studies determined that patients with EGFR-mutant NSCLC had a high likelihood of responding to these TKI leading to trials in the first-line setting for EGFR-mutant cancer. Four prospective randomized clinical trials studied in Asian populations demonstrated that erlotinib and gefitinib resulted in improved progressi on-free survival compared to chemo therapy for first line the rapy in NSCLC patients with EGFR mutations. Other clinical studies in mixed ethnicity cohorts have concluded with similar C had a high likelihood of responding to these TKI leading to trials in the first-line setting for EGFR-mutant cancer. Four prospective randomized clinical trials studied in Asian populations demonstrated that erlotinib and gefitinib resulted in improved progressi on-free survival compared to chemo therapy for first line the rapy in NSCLC patients with EGFR mutations. Other clinical studies in mixed ethnicity cohorts have concluded with similar. The EURTAC trial was a randomized phase 3 trial to as sess the safety and efficacy of erlotinib compared with standard platinum-based chemo therapy for first-line treatment of a patient populati on with advanced EGFR-mutati on detected NSCLC in a largely Caucasian populati on of European patients. Erlotinib-treated patients experienced significant improvements in median PFS (9.7 months vs. 5.2 months) compared to chemo therapy. Patients on the erlotinib arm also had a considerably higher per centage of responses (58% vs. 15%) in the in tent-to-treat populati on. This trial has been submitted for first line in dicati on of erlotinib in EGFR mutated NSCLC patients. The majority of activating EGFR mutations ", "of a prospective randomized trial highlighting the challenges of retrospectively validating a compani on diagnostic assay after the pivotal drug trials have been completed. The anti-EGFR TKI erlotinib was in itially approved for all patients with advanced NSCLC who had progressed on first-line chemo therapy. A number of subsequent studies determined that patients with EGFR-mutant NSCLC had a high likelihood of responding to these TKI leading to trials in the first-line setting for EGFR-mutant cancer. Four prospective randomized clinical trials studied in Asian populations demonstrated that erlotinib and gefitinib resulted in improved progressi on-free survival compared to chemo therapy for first line the rapy in NSCLC patients with EGFR mutations. Other clinical studies in mixed ethnicity cohorts have concluded with similar C had a high likelihood of responding to these TKI leading to trials in the first-line setting for EGFR-mutant cancer. Four prospective randomized clinical trials studied in Asian populations demonstrated that erlotinib and gefitinib resulted in improved progressi on-free survival compared to chemo therapy for first line the rapy in NSCLC patients with EGFR mutations. Other clinical studies in mixed ethnicity cohorts have concluded with similar. The EURTAC trial was a randomized phase 3 trial to as sess the safety and efficacy of erlotinib compared with standard platinum-based chemo therapy for first-line treatment of a patient populati on with advanced EGFR-mutati on detected NSCLC in a largely Caucasian populati on of European patients. Erlotinib-treated patients experienced significant improvements in median PFS (9.7 months vs. 5.2 months) compared to chemo therapy. Patients on the erlotinib arm also had a considerably higher per centage of responses (58% vs. 15%) in the in tent-to-treat populati on. This trial has been submitted for first line in dicati on of erlotinib in EGFR mutated NSCLC patients. The majority of activating EGFR mutations ", "Following failure of chemo therapy and erlotinib treatment options are limited for patients with advanced non\"small cell lung cancer (NSCLC). Reversible epidermal growth fact or recept or (EGFR) tyrosine kinase in hibitors (TKIs) such as erlotinib and gefitinib selectively target EGFR/HER 1 one of the members of the human epidermal growth fact or recept or (HER) family and are most effective in cancers harboring EGFR mutations. The remaining members of the HER family comprise HER 2 and HER 4 tyrosine kinases and the kinase? null HER 3.1 HER family members act to gether via hetero? and homodimerizati on to enable downstream signaling pathways modulating a range of cellular activities in cluding growth proliferati on differentiati on and migrati on.1 In contrast to patients with EGFR? mutati on? positive tumors patients with KRAS? mutant NSCLC are unlikely to respond to gefitinib or erlotinib and do not have an improved progressi on? free survival (PFS) compared with those who have placebo following erlotinib the rapy.2 Dacomitinib (PF?00299804) is a potent irreversible oral small? molecule in hibit or of HER 1/EGFR HER 2 and HER 4 tyrosine kinases with antitum or activity in both gefitinib? sensitive and gefitinib? resistant in cluding EGFR T 790 M preclinical NSCLC models.3 Dacomitinib demonstrated encouraging antitum or activity against NSCLC in Western and Japanese patients in phase 1 studies 5 further supported by preliminary data from phase 2 NSCLC studies conducted in Asian patients with KRAS wild? type refractory disease 7; unselected patients previously treated with chemo therapy 8; and patients with EGFR? mutant disease (first? line treatment).9 This phase 2 trial (Clinical Trials. gov identifier NCT 00548093) as sessed the efficacy safety and impact on health? related quality of life (HRQo L) of dacomitinib in patients with KRAS wild? type NS CLC who progressed after 1 or 2 chemo therapy regimens and erlotinib.", "Immuno therapy manipulates the immune system to control and eradicate cancer. Many recent studies provide evidence suggesting that immunotherapeutic manipulations are viable in many tumor types in cluding lung cancer. Numerous trials of peptide vaccines autologous cellular the rapy T cell-directed antibody the rapy and monoclonal antibody the rapy for lung cancer have been carried out around the world (8\"10) and some of them have shown favorable (11\"13). The EML 4-ALK fusi on gene was identified in NSCLC patients by a team led by Profess or H. Mano. This fusi on gene was formed as the result of a small in versi on with in the short arm of chromosome 2 that joins differing portions of the EML 4 gene with a porti on of the ALK gene (1415). As a result of this fusi on constant dimerizati on of the kinase doma in of ALK is in duced and its catalytic activity in creases consequently. The EML 4-ALK fusi on gene is mainly identified in young never/former light smokers with NSCLC (16). It is estimated that approximately 5% of all NSCLC cases have this fusi on gene. A few reports have also identified EML 4-ALK in other cancers namely breast cancer and colorectal cancer (1718). For the most part the EML 4-ALK fusi on gene and other mutations such as those in EGFR and KRAS are mutually exclusive (19). The chromosomal in versi on does not always occur in the same locati on and multiple EML 4-ALK variants have been identified (19). At least 11 variants have been reported. The most comm on variants are E 13; A 20 (variant 1) and E 6 a/b; A 20 (variant 3 a/b) which have been detected in 33% and 29% of NSCLC patients respectively (14). PF-02341066 (crizotinib) is an ALK in hibit or currently under clinical development.", ".01 Fisher's exact test). m NP patients showed prolonged PFS (HR?=?0.27; 95% CI 0.04 to 0.59; P<0.01) and OS (HR?=?0.34; 95% CI 0.06 to 0.84; P?=?0.03). Late PET analysis provided concordant Lung cancer is the leading cause of cancer-related death in both Europe and the United States of America. The most comm on forms of lung cancer are non-small cell lung cancer (NSCLC) histological subtypes. Systemic chemo therapy has contributed to a significant improvement in NSCLC the rapy but progress appears to be stagnating. Over the last decade a better knowledge of cellular pathways has allowed the development of new the rapies based on NSCLC-driving genetic abnormalities. Targeted the rapies have been developed to block pathological cellular pathways in volved in cancer cell survival proliferati on and metastasis. Epidermal Growth Fact or Recept or (EGFR) is over expressed in NSCLC and has been extensively studied as a potential the rapeutic target. Two EGF Recept or blockers gefitinib and erlotinib have been demonstrated to be effective in front-line the rapy in patients with in operable NSCLC harboring EGFR-activating mutations. Erlotinib is also authorized after failure of previous chemo therapy and as maintenance the rapy. In clinical practice evaluati on of tumor response is based on changes in tumor size according to criteria proposed by the World Health Or ganizati on or RECIST criteria. This morphological evaluati on may lead to under estimati on of the efficacy of cytostatic the rapeutic agents such as erlotinib that stabilize the disease in non-mutated patients where as conventional cytotoxic drugs in duce shrinkage of tumor dimensions in the case of tumor response. NSCLC tumor size evaluati on can also be difficult due to at electasis of normal lung. The major"], "answer": "Acquired resistance to EGFR inhibitors in lung cancer is primarily attributed to several mechanisms, including the emergence of an EGFR gatekeeper mutation (T790M), MET gene amplification, and mutations in PIK3CA and KRAS. These alterations enable tumors to bypass the inhibitory effects of EGFR-TKIs, leading to treatment failure."}
{"question": "What clinical evidence exists for MEK inhibitors in KRAS-mutant NSCLC?", "contexts": [". In additi on because HGF over expressi on was frequently observed in tumors with the gatekeeper T 790 M mutati on mono therapy with a mutant-selective EGFR-TKI may not be sufficient to in hibit the growth of tumors with acquired resistance to gefitinib. Our findings suggest that the combinati on of a MEK-TKI and a PIK 3/m TOR-TKI may be effective in controlling these resistant tumors. Many KRAS-mutant cancer cells have been shown to be sensitive to MEK in hibitors and KRAS mutations can be detected in up to 30% of lung cancers dependent upon histology and ethnicity suggesting that a subset of lung cancers would likely be highly sensitive to AZD 6244. Our finding that AZD 6244 was effective in one distinct KRAS mutant human lung cancer NCI-H 460 models supports and validates this hypothesis. Although mono therapy with AZD 6244 resulted in antitum or and some antiangiogenic effects in all of our lung cancer models the antitum or effects were more apparent in the NCI-H 1993 lung adeno carcinoma model. The in creased antitum or efficacy observed in this model is as sociated with differences in the in hibitory effect of p-AKT signaling pathway in NCI-H 1975 and NCI-H 460 lung tumors. However additional studies are needed to elucidate this phenomen on. In this study we evaluated the rapy directed against MEK and PI 3 K/m TOR in distinct gefitinib-resistant NSCLC xenograft models. MEK or PI 3 K/m TOR in hibiti on resulted in antitum or effects for these gefitinib-resistance NSCLC models by blocking key in tracellular pathways controlling cell proliferati on and survival as demonstrated both in vitro and in vivo. Surprisingly PI 3 K/m TOR in hibiti on by BEZ 235 also suppressed lung tumor angiogenesis and targeted both MEK and PI 3 K/m TOR activati on in lung tumors resulting in substantial antiangiogenic effects which may due to the significantly reduced expressi on of MMP-9 in tumors. \"", "Lung cancer is the leading cause of cancer-related death in many countries in cluding the China. Non-small cell lung cancer (NSCLC) accounts for up to 80% of all lung cancer cases; patients typically present with advanced disease at the time of diagnosis. The prognosis of patients with advanced lung cancer remains poor and recent studies show that conventional the rapies may have reached a the rapeutic plateau as evidenced by the 5-year survival rate for NSCLCs which remains at 15%. The EGF recept or tyrosine kinase in hibitors (EGFR-TKIs) gefitinib and erlotinib have shown marked the rapeutic effects against NSCLCs with EGFR activating mutations such as exon 19 deletions and L 858 R point mutations. Almost all tumors however acquire resistance to EGFR-TKIs after varying per iods of time. Comm on mechanisms for acquired resistance in clude emergence of an EGFR gatekeeper mutati on (T 790 M) and MET gene amplificati on. In additi on PIK 3 CA mutations as well as KRAS mutations have been found to contribute to EGFR-TKIs resistance in a subpopulati on of tumors. The limited the rapeutic options currently available for patients with advanced lung cancer create a pressing need to identify new the rapeutic strategy. Selumetinib (AZD 6244) is an oral non-ATP competitive in hibit or and highly specific for extracellular signal-regulated kinase (ERK) kinase (MEK)1/2 a key enzyme in the RAS-RAF-MEK-ERK pathway.", "showed BEZ 235 significantly decreased the vascular density of all three gefitinib-resistant NSCLC tumors where as AZD 6244 mono therapy had only a mildly effect upon lung tumor angiogenesis. The antiangiogenic effects AZD 6244 and BEZ 235 were markedly in creased when they were combined. Effects of AZD 6244 and/or BEZ 235 on the expressions of Ki-67 (A) and CD 31 (B) in NCI-1993 NCI-1975 and NCI-H 460 xenograft models. All three gefitinib-resistant tumor xenograft models were treated with the AZD 6244 and/or BEZ 235 for 2 h on Day 21 of the efficacy study tumor tissues in each group were resected and immunostained with anti-Ki 67 and anti-CD 31 antibodies. N?=?10 * P?<?0.05 vs vehicle group. ** P?<?0.01 vs vehicle group. MEK and PIK 3/m TOR in hibitors had no effect on caspase-3 8 and 9 activities in gefitinib-resistant NSCLC tumor models In order to in vestigate whether AZD 6244 and/or BEZ 235 would in duce apoptosis in gefitinib-resistant NSCLC tumor models activity of caspase-3 8 and 9 were measured by the colorimetric assay. The showed that AZD 6244 and/or BEZ 235 had no effect on caspase-3 8 and 9 activities in all three gefitinib-resistant NSCLC tumor models. Effects of AZD 6244 and/or BEZ 235 on the activities of caspase-3 8 and 9 in NCI-1993 NCI-1975 and NCI-H 460 xenograft models. All three gefitinib-resistant tumor xenograft models were treated with the AZD 6244 and/or BEZ 235 for 2 h on Day 21 of the efficacy study tumor tissues in each group were resected and measured by caspase colorimetric protease kits. N?=?10.", "Following failure of chemo therapy and erlotinib treatment options are limited for patients with advanced non\"small cell lung cancer (NSCLC). Reversible epidermal growth fact or recept or (EGFR) tyrosine kinase in hibitors (TKIs) such as erlotinib and gefitinib selectively target EGFR/HER 1 one of the members of the human epidermal growth fact or recept or (HER) family and are most effective in cancers harboring EGFR mutations. The remaining members of the HER family comprise HER 2 and HER 4 tyrosine kinases and the kinase? null HER 3.1 HER family members act to gether via hetero? and homodimerizati on to enable downstream signaling pathways modulating a range of cellular activities in cluding growth proliferati on differentiati on and migrati on.1 In contrast to patients with EGFR? mutati on? positive tumors patients with KRAS? mutant NSCLC are unlikely to respond to gefitinib or erlotinib and do not have an improved progressi on? free survival (PFS) compared with those who have placebo following erlotinib the rapy.2 Dacomitinib (PF?00299804) is a potent irreversible oral small? molecule in hibit or of HER 1/EGFR HER 2 and HER 4 tyrosine kinases with antitum or activity in both gefitinib? sensitive and gefitinib? resistant in cluding EGFR T 790 M preclinical NSCLC models.3 Dacomitinib demonstrated encouraging antitum or activity against NSCLC in Western and Japanese patients in phase 1 studies 5 further supported by preliminary data from phase 2 NSCLC studies conducted in Asian patients with KRAS wild? type refractory disease 7; unselected patients previously treated with chemo therapy 8; and patients with EGFR? mutant disease (first? line treatment).9 This phase 2 trial (Clinical Trials. gov identifier NCT 00548093) as sessed the efficacy safety and impact on health? related quality of life (HRQo L) of dacomitinib in patients with KRAS wild? type NS CLC who progressed after 1 or 2 chemo therapy regimens and erlotinib.", "Immuno therapy manipulates the immune system to control and eradicate cancer. Many recent studies provide evidence suggesting that immunotherapeutic manipulations are viable in many tumor types in cluding lung cancer. Numerous trials of peptide vaccines autologous cellular the rapy T cell-directed antibody the rapy and monoclonal antibody the rapy for lung cancer have been carried out around the world (8\"10) and some of them have shown favorable (11\"13). The EML 4-ALK fusi on gene was identified in NSCLC patients by a team led by Profess or H. Mano. This fusi on gene was formed as the result of a small in versi on with in the short arm of chromosome 2 that joins differing portions of the EML 4 gene with a porti on of the ALK gene (1415). As a result of this fusi on constant dimerizati on of the kinase doma in of ALK is in duced and its catalytic activity in creases consequently. The EML 4-ALK fusi on gene is mainly identified in young never/former light smokers with NSCLC (16). It is estimated that approximately 5% of all NSCLC cases have this fusi on gene. A few reports have also identified EML 4-ALK in other cancers namely breast cancer and colorectal cancer (1718). For the most part the EML 4-ALK fusi on gene and other mutations such as those in EGFR and KRAS are mutually exclusive (19). The chromosomal in versi on does not always occur in the same locati on and multiple EML 4-ALK variants have been identified (19). At least 11 variants have been reported. The most comm on variants are E 13; A 20 (variant 1) and E 6 a/b; A 20 (variant 3 a/b) which have been detected in 33% and 29% of NSCLC patients respectively (14). PF-02341066 (crizotinib) is an ALK in hibit or currently under clinical development.", "Immuno therapy manipulates the immune system to control and eradicate cancer. Many recent studies provide evidence suggesting that immunotherapeutic manipulations are viable in many tumor types in cluding lung cancer. Numerous trials of peptide vaccines autologous cellular the rapy T cell-directed antibody the rapy and monoclonal antibody the rapy for lung cancer have been carried out around the world (8\"10) and some of them have shown favorable (11\"13). The EML 4-ALK fusi on gene was identified in NSCLC patients by a team led by Profess or H. Mano. This fusi on gene was formed as the result of a small in versi on with in the short arm of chromosome 2 that joins differing portions of the EML 4 gene with a porti on of the ALK gene. As a result of this fusi on constant dimerizati on of the kinase doma in of ALK is in duced and its catalytic activity in creases consequently. The EML 4-ALK fusi on gene is mainly identified in young never/former light smokers with NSCLC. It is estimated that approximately 5% of all NSCLC cases have this fusi on gene. A few reports have also identified EML 4-ALK in other cancers namely breast cancer and colorectal cancer. For the most part the EML 4-ALK fusi on gene and other mutations such as those in EGFR and KRAS are mutually exclusive. The chromosomal in versi on does not always occur in the same locati on and multiple EML 4-ALK variants have been identified. At least 11 variants have been reported. The most comm on variants are E 13; A 20 (variant 1) and E 6 a/b; A 20 (variant 3 a/b) which have been detected in 33% and 29% of NSCLC patients respectively. PF-02341066 (crizotinib) is an ALK in hibit or currently under clinical development.", "provide biological in sights into the regulati on of BRAF on cogene dependence and identify strategies to optimize outcomes in BRAF-mutant NSCLC patients. On cogenic mutations in the BRAF kinase occur in 6\"8% of nonsmall cell lung cancers (NSCLCs) accounting for more than 90000 deaths annually worldwide. The biological and clinical relevance of these BRAF mutations in NSCLC is in completely under stood. Here we demonstrate that human NSCLC cells with BRAFV 600 E but not other BRAF mutations in itially are sensitive to BRAF-in hibit or treatment. However these BRAFV 600 E NSCLC cells rapidly acquire resistance to BRAF in hibiti on through at least one of two discrete molecular mechanisms: (i) loss of full-length BRAFV 600 E coupled with expressi on of an aberrant form of BRAFV 600 E that retains RAF pathway dependence or (ii) constitutive autocrine EGF recept or (EGFR) signaling driven by c-Jun\"mediated EGFR ligand expressi on. BRAFV 600 E cells with EGFR-driven resistance are characterized by hyperphosphorylated prote in kinase AKT\"", "with a 96.3% overall agreement. The clinical outcome of patients who were EGFR-mutati on detected by the EGFR PCR test was very similar to the entire EURTAC cohort. The concordance between the EGFR PCR test and Sanger sequencing was 90.6%. In 78.9% of the discordant samples the EGFR PCR test result was confirmed by a sensitive deep sequencing assay. This retrospective study demonstrates the clinical utility of the EGFR PCR test in the accurate selecti on of patients for anti-EGFR TKI the rapy. The EGFR PCR test demonstrated improved per formance relative to Sanger sequencing. This study was funded by Roche. The funders contributed to the study design data collecti on analysis decisi on to publish and preparati on of the manuscript. The efficacy of many novel targeted cancer the rapies can be predicted by the detecti on of specific biomarkers in the tumor. The FDA has in dicated that if the identificati on of a specific biomarker is required for the safe and efficacious administrati on of a drug a well-validated FDA approved compani on diagnostic assay is required for that drug. The optimal approval path for a new targeted the rapy and its compani on diagnostic is a parallel clinical development process that in volves clinical trials for the in vestigational agent where the in vestigational diagnostic test is used to either select patients for the trials or to predict response to treatment and ends ideally with simultaneous health authority approval of the drug and the compani on diagnostic. Successful examples of this in clude the co-development (and co-approval) of the BRAF in hibit or vemurafenib and its compani on diagnostic BRAF V 600 E mutati on assay for BRAF-mutant metastatic melanoma and the ALK in hibit or crizotinib and its compani on diagnostic ALK fusi on gene test in advanced ALK-fusi on positive non-small cell lung cancer (NSCLC) patients. However in some cases predictive biomarkers for a targeted the rapy are not recognized until after the drug is fir", "response rate and higher adverse effects of vinorelbine hinder its wide use in treatment of advanced NSCLC. The refore it is of great in terest to uncover the biomarkers for sensitivity of NSCLC cells to vinorelbine to allow the identificati on of patients most likely to benefit from vinorelbine-based chemo therapy and to improve the the rapy. In present work four NSCLC cell lines were divided into vinorelbine-sensitive (VS) group and vinorelbine-resistant (VR) group according to their sensitivities to vinorelbine. And then the gene expressi on profiles of these two groups was compared the differentially expressed genes (expressi on difference higher than 100% and p<0.05 to tally 496 genes) were applied to In genuity Pathway Analysis (IPA). IPA suggest that pancreatic cells bearing Kras mutati on can be in duced to differentiate into quasi-normal cells with suppressed tumorigenicity by selective in hibiti on of the MAPK/ERK/MYC signaling cascade. These findings may have important the rapeutic implications. Pancreatic cancer is one of the deadliest human malignancies. A striking feature of pancreatic cancer is that activating Kras mutations are found in?90% of cases. However apart from a restricted populati on of cells expressing pancreatic and duodenal homeobox 1 (PDX 1) most pancreatic cells are refractory to Kras-driven transformati on. In the present study we sought to determine which subsets of PDX 1+ cells may be responsible for tumor growth. Using the Lox-Stop-Lox\"Kras G 12 D genetic mouse model of pancreatic carcinogenesis we isolated a populati on of Kras G 12 D-expressing PDX 1+ cells with an in herent capacity to metastasize. This populati on of cells bears the surface phenotype of Ep CAM+CD 24+CD 44+CD 133\"SCA 1? and is closer in its properties to stem-like cells than to more mature cell types. We further demonstrate that the tumorigenic capacity of PDX 1+ cells is limited becoming progressively lost as the cells acquire a mature phenotype. These data are", "of a prospective randomized trial highlighting the challenges of retrospectively validating a compani on diagnostic assay after the pivotal drug trials have been completed. The anti-EGFR TKI erlotinib was in itially approved for all patients with advanced NSCLC who had progressed on first-line chemo therapy. A number of subsequent studies determined that patients with EGFR-mutant NSCLC had a high likelihood of responding to these TKI leading to trials in the first-line setting for EGFR-mutant cancer. Four prospective randomized clinical trials studied in Asian populations demonstrated that erlotinib and gefitinib resulted in improved progressi on-free survival compared to chemo therapy for first line the rapy in NSCLC patients with EGFR mutations. Other clinical studies in mixed ethnicity cohorts have concluded with similar C had a high likelihood of responding to these TKI leading to trials in the first-line setting for EGFR-mutant cancer. Four prospective randomized clinical trials studied in Asian populations demonstrated that erlotinib and gefitinib resulted in improved progressi on-free survival compared to chemo therapy for first line the rapy in NSCLC patients with EGFR mutations. Other clinical studies in mixed ethnicity cohorts have concluded with similar. The EURTAC trial was a randomized phase 3 trial to as sess the safety and efficacy of erlotinib compared with standard platinum-based chemo therapy for first-line treatment of a patient populati on with advanced EGFR-mutati on detected NSCLC in a largely Caucasian populati on of European patients. Erlotinib-treated patients experienced significant improvements in median PFS (9.7 months vs. 5.2 months) compared to chemo therapy. Patients on the erlotinib arm also had a considerably higher per centage of responses (58% vs. 15%) in the in tent-to-treat populati on. This trial has been submitted for first line in dicati on of erlotinib in EGFR mutated NSCLC patients. The majority of activating EGFR mutations "], "answer": "Clinical evidence for MEK inhibitors in KRAS-mutant non-small cell lung cancer (NSCLC) includes findings that many KRAS-mutant cancer cells are sensitive to MEK inhibitors, with specific reference to AZD 6244. This inhibitor demonstrated effectiveness in distinct KRAS mutant human lung cancer models, particularly the NCI-H 460 model, where it resulted in antitumor effects and some antiangiogenic effects. Additionally, the combination of MEK inhibitors with other therapies, such as PIK 3/mTOR inhibitors, showed promise in controlling gefitinib-resistant NSCLC tumors by blocking key intracellular pathways involved in cell proliferation and survival. However, further studies are needed to fully elucidate these effects."}
{"question": "Which immune checkpoints are targeted in lung cancer studies?", "contexts": ["Lung cancer is one of the main causes of cancer-related mortality. Approximately 85% of lung cancers are diagnosed as non-small cell lung cancer (NSCLC) and the overall survival (OS) rate for advanced NSCLC is poor. The 5-year survival rate is 5% for stage IIIb NSCLC and <1% for stage IV NSCLC. Treatment for NCSLC is determined by the patient\u2122s clinical and tumor characteristics per formance status (PS) the histological subtype and tumor genotype/phenotype. Recently there have been many studies concerning agents that target molecular changes such as mutations in the epidermal growth fact or recept or (EGFR) and the fusi on on cogene EML 4-ALK in which the echinoderm microtubule-as sociated prote in-like 4 (EML 4) is fused with the in tracellular doma in of anaplastic kinase (ALK) (2\"4). Although significant advances have been made in the treatment of NSCLC using molecular targeted the rapies such as erlotinib and crizotinib the median OS for patients with advanced NSCLC remains low and acquired resistance to target agents is a major clinical problem. The refore the development of novel the rapies is needed. Immuno therapy manipulates the immune system to control and eradicate cancer. Many recent studies provide evidence suggesting that immunotherapeutic manipulations are viable in many tumor types in cluding lung cancer. Numerous trials of peptide vaccines autologous cellular the rapy T cell-directed antibody the rapy and monoclonal antibody the rapy for lung cancer have been carried out around the world (8\"10) and some of them have shown favorable", "Lung cancer is one of the main causes of cancer-related mortality. Approximately 85% of lung cancers are diagnosed as non-small cell lung cancer (NSCLC) and the overall survival (OS) rate for advanced NSCLC is poor. The 5-year survival rate is 5% for stage IIIb NSCLC and <1% for stage IV NSCLC (1). Treatment for NCSLC is determined by the patient\u2122s clinical and tumor characteristics per formance status (PS) the histological subtype and tumor genotype/phenotype. Recently there have been many studies concerning agents that target molecular changes such as mutations in the epidermal growth fact or recept or (EGFR) and the fusi on on cogene EML 4-ALK in which the echinoderm microtubule-as sociated prote in-like 4 (EML 4) is fused with the in tracellular doma in of anaplastic kinase (ALK) (2\"4). Although significant advances have been made in the treatment of NSCLC using molecular targeted the rapies such as erlotinib and crizotinib the median OS for patients with advanced NSCLC remains low (56) and acquired resistance to target agents is a major clinical problem. The refore the development of novel the rapies is needed (7). Immuno therapy manipulates the immune system to control and eradicate cancer. Many recent studies provide evidence suggesting that immunotherapeutic manipulations are viable in many tumor types in cluding lung cancer. Numerous trials of peptide vaccines autologous cellular the rapy T cell-directed antibody the rapy and monoclonal antibody the rapy for lung cancer have been carried out around the world (8\"10) and some of them have shown favorable", "were in accordance with the study that genetic polymorphisms in in nate immunity genes may play a role in the carcinogenesis of lung cancer. It is likely that some genetic variations in strong link disequilibrium with this in tronic SNP (rs 7525160 G?>? C) are functional which provides a new in sight into the hallmarks in susceptibility to lung cancer and further functional experiments are warranted to address the proposal. Functionally human CR 1 exists on the surface of almost all per ipheral blood cells and plays a key role in immune complex clearance and complement in hibiti on at the cell surface by binding to activated products C 3 b and C 4 b. CR 1 also possesses cofact or activity for the serum protease fact or I and is thus in volved in the generati on of further fragments of C 3/4 b with the activati on of complement cascade and the cellular immune response. In our study the as sociati on of CR 1 polymorphism with lung cancer is biologically plausible in that the in tronic polymorphism could affect the density of CR 1 molecules on the cell surface the reby contributing to autoimmune disorders and neoplasm. To bacco smoking is an established risk fact or for susceptibility to lung cancer. However not all people who suffer from lung cancer are smokers. Lung cancer in non-smokers can be in duced by second hand smoke air pollutants and diesel exhaust. Our present data showed significant difference of pack-year smoked but not smoking status between NSCLC cases and controls which suggested the important role of other environmental factors in the development of NSCLC. To bacco could in duce chronic and sustained in flammati on in lung micro environment contributing to pulmonary carcinogenesis in smokers.", "The chronic airway in flammati on and dysfunctional immune system might promote pulmonary carcinogenesis. Implicated in the immune and in flammatory responses the complement cascade plays a pivotal role in the development of cancer. Thus it is likely that the genetic variants of CR 1 in the complement system confer the susceptibility to lung cancer. In this study we have for the first time demonstrated that one in tronic SNP (rs 7525160 G?>? C) out of 13 tag SNPs of CR 1 was as sociated with the risk of NSCLC in Chinese populati on. Notably the rs 7525160 CC genotype was as sociated with an in creased risk of developing NSCLC (OR?=?1.52 95% CI?=?1.02-2.28; P?=?0.028) compared with the GG genotype. MDR analysis also showed that there was no gene-gene in teracti on among 12 tag SNPs in CR 1 gene. Moreover the risk of NSCLC was as sociated with the rs 7525160 C allele carriers in smokers with OR (95% CI) of 1.72 (1.15-2.59) but not in non-smokers with OR (95% CI) of 1.15 (0.81-1.65) in dicating this SNP is a smoking-modifying risk fact or for susceptibility to NSCLC. To the best of our knowledge this study shed new in sight into the in terplay of genetic variati on of CR 1 with lung cancer risk. More importantly it highlights the potential gene-environmental in teracti on in fluences the susceptibility to lung cancer.", "Immuno therapy manipulates the immune system to control and eradicate cancer. Many recent studies provide evidence suggesting that immunotherapeutic manipulations are viable in many tumor types in cluding lung cancer. Numerous trials of peptide vaccines autologous cellular the rapy T cell-directed antibody the rapy and monoclonal antibody the rapy for lung cancer have been carried out around the world (8\"10) and some of them have shown favorable (11\"13). The EML 4-ALK fusi on gene was identified in NSCLC patients by a team led by Profess or H. Mano. This fusi on gene was formed as the result of a small in versi on with in the short arm of chromosome 2 that joins differing portions of the EML 4 gene with a porti on of the ALK gene. As a result of this fusi on constant dimerizati on of the kinase doma in of ALK is in duced and its catalytic activity in creases consequently. The EML 4-ALK fusi on gene is mainly identified in young never/former light smokers with NSCLC. It is estimated that approximately 5% of all NSCLC cases have this fusi on gene. A few reports have also identified EML 4-ALK in other cancers namely breast cancer and colorectal cancer. For the most part the EML 4-ALK fusi on gene and other mutations such as those in EGFR and KRAS are mutually exclusive. The chromosomal in versi on does not always occur in the same locati on and multiple EML 4-ALK variants have been identified. At least 11 variants have been reported. The most comm on variants are E 13; A 20 (variant 1) and E 6 a/b; A 20 (variant 3 a/b) which have been detected in 33% and 29% of NSCLC patients respectively. PF-02341066 (crizotinib) is an ALK in hibit or currently under clinical development.", "Stage at primarydiagnosis \u00b1 obscure boundary \u00b1 Emphysema \u00b1 T tumor \u00b1 L 1 cycle \u00b1 Obstructivepneumoniaatelectasis \u00b1 pulmonary nodule Patients with SCLCStage at recruitmenttime \u00b1 Stage at primarydiagnosis \u00b1 N 1 ipsilateral Paratracheal \u00b1 T tumor \u00b1 N 1 ipsilateral hilum \u00b1 N 2 ipsilateralmediastinum \u00b1 Enhanced image \u00b1 pulmonary nodule \u00b1 N LN \u00b1 Maintenancetreatment Patients survived Stage at primarydiagnosis \u00b1 N 2 ipsilateralmediastinum \u00b1 Enhanced image \u00b1 Stage at recruitmenttime \u00b1 N 1 ipsilateral hilum \u00b1 TTF 1 \u00b1 Naps in A \u00b1 Locati on \u00b1 N 1 ipsilateralparatracheal \u00b1 Lobular Patientsnonsurvived Stage at recruitmenttime \u00b1 Stage at primarydiagnosis \u00b1 N 1 ipsilateralparatracheal \u00b1 N 2 ipsilateralmediastinum \u00b1 N 1 ipsilateral hilum \u00b1 Enhanced image \u00b1 N 2 below carina \u00b1 TTF 1 \u00b1 N LN \u00b1 T tumor \u00b1 \u00b1 Abbreviations N degrees of lung cancer metastasis to lymph nodes of TNM category N 1 degree that has metastatic lymph nodes near pulmonary center and side of main bronchia N 2 degree that has metastatic lymph nodes in the same side of the mediastinum as lung cancer TTF 1 thyroid transcripti on fact or 1 asan immunohistochemical biomarker for adeno carcinoma CK 7 kerat in as an immunohistochemical biomarker for epithelial cells L 1 cycle number of the firstline chemo therapy cycles \u00b1 \u00b1 \u00b1 in ADC and SCC and lyso PG in SCLC where as PG and TAG in creased in ADC and SCCPE in SCLC and PC in SCC The volcanic map demonstrated the clear patterns of lipid elements significantlyincreased or declined between heathy controls with ADCFigure 4 E SCC or SCLC and varied among different subtypes of lung cancerspatient genders Different lipidomics between About or lipid elements significantly in creased and or declined", "Lung cancer is the leading cause of cancer-related death in many countries in cluding the China. Non-small cell lung cancer (NSCLC) accounts for up to 80% of all lung cancer cases; patients typically present with advanced disease at the time of diagnosis. The prognosis of patients with advanced lung cancer remains poor and recent studies show that conventional the rapies may have reached a the rapeutic plateau as evidenced by the 5-year survival rate for NSCLCs which remains at 15%. The EGF recept or tyrosine kinase in hibitors (EGFR-TKIs) gefitinib and erlotinib have shown marked the rapeutic effects against NSCLCs with EGFR activating mutations such as exon 19 deletions and L 858 R point mutations. Almost all tumors however acquire resistance to EGFR-TKIs after varying per iods of time. Comm on mechanisms for acquired resistance in clude emergence of an EGFR gatekeeper mutati on (T 790 M) and MET gene amplificati on. In additi on PIK 3 CA mutations as well as KRAS mutations have been found to contribute to EGFR-TKIs resistance in a subpopulati on of tumors. The limited the rapeutic options currently available for patients with advanced lung cancer create a pressing need to identify new the rapeutic strategy. Selumetinib (AZD 6244) is an oral non-ATP competitive in hibit or and highly specific for extracellular signal-regulated kinase (ERK) kinase (MEK)1/2 a key enzyme in the RAS-RAF-MEK-ERK pathway.", "Lung cancer represents the most frequent cause of cancer deaths. More than 225000 new cases were diagnosed during 2012 only in the United States of America accounting for approximately 160000 annual deaths. More than 50% of the patients diagnosed with non-small cell lung cancer (NSCLC) present advanced disease (stage III and IV) at onset. The most comm on histology is adeno carcinoma representing approximately 80% of all cases. Pemetrexed is a multitargeted antifolate drug and one of the latest active drugs against NSCLC approved for the first-line (in combinati on with cisplat in) and second-line treatment (mono therapy) of patients with non-squamous histology. More recently pemetrexed gained approval for its use as a single-agent maintenance the rapy after response/stabilizati on to four cycles of a platinum doublet with or without pemetrexed. Thymidylate synthase (TS) is the main biological target of antifolate drugs such as pemetrexed or 5-fluorouracil. Different studies have evaluated the correlati on between tumor TS expressi on and TS genotype and the prognosis of patients with different cancer types treated with antifolates. In NSCLC constitutive expressi on of TS is lower in tumors with adeno carcinoma histology than among those with squamous differentiati on. This finding could possibly expla in the higher efficacy of the drug among non-squamous histology patients. The potential predictive role of TS polymorphisms in NSCLC has never been studied in a European populati on. In additi on how differential TS genotypes may impact on the outcome of patients depending on their smoking status or with Epidermal Growth Fact or Recept or (EGFR) activating mutations tumors is to be determined. Finally although the to xicity profile described in most patients receiving pemetrexed in combinati on or as a single agent is usually favorable there are several reported cases of fundamentally dermatological hematological and potentially serious renal to xicities even when the", "Lung cancer represents the most frequent cause of cancer deaths. More than 225000 new cases were diagnosed during 2012 only in the United States of America accounting for approximately 160000 annual deaths. More than 50% of the patients diagnosed with non-small cell lung cancer (NSCLC) present advanced disease (stage III and IV) at onset. The most comm on histology is adeno carcinoma representing approximately 80% of all cases. Pemetrexed is a multitargeted antifolate drug and one of the latest active drugs against NSCLC approved for the first-line (in combinati on with cisplat in) and second-line treatment (mono therapy) of patients with non-squamous histology. More recently pemetrexed gained approval for its use as a single-agent maintenance the rapy after response/stabilizati on to four cycles of a platinum doublet with or without pemetrexed. Thymidylate synthase (TS) is the main biological target of antifolate drugs such as pemetrexed or 5-fluorouracil. Different studies have evaluated the correlati on between tumor TS expressi on and TS genotype and the prognosis of patients with different cancer types treated with antifolates. In NSCLC constitutive expressi on of TS is lower in tumors with adeno carcinoma histology than among those with squamous differentiati on. This finding could possibly expla in the higher efficacy of the drug among non-squamous histology patients.", "(NSCLC) patients and 53 small cell carcinoma patients. In the NSCLC cases there were 320 adenocarcinom as 73 squamous cell carcinom as and 41 other tumors with a variety of different pathologies (such as large cell carcinom as mixed cell carcinom as or undifferentiated carcinom as)..0096911. t 001 Characteristics of lung cancer cases and controls. Variables Cases(%) Controls(%) P value Female 487 516 Mean age (years) 56.5\u00b111.7 56.3\u00b112.5 0.248 a In come (yuan/month) 628.9\u00b1419.3 563.5\u00b1387.6 0.084 a Never smoker 487 516 Histological type NSCLC 434(89.1) Adeno carcinoma 320(65.7) Squamous cell carcinoma 73(15.0) Small cell carcinoma 53(10.9) Other 41(8.4) a Student's t-test was used to compare the frequency distributions of demographic variables between the cases and controls. As sociati on analysis The observed genotype frequencies among the control subjects was in agreement with that expected under the Hardy-Weinberg equilibrium (P?=?0.119). The distributi on of ATM rs 189037 genotypes among subjects were displayed in Using subjects with the ATM rs 189037 GG genotype as the reference group we calculated the ORs and 95%CIs for heterozygous carriers of GA genotype and homozygous carriers of AA genotype. No significant difference was observed between lung cancer cases and controls in each test (P>0.05). In order to in crease the statistical power we combined the GA genotype with the AA genotype to compare with GG genotype as a dominant model and combined the GA genotype with the GG genotype to compare with AA genotype as a recessive model. The in dicated that in dividuals with AA genotype had a significantly elevated risk of lung adeno carcinoma compared with those carrying the GG or GA genotype (OR?=?1.44 95%CI 1.02\"2.02 P?=?0.039)..0096911. t 002 Distributi on of ATM rs 189037 genotypes and ORs for lung cancer cases and controls."], "answer": "Insufficient evidence in provided documents."}
{"question": "What adverse effects are associated with immunotherapy in lung cancer trials?", "contexts": ["(NSCLC) patients and 53 small cell carcinoma patients. In the NSCLC cases there were 320 adenocarcinom as 73 squamous cell carcinom as and 41 other tumors with a variety of different pathologies (such as large cell carcinom as mixed cell carcinom as or undifferentiated carcinom as)..0096911. t 001 Characteristics of lung cancer cases and controls. Variables Cases(%) Controls(%) P value Female 487 516 Mean age (years) 56.5\u00b111.7 56.3\u00b112.5 0.248 a In come (yuan/month) 628.9\u00b1419.3 563.5\u00b1387.6 0.084 a Never smoker 487 516 Histological type NSCLC 434(89.1) Adeno carcinoma 320(65.7) Squamous cell carcinoma 73(15.0) Small cell carcinoma 53(10.9) Other 41(8.4) a Student's t-test was used to compare the frequency distributions of demographic variables between the cases and controls. As sociati on analysis The observed genotype frequencies among the control subjects was in agreement with that expected under the Hardy-Weinberg equilibrium (P?=?0.119). The distributi on of ATM rs 189037 genotypes among subjects were displayed in Using subjects with the ATM rs 189037 GG genotype as the reference group we calculated the ORs and 95%CIs for heterozygous carriers of GA genotype and homozygous carriers of AA genotype. No significant difference was observed between lung cancer cases and controls in each test (P>0.05). In order to in crease the statistical power we combined the GA genotype with the AA genotype to compare with GG genotype as a dominant model and combined the GA genotype with the GG genotype to compare with AA genotype as a recessive model. The in dicated that in dividuals with AA genotype had a significantly elevated risk of lung adeno carcinoma compared with those carrying the GG or GA genotype (OR?=?1.44 95%CI 1.02\"2.02 P?=?0.039)..0096911. t 002 Distributi on of ATM rs 189037 genotypes and ORs for lung cancer cases and controls.", "Lung cancer is one of the main causes of cancer-related mortality. Approximately 85% of lung cancers are diagnosed as non-small cell lung cancer (NSCLC) and the overall survival (OS) rate for advanced NSCLC is poor. The 5-year survival rate is 5% for stage IIIb NSCLC and <1% for stage IV NSCLC. Treatment for NCSLC is determined by the patient\u2122s clinical and tumor characteristics per formance status (PS) the histological subtype and tumor genotype/phenotype. Recently there have been many studies concerning agents that target molecular changes such as mutations in the epidermal growth fact or recept or (EGFR) and the fusi on on cogene EML 4-ALK in which the echinoderm microtubule-as sociated prote in-like 4 (EML 4) is fused with the in tracellular doma in of anaplastic kinase (ALK) (2\"4). Although significant advances have been made in the treatment of NSCLC using molecular targeted the rapies such as erlotinib and crizotinib the median OS for patients with advanced NSCLC remains low and acquired resistance to target agents is a major clinical problem. The refore the development of novel the rapies is needed. Immuno therapy manipulates the immune system to control and eradicate cancer. Many recent studies provide evidence suggesting that immunotherapeutic manipulations are viable in many tumor types in cluding lung cancer. Numerous trials of peptide vaccines autologous cellular the rapy T cell-directed antibody the rapy and monoclonal antibody the rapy for lung cancer have been carried out around the world (8\"10) and some of them have shown favorable", "Lung cancer is one of the main causes of cancer-related mortality. Approximately 85% of lung cancers are diagnosed as non-small cell lung cancer (NSCLC) and the overall survival (OS) rate for advanced NSCLC is poor. The 5-year survival rate is 5% for stage IIIb NSCLC and <1% for stage IV NSCLC (1). Treatment for NCSLC is determined by the patient\u2122s clinical and tumor characteristics per formance status (PS) the histological subtype and tumor genotype/phenotype. Recently there have been many studies concerning agents that target molecular changes such as mutations in the epidermal growth fact or recept or (EGFR) and the fusi on on cogene EML 4-ALK in which the echinoderm microtubule-as sociated prote in-like 4 (EML 4) is fused with the in tracellular doma in of anaplastic kinase (ALK) (2\"4). Although significant advances have been made in the treatment of NSCLC using molecular targeted the rapies such as erlotinib and crizotinib the median OS for patients with advanced NSCLC remains low (56) and acquired resistance to target agents is a major clinical problem. The refore the development of novel the rapies is needed (7). Immuno therapy manipulates the immune system to control and eradicate cancer. Many recent studies provide evidence suggesting that immunotherapeutic manipulations are viable in many tumor types in cluding lung cancer. Numerous trials of peptide vaccines autologous cellular the rapy T cell-directed antibody the rapy and monoclonal antibody the rapy for lung cancer have been carried out around the world (8\"10) and some of them have shown favorable", "Stage at primarydiagnosis \u00b1 obscure boundary \u00b1 Emphysema \u00b1 T tumor \u00b1 L 1 cycle \u00b1 Obstructivepneumoniaatelectasis \u00b1 pulmonary nodule Patients with SCLCStage at recruitmenttime \u00b1 Stage at primarydiagnosis \u00b1 N 1 ipsilateral Paratracheal \u00b1 T tumor \u00b1 N 1 ipsilateral hilum \u00b1 N 2 ipsilateralmediastinum \u00b1 Enhanced image \u00b1 pulmonary nodule \u00b1 N LN \u00b1 Maintenancetreatment Patients survived Stage at primarydiagnosis \u00b1 N 2 ipsilateralmediastinum \u00b1 Enhanced image \u00b1 Stage at recruitmenttime \u00b1 N 1 ipsilateral hilum \u00b1 TTF 1 \u00b1 Naps in A \u00b1 Locati on \u00b1 N 1 ipsilateralparatracheal \u00b1 Lobular Patientsnonsurvived Stage at recruitmenttime \u00b1 Stage at primarydiagnosis \u00b1 N 1 ipsilateralparatracheal \u00b1 N 2 ipsilateralmediastinum \u00b1 N 1 ipsilateral hilum \u00b1 Enhanced image \u00b1 N 2 below carina \u00b1 TTF 1 \u00b1 N LN \u00b1 T tumor \u00b1 \u00b1 Abbreviations N degrees of lung cancer metastasis to lymph nodes of TNM category N 1 degree that has metastatic lymph nodes near pulmonary center and side of main bronchia N 2 degree that has metastatic lymph nodes in the same side of the mediastinum as lung cancer TTF 1 thyroid transcripti on fact or 1 asan immunohistochemical biomarker for adeno carcinoma CK 7 kerat in as an immunohistochemical biomarker for epithelial cells L 1 cycle number of the firstline chemo therapy cycles \u00b1 \u00b1 \u00b1 in ADC and SCC and lyso PG in SCLC where as PG and TAG in creased in ADC and SCCPE in SCLC and PC in SCC The volcanic map demonstrated the clear patterns of lipid elements significantlyincreased or declined between heathy controls with ADCFigure 4 E SCC or SCLC and varied among different subtypes of lung cancerspatient genders Different lipidomics between About or lipid elements significantly in creased and or declined", "Immuno therapy manipulates the immune system to control and eradicate cancer. Many recent studies provide evidence suggesting that immunotherapeutic manipulations are viable in many tumor types in cluding lung cancer. Numerous trials of peptide vaccines autologous cellular the rapy T cell-directed antibody the rapy and monoclonal antibody the rapy for lung cancer have been carried out around the world (8\"10) and some of them have shown favorable (11\"13). The EML 4-ALK fusi on gene was identified in NSCLC patients by a team led by Profess or H. Mano. This fusi on gene was formed as the result of a small in versi on with in the short arm of chromosome 2 that joins differing portions of the EML 4 gene with a porti on of the ALK gene. As a result of this fusi on constant dimerizati on of the kinase doma in of ALK is in duced and its catalytic activity in creases consequently. The EML 4-ALK fusi on gene is mainly identified in young never/former light smokers with NSCLC. It is estimated that approximately 5% of all NSCLC cases have this fusi on gene. A few reports have also identified EML 4-ALK in other cancers namely breast cancer and colorectal cancer. For the most part the EML 4-ALK fusi on gene and other mutations such as those in EGFR and KRAS are mutually exclusive. The chromosomal in versi on does not always occur in the same locati on and multiple EML 4-ALK variants have been identified. At least 11 variants have been reported. The most comm on variants are E 13; A 20 (variant 1) and E 6 a/b; A 20 (variant 3 a/b) which have been detected in 33% and 29% of NSCLC patients respectively. PF-02341066 (crizotinib) is an ALK in hibit or currently under clinical development.", "After publicati on of the In ternational Adjuvant Lung Cancer Trial in 2004 adjuvant chemo therapy containing a platinum agent has become the standard of care for patients with a complete surgical resecti on of American Joint Committee on Cancer stage II to III (versi on 6) non-small cell lung cancer (NSCLC).1 The trial in cluded patients with stage I to III disease and demonstrated an absolute 4.1% improvement in overall survival (OS) and a subgroup analysis in dicated that the OS benefit in creased with stage: the hazards ratio (HR) for death among patients receiving adjuvant chemo therapy compared with controls was approximately 0.98 for patients with stage I disease 0.88 for patients with stage II disease and 0.79 for patients with stage III disease.1 The data were confirmed by the National Cancer In stitute of Canada Clinical Trials Group JBR.10 trial in 2005 which in cluded patients with stage IB and stage II disease.2 A third trial Cancer and Leukemia Group B (CALGB) 9633 which in cluded only patients with stage IB disease was terminated early and also reported a the rapeutic benefit for adjuvant chemo therapy.3 However a final analysis of mature data revealed no statistically significant OS benefit (HR 0.83) but demonstrated a benefit for patients with tumor diameters of??4 cm (HR 0.69).4 During the same time period an in creasing number of correlative biomarker analyses demonstrated that the efficacy of platinum agents was as sociated with in tratumoral levels of the excisi on repair cross-complementing group 1 (ERCC 1) gene with high levels in dicating resistance.5\"9 Similarly high in tratumoral levels of the regulatory subunit of ribonucleotide reductase M 1 (RRM 1) were reported to be predictive of resistance to gemcitabine.9\"13 Finally both biomarkers had also been reported to be prognostic of survival in patients who had not received chemo therapy or radiati on with high levels in dicating longer survival.814\"16 Based on these data we designed an adjuv", "Preclinical data suggests that irradiationinduced immunogenicity can be further in creased if applied in ahypofractionated setting potentially boosting the expected synergistic effect with immune checkpoint in hibiti on in restoring the immune antitum or response If proven safe and efficient a hypofractionated radiati on schedule can provide a considerablymore practicable opti on for the patient Taking into considerati on the in tend to develop a combinati on treatment strategy thatcan be made available to patients soon after proving to be efficient and the potentially elevated to xicity of a hypofractionatedradio therapy approach this trial was designed as a twotrialsinone design An accompanying translational research program isplanned striving to gain in sights into the tumorhost biology and to identify suitable biomarkers to predict the rapy response Trial registrati on Clinicaltrialsgov NCT 04351256 Registered April Eudra CT \" Registered October Keywords Nonsmall cell lung cancer NSCLC Radioimmuno therapy Immune checkpoint in hibiti on Anti PDL 1 monoclonalantibody Hypofractionated radiati on Geriatric risk profile", "Lung cancer represents the most frequent cause of cancer deaths. More than 225000 new cases were diagnosed during 2012 only in the United States of America accounting for approximately 160000 annual deaths. More than 50% of the patients diagnosed with non-small cell lung cancer (NSCLC) present advanced disease (stage III and IV) at onset. The most comm on histology is adeno carcinoma representing approximately 80% of all cases. Pemetrexed is a multitargeted antifolate drug and one of the latest active drugs against NSCLC approved for the first-line (in combinati on with cisplat in) and second-line treatment (mono therapy) of patients with non-squamous histology. More recently pemetrexed gained approval for its use as a single-agent maintenance the rapy after response/stabilizati on to four cycles of a platinum doublet with or without pemetrexed. Thymidylate synthase (TS) is the main biological target of antifolate drugs such as pemetrexed or 5-fluorouracil. Different studies have evaluated the correlati on between tumor TS expressi on and TS genotype and the prognosis of patients with different cancer types treated with antifolates. In NSCLC constitutive expressi on of TS is lower in tumors with adeno carcinoma histology than among those with squamous differentiati on. This finding could possibly expla in the higher efficacy of the drug among non-squamous histology patients. The potential predictive role of TS polymorphisms in NSCLC has never been studied in a European populati on. In additi on how differential TS genotypes may impact on the outcome of patients depending on their smoking status or with Epidermal Growth Fact or Recept or (EGFR) activating mutations tumors is to be determined. Finally although the to xicity profile described in most patients receiving pemetrexed in combinati on or as a single agent is usually favorable there are several reported cases of fundamentally dermatological hematological and potentially serious renal to xicities even when the", ".01 Fisher's exact test). m NP patients showed prolonged PFS (HR?=?0.27; 95% CI 0.04 to 0.59; P<0.01) and OS (HR?=?0.34; 95% CI 0.06 to 0.84; P?=?0.03). Late PET analysis provided concordant Lung cancer is the leading cause of cancer-related death in both Europe and the United States of America. The most comm on forms of lung cancer are non-small cell lung cancer (NSCLC) histological subtypes. Systemic chemo therapy has contributed to a significant improvement in NSCLC the rapy but progress appears to be stagnating. Over the last decade a better knowledge of cellular pathways has allowed the development of new the rapies based on NSCLC-driving genetic abnormalities. Targeted the rapies have been developed to block pathological cellular pathways in volved in cancer cell survival proliferati on and metastasis. Epidermal Growth Fact or Recept or (EGFR) is over expressed in NSCLC and has been extensively studied as a potential the rapeutic target. Two EGF Recept or blockers gefitinib and erlotinib have been demonstrated to be effective in front-line the rapy in patients with in operable NSCLC harboring EGFR-activating mutations. Erlotinib is also authorized after failure of previous chemo therapy and as maintenance the rapy. In clinical practice evaluati on of tumor response is based on changes in tumor size according to criteria proposed by the World Health anizati on or RECIST criteria. This morphological evaluati on may lead to under estimati on of the efficacy of cytostatic the rapeutic agents such as erlotinib that stabilize the disease in non-mutated patients where as conventional cytotoxic drugs in duce shrinkage of tumor dimensions in the case of tumor response. NSCLC tumor size evaluati on can also be difficult due to at electasis of normal lung. The major", ".01 Fisher's exact test). m NP patients showed prolonged PFS (HR?=?0.27; 95% CI 0.04 to 0.59; P<0.01) and OS (HR?=?0.34; 95% CI 0.06 to 0.84; P?=?0.03). Late PET analysis provided concordant Lung cancer is the leading cause of cancer-related death in both Europe and the United States of America. The most comm on forms of lung cancer are non-small cell lung cancer (NSCLC) histological subtypes. Systemic chemo therapy has contributed to a significant improvement in NSCLC the rapy but progress appears to be stagnating. Over the last decade a better knowledge of cellular pathways has allowed the development of new the rapies based on NSCLC-driving genetic abnormalities. Targeted the rapies have been developed to block pathological cellular pathways in volved in cancer cell survival proliferati on and metastasis. Epidermal Growth Fact or Recept or (EGFR) is over expressed in NSCLC and has been extensively studied as a potential the rapeutic target. Two EGF Recept or blockers gefitinib and erlotinib have been demonstrated to be effective in front-line the rapy in patients with in operable NSCLC harboring EGFR-activating mutations. Erlotinib is also authorized after failure of previous chemo therapy and as maintenance the rapy. In clinical practice evaluati on of tumor response is based on changes in tumor size according to criteria proposed by the World Health Or ganizati on or RECIST criteria. This morphological evaluati on may lead to under estimati on of the efficacy of cytostatic the rapeutic agents such as erlotinib that stabilize the disease in non-mutated patients where as conventional cytotoxic drugs in duce shrinkage of tumor dimensions in the case of tumor response. NSCLC tumor size evaluati on can also be difficult due to at electasis of normal lung. The major"], "answer": "Insufficient evidence in provided documents."}
{"question": "What survival outcomes are reported for advanced NSCLC patients?", "contexts": ["Lung cancer is one of the main causes of cancer-related mortality. Approximately 85% of lung cancers are diagnosed as non-small cell lung cancer (NSCLC) and the overall survival (OS) rate for advanced NSCLC is poor. The 5-year survival rate is 5% for stage IIIb NSCLC and <1% for stage IV NSCLC (1). Treatment for NCSLC is determined by the patient\u2122s clinical and tumor characteristics per formance status (PS) the histological subtype and tumor genotype/phenotype. Recently there have been many studies concerning agents that target molecular changes such as mutations in the epidermal growth fact or recept or (EGFR) and the fusi on on cogene EML 4-ALK in which the echinoderm microtubule-as sociated prote in-like 4 (EML 4) is fused with the in tracellular doma in of anaplastic kinase (ALK) (2\"4). Although significant advances have been made in the treatment of NSCLC using molecular targeted the rapies such as erlotinib and crizotinib the median OS for patients with advanced NSCLC remains low (56) and acquired resistance to target agents is a major clinical problem. The refore the development of novel the rapies is needed (7). Immuno therapy manipulates the immune system to control and eradicate cancer. Many recent studies provide evidence suggesting that immunotherapeutic manipulations are viable in many tumor types in cluding lung cancer. Numerous trials of peptide vaccines autologous cellular the rapy T cell-directed antibody the rapy and monoclonal antibody the rapy for lung cancer have been carried out around the world (8\"10) and some of them have shown favorable", "Lung cancer is one of the main causes of cancer-related mortality. Approximately 85% of lung cancers are diagnosed as non-small cell lung cancer (NSCLC) and the overall survival (OS) rate for advanced NSCLC is poor. The 5-year survival rate is 5% for stage IIIb NSCLC and <1% for stage IV NSCLC. Treatment for NCSLC is determined by the patient\u2122s clinical and tumor characteristics per formance status (PS) the histological subtype and tumor genotype/phenotype. Recently there have been many studies concerning agents that target molecular changes such as mutations in the epidermal growth fact or recept or (EGFR) and the fusi on on cogene EML 4-ALK in which the echinoderm microtubule-as sociated prote in-like 4 (EML 4) is fused with the in tracellular doma in of anaplastic kinase (ALK) (2\"4). Although significant advances have been made in the treatment of NSCLC using molecular targeted the rapies such as erlotinib and crizotinib the median OS for patients with advanced NSCLC remains low and acquired resistance to target agents is a major clinical problem. The refore the development of novel the rapies is needed. Immuno therapy manipulates the immune system to control and eradicate cancer. Many recent studies provide evidence suggesting that immunotherapeutic manipulations are viable in many tumor types in cluding lung cancer. Numerous trials of peptide vaccines autologous cellular the rapy T cell-directed antibody the rapy and monoclonal antibody the rapy for lung cancer have been carried out around the world (8\"10) and some of them have shown favorable", "Lung cancer represents the most frequent cause of cancer deaths. More than 225000 new cases were diagnosed during 2012 only in the United States of America accounting for approximately 160000 annual deaths. More than 50% of the patients diagnosed with non-small cell lung cancer (NSCLC) present advanced disease (stage III and IV) at onset. The most comm on histology is adeno carcinoma representing approximately 80% of all cases. Pemetrexed is a multitargeted antifolate drug and one of the latest active drugs against NSCLC approved for the first-line (in combinati on with cisplat in) and second-line treatment (mono therapy) of patients with non-squamous histology. More recently pemetrexed gained approval for its use as a single-agent maintenance the rapy after response/stabilizati on to four cycles of a platinum doublet with or without pemetrexed. Thymidylate synthase (TS) is the main biological target of antifolate drugs such as pemetrexed or 5-fluorouracil. Different studies have evaluated the correlati on between tumor TS expressi on and TS genotype and the prognosis of patients with different cancer types treated with antifolates. In NSCLC constitutive expressi on of TS is lower in tumors with adeno carcinoma histology than among those with squamous differentiati on. This finding could possibly expla in the higher efficacy of the drug among non-squamous histology patients. The potential predictive role of TS polymorphisms in NSCLC has never been studied in a European populati on. In additi on how differential TS genotypes may impact on the outcome of patients depending on their smoking status or with Epidermal Growth Fact or Recept or (EGFR) activating mutations tumors is to be determined. Finally although the to xicity profile described in most patients receiving pemetrexed in combinati on or as a single agent is usually favorable there are several reported cases of fundamentally dermatological hematological and potentially serious renal to xicities even when the", "Lung cancer is the leading cause of cancer-related death in many countries in cluding the China. Non-small cell lung cancer (NSCLC) accounts for up to 80% of all lung cancer cases; patients typically present with advanced disease at the time of diagnosis. The prognosis of patients with advanced lung cancer remains poor and recent studies show that conventional the rapies may have reached a the rapeutic plateau as evidenced by the 5-year survival rate for NSCLCs which remains at 15%. The EGF recept or tyrosine kinase in hibitors (EGFR-TKIs) gefitinib and erlotinib have shown marked the rapeutic effects against NSCLCs with EGFR activating mutations such as exon 19 deletions and L 858 R point mutations. Almost all tumors however acquire resistance to EGFR-TKIs after varying per iods of time. Comm on mechanisms for acquired resistance in clude emergence of an EGFR gatekeeper mutati on (T 790 M) and MET gene amplificati on. In additi on PIK 3 CA mutations as well as KRAS mutations have been found to contribute to EGFR-TKIs resistance in a subpopulati on of tumors. The limited the rapeutic options currently available for patients with advanced lung cancer create a pressing need to identify new the rapeutic strategy. Selumetinib (AZD 6244) is an oral non-ATP competitive in hibit or and highly specific for extracellular signal-regulated kinase (ERK) kinase (MEK)1/2 a key enzyme in the RAS-RAF-MEK-ERK pathway.", "After publicati on of the In ternational Adjuvant Lung Cancer Trial in 2004 adjuvant chemo therapy containing a platinum agent has become the standard of care for patients with a complete surgical resecti on of American Joint Committee on Cancer stage II to III (versi on 6) non-small cell lung cancer (NSCLC).1 The trial in cluded patients with stage I to III disease and demonstrated an absolute 4.1% improvement in overall survival (OS) and a subgroup analysis in dicated that the OS benefit in creased with stage: the hazards ratio (HR) for death among patients receiving adjuvant chemo therapy compared with controls was approximately 0.98 for patients with stage I disease 0.88 for patients with stage II disease and 0.79 for patients with stage III disease.1 The data were confirmed by the National Cancer In stitute of Canada Clinical Trials Group JBR.10 trial in 2005 which in cluded patients with stage IB and stage II disease.2 A third trial Cancer and Leukemia Group B (CALGB) 9633 which in cluded only patients with stage IB disease was terminated early and also reported a the rapeutic benefit for adjuvant chemo therapy.3 However a final analysis of mature data revealed no statistically significant OS benefit (HR 0.83) but demonstrated a benefit for patients with tumor diameters of??4 cm (HR 0.69).4 During the same time period an in creasing number of correlative biomarker analyses demonstrated that the efficacy of platinum agents was as sociated with in tratumoral levels of the excisi on repair cross-complementing group 1 (ERCC 1) gene with high levels in dicating resistance.5\"9 Similarly high in tratumoral levels of the regulatory subunit of ribonucleotide reductase M 1 (RRM 1) were reported to be predictive of resistance to gemcitabine.9\"13 Finally both biomarkers had also been reported to be prognostic of survival in patients who had not received chemo therapy or radiati on with high levels in dicating longer survival.814\"16 Based on these data we designed an adjuv", ".01 Fisher's exact test). m NP patients showed prolonged PFS (HR?=?0.27; 95% CI 0.04 to 0.59; P<0.01) and OS (HR?=?0.34; 95% CI 0.06 to 0.84; P?=?0.03). Late PET analysis provided concordant Lung cancer is the leading cause of cancer-related death in both Europe and the United States of America. The most comm on forms of lung cancer are non-small cell lung cancer (NSCLC) histological subtypes. Systemic chemo therapy has contributed to a significant improvement in NSCLC the rapy but progress appears to be stagnating. Over the last decade a better knowledge of cellular pathways has allowed the development of new the rapies based on NSCLC-driving genetic abnormalities. Targeted the rapies have been developed to block pathological cellular pathways in volved in cancer cell survival proliferati on and metastasis. Epidermal Growth Fact or Recept or (EGFR) is over expressed in NSCLC and has been extensively studied as a potential the rapeutic target. Two EGF Recept or blockers gefitinib and erlotinib have been demonstrated to be effective in front-line the rapy in patients with in operable NSCLC harboring EGFR-activating mutations. Erlotinib is also authorized after failure of previous chemo therapy and as maintenance the rapy. In clinical practice evaluati on of tumor response is based on changes in tumor size according to criteria proposed by the World Health anizati on or RECIST criteria. This morphological evaluati on may lead to under estimati on of the efficacy of cytostatic the rapeutic agents such as erlotinib that stabilize the disease in non-mutated patients where as conventional cytotoxic drugs in duce shrinkage of tumor dimensions in the case of tumor response. NSCLC tumor size evaluati on can also be difficult due to at electasis of normal lung. The major", ".01 Fisher's exact test). m NP patients showed prolonged PFS (HR?=?0.27; 95% CI 0.04 to 0.59; P<0.01) and OS (HR?=?0.34; 95% CI 0.06 to 0.84; P?=?0.03). Late PET analysis provided concordant Lung cancer is the leading cause of cancer-related death in both Europe and the United States of America. The most comm on forms of lung cancer are non-small cell lung cancer (NSCLC) histological subtypes. Systemic chemo therapy has contributed to a significant improvement in NSCLC the rapy but progress appears to be stagnating. Over the last decade a better knowledge of cellular pathways has allowed the development of new the rapies based on NSCLC-driving genetic abnormalities. Targeted the rapies have been developed to block pathological cellular pathways in volved in cancer cell survival proliferati on and metastasis. Epidermal Growth Fact or Recept or (EGFR) is over expressed in NSCLC and has been extensively studied as a potential the rapeutic target. Two EGF Recept or blockers gefitinib and erlotinib have been demonstrated to be effective in front-line the rapy in patients with in operable NSCLC harboring EGFR-activating mutations. Erlotinib is also authorized after failure of previous chemo therapy and as maintenance the rapy. In clinical practice evaluati on of tumor response is based on changes in tumor size according to criteria proposed by the World Health Or ganizati on or RECIST criteria. This morphological evaluati on may lead to under estimati on of the efficacy of cytostatic the rapeutic agents such as erlotinib that stabilize the disease in non-mutated patients where as conventional cytotoxic drugs in duce shrinkage of tumor dimensions in the case of tumor response. NSCLC tumor size evaluati on can also be difficult due to at electasis of normal lung. The major", "Lung cancer represents the most frequent cause of cancer deaths. More than 225000 new cases were diagnosed during 2012 only in the United States of America accounting for approximately 160000 annual deaths. More than 50% of the patients diagnosed with non-small cell lung cancer (NSCLC) present advanced disease (stage III and IV) at onset. The most comm on histology is adeno carcinoma representing approximately 80% of all cases. Pemetrexed is a multitargeted antifolate drug and one of the latest active drugs against NSCLC approved for the first-line (in combinati on with cisplat in) and second-line treatment (mono therapy) of patients with non-squamous histology. More recently pemetrexed gained approval for its use as a single-agent maintenance the rapy after response/stabilizati on to four cycles of a platinum doublet with or without pemetrexed. Thymidylate synthase (TS) is the main biological target of antifolate drugs such as pemetrexed or 5-fluorouracil. Different studies have evaluated the correlati on between tumor TS expressi on and TS genotype and the prognosis of patients with different cancer types treated with antifolates. In NSCLC constitutive expressi on of TS is lower in tumors with adeno carcinoma histology than among those with squamous differentiati on. This finding could possibly expla in the higher efficacy of the drug among non-squamous histology patients.", "Following failure of chemo therapy and erlotinib treatment options are limited for patients with advanced non\"small cell lung cancer (NSCLC). Reversible epidermal growth fact or recept or (EGFR) tyrosine kinase in hibitors (TKIs) such as erlotinib and gefitinib selectively target EGFR/HER 1 one of the members of the human epidermal growth fact or recept or (HER) family and are most effective in cancers harboring EGFR mutations. The remaining members of the HER family comprise HER 2 and HER 4 tyrosine kinases and the kinase? null HER 3.1 HER family members act to gether via hetero? and homodimerizati on to enable downstream signaling pathways modulating a range of cellular activities in cluding growth proliferati on differentiati on and migrati on.1 In contrast to patients with EGFR? mutati on? positive tumors patients with KRAS? mutant NSCLC are unlikely to respond to gefitinib or erlotinib and do not have an improved progressi on? free survival (PFS) compared with those who have placebo following erlotinib the rapy.2 Dacomitinib (PF?00299804) is a potent irreversible oral small? molecule in hibit or of HER 1/EGFR HER 2 and HER 4 tyrosine kinases with antitum or activity in both gefitinib? sensitive and gefitinib? resistant in cluding EGFR T 790 M preclinical NSCLC models.3 Dacomitinib demonstrated encouraging antitum or activity against NSCLC in Western and Japanese patients in phase 1 studies 5 further supported by preliminary data from phase 2 NSCLC studies conducted in Asian patients with KRAS wild? type refractory disease 7; unselected patients previously treated with chemo therapy 8; and patients with EGFR? mutant disease (first? line treatment).9 This phase 2 trial (Clinical Trials. gov identifier NCT 00548093) as sessed the efficacy safety and impact on health? related quality of life (HRQo L) of dacomitinib in patients with KRAS wild? type NS CLC who progressed after 1 or 2 chemo therapy regimens and erlotinib.", "Cetuximab is a monoclonal antibody that targets EGFR which is also used in advanced NSCLC in combinati on with standard chemo therapy as part of first-line treatment. Like erlotinib afatinib is a drug that blocks the growth signal from EGFR and used for advanced NSCLCs that have mutations in the EGFR gene. Some younger non-smokers with adenocarcinom as are found to have an ALK/EML 4 fusi on on cogene which is currently a target for the drug Crizotinib. Other drugs currently used to treat lung cancers are not gene-specific and in stead target general molecular pathways like folate anitmetabolites (methotrexate and pemetrexed) mitotic in hibitors (docetaxel piclitaxel and vinorelbine) to poisomerase in hibitors (etopophos and to potecan) and nucleoside analogs which in terfere with DNA synthesis (carboplat in cisplat in and gemciabine). In hibitors of EGFR-directed tyrosine kinase are established to be an effective treatment opti on for advanced NSCLC not responding to chemo therapy. However EGFR-directed monoclonal antibodies in combinati on with platinum-based first-line chemo therapy cetuximab combined with cisplat in/vinorelbine and bevacizumab in combinati on with platinum-based chemo therapy resulted in better survival compared to chemo therapy alone in patients with advanced EGFR-positive NSCLC. Other targeted the rapies in cluding dual and multi-kinase in hibitors are in earlier stages of clinical development. With the accumulati on of knowledge and experience in next generati on technologies it is necessary to expand our under standing in the sensitivity of specific mutations to in dividualized the rapies. \""], "answer": "The survival outcomes for advanced non-small cell lung cancer (NSCLC) patients are poor. The 5-year survival rate is 5% for stage IIIb NSCLC and less than 1% for stage IV NSCLC. Despite advances in treatment, including molecular targeted therapies, the median overall survival (OS) for these patients remains low, and acquired resistance to targeted agents is a significant clinical challenge."}
{"question": "What phases of clinical trials (I/II/III) are represented in lung cancer targeted therapy research?", "contexts": ["Lung cancer is one of the main causes of cancer-related mortality. Approximately 85% of lung cancers are diagnosed as non-small cell lung cancer (NSCLC) and the overall survival (OS) rate for advanced NSCLC is poor. The 5-year survival rate is 5% for stage IIIb NSCLC and <1% for stage IV NSCLC (1). Treatment for NCSLC is determined by the patient\u2122s clinical and tumor characteristics per formance status (PS) the histological subtype and tumor genotype/phenotype. Recently there have been many studies concerning agents that target molecular changes such as mutations in the epidermal growth fact or recept or (EGFR) and the fusi on on cogene EML 4-ALK in which the echinoderm microtubule-as sociated prote in-like 4 (EML 4) is fused with the in tracellular doma in of anaplastic kinase (ALK) (2\"4). Although significant advances have been made in the treatment of NSCLC using molecular targeted the rapies such as erlotinib and crizotinib the median OS for patients with advanced NSCLC remains low (56) and acquired resistance to target agents is a major clinical problem. The refore the development of novel the rapies is needed (7). Immuno therapy manipulates the immune system to control and eradicate cancer. Many recent studies provide evidence suggesting that immunotherapeutic manipulations are viable in many tumor types in cluding lung cancer. Numerous trials of peptide vaccines autologous cellular the rapy T cell-directed antibody the rapy and monoclonal antibody the rapy for lung cancer have been carried out around the world (8\"10) and some of them have shown favorable", "Lung cancer is one of the main causes of cancer-related mortality. Approximately 85% of lung cancers are diagnosed as non-small cell lung cancer (NSCLC) and the overall survival (OS) rate for advanced NSCLC is poor. The 5-year survival rate is 5% for stage IIIb NSCLC and <1% for stage IV NSCLC. Treatment for NCSLC is determined by the patient\u2122s clinical and tumor characteristics per formance status (PS) the histological subtype and tumor genotype/phenotype. Recently there have been many studies concerning agents that target molecular changes such as mutations in the epidermal growth fact or recept or (EGFR) and the fusi on on cogene EML 4-ALK in which the echinoderm microtubule-as sociated prote in-like 4 (EML 4) is fused with the in tracellular doma in of anaplastic kinase (ALK) (2\"4). Although significant advances have been made in the treatment of NSCLC using molecular targeted the rapies such as erlotinib and crizotinib the median OS for patients with advanced NSCLC remains low and acquired resistance to target agents is a major clinical problem. The refore the development of novel the rapies is needed. Immuno therapy manipulates the immune system to control and eradicate cancer. Many recent studies provide evidence suggesting that immunotherapeutic manipulations are viable in many tumor types in cluding lung cancer. Numerous trials of peptide vaccines autologous cellular the rapy T cell-directed antibody the rapy and monoclonal antibody the rapy for lung cancer have been carried out around the world (8\"10) and some of them have shown favorable", "After publicati on of the In ternational Adjuvant Lung Cancer Trial in 2004 adjuvant chemo therapy containing a platinum agent has become the standard of care for patients with a complete surgical resecti on of American Joint Committee on Cancer stage II to III (versi on 6) non-small cell lung cancer (NSCLC).1 The trial in cluded patients with stage I to III disease and demonstrated an absolute 4.1% improvement in overall survival (OS) and a subgroup analysis in dicated that the OS benefit in creased with stage: the hazards ratio (HR) for death among patients receiving adjuvant chemo therapy compared with controls was approximately 0.98 for patients with stage I disease 0.88 for patients with stage II disease and 0.79 for patients with stage III disease.1 The data were confirmed by the National Cancer In stitute of Canada Clinical Trials Group JBR.10 trial in 2005 which in cluded patients with stage IB and stage II disease.2 A third trial Cancer and Leukemia Group B (CALGB) 9633 which in cluded only patients with stage IB disease was terminated early and also reported a the rapeutic benefit for adjuvant chemo therapy.3 However a final analysis of mature data revealed no statistically significant OS benefit (HR 0.83) but demonstrated a benefit for patients with tumor diameters of??4 cm (HR 0.69).4 During the same time period an in creasing number of correlative biomarker analyses demonstrated that the efficacy of platinum agents was as sociated with in tratumoral levels of the excisi on repair cross-complementing group 1 (ERCC 1) gene with high levels in dicating resistance.5\"9 Similarly high in tratumoral levels of the regulatory subunit of ribonucleotide reductase M 1 (RRM 1) were reported to be predictive of resistance to gemcitabine.9\"13 Finally both biomarkers had also been reported to be prognostic of survival in patients who had not received chemo therapy or radiati on with high levels in dicating longer survival.814\"16 Based on these data we designed an adjuv", "Stage at primarydiagnosis \u00b1 obscure boundary \u00b1 Emphysema \u00b1 T tumor \u00b1 L 1 cycle \u00b1 Obstructivepneumoniaatelectasis \u00b1 pulmonary nodule Patients with SCLCStage at recruitmenttime \u00b1 Stage at primarydiagnosis \u00b1 N 1 ipsilateral Paratracheal \u00b1 T tumor \u00b1 N 1 ipsilateral hilum \u00b1 N 2 ipsilateralmediastinum \u00b1 Enhanced image \u00b1 pulmonary nodule \u00b1 N LN \u00b1 Maintenancetreatment Patients survived Stage at primarydiagnosis \u00b1 N 2 ipsilateralmediastinum \u00b1 Enhanced image \u00b1 Stage at recruitmenttime \u00b1 N 1 ipsilateral hilum \u00b1 TTF 1 \u00b1 Naps in A \u00b1 Locati on \u00b1 N 1 ipsilateralparatracheal \u00b1 Lobular Patientsnonsurvived Stage at recruitmenttime \u00b1 Stage at primarydiagnosis \u00b1 N 1 ipsilateralparatracheal \u00b1 N 2 ipsilateralmediastinum \u00b1 N 1 ipsilateral hilum \u00b1 Enhanced image \u00b1 N 2 below carina \u00b1 TTF 1 \u00b1 N LN \u00b1 T tumor \u00b1 \u00b1 Abbreviations N degrees of lung cancer metastasis to lymph nodes of TNM category N 1 degree that has metastatic lymph nodes near pulmonary center and side of main bronchia N 2 degree that has metastatic lymph nodes in the same side of the mediastinum as lung cancer TTF 1 thyroid transcripti on fact or 1 asan immunohistochemical biomarker for adeno carcinoma CK 7 kerat in as an immunohistochemical biomarker for epithelial cells L 1 cycle number of the firstline chemo therapy cycles \u00b1 \u00b1 \u00b1 in ADC and SCC and lyso PG in SCLC where as PG and TAG in creased in ADC and SCCPE in SCLC and PC in SCC The volcanic map demonstrated the clear patterns of lipid elements significantlyincreased or declined between heathy controls with ADCFigure 4 E SCC or SCLC and varied among different subtypes of lung cancerspatient genders Different lipidomics between About or lipid elements significantly in creased and or declined", ".01 Fisher's exact test). m NP patients showed prolonged PFS (HR?=?0.27; 95% CI 0.04 to 0.59; P<0.01) and OS (HR?=?0.34; 95% CI 0.06 to 0.84; P?=?0.03). Late PET analysis provided concordant Lung cancer is the leading cause of cancer-related death in both Europe and the United States of America. The most comm on forms of lung cancer are non-small cell lung cancer (NSCLC) histological subtypes. Systemic chemo therapy has contributed to a significant improvement in NSCLC the rapy but progress appears to be stagnating. Over the last decade a better knowledge of cellular pathways has allowed the development of new the rapies based on NSCLC-driving genetic abnormalities. Targeted the rapies have been developed to block pathological cellular pathways in volved in cancer cell survival proliferati on and metastasis. Epidermal Growth Fact or Recept or (EGFR) is over expressed in NSCLC and has been extensively studied as a potential the rapeutic target. Two EGF Recept or blockers gefitinib and erlotinib have been demonstrated to be effective in front-line the rapy in patients with in operable NSCLC harboring EGFR-activating mutations. Erlotinib is also authorized after failure of previous chemo therapy and as maintenance the rapy. In clinical practice evaluati on of tumor response is based on changes in tumor size according to criteria proposed by the World Health anizati on or RECIST criteria. This morphological evaluati on may lead to under estimati on of the efficacy of cytostatic the rapeutic agents such as erlotinib that stabilize the disease in non-mutated patients where as conventional cytotoxic drugs in duce shrinkage of tumor dimensions in the case of tumor response. NSCLC tumor size evaluati on can also be difficult due to at electasis of normal lung. The major", ".01 Fisher's exact test). m NP patients showed prolonged PFS (HR?=?0.27; 95% CI 0.04 to 0.59; P<0.01) and OS (HR?=?0.34; 95% CI 0.06 to 0.84; P?=?0.03). Late PET analysis provided concordant Lung cancer is the leading cause of cancer-related death in both Europe and the United States of America. The most comm on forms of lung cancer are non-small cell lung cancer (NSCLC) histological subtypes. Systemic chemo therapy has contributed to a significant improvement in NSCLC the rapy but progress appears to be stagnating. Over the last decade a better knowledge of cellular pathways has allowed the development of new the rapies based on NSCLC-driving genetic abnormalities. Targeted the rapies have been developed to block pathological cellular pathways in volved in cancer cell survival proliferati on and metastasis. Epidermal Growth Fact or Recept or (EGFR) is over expressed in NSCLC and has been extensively studied as a potential the rapeutic target. Two EGF Recept or blockers gefitinib and erlotinib have been demonstrated to be effective in front-line the rapy in patients with in operable NSCLC harboring EGFR-activating mutations. Erlotinib is also authorized after failure of previous chemo therapy and as maintenance the rapy. In clinical practice evaluati on of tumor response is based on changes in tumor size according to criteria proposed by the World Health Or ganizati on or RECIST criteria. This morphological evaluati on may lead to under estimati on of the efficacy of cytostatic the rapeutic agents such as erlotinib that stabilize the disease in non-mutated patients where as conventional cytotoxic drugs in duce shrinkage of tumor dimensions in the case of tumor response. NSCLC tumor size evaluati on can also be difficult due to at electasis of normal lung. The major", "Lung cancer represents the most frequent cause of cancer deaths. More than 225000 new cases were diagnosed during 2012 only in the United States of America accounting for approximately 160000 annual deaths. More than 50% of the patients diagnosed with non-small cell lung cancer (NSCLC) present advanced disease (stage III and IV) at onset. The most comm on histology is adeno carcinoma representing approximately 80% of all cases. Pemetrexed is a multitargeted antifolate drug and one of the latest active drugs against NSCLC approved for the first-line (in combinati on with cisplat in) and second-line treatment (mono therapy) of patients with non-squamous histology. More recently pemetrexed gained approval for its use as a single-agent maintenance the rapy after response/stabilizati on to four cycles of a platinum doublet with or without pemetrexed. Thymidylate synthase (TS) is the main biological target of antifolate drugs such as pemetrexed or 5-fluorouracil. Different studies have evaluated the correlati on between tumor TS expressi on and TS genotype and the prognosis of patients with different cancer types treated with antifolates. In NSCLC constitutive expressi on of TS is lower in tumors with adeno carcinoma histology than among those with squamous differentiati on. This finding could possibly expla in the higher efficacy of the drug among non-squamous histology patients.", "Lung cancer represents the most frequent cause of cancer deaths. More than 225000 new cases were diagnosed during 2012 only in the United States of America accounting for approximately 160000 annual deaths. More than 50% of the patients diagnosed with non-small cell lung cancer (NSCLC) present advanced disease (stage III and IV) at onset. The most comm on histology is adeno carcinoma representing approximately 80% of all cases. Pemetrexed is a multitargeted antifolate drug and one of the latest active drugs against NSCLC approved for the first-line (in combinati on with cisplat in) and second-line treatment (mono therapy) of patients with non-squamous histology. More recently pemetrexed gained approval for its use as a single-agent maintenance the rapy after response/stabilizati on to four cycles of a platinum doublet with or without pemetrexed. Thymidylate synthase (TS) is the main biological target of antifolate drugs such as pemetrexed or 5-fluorouracil. Different studies have evaluated the correlati on between tumor TS expressi on and TS genotype and the prognosis of patients with different cancer types treated with antifolates. In NSCLC constitutive expressi on of TS is lower in tumors with adeno carcinoma histology than among those with squamous differentiati on. This finding could possibly expla in the higher efficacy of the drug among non-squamous histology patients. The potential predictive role of TS polymorphisms in NSCLC has never been studied in a European populati on. In additi on how differential TS genotypes may impact on the outcome of patients depending on their smoking status or with Epidermal Growth Fact or Recept or (EGFR) activating mutations tumors is to be determined. Finally although the to xicity profile described in most patients receiving pemetrexed in combinati on or as a single agent is usually favorable there are several reported cases of fundamentally dermatological hematological and potentially serious renal to xicities even when the", "Following failure of chemo therapy and erlotinib treatment options are limited for patients with advanced non\"small cell lung cancer (NSCLC). Reversible epidermal growth fact or recept or (EGFR) tyrosine kinase in hibitors (TKIs) such as erlotinib and gefitinib selectively target EGFR/HER 1 one of the members of the human epidermal growth fact or recept or (HER) family and are most effective in cancers harboring EGFR mutations. The remaining members of the HER family comprise HER 2 and HER 4 tyrosine kinases and the kinase? null HER 3.1 HER family members act to gether via hetero? and homodimerizati on to enable downstream signaling pathways modulating a range of cellular activities in cluding growth proliferati on differentiati on and migrati on.1 In contrast to patients with EGFR? mutati on? positive tumors patients with KRAS? mutant NSCLC are unlikely to respond to gefitinib or erlotinib and do not have an improved progressi on? free survival (PFS) compared with those who have placebo following erlotinib the rapy.2 Dacomitinib (PF?00299804) is a potent irreversible oral small? molecule in hibit or of HER 1/EGFR HER 2 and HER 4 tyrosine kinases with antitum or activity in both gefitinib? sensitive and gefitinib? resistant in cluding EGFR T 790 M preclinical NSCLC models.3 Dacomitinib demonstrated encouraging antitum or activity against NSCLC in Western and Japanese patients in phase 1 studies 5 further supported by preliminary data from phase 2 NSCLC studies conducted in Asian patients with KRAS wild? type refractory disease 7; unselected patients previously treated with chemo therapy 8; and patients with EGFR? mutant disease (first? line treatment).9 This phase 2 trial (Clinical Trials. gov identifier NCT 00548093) as sessed the efficacy safety and impact on health? related quality of life (HRQo L) of dacomitinib in patients with KRAS wild? type NS CLC who progressed after 1 or 2 chemo therapy regimens and erlotinib.", "Lung cancer is the leading cause of cancer-related death in many countries in cluding the China. Non-small cell lung cancer (NSCLC) accounts for up to 80% of all lung cancer cases; patients typically present with advanced disease at the time of diagnosis. The prognosis of patients with advanced lung cancer remains poor and recent studies show that conventional the rapies may have reached a the rapeutic plateau as evidenced by the 5-year survival rate for NSCLCs which remains at 15%. The EGF recept or tyrosine kinase in hibitors (EGFR-TKIs) gefitinib and erlotinib have shown marked the rapeutic effects against NSCLCs with EGFR activating mutations such as exon 19 deletions and L 858 R point mutations. Almost all tumors however acquire resistance to EGFR-TKIs after varying per iods of time. Comm on mechanisms for acquired resistance in clude emergence of an EGFR gatekeeper mutati on (T 790 M) and MET gene amplificati on. In additi on PIK 3 CA mutations as well as KRAS mutations have been found to contribute to EGFR-TKIs resistance in a subpopulati on of tumors. The limited the rapeutic options currently available for patients with advanced lung cancer create a pressing need to identify new the rapeutic strategy. Selumetinib (AZD 6244) is an oral non-ATP competitive in hibit or and highly specific for extracellular signal-regulated kinase (ERK) kinase (MEK)1/2 a key enzyme in the RAS-RAF-MEK-ERK pathway."], "answer": "Insufficient evidence in provided documents."}
{"question": "Are there real-world observational studies in lung cancer treatment?", "contexts": ["Stage at primarydiagnosis \u00b1 obscure boundary \u00b1 Emphysema \u00b1 T tumor \u00b1 L 1 cycle \u00b1 Obstructivepneumoniaatelectasis \u00b1 pulmonary nodule Patients with SCLCStage at recruitmenttime \u00b1 Stage at primarydiagnosis \u00b1 N 1 ipsilateral Paratracheal \u00b1 T tumor \u00b1 N 1 ipsilateral hilum \u00b1 N 2 ipsilateralmediastinum \u00b1 Enhanced image \u00b1 pulmonary nodule \u00b1 N LN \u00b1 Maintenancetreatment Patients survived Stage at primarydiagnosis \u00b1 N 2 ipsilateralmediastinum \u00b1 Enhanced image \u00b1 Stage at recruitmenttime \u00b1 N 1 ipsilateral hilum \u00b1 TTF 1 \u00b1 Naps in A \u00b1 Locati on \u00b1 N 1 ipsilateralparatracheal \u00b1 Lobular Patientsnonsurvived Stage at recruitmenttime \u00b1 Stage at primarydiagnosis \u00b1 N 1 ipsilateralparatracheal \u00b1 N 2 ipsilateralmediastinum \u00b1 N 1 ipsilateral hilum \u00b1 Enhanced image \u00b1 N 2 below carina \u00b1 TTF 1 \u00b1 N LN \u00b1 T tumor \u00b1 \u00b1 Abbreviations N degrees of lung cancer metastasis to lymph nodes of TNM category N 1 degree that has metastatic lymph nodes near pulmonary center and side of main bronchia N 2 degree that has metastatic lymph nodes in the same side of the mediastinum as lung cancer TTF 1 thyroid transcripti on fact or 1 asan immunohistochemical biomarker for adeno carcinoma CK 7 kerat in as an immunohistochemical biomarker for epithelial cells L 1 cycle number of the firstline chemo therapy cycles \u00b1 \u00b1 \u00b1 in ADC and SCC and lyso PG in SCLC where as PG and TAG in creased in ADC and SCCPE in SCLC and PC in SCC The volcanic map demonstrated the clear patterns of lipid elements significantlyincreased or declined between heathy controls with ADCFigure 4 E SCC or SCLC and varied among different subtypes of lung cancerspatient genders Different lipidomics between About or lipid elements significantly in creased and or declined", ". Lung cancer in non-smokers can be in duced by second hand smoke air pollutants and diesel exhaust. Our present data showed significant difference of pack-year smoked but not smoking status between NSCLC cases and controls which suggested the important role of other environmental factors in the development of NSCLC. To bacco could in duce chronic and sustained in flammati on in lung micro environment contributing to pulmonary carcinogenesis in smokers. Support also comes from the epidemiologic data regarding in flammati on and lung cancer. CR 1 an important molecule implicated in immunity and in flammati on could protect the host from in vasi on of exogenous chemicals derived from cigarette smoking. Genetic variant of CR 1 could alter gene functi on and result in deregulati on of the in flammatory and immune responses the reby modulating the susceptibility to lung cancer. More importantly we observed a potential in teracti on of this SNP (rs 7525160 G?>? C) with smoking status suggesting the gene-environmental in teracti on plays a prominent role in the susceptibility to lung cancer. Our present study has its limitati on. Our patients may not be representative of total NSCLC patients at large because they were recruited from only one hospital. In additi on due to the relatively small sample size further case-control studies are still needed to replicate and extend our findings.", "(NSCLC) patients and 53 small cell carcinoma patients. In the NSCLC cases there were 320 adenocarcinom as 73 squamous cell carcinom as and 41 other tumors with a variety of different pathologies (such as large cell carcinom as mixed cell carcinom as or undifferentiated carcinom as)..0096911. t 001 Characteristics of lung cancer cases and controls. Variables Cases(%) Controls(%) P value Female 487 516 Mean age (years) 56.5\u00b111.7 56.3\u00b112.5 0.248 a In come (yuan/month) 628.9\u00b1419.3 563.5\u00b1387.6 0.084 a Never smoker 487 516 Histological type NSCLC 434(89.1) Adeno carcinoma 320(65.7) Squamous cell carcinoma 73(15.0) Small cell carcinoma 53(10.9) Other 41(8.4) a Student's t-test was used to compare the frequency distributions of demographic variables between the cases and controls. As sociati on analysis The observed genotype frequencies among the control subjects was in agreement with that expected under the Hardy-Weinberg equilibrium (P?=?0.119). The distributi on of ATM rs 189037 genotypes among subjects were displayed in Using subjects with the ATM rs 189037 GG genotype as the reference group we calculated the ORs and 95%CIs for heterozygous carriers of GA genotype and homozygous carriers of AA genotype. No significant difference was observed between lung cancer cases and controls in each test (P>0.05). In order to in crease the statistical power we combined the GA genotype with the AA genotype to compare with GG genotype as a dominant model and combined the GA genotype with the GG genotype to compare with AA genotype as a recessive model. The in dicated that in dividuals with AA genotype had a significantly elevated risk of lung adeno carcinoma compared with those carrying the GG or GA genotype (OR?=?1.44 95%CI 1.02\"2.02 P?=?0.039)..0096911. t 002 Distributi on of ATM rs 189037 genotypes and ORs for lung cancer cases and controls.", "Lung cancer is one of the main causes of cancer-related mortality. Approximately 85% of lung cancers are diagnosed as non-small cell lung cancer (NSCLC) and the overall survival (OS) rate for advanced NSCLC is poor. The 5-year survival rate is 5% for stage IIIb NSCLC and <1% for stage IV NSCLC. Treatment for NCSLC is determined by the patient\u2122s clinical and tumor characteristics per formance status (PS) the histological subtype and tumor genotype/phenotype. Recently there have been many studies concerning agents that target molecular changes such as mutations in the epidermal growth fact or recept or (EGFR) and the fusi on on cogene EML 4-ALK in which the echinoderm microtubule-as sociated prote in-like 4 (EML 4) is fused with the in tracellular doma in of anaplastic kinase (ALK) (2\"4). Although significant advances have been made in the treatment of NSCLC using molecular targeted the rapies such as erlotinib and crizotinib the median OS for patients with advanced NSCLC remains low and acquired resistance to target agents is a major clinical problem. The refore the development of novel the rapies is needed. Immuno therapy manipulates the immune system to control and eradicate cancer. Many recent studies provide evidence suggesting that immunotherapeutic manipulations are viable in many tumor types in cluding lung cancer. Numerous trials of peptide vaccines autologous cellular the rapy T cell-directed antibody the rapy and monoclonal antibody the rapy for lung cancer have been carried out around the world (8\"10) and some of them have shown favorable", "Lung cancer is one of the main causes of cancer-related mortality. Approximately 85% of lung cancers are diagnosed as non-small cell lung cancer (NSCLC) and the overall survival (OS) rate for advanced NSCLC is poor. The 5-year survival rate is 5% for stage IIIb NSCLC and <1% for stage IV NSCLC (1). Treatment for NCSLC is determined by the patient\u2122s clinical and tumor characteristics per formance status (PS) the histological subtype and tumor genotype/phenotype. Recently there have been many studies concerning agents that target molecular changes such as mutations in the epidermal growth fact or recept or (EGFR) and the fusi on on cogene EML 4-ALK in which the echinoderm microtubule-as sociated prote in-like 4 (EML 4) is fused with the in tracellular doma in of anaplastic kinase (ALK) (2\"4). Although significant advances have been made in the treatment of NSCLC using molecular targeted the rapies such as erlotinib and crizotinib the median OS for patients with advanced NSCLC remains low (56) and acquired resistance to target agents is a major clinical problem. The refore the development of novel the rapies is needed (7). Immuno therapy manipulates the immune system to control and eradicate cancer. Many recent studies provide evidence suggesting that immunotherapeutic manipulations are viable in many tumor types in cluding lung cancer. Numerous trials of peptide vaccines autologous cellular the rapy T cell-directed antibody the rapy and monoclonal antibody the rapy for lung cancer have been carried out around the world (8\"10) and some of them have shown favorable", "Lung cancer represents the most frequent cause of cancer deaths. More than 225000 new cases were diagnosed during 2012 only in the United States of America accounting for approximately 160000 annual deaths. More than 50% of the patients diagnosed with non-small cell lung cancer (NSCLC) present advanced disease (stage III and IV) at onset. The most comm on histology is adeno carcinoma representing approximately 80% of all cases. Pemetrexed is a multitargeted antifolate drug and one of the latest active drugs against NSCLC approved for the first-line (in combinati on with cisplat in) and second-line treatment (mono therapy) of patients with non-squamous histology. More recently pemetrexed gained approval for its use as a single-agent maintenance the rapy after response/stabilizati on to four cycles of a platinum doublet with or without pemetrexed. Thymidylate synthase (TS) is the main biological target of antifolate drugs such as pemetrexed or 5-fluorouracil. Different studies have evaluated the correlati on between tumor TS expressi on and TS genotype and the prognosis of patients with different cancer types treated with antifolates. In NSCLC constitutive expressi on of TS is lower in tumors with adeno carcinoma histology than among those with squamous differentiati on. This finding could possibly expla in the higher efficacy of the drug among non-squamous histology patients. The potential predictive role of TS polymorphisms in NSCLC has never been studied in a European populati on. In additi on how differential TS genotypes may impact on the outcome of patients depending on their smoking status or with Epidermal Growth Fact or Recept or (EGFR) activating mutations tumors is to be determined. Finally although the to xicity profile described in most patients receiving pemetrexed in combinati on or as a single agent is usually favorable there are several reported cases of fundamentally dermatological hematological and potentially serious renal to xicities even when the", "After publicati on of the In ternational Adjuvant Lung Cancer Trial in 2004 adjuvant chemo therapy containing a platinum agent has become the standard of care for patients with a complete surgical resecti on of American Joint Committee on Cancer stage II to III (versi on 6) non-small cell lung cancer (NSCLC).1 The trial in cluded patients with stage I to III disease and demonstrated an absolute 4.1% improvement in overall survival (OS) and a subgroup analysis in dicated that the OS benefit in creased with stage: the hazards ratio (HR) for death among patients receiving adjuvant chemo therapy compared with controls was approximately 0.98 for patients with stage I disease 0.88 for patients with stage II disease and 0.79 for patients with stage III disease.1 The data were confirmed by the National Cancer In stitute of Canada Clinical Trials Group JBR.10 trial in 2005 which in cluded patients with stage IB and stage II disease.2 A third trial Cancer and Leukemia Group B (CALGB) 9633 which in cluded only patients with stage IB disease was terminated early and also reported a the rapeutic benefit for adjuvant chemo therapy.3 However a final analysis of mature data revealed no statistically significant OS benefit (HR 0.83) but demonstrated a benefit for patients with tumor diameters of??4 cm (HR 0.69).4 During the same time period an in creasing number of correlative biomarker analyses demonstrated that the efficacy of platinum agents was as sociated with in tratumoral levels of the excisi on repair cross-complementing group 1 (ERCC 1) gene with high levels in dicating resistance.5\"9 Similarly high in tratumoral levels of the regulatory subunit of ribonucleotide reductase M 1 (RRM 1) were reported to be predictive of resistance to gemcitabine.9\"13 Finally both biomarkers had also been reported to be prognostic of survival in patients who had not received chemo therapy or radiati on with high levels in dicating longer survival.814\"16 Based on these data we designed an adjuv", ".01 Fisher's exact test). m NP patients showed prolonged PFS (HR?=?0.27; 95% CI 0.04 to 0.59; P<0.01) and OS (HR?=?0.34; 95% CI 0.06 to 0.84; P?=?0.03). Late PET analysis provided concordant Lung cancer is the leading cause of cancer-related death in both Europe and the United States of America. The most comm on forms of lung cancer are non-small cell lung cancer (NSCLC) histological subtypes. Systemic chemo therapy has contributed to a significant improvement in NSCLC the rapy but progress appears to be stagnating. Over the last decade a better knowledge of cellular pathways has allowed the development of new the rapies based on NSCLC-driving genetic abnormalities. Targeted the rapies have been developed to block pathological cellular pathways in volved in cancer cell survival proliferati on and metastasis. Epidermal Growth Fact or Recept or (EGFR) is over expressed in NSCLC and has been extensively studied as a potential the rapeutic target. Two EGF Recept or blockers gefitinib and erlotinib have been demonstrated to be effective in front-line the rapy in patients with in operable NSCLC harboring EGFR-activating mutations. Erlotinib is also authorized after failure of previous chemo therapy and as maintenance the rapy. In clinical practice evaluati on of tumor response is based on changes in tumor size according to criteria proposed by the World Health anizati on or RECIST criteria. This morphological evaluati on may lead to under estimati on of the efficacy of cytostatic the rapeutic agents such as erlotinib that stabilize the disease in non-mutated patients where as conventional cytotoxic drugs in duce shrinkage of tumor dimensions in the case of tumor response. NSCLC tumor size evaluati on can also be difficult due to at electasis of normal lung. The major", ".01 Fisher's exact test). m NP patients showed prolonged PFS (HR?=?0.27; 95% CI 0.04 to 0.59; P<0.01) and OS (HR?=?0.34; 95% CI 0.06 to 0.84; P?=?0.03). Late PET analysis provided concordant Lung cancer is the leading cause of cancer-related death in both Europe and the United States of America. The most comm on forms of lung cancer are non-small cell lung cancer (NSCLC) histological subtypes. Systemic chemo therapy has contributed to a significant improvement in NSCLC the rapy but progress appears to be stagnating. Over the last decade a better knowledge of cellular pathways has allowed the development of new the rapies based on NSCLC-driving genetic abnormalities. Targeted the rapies have been developed to block pathological cellular pathways in volved in cancer cell survival proliferati on and metastasis. Epidermal Growth Fact or Recept or (EGFR) is over expressed in NSCLC and has been extensively studied as a potential the rapeutic target. Two EGF Recept or blockers gefitinib and erlotinib have been demonstrated to be effective in front-line the rapy in patients with in operable NSCLC harboring EGFR-activating mutations. Erlotinib is also authorized after failure of previous chemo therapy and as maintenance the rapy. In clinical practice evaluati on of tumor response is based on changes in tumor size according to criteria proposed by the World Health Or ganizati on or RECIST criteria. This morphological evaluati on may lead to under estimati on of the efficacy of cytostatic the rapeutic agents such as erlotinib that stabilize the disease in non-mutated patients where as conventional cytotoxic drugs in duce shrinkage of tumor dimensions in the case of tumor response. NSCLC tumor size evaluati on can also be difficult due to at electasis of normal lung. The major", "Lung cancer represents the most frequent cause of cancer deaths. More than 225000 new cases were diagnosed during 2012 only in the United States of America accounting for approximately 160000 annual deaths. More than 50% of the patients diagnosed with non-small cell lung cancer (NSCLC) present advanced disease (stage III and IV) at onset. The most comm on histology is adeno carcinoma representing approximately 80% of all cases. Pemetrexed is a multitargeted antifolate drug and one of the latest active drugs against NSCLC approved for the first-line (in combinati on with cisplat in) and second-line treatment (mono therapy) of patients with non-squamous histology. More recently pemetrexed gained approval for its use as a single-agent maintenance the rapy after response/stabilizati on to four cycles of a platinum doublet with or without pemetrexed. Thymidylate synthase (TS) is the main biological target of antifolate drugs such as pemetrexed or 5-fluorouracil. Different studies have evaluated the correlati on between tumor TS expressi on and TS genotype and the prognosis of patients with different cancer types treated with antifolates. In NSCLC constitutive expressi on of TS is lower in tumors with adeno carcinoma histology than among those with squamous differentiati on. This finding could possibly expla in the higher efficacy of the drug among non-squamous histology patients."], "answer": "Insufficient evidence in provided documents."}
{"question": "How do genomic alterations correlate with transcriptomic signatures in lung cancer?", "contexts": ["Identificati on of cis-acting me QTLs We profiled DNA methylati on for 244 fresh-frozen histologically normal lung samples from non-small cell lung cancer (NSCLC) patients from the Environment and Genetics in Lung cancer Etiology (EAGLE) study 19. A subset of 210 tissue samples that passed quality control and had germline genotype data from blood samples 20 was used for me QTL analysis. The analysis was restricted to 338456 autosomal Cp G probes after excluding those annotated in repetitive genomic regions or that harbored genetic variants. The distributi on of methylati on levels differed strongly across distinct types of genomic regions (Supplementary Fig. 1 ab). Consistent with previous studies 21 Cp G sites in promoter or CGI regions were largely unmethylated while those in other regions were largely methylated (Supplementary Fig. 1 ab). We per formed cis-me QTL analysis for each methylati on trait by searching for SNPs with in 500 kb of the target Cp G-site in each directi on (1 Mb overall). The genetic as sociati on was tested under an additive model between each SNP and each normalized methylati on probe adjusting for sex age plate populati on stratificati on and methylati on-based principal component analysis (PCA) scores. Controlling FDR at 5% (P=4.0\u201410?5) we detected cis-me QTLs for 34304 (10.1% of 338456) Cp G probes (Supplementary) mapping to 9330 genes.", "Identificati on of cis-acting me QTLs We profiled DNA methylati on for 244 fresh-frozen histologically normal lung samples from non-small cell lung cancer (NSCLC) patients from the Environment and Genetics in Lung cancer Etiology (EAGLE) study 19. A subset of 210 tissue samples that passed quality control and had germline genotype data from blood samples 20 was used for me QTL analysis. The analysis was restricted to 338456 autosomal Cp G probes after excluding those annotated in repetitive genomic regions or that harbored genetic variants. The distributi on of methylati on levels differed strongly across distinct types of genomic regions (Supplementary Fig. 1 ab). Consistent with previous studies 21 Cp G sites in promoter or CGI regions were largely unmethylated while those in other regions were largely methylated (Supplementary Fig. 1 ab). We per formed cis-me QTL analysis for each methylati on trait by searching for SNPs with in 500 kb of the target Cp G-site in each directi on (1 Mb overall). The genetic as sociati on was tested under an additive model between each SNP and each normalized methylati on probe adjusting for sex age plate populati on stratificati on and methylati on-based principal component analysis (PCA) scores. Controlling FDR at 5% (P=4.0\u00d710?5) we detected cis-me QTLs for 34304 (10.1% of 338456) Cp G probes (Supplementary) mapping to 9330 genes. A more stringent threshold (P=6.0\u00d710?6) at FDR=1% detected cis-me QTLs for 27043 Cp G probes mapping to 8479 genes. Moreover with a 200 kb window (100 kb from both sides) in stead than 1 Mb we detected 40650 cis-me QTLs (P=2.0\u00d710?4) controlling for FDR=5%. The methylati on distributi on in Cp G sites detected with me QTLs differed substantially from those without me QTLs (Supplementary Fig. 1 ab). The peak SNPs were equally distributed on either side of the target Cp G-sites with a median distance (?) of 11.8 kb. The proporti on of explained phenotypic variance (h 2) ranged from 7.7% to 79.8% (Supplement", "(NSCLC) patients and 53 small cell carcinoma patients. In the NSCLC cases there were 320 adenocarcinom as 73 squamous cell carcinom as and 41 other tumors with a variety of different pathologies (such as large cell carcinom as mixed cell carcinom as or undifferentiated carcinom as)..0096911. t 001 Characteristics of lung cancer cases and controls. Variables Cases(%) Controls(%) P value Female 487 516 Mean age (years) 56.5\u00b111.7 56.3\u00b112.5 0.248 a In come (yuan/month) 628.9\u00b1419.3 563.5\u00b1387.6 0.084 a Never smoker 487 516 Histological type NSCLC 434(89.1) Adeno carcinoma 320(65.7) Squamous cell carcinoma 73(15.0) Small cell carcinoma 53(10.9) Other 41(8.4) a Student's t-test was used to compare the frequency distributions of demographic variables between the cases and controls. As sociati on analysis The observed genotype frequencies among the control subjects was in agreement with that expected under the Hardy-Weinberg equilibrium (P?=?0.119). The distributi on of ATM rs 189037 genotypes among subjects were displayed in Using subjects with the ATM rs 189037 GG genotype as the reference group we calculated the ORs and 95%CIs for heterozygous carriers of GA genotype and homozygous carriers of AA genotype. No significant difference was observed between lung cancer cases and controls in each test (P>0.05). In order to in crease the statistical power we combined the GA genotype with the AA genotype to compare with GG genotype as a dominant model and combined the GA genotype with the GG genotype to compare with AA genotype as a recessive model. The in dicated that in dividuals with AA genotype had a significantly elevated risk of lung adeno carcinoma compared with those carrying the GG or GA genotype (OR?=?1.44 95%CI 1.02\"2.02 P?=?0.039)..0096911. t 002 Distributi on of ATM rs 189037 genotypes and ORs for lung cancer cases and controls.", "The chronic airway in flammati on and dysfunctional immune system might promote pulmonary carcinogenesis. Implicated in the immune and in flammatory responses the complement cascade plays a pivotal role in the development of cancer. Thus it is likely that the genetic variants of CR 1 in the complement system confer the susceptibility to lung cancer. In this study we have for the first time demonstrated that one in tronic SNP (rs 7525160 G?>? C) out of 13 tag SNPs of CR 1 was as sociated with the risk of NSCLC in Chinese populati on. Notably the rs 7525160 CC genotype was as sociated with an in creased risk of developing NSCLC (OR?=?1.52 95% CI?=?1.02-2.28; P?=?0.028) compared with the GG genotype. MDR analysis also showed that there was no gene-gene in teracti on among 12 tag SNPs in CR 1 gene. Moreover the risk of NSCLC was as sociated with the rs 7525160 C allele carriers in smokers with OR (95% CI) of 1.72 (1.15-2.59) but not in non-smokers with OR (95% CI) of 1.15 (0.81-1.65) in dicating this SNP is a smoking-modifying risk fact or for susceptibility to NSCLC. To the best of our knowledge this study shed new in sight into the in terplay of genetic variati on of CR 1 with lung cancer risk. More importantly it highlights the potential gene-environmental in teracti on in fluences the susceptibility to lung cancer.", "were in accordance with the study that genetic polymorphisms in in nate immunity genes may play a role in the carcinogenesis of lung cancer. It is likely that some genetic variations in strong link disequilibrium with this in tronic SNP (rs 7525160 G?>? C) are functional which provides a new in sight into the hallmarks in susceptibility to lung cancer and further functional experiments are warranted to address the proposal. Functionally human CR 1 exists on the surface of almost all per ipheral blood cells and plays a key role in immune complex clearance and complement in hibiti on at the cell surface by binding to activated products C 3 b and C 4 b. CR 1 also possesses cofact or activity for the serum protease fact or I and is thus in volved in the generati on of further fragments of C 3/4 b with the activati on of complement cascade and the cellular immune response. In our study the as sociati on of CR 1 polymorphism with lung cancer is biologically plausible in that the in tronic polymorphism could affect the density of CR 1 molecules on the cell surface the reby contributing to autoimmune disorders and neoplasm. To bacco smoking is an established risk fact or for susceptibility to lung cancer. However not all people who suffer from lung cancer are smokers. Lung cancer in non-smokers can be in duced by second hand smoke air pollutants and diesel exhaust. Our present data showed significant difference of pack-year smoked but not smoking status between NSCLC cases and controls which suggested the important role of other environmental factors in the development of NSCLC. To bacco could in duce chronic and sustained in flammati on in lung micro environment contributing to pulmonary carcinogenesis in smokers.", "and chronic obstructive pulmonary disease 19\" Clinicalphenomes were furthermore in tegrated with lipidomicprofiles in patients with pulmonary embolism acutepneumonia and acute exacerbati on of chronic obstructive pulmonary diseases based on clinical transomicsprinciple 15 Lipidomic profiles difference between health and lung cancer has been defined and it depends upon methodologies of measurement and analysis sample preparations and sources and patient populations and status 8 For example serum levels of lyso PC C 260 and C 261 and PCC 424 and C 344 were different between stage I NSCLC and healthy patients 22 Some elements and pathways of serum PC and PE profiles in creased in patients with lung benign disease and earlystage NSCLC as compared with healthy where as few eg PC significantlyelevated in earlystage NSCLC patients alone 2 It seemsth at patterns of lipid elements may be as sociated with the specificity of lung cancer and stage rather than the in tactlipid pathways We per formed", "provide biological in sights into the regulati on of BRAF on cogene dependence and identify strategies to optimize outcomes in BRAF-mutant NSCLC patients. On cogenic mutations in the BRAF kinase occur in 6\"8% of nonsmall cell lung cancers (NSCLCs) accounting for more than 90000 deaths annually worldwide. The biological and clinical relevance of these BRAF mutations in NSCLC is in completely under stood. Here we demonstrate that human NSCLC cells with BRAFV 600 E but not other BRAF mutations in itially are sensitive to BRAF-in hibit or treatment. However these BRAFV 600 E NSCLC cells rapidly acquire resistance to BRAF in hibiti on through at least one of two discrete molecular mechanisms: (i) loss of full-length BRAFV 600 E coupled with expressi on of an aberrant form of BRAFV 600 E that retains RAF pathway dependence or (ii) constitutive autocrine EGF recept or (EGFR) signaling driven by c-Jun\"mediated EGFR ligand expressi on. BRAFV 600 E cells with EGFR-driven resistance are characterized by hyperphosphorylated prote in kinase AKT\"", "This in dicates the necessity of sequencing in dividual human lung cancers in order to match the use of a single targeted drug or two or more targeted drugs in combinati on against in dividual lung cancer-specific mutations. In this study we have used Ion Ampliseq Cancer Panel to sequence 13500 loci in 45 cancer-related genes mainly on cogenes and tumor suppress or genes of 76 human lung cancer samples. We identified frequent mutations in a group of genes in cluding EGFR KRAS and TP 53 (). Although most of these genes were already known to be as sociated with lung cancers the mutated points and the as sociated mutations in other genes were different in our sample set (Tables 7). As there is in creasing awareness about the changes in lung cancer cells in recent times newer drugs that specifically target these changes have been developed. These targeted drugs either work synergistically with the chemo therapy drugs or by the mselves with much lesser to xicity due to a selective effect as an alternative to a more systemic modulati on of proteins as sociated with on cogenesis. EGFR in hibitors (Afatinib Erlotinib and Gefitinib) and VEGF in hibitors (Bevacizumab) are currently used for target the rapies for NSCLC patients with mutations in the VEGF and EGFR. Erlotinib is a drug that blocks EGFR from signaling the cell to grow. It prevents the progressi on of lung cancer specifically in non-smoking women and is mostly used in advanced NSCLC treatment that was not responsive to chemo therapy. It is also used as the first treatment in patients whose cancers have a mutati on in the EGFR gene.", "suggest that tumor in hibiting mi R-182 features dominate and thus make this mi RNA a favorable prognostic fact or. Based on the as sociati on with angiogenesis suggested from the GSEA we in vestigated the correlati on between mi R-182 and a set of angiogenesis-related prote in markers. There was a negative correlati on between mi R-182 and FGF 2. Our group has published data on FGF 2 which identify this marker as an in dependent negative prognostic fact or in lung cancer cells. Fibroblast growth fact or recept or substrate 2 (FRS 2) is a downstream mediat or of the fibroblast growth fact or pathway and is a target gene of mi R-182. FRS 2 is thought to in duce tumor progressi on through stimulati on of angiogenesis. In our total NSCLC cohort the coexpressi on between mi R-182 and FGF 2 showed an in dependent significantly worse prognosis for low mi R-182/high FGF 2 than for high mi R-182/low FGF 2 (P?=?0.015). A correlati on was also detected between mi R-182 and MMP-7. In a previous paper our group found high MMP-7 expressi on to be an in dependent favorable prognostic fact or in this same NSCLC cohort. When examining coexpressi on of the two variables those with high mi R-182 and high MMP-7 expressi on had an in dependently better survival than those with low mi R-182/low MMP-7 expressi on (HR 0.49 P?=?0.015). When stratifying on histology the SCC patients with high/high expressi on had a remarkably better prognosis than the rest of the groups (HR 0.26 P?=?0.012). To our knowledge there are no published data linking mi R-182 and MMP-7. Few studies have described the connecti on between FGF 2 and MMP-7. Based on our strong from the co-variations between mi R-182 and particularly MMP-7 it would be in teresting to see functional studies exploring potential relations between these two markers. In our previous pilot study on mi RNA signatures mi R-182 appeared as an on cogene since it was up-regulated in short vs long term NSCLC survivors and in NSCLC vs normal tissues", "lung cancer the search for valuable and efficient tumor markers is very urgent in recent yearslincr or has appeared as an importantregulat or of lung cancer research from qu demonstrated that the expressi on of lincr or was in creased in nsclc tissues compared to that in the normal tissues the over expressi on of lincr or was shown to be closely related to the poor prognosis of lnm histological grade and stage of tnm pan qu another study bypan demonstrated that the decreased expression of lincr or could obviously impair the proliferative capacity of lung adeno carcinoma lad cells cause a g 0 g 1 phasearrest and in crease the ratio of apoptotic lad cells moreoverdownregulati on of lincr or substantially in hibited the in vasive and metastatic ability of lad cells meanwhile forced expression of lincr or was observed to reduce the expressi on of ecadherin and \u03b2catenin which are the characteristic biomarkers of epithelial cells where as it in creased the expressi on of ncadherin and vimentinthus displaying a mesenchymal phenotypeconversely downregulati on of lincr or was demonstrated to result in in creased the expressi on of epithelial markers and decreased the expressi on of mesenchymal markers this resultuncovered the fact that the prometastatic eects of lincrorwere in duced by the regulati on of the expressi on of a number of genes in volved in cell metastasis and emt progress meanwhileoverexpressi on of lincr or was shown to enhance the resistance of lad to docetaxel dtx pan suggestingth at lincrorinduced resistance of lad cells to dtx andem t through regulati on the expressi on of mir 145 whichw as predicted to in teract with lincr or more importantlyfurther research confirmed that mir 145 could bind to lincr or and its downregulati on could partly in hibit the resistance of lad cells to dtx and emt aside from that pan andhis colleagues discovered that a decrease in the expressi on ofmir 145 and in crease in the expressi on fscn 1 could obviouslyreverse the in hib"], "answer": "Insufficient evidence in provided documents."}
{"question": "What is the role of BRAF mutations in papillary thyroid carcinoma?", "contexts": ["henhua []tissue TNF\u03b1 tumor necrosis factora DTC differentiated thyroid carcinoma IL 6 in terleuk in 6 PTC papillary thyroid carcinoma FTC follicular thyroid carcinoma AT Canaplastic thyroid carcinoma MTC medullary thyroid carcinoma WDTC welldifferentiated thyroid carcinoma FNAC fine needle as pirati on cytologynodular goiter PTCQuality of in cluded studies The quality as sessment of these studies is as sessed bythe NOS and the resultis shown in Supplemental Table Five or more scores are determined as highquality Two studies conducted by Cao G in [] and L Kayser in [] only get two scoresshowing a poor quality in methodology The rest studies are as sessed as high quality TNF\u03b1 and thyroid carcinoma Twelve studies reported the expressi on of TNF\u03b1 both in patients with thyroid carcinoma and control subjects[\" \" ] Among these sevenstudies [ ] had tested the level of serum TNF\u03b1 two studies [ ] had tested the expressi on of TNF\u03b1 in tissues and the ratio of TNF\u03b1 immunoreactivity was tested in four studies [ ] Firstly fixedeffect model is used to merge the SMDvalues of serum TNF\u03b1 level however a large heterogeneity is found by the heterogeneity analysis heterogeneity test Chi 2 P I 2 and itmay be due to the different units differenttesting", "we used the Gene Expressi on Profiling In teractive Analysis database to verify the expressi on of key genes in PTC and adjacent tissues The overall survival and diseasefree survivalanalyses were per formed by Kaplan\"Meier plots for these PTCrelated hub genes Genetic alterations of hub genes in PTC and their correlations with other genes were analyzed utilizing the c Bio Portal for Cancer Genomics Hub genesrelated to clinicopathological features were analyzed using the on line database UALCAN httpualcanpathuabedu[] The correlati on of ADORA 1 APOE and LPAR 5 expressi on with the immune in filtrati on level in PTC and the expressi on of these three genes in different kinds of cancers was per formed using the Tumor Immune Estimati on Resource database []For q RTPCR analysis total RNA was isolated from normal and cancerous papillary thyroid samples utilizing TRIzol reagent Qiagen Valencia CA USA c DNA was synthesized with RNA reverse transcripti on kit TIANGENBIOTECH Beijing China q RTPCR was per formed with an ABI Real Time PCR System Applied Biosystems Life Technologies USA The expressi on of the genes of in terest was normalized to actin The primers for ADORA 1 APOE LPAR 5 and actin are shown in Table For Western blot RIPA buffer was used to extract prote in from four pairs of tissue from PTC patients and the prote in concentrations were measured via BCA Differentially expressed genes screening based on RNASeq To screen out the genes or modules that may play a role in promoting cancer in papillary thyroid carcinoma weperformed RNASeq experiments on four pairs of thyroid cancer tissues and their matched paracancerous tissues to obta in differentially expressed genes After RNASeq we acquire \" milli on reads for each sample The fold changesbetween PTC cancer tissues and matched paracancerous samples were calculated Setting the cutoff criteri on as Pvalue and a fold change there were upregulated and downregulated genes These DEGswere considered to be candidate genes for", "in cancer tissues [ ] yu xiao conducted a clinical studycomparing the level of serum lept in in ptc patientsincluding patients with lymph node metastasis and thyroid adenoma patients in dalian china and foundth at patients with lymph node metastasis have a higherlevel of lept in than those without lymph node metastasislept in can in duce the expressi on of vascular endothelialgrowth fact or and promote neovascularizati on in tumortissue in additi on it can also in hibit the apoptosisthrough bcl 2 dependent mechanism meanwhile leptinrecept or exists in all thyroid cancer cells it is over expressed in ptc and is in volved in tumor in vasi on and lymph node metastasis [ ] thus lept in may be in volved in the tumorigenesis and metastasis of thyroid cancer through a complex pathway and a monitoringmay have some significance due to the absence of directevidence elevated lept in levels can also be caused by thyroid carcinoma the cause and effect relationship between lept in and thyroid carcinoma are unclear now and need further studiescompared to lean women over weightobese womenhad lower serum adiponect in levels and this differenceh as statistical significance in additi on adiponectinis negatively as sociated with a variety of benign and malignant tumors especially those as sociated with obesity and in sulin resistance such as leukemia renal carcinoma gastric carcinoma and colon cancer moreover the as sociati on of adiponect in with potential tumorlimiting functions has been widely proposed otvos l jr tried in vitro experiments and proved that adiponect in can in hibit the metastasis of cancer cells mitsiades n measured circulatingadiponect in levels in ptai ents with ptc and found thatit is in dependently and in versely as sociated with the risk of thyroid cancer as the recept or that binds to adiponect in for biological effects adiponect in recept or hadbeen reported closely correlated with the development of ptc adiponect in recept or 1 and are higher expressi on in p", "Characteristics of patients The study group in cluded papillary thyroid cancers PTC follicular thyroid cancers FTC and poorlydifferentiated thyroid cancers PDTCThere were women and men The mean agew as \u00b1 years Three hundred and seventytwo patients were prepared with rh TSH stimulati on Eightytwo patients presented positive Tg Ab at the time of postoperative RAI treatment In the postoperative setting prior to RAI administrati on patients were at low risk LR at in termediaterisk IR and at high risk HRaccording to the ATA risk Per sistent disease and tumor burden Overall PD was detected in patients Their characteristics in terms of ATA risk RAI preparati on modality PD sites and RAI or 18 FDG uptake arepresented in Table Of patients had very smallvolumelargevolume smallvolume and PDFigure shows two points First the rate of PDincreased from in LR patients and in IR to in HR patients p Second the per centage of patients with largevolume PD in creased with risk stratificati on from LRIR to HR patients and respectively p Table Characteristics of patients according to the ATA riskstratificati on system in the postoperative setting Mean age \u00b1 SD yrs Sex ratio Female Mean tumor size \u00b1 SD mm Histology PTCFTCPDTCAggressive pathological subtypes No Yes Extrathyroidal extensi on Minimal Gross T status TNM T 1 a T 1 b T 2 T 3 a T 3 b T 4 a T 4 b N status TNM Nx N 0 N 1 a N 1 b M status TNM M 0 M 1 Positive Tg Ab level Stimulated Tg level at RAI treatment", "Of patients who under went thyroidectomy procedures were females and the mean age at operati on was years and were as sociated with multiple endocrine neoplasia type There was no history of radiati on exposure Eightyone patients had fine needle as pirati on FNA which correlated with the final histopathology in of cases Sixtysix patients had malignant cancer papillary of patients who had neck dissecti on had lymph node metastasis and had distant metastases to the lung Procedures in cluded total thyroidectomy hemithyroidectomy completi on and subtotal thyroidectomy Twentythree patients developed hypocalcemia per manent and had unilateral recurrent laryngeal nerve in jury per manent Patients were followed up for a mean durati on of months median months Of patients with thyroid cancer received radioactive iodine and had recurrence Malignancy is the commonest in dicati on for thyroid surgery in children and FNA is highly diagnostic Hypocalcemia and recurrent laryngeal nerve in jury are significant complications The recurrence rate in thyroid cancer is", "IO 3 m RNA was found to be upregulated in MCF 7 cells and downregulated in MDAMB 231 cells when compared to the nontumoral cell line MCF 10 A cells DIO 3 mediated T 3 deiodinati on also occurs in MCF 7 cells In these cells DIO 3 expressi on is to regulated by retinoids but not by estradiol 37\" These findings are consistent with the presence of DIO 3 in other tissues of ectodermal or igin such as the skin and the nervous system 4041 The role of thyroid hormone metabolism on human tumorigenesis has been largely debated 10 In breast cancer previous studies showed that higher levels of the thyroid hormone recept or alpha were an in dependent prognostic fact or for in creased overall survival 42 More recently high levels of the thyroid hormone recept or beta in breast tumors were also as sociated with in creased breast cancerspecific survival 43 In basal cell carcinom as BCC for in stance a DIO 3 mediated decrease in T 3 levels relates to in creased cell proliferati on 31 Similarly in colon cancer cells DIO 3 knockdown and consequent in creases in T 3 levels are as sociated with reduced cell proliferati on and in ducti on of differentiati on 44 High levels of DIO 3 expressi on in primary PTC tumors were as sociated with advanced disease at the diagnosis 30 Some data in deed suggest that T 3 can contribute to tumor growth in breast cancer cells in a 0 vitro 17 while a micro environment with low T 3 levels could facilitate in vasiveness and dedifferentiati on However in agreement with our data in breast cancer similar levels of DIO 3 m RNA are observed in glioblastoma and liver carcinom as as compared to respective normal tissues 45 These differences could be at tributed to the tissue embryological or igin since the tissues of ectodermal or igin seem to mainta in DIO 3 expressi on during adulthood while DIO 3 gene is subject to imprinting in other tissues Loss of DIO 3 expressi on was as sociated with tumor aggressiveness in colon cancer and also in thyroid cancer DIO 3 ex", "thyroid carcinoma PTC tissues elevated PDLIM 5 expressi on promotes the migrati on in vasi on and proliferati on of PTC cells by activating the RASERK pathway Wei PDLIM 5 may the refore serve as a the rapeutic target in a variety of cancers It can promote the in vasi on and metastasis of cancercells Genotyping chip detecti on experiments have shown that PDLIM 5 is over expressed in prostate cancer tissue Koutros and some studies have proved that the utility of serum and urine PDLIM 5 levels as in dicators for auxiliary diagnosis of prostate cancer with potential value in predicting the risk of progressi on in advanced prostate cancer PCA Ma PDLIM 5 plays a key role in regulating the proliferati on in vasion and migrati on of malignant tumor cells by binding to AMPK and regulating its activati on and degradati on Liu PDLIM 5 may the refore act as an on cogene in the development and progressi on of PCAIn view of the important role of PDLIM 5 in cancer somestudies have in dicated that it is in volved in the growth of gastriccancer cells and suggested that PDLIM 5 silencing through theuse of small in terfering RNAs si RNA may be a potentialstrategy for the treatment of gastric cancer Li In additi on Edlund found that the in creased expression of PDLIM 5 is related to high tumor proliferati on rates in nonsmall cell carcinoma Edlund Steroids such as corticosteroid medications play an important role in the development of cancer it has been reported that singlenucleotide polymorphisms SNPs in PDLIM 5 in teract with steroids thus aecting the occurrence and development of cancer Wang The above findings show that P", "Papillary thyroid carcinoma PTCis acomm on thyroid malignancy accountingf or about of systemic malignancies 1 PTC is currently characterized by a highincidence and low mortality 2 clinical Recentimprovements in highfrequencyultrasonic diagnostic technologies and the applicati on of ultrasoundguided puncturetechniques have led to an apparent in crease in the in cidence of PTC year by year 3\"Regardingthyroidtumors the palpati on detecti on rate for thyroid microtumors in the general populati on is about compared with as high as to for highfrequency ultrasound 6 which has thus greatly improved disease diagnosisdiagnosisthe of Surgical resecti on is a routine treatmentf or thyroid tumors but the recurrence rateis usually high and the consequent reducti on in thyroid functi on can seriously affect the patient\u2122s quality of life 7 As sociated with the in creasing detecti on rate of thyroidtumors and the pursuit of minimally in vasive treatments radiofrequency ablati on RFA has been gradually applied in the clinic RFA uses local hyperthermia to cause tissue necrosis The the rmal effectsdo not depend on the tissue type and most lesions can be completely eliminated by RFA 89 RFA has thus become a novellocal treatment for tumors The clinical diagnosis of benign and malignant thyroid tumors currently depends on the clinical manifestations and pathological examinations However the clinicalmanifestations are mostly derived from involvessubjective empirical analysis while a finalpathological diagnosisinvasiveprocedures with lesssatisfactory specificity It is the refore necessary to identifyappropriatepredictivetum or markersdiagnosticandforimplications The collagenases matrix metalloproteinase MMP 2 and MMP 9 can degradetype IV collagen in the basement membrane with importanttumorangiogenesis and tumor cell in vasi on and metastasis 10 MMP 2 and MMP 9 expressi on levels were found to be upregulated in thyroid cancer tissue 11 however the sestudies mostly examined pathological tiss", "suggest that Raman spectroscopy may over come the limits of current diagnostic tools Detecti on of nodular thyroid pathology is in creasing worldwide paired with an in creased number of thyroid cancer diagnosis 1 Whether this \u0153epidemic\u009d spread is real or is due to an exaggerated use of imaging tools in clinical practice is object of a vivid debate with in the scientific community Anyway management of patients with thyroid nodule causes a clinical problem and a social burden as well 2 To avoid over diagnosis and over treatment of these patients physicians need additional in formati on about the biology of each thyroid nodule In particular there is need for a tool able to distinguish between benign and malignant follicular lesions and between in dolent and aggressive tumors 3 The genomic profile of thyroid tumors has been extensively in vestigated 4 and several immunocytochemical and molecular markers have been proposed for a more accurate classificati on of thyroid nodules 5 However none of these markers reaches a reliable sensibility and specificity to be routinely used in clinical setting 6 Moreover although the major genetic alterations of thyroid tumors are known only little in formati on if any is available about changes in prote in lipids and other cellular constituents due to thyroid on cogenesis To correctly manage patients with thyroid nodules and to avoid unnecessary surgery we strongly need a method of analysis that over comes the limits of current diagnostic tools by identifying specific tumoral markers possibly with high spatial resoluti on and low impact on the patient Cells and tissues are characterized by a specific biochemical compositi on Each pathology or cellular abnormality is accompanied by biochemical molecular changes Optical and spectroscopic techniques that correlate the biochemical compositi on molecular structure and their variations with the morphological alterations represent a powerful diagnostic and potentially clinical tool 8 Among", "however further treatments are warranted with less to xicity Evidence for cellmediated immunity to tumorspecificantigens has been found in medullary thyroid cancer and early studies suggested that MTCspecific T cells exist Emerging data suggest that the immune system may be relevant in the treatment of MTC \" Furthermoreimmunebased treatments have been studied Dentritic cell\"basedimmuno therapy was given in patients with solid tumorsincluding MTC and it was reported that vaccinati on with autologous tumorpulsed DCs generated from per ipheral bloodw as safe and can in duce tumorspecific cellular cytotoxicity This case report may demonstrate the potential for the rapeuticcancer vaccines to synergize with immune checkpoint in hibitionsequentially in MTC and that principle could be applied as well to other cancers that may have tumor microenvironments TMEsdevoid of baseline immune recogniti on The the rapeutic cancervaccine in this trial was a heatkilled yeastbased vaccine designed to stimulate an immune response against CEA After a phase Itrial demonstrated safety transient in jecti on site reacti on wasthe most comm on adverse event and preliminary evidence of immunologic and clinical activity a phase II study was developed in MTC NCT 01856920 The phase I study in cluded apatient with MTC who had substantial 'ammati on at sites of disease that followed months of the vaccine It isalso possible that the patient\u2122s previous sunitinib is relevant in this case report In a model using CEAtransgenic mice bearing CEA tumors continuous sunitinib followed by vaccine in creasedintratumoral\u0081ltrati on of antigenspecific T lymphocytesdecreased immunosuppressant T"], "answer": "Insufficient evidence in provided documents."}
{"question": "How does RET activation contribute to thyroid cancer progression?", "contexts": ["For many years doxorubic in was the only US Food and Drug Administrati on FDA\"approved treatment for patients with advanced thyroid cancer however response rate in patients with MTC is up to with significant to xicity \" Recently in advanced MTC several TKIs such as axitinib cabozantinib gefitinib lenvatinib imatinib motesanib sorafenib pazopanib sunitinib and vandetanib have been studied in phase I IIand III clinical trials Vandetanib an oral in hibit or of VEGFRvascular endothelial growth fact or recept or RET and EGFRepidermal growth fact or recept or was approved by the FDA in April after a phase III trial demonstrated improvedmedian progressionfree survival PFS compared to placebohazard ratio CI \" and overall response rate of Cabozantinib an in hibit or of hepatocyte growthfact or recept or MET VEGFR 2 and RET was approved bythe FDA in after a phase III trial demonstrated improvedmedian PFS of months relative to months in the placebo group The impact of to xicity on patientsw as clearly in dicated and for cabozantinib of patientsrequired dose reductions and required dosing delays The refore to xicity of FDAapproved TKI agents limits their usein patients with small volume as ymptomatic or in dolent disease Furthermore no clear data exist from these studies thateither agent impacts overall survival In additi on RETspecific TKIs in development are Selpercatinib previously LOXO 292 and Blue 667 with more specific RETtargeting activity The seagents have demonstrated evidence of efficacy in early trial", "an important regulatory fact or in this processanother possibility is that the activati on of the immunesystem of patients with thyroid cancer leads to an in crease in adikopines level in general the data above support that il 6 is important for thyroid cancer but the detail mechanism remain to be further studylept in a circulating hormone secreted by adipocytesexerts its biological effect by combing with its receptorwhich is mainly presented in the hypothalamus meanwhile gene of lept in recept or is also expressed in manyother tissues such as lung liver and kidney it is reported that obesity and over weight can lead to a highlevel of serum lept in which may because that obesity always accompanies with in sulin resistance and hyperinsulinemia and in sulin further enhance the expressi on of lept in moreover lept in acts as a growth fact or in a variety of human cellsincluding both normal cells and tumor cells which regulates the process of differentiati on proliferati on and apoptosis thus stimulate the tumorigenesis and development of tumors through mediatingpathway rhoalimk 1 cofilinpathway and mapkerk pathway kim wg evaluated the effect of dietinduced obesity on thyroid carcinogenesis in a mouse model that spontaneously develops thyroid cancer thrb pvpv pten\u02c6' mice and found that obesity in creases the frequency of anaplasia of thyroid cancer and exacerbatesthyroid cancer progressi on that were mediated by jakst at 3 in creased activati on of the jak 2 signaling transducer and activat or of stat 3 signaling pathway and in duction of stat 3 target gene expressi on lept in is always reported a high expressi on on solid tumors and it isconfirmed that serum lept in levelis significantly in creased in thyroid cancer mainly ptc while otherstudies showed a same", "IO 3 m RNA was found to be upregulated in MCF 7 cells and downregulated in MDAMB 231 cells when compared to the nontumoral cell line MCF 10 A cells DIO 3 mediated T 3 deiodinati on also occurs in MCF 7 cells In these cells DIO 3 expressi on is to regulated by retinoids but not by estradiol 37\" These findings are consistent with the presence of DIO 3 in other tissues of ectodermal or igin such as the skin and the nervous system 4041 The role of thyroid hormone metabolism on human tumorigenesis has been largely debated 10 In breast cancer previous studies showed that higher levels of the thyroid hormone recept or alpha were an in dependent prognostic fact or for in creased overall survival 42 More recently high levels of the thyroid hormone recept or beta in breast tumors were also as sociated with in creased breast cancerspecific survival 43 In basal cell carcinom as BCC for in stance a DIO 3 mediated decrease in T 3 levels relates to in creased cell proliferati on 31 Similarly in colon cancer cells DIO 3 knockdown and consequent in creases in T 3 levels are as sociated with reduced cell proliferati on and in ducti on of differentiati on 44 High levels of DIO 3 expressi on in primary PTC tumors were as sociated with advanced disease at the diagnosis 30 Some data in deed suggest that T 3 can contribute to tumor growth in breast cancer cells in a 0 vitro 17 while a micro environment with low T 3 levels could facilitate in vasiveness and dedifferentiati on However in agreement with our data in breast cancer similar levels of DIO 3 m RNA are observed in glioblastoma and liver carcinom as as compared to respective normal tissues 45 These differences could be at tributed to the tissue embryological or igin since the tissues of ectodermal or igin seem to mainta in DIO 3 expressi on during adulthood while DIO 3 gene is subject to imprinting in other tissues Loss of DIO 3 expressi on was as sociated with tumor aggressiveness in colon cancer and also in thyroid cancer DIO 3 ex", "in cancer tissues [ ] Yu Xiao [] conducted a clinical studycomparing the level of serum lept in in PTC patientsincluding patients with lymph node metastasis and thyroid adenoma patients in Dalian China and foundth at patients with lymph node metastasis have a higherlevel of lept in than those without lymph node metastasis Lept in can in duce the expressi on of vascular endothelialgrowth fact or and promote neovascularizati on in tumortissue [] In additi on it can also in hibit the apoptosisthrough Bcl 2 dependent mechanism Meanwhile leptinrecept or exists in all thyroid cancer cells It is over expressed in PTC and is in volved in tumor in vasi on and lymph node metastasis [ ] Thus lept in may be in volved in the tumorigenesis and metastasis of thyroid cancer through a complex pathway and a monitoringmay have some significance Due to the absence of directevidence elevated lept in levels can also be caused by thyroid carcinoma The cause and effect relationship between lept in and thyroid carcinoma are unclear now and need further studies Compared to lean women over weightobese womenhad lower serum adiponect in levels and this differenceh as statistical significance [] In additi on adiponectinis negatively as sociated with a variety of benign and malignant tumors especially those as sociated with obesity and in sulin resistance such as leukemia [] renal carcinoma [] gastric carcinoma [] and colon cancer[] Moreover the as sociati on of adiponect in with potential tumorlimiting functions has been widely proposed []Otvos L Jr [] tried in vitro experiments and proved that adiponect in can in hibit the metastasis of cancer cells Mitsiades N [] measured circulatingad iponect in levels in ptaients with PTC and found thatit is in dependently and in versely as sociated with the risk of thyroid cancer As the recept or that binds to adiponect in for biological effects adiponect in recept or hadbeen reported closely correlated with the development of PTC Adiponect in recept or 1 a", "we used the Gene Expressi on Profiling In teractive Analysis database to verify the expressi on of key genes in PTC and adjacent tissues The overall survival and diseasefree survivalanalyses were per formed by Kaplan\"Meier plots for these PTCrelated hub genes Genetic alterations of hub genes in PTC and their correlations with other genes were analyzed utilizing the c Bio Portal for Cancer Genomics Hub genesrelated to clinicopathological features were analyzed using the on line database UALCAN httpualcanpathuabedu[] The correlati on of ADORA 1 APOE and LPAR 5 expressi on with the immune in filtrati on level in PTC and the expressi on of these three genes in different kinds of cancers was per formed using the Tumor Immune Estimati on Resource database []For q RTPCR analysis total RNA was isolated from normal and cancerous papillary thyroid samples utilizing TRIzol reagent Qiagen Valencia CA USA c DNA was synthesized with RNA reverse transcripti on kit TIANGENBIOTECH Beijing China q RTPCR was per formed with an ABI Real Time PCR System Applied Biosystems Life Technologies USA The expressi on of the genes of in terest was normalized to actin The primers for ADORA 1 APOE LPAR 5 and actin are shown in Table For Western blot RIPA buffer was used to extract prote in from four pairs of tissue from PTC patients and the prote in concentrations were measured via BCA Differentially expressed genes screening based on RNASeq To screen out the genes or modules that may play a role in promoting cancer in papillary thyroid carcinoma weperformed RNASeq experiments on four pairs of thyroid cancer tissues and their matched paracancerous tissues to obta in differentially expressed genes After RNASeq we acquire \" milli on reads for each sample The fold changesbetween PTC cancer tissues and matched paracancerous samples were calculated Setting the cutoff criteri on as Pvalue and a fold change there were upregulated and downregulated genes These DEGswere considered to be candidate genes for", "Characteristics of patients The study group in cluded papillary thyroid cancers PTC follicular thyroid cancers FTC and poorlydifferentiated thyroid cancers PDTCThere were women and men The mean agew as \u00b1 years Three hundred and seventytwo patients were prepared with rh TSH stimulati on Eightytwo patients presented positive Tg Ab at the time of postoperative RAI treatment In the postoperative setting prior to RAI administrati on patients were at low risk LR at in termediaterisk IR and at high risk HRaccording to the ATA risk Per sistent disease and tumor burden Overall PD was detected in patients Their characteristics in terms of ATA risk RAI preparati on modality PD sites and RAI or 18 FDG uptake arepresented in Table Of patients had very smallvolumelargevolume smallvolume and PDFigure shows two points First the rate of PDincreased from in LR patients and in IR to in HR patients p Second the per centage of patients with largevolume PD in creased with risk stratificati on from LRIR to HR patients and respectively p Table Characteristics of patients according to the ATA riskstratificati on system in the postoperative setting Mean age \u00b1 SD yrs Sex ratio Female Mean tumor size \u00b1 SD mm Histology PTCFTCPDTCAggressive pathological subtypes No Yes Extrathyroidal extensi on Minimal Gross T status TNM T 1 a T 1 b T 2 T 3 a T 3 b T 4 a T 4 b N status TNM Nx N 0 N 1 a N 1 b M status TNM M 0 M 1 Positive Tg Ab level Stimulated Tg level at RAI treatment", "Papillary thyroid carcinoma PTCis acomm on thyroid malignancy accountingf or about of systemic malignancies 1 PTC is currently characterized by a highincidence and low mortality 2 clinical Recentimprovements in highfrequencyultrasonic diagnostic technologies and the applicati on of ultrasoundguided puncturetechniques have led to an apparent in crease in the in cidence of PTC year by year 3\"Regardingthyroidtumors the palpati on detecti on rate for thyroid microtumors in the general populati on is about compared with as high as to for highfrequency ultrasound 6 which has thus greatly improved disease diagnosisdiagnosisthe of Surgical resecti on is a routine treatmentf or thyroid tumors but the recurrence rateis usually high and the consequent reducti on in thyroid functi on can seriously affect the patient\u2122s quality of life 7 As sociated with the in creasing detecti on rate of thyroidtumors and the pursuit of minimally in vasive treatments radiofrequency ablati on RFA has been gradually applied in the clinic RFA uses local hyperthermia to cause tissue necrosis The the rmal effectsdo not depend on the tissue type and most lesions can be completely eliminated by RFA 89 RFA has thus become a novellocal treatment for tumors The clinical diagnosis of benign and malignant thyroid tumors currently depends on the clinical manifestations and pathological examinations However the clinicalmanifestations are mostly derived from involvessubjective empirical analysis while a finalpathological diagnosisinvasiveprocedures with lesssatisfactory specificity It is the refore necessary to identifyappropriatepredictivetum or markersdiagnosticandforimplications The collagenases matrix metalloproteinase MMP 2 and MMP 9 can degradetype IV collagen in the basement membrane with importanttumorangiogenesis and tumor cell in vasi on and metastasis 10 MMP 2 and MMP 9 expressi on levels were found to be upregulated in thyroid cancer tissue 11 however the sestudies mostly examined pathological tiss", "ocalcemia transient per manent and Table Thyroid pathology in the patients Pathologyn Benign Normal thyroid tissue Colloid nodule Cyst Adenoma Thyroiditis Graves\u2122 disease Thyroid cancer Papillary Follicular Medullary Hurthle Anaplastic Total Data are number Table Benign and malignant lesions in patients Benignn 37 Malignantn 66 P value Age meanyears Gender malefemale Presence of nodule Hypocalcemia Recurrent laryngeal nerve palsy Bleedinghematoma Wound in fecti on Tracheal in jury Overall complications Mean length of stay days MEN recurrent laryngeal nerve palsy transient per manent all were unilateral Table Of patients with malignant lesions had lymph node metastasis and patients had distant metastases to the lung None of the patients developed postoperative bleeding wound in fecti on or tracheal in jury Patients were followed up for a mean of months median range months radioactive iodine treatment was delivered to patients with malignant lesions patients had recurrences were local recurrences and were local and distant recurrences to the lung Three cases received radioactive iodine RAI before and after recurrence One case was low risk before recurrence so did not receive RAI until after recurrence One case had medullary thyroid cancer so did not receive RAI In the remaining five cases there was no clear data whether those patients received RAI before or only after a recurrence All local recurrences under went resecti on except for one patient who was lost follow up There was no mortality in this study", "thyroid carcinoma PTC tissues elevated PDLIM 5 expressi on promotes the migrati on in vasi on and proliferati on of PTC cells by activating the RASERK pathway Wei PDLIM 5 may the refore serve as a the rapeutic target in a variety of cancers It can promote the in vasi on and metastasis of cancercells Genotyping chip detecti on experiments have shown that PDLIM 5 is over expressed in prostate cancer tissue Koutros and some studies have proved that the utility of serum and urine PDLIM 5 levels as in dicators for auxiliary diagnosis of prostate cancer with potential value in predicting the risk of progressi on in advanced prostate cancer PCA Ma PDLIM 5 plays a key role in regulating the proliferati on in vasion and migrati on of malignant tumor cells by binding to AMPK and regulating its activati on and degradati on Liu PDLIM 5 may the refore act as an on cogene in the development and progressi on of PCAIn view of the important role of PDLIM 5 in cancer somestudies have in dicated that it is in volved in the growth of gastriccancer cells and suggested that PDLIM 5 silencing through theuse of small in terfering RNAs si RNA may be a potentialstrategy for the treatment of gastric cancer Li In additi on Edlund found that the in creased expression of PDLIM 5 is related to high tumor proliferati on rates in nonsmall cell carcinoma Edlund Steroids such as corticosteroid medications play an important role in the development of cancer it has been reported that singlenucleotide polymorphisms SNPs in PDLIM 5 in teract with steroids thus aecting the occurrence and development of cancer Wang The above findings show that P", "suggest that Raman spectroscopy may over come the limits of current diagnostic tools Detecti on of nodular thyroid pathology is in creasing worldwide paired with an in creased number of thyroid cancer diagnosis 1 Whether this \u0153epidemic\u009d spread is real or is due to an exaggerated use of imaging tools in clinical practice is object of a vivid debate with in the scientific community Anyway management of patients with thyroid nodule causes a clinical problem and a social burden as well 2 To avoid over diagnosis and over treatment of these patients physicians need additional in formati on about the biology of each thyroid nodule In particular there is need for a tool able to distinguish between benign and malignant follicular lesions and between in dolent and aggressive tumors 3 The genomic profile of thyroid tumors has been extensively in vestigated 4 and several immunocytochemical and molecular markers have been proposed for a more accurate classificati on of thyroid nodules 5 However none of these markers reaches a reliable sensibility and specificity to be routinely used in clinical setting 6 Moreover although the major genetic alterations of thyroid tumors are known only little in formati on if any is available about changes in prote in lipids and other cellular constituents due to thyroid on cogenesis To correctly manage patients with thyroid nodules and to avoid unnecessary surgery we strongly need a method of analysis that over comes the limits of current diagnostic tools by identifying specific tumoral markers possibly with high spatial resoluti on and low impact on the patient Cells and tissues are characterized by a specific biochemical compositi on Each pathology or cellular abnormality is accompanied by biochemical molecular changes Optical and spectroscopic techniques that correlate the biochemical compositi on molecular structure and their variations with the morphological alterations represent a powerful diagnostic and potentially clinical tool 8 Among"], "answer": "RET activation contributes to thyroid cancer progression by promoting tumorigenesis and metastasis. Specifically, RET is involved in signaling pathways that enhance cell proliferation and survival, which can lead to more aggressive tumor behavior. The use of RET-specific tyrosine kinase inhibitors (TKIs) like vandetanib and cabozantinib has shown improved progression-free survival in patients with advanced medullary thyroid carcinoma (MTC), indicating that targeting RET can impact disease progression. Additionally, RET activation is associated with increased expression of growth factors that facilitate tumor growth and vascularization, further supporting its role in thyroid cancer progression."}
{"question": "What resistance mechanisms are described for lenvatinib in thyroid cancer?", "contexts": ["For many years doxorubic in was the only US Food and Drug Administrati on FDA\"approved treatment for patients with advanced thyroid cancer however response rate in patients with MTC is up to with significant to xicity \" Recently in advanced MTC several TKIs such as axitinib cabozantinib gefitinib lenvatinib imatinib motesanib sorafenib pazopanib sunitinib and vandetanib have been studied in phase I IIand III clinical trials Vandetanib an oral in hibit or of VEGFRvascular endothelial growth fact or recept or RET and EGFRepidermal growth fact or recept or was approved by the FDA in April after a phase III trial demonstrated improvedmedian progressionfree survival PFS compared to placebohazard ratio CI \" and overall response rate of Cabozantinib an in hibit or of hepatocyte growthfact or recept or MET VEGFR 2 and RET was approved bythe FDA in after a phase III trial demonstrated improvedmedian PFS of months relative to months in the placebo group The impact of to xicity on patientsw as clearly in dicated and for cabozantinib of patientsrequired dose reductions and required dosing delays The refore to xicity of FDAapproved TKI agents limits their usein patients with small volume as ymptomatic or in dolent disease Furthermore no clear data exist from these studies thateither agent impacts overall survival In additi on RETspecific TKIs in development are Selpercatinib previously LOXO 292 and Blue 667 with more specific RETtargeting activity The seagents have demonstrated evidence of efficacy in early trial", "and dose reducti on while the target populati on for thyroid cancer or hepatocellular carcinoma that showed efficacy for lenvatinib was first line setting 20 this study targeted patients receiving salvage line the rapy most patients with metastatic colorectal cancer in the salvage line setting had grade or proteinuria and hypertensi on at baseline because of the long term prior treatment with anti vegfvegfr treatment where as the occurrence of grade hypertensi on was significantly higher compared with that of regorafenib in a similar study populati on in the correct concur and consign trials 7 it was manageable by dose reducti on or in terrupti on but it may be necessary to consider the starting dose in the future although palmar plantar erythrodysesthesia is a not life threatening to xicity these adverse events have a significant impact on treatment schedules and quality of life in treated patients grade \u2030\u00a5 palmar plantar erythrodysesthesia has been observed in and of patients treated with lenvatinib in this study and the select japanese populati on 15 respectively while in patients treated with regorafenib in the correct japanese populati on 16 to date the clear mechanism of palmar plantar erythrodysesthesia by vegf recept or tyrosine kinase in hibitors is not known but it has been reproduced that palmar plantar erythrodysesthesia by lenvatinib is well to lerated overall it is suggested that lenvatinib might be a favourable treatment opti on in terms of to xicitiesseveral preclinical studies demonstrated that vegf targeted treatment affects immune suppressi on by promoting the expansi on of suppressive immune cell populations such as regulatory t cells and myel", "in cancer tissues [ ] Yu Xiao [] conducted a clinical studycomparing the level of serum lept in in PTC patientsincluding patients with lymph node metastasis and thyroid adenoma patients in Dalian China and foundth at patients with lymph node metastasis have a higherlevel of lept in than those without lymph node metastasis Lept in can in duce the expressi on of vascular endothelialgrowth fact or and promote neovascularizati on in tumortissue [] In additi on it can also in hibit the apoptosisthrough Bcl 2 dependent mechanism Meanwhile leptinrecept or exists in all thyroid cancer cells It is over expressed in PTC and is in volved in tumor in vasi on and lymph node metastasis [ ] Thus lept in may be in volved in the tumorigenesis and metastasis of thyroid cancer through a complex pathway and a monitoringmay have some significance Due to the absence of directevidence elevated lept in levels can also be caused by thyroid carcinoma The cause and effect relationship between lept in and thyroid carcinoma are unclear now and need further studies Compared to lean women over weightobese womenhad lower serum adiponect in levels and this differenceh as statistical significance [] In additi on adiponectinis negatively as sociated with a variety of benign and malignant tumors especially those as sociated with obesity and in sulin resistance such as leukemia [] renal carcinoma [] gastric carcinoma [] and colon cancer[] Moreover the as sociati on of adiponect in with potential tumorlimiting functions has been widely proposed []Otvos L Jr [] tried in vitro experiments and proved that adiponect in can in hibit the metastasis of cancer cells Mitsiades N [] measured circulatingad iponect in levels in ptaients with PTC and found thatit is in dependently and in versely as sociated with the risk of thyroid cancer As the recept or that binds to adiponect in for biological effects adiponect in recept or hadbeen reported closely correlated with the development of PTC Adiponect in recept or 1 a", "of recent clinical trials trifluridinetipiracil and regorafenib are recognised as new treatment options for patients with metastatic colorectal cancer refractory or in tolerant to standard the rapies 6 Nevertheless the prognosis of patients which are refractory or in tolerant to standard chemotherapies is poor and there are still an unmet medical needs for these patients especially for those who are in a good per formance status and eligible for further the rapies Lenvatinib is an oral multitargeted tyrosine kinase in hibit or of the vascular endothelial growth fact or recept or VEGFR \" fibroblast growth fact or receptors \" platelet derived growth fact or recept or alpha RET and KIT 8 Preclinical studies have shown that Iwasa a 0 S et a 0 al ESMO 20205 e 000776 101136 esmo 2020000776 0 c accesslenvatinib not only in terferes the in teracti on between cancer cells and endothelial cells but also in hibits tumour growth 10 Several phase trials of patients with solid tumours in the USA 11 Europe 12 and Japan 13 showed that the optimum dosage of lenvatinib was mg one time a day in a day cycle A total of patients were enrolled in four phase studies of lenvatinib mono therapy of whom had colorectal cancer Disease control rate DCR was achieved in out of patients in cluding one with a partial response which continued for weeks mg two times a day for weeks of a week cycle Grade palmar plantar erythrodysesthesia was reportedly much lower in of patients treated with lenvatinib for thyroid cancer in a Japanese populati on of the SELECT trial than that of reported in a Japanese populati on of CORRECT trial using regorafenib for metastatic colorectal cancer 15 These", "in cancer tissues [ ] yu xiao conducted a clinical studycomparing the level of serum lept in in ptc patientsincluding patients with lymph node metastasis and thyroid adenoma patients in dalian china and foundth at patients with lymph node metastasis have a higherlevel of lept in than those without lymph node metastasislept in can in duce the expressi on of vascular endothelialgrowth fact or and promote neovascularizati on in tumortissue in additi on it can also in hibit the apoptosisthrough bcl 2 dependent mechanism meanwhile leptinrecept or exists in all thyroid cancer cells it is over expressed in ptc and is in volved in tumor in vasi on and lymph node metastasis [ ] thus lept in may be in volved in the tumorigenesis and metastasis of thyroid cancer through a complex pathway and a monitoringmay have some significance due to the absence of directevidence elevated lept in levels can also be caused by thyroid carcinoma the cause and effect relationship between lept in and thyroid carcinoma are unclear now and need further studiescompared to lean women over weightobese womenhad lower serum adiponect in levels and this differenceh as statistical significance in additi on adiponectinis negatively as sociated with a variety of benign and malignant tumors especially those as sociated with obesity and in sulin resistance such as leukemia renal carcinoma gastric carcinoma and colon cancer moreover the as sociati on of adiponect in with potential tumorlimiting functions has been widely proposed otvos l jr tried in vitro experiments and proved that adiponect in can in hibit the metastasis of cancer cells mitsiades n measured circulatingadiponect in levels in ptai ents with ptc and found thatit is in dependently and in versely as sociated with the risk of thyroid cancer as the recept or that binds to adiponect in for biological effects adiponect in recept or hadbeen reported closely correlated with the development of ptc adiponect in recept or 1 and are higher expressi on in p", "we used the Gene Expressi on Profiling In teractive Analysis database to verify the expressi on of key genes in PTC and adjacent tissues The overall survival and diseasefree survivalanalyses were per formed by Kaplan\"Meier plots for these PTCrelated hub genes Genetic alterations of hub genes in PTC and their correlations with other genes were analyzed utilizing the c Bio Portal for Cancer Genomics Hub genesrelated to clinicopathological features were analyzed using the on line database UALCAN httpualcanpathuabedu[] The correlati on of ADORA 1 APOE and LPAR 5 expressi on with the immune in filtrati on level in PTC and the expressi on of these three genes in different kinds of cancers was per formed using the Tumor Immune Estimati on Resource database []For q RTPCR analysis total RNA was isolated from normal and cancerous papillary thyroid samples utilizing TRIzol reagent Qiagen Valencia CA USA c DNA was synthesized with RNA reverse transcripti on kit TIANGENBIOTECH Beijing China q RTPCR was per formed with an ABI Real Time PCR System Applied Biosystems Life Technologies USA The expressi on of the genes of in terest was normalized to actin The primers for ADORA 1 APOE LPAR 5 and actin are shown in Table For Western blot RIPA buffer was used to extract prote in from four pairs of tissue from PTC patients and the prote in concentrations were measured via BCA Differentially expressed genes screening based on RNASeq To screen out the genes or modules that may play a role in promoting cancer in papillary thyroid carcinoma weperformed RNASeq experiments on four pairs of thyroid cancer tissues and their matched paracancerous tissues to obta in differentially expressed genes After RNASeq we acquire \" milli on reads for each sample The fold changesbetween PTC cancer tissues and matched paracancerous samples were calculated Setting the cutoff criteri on as Pvalue and a fold change there were upregulated and downregulated genes These DEGswere considered to be candidate genes for", "IO 3 m RNA was found to be upregulated in MCF 7 cells and downregulated in MDAMB 231 cells when compared to the nontumoral cell line MCF 10 A cells DIO 3 mediated T 3 deiodinati on also occurs in MCF 7 cells In these cells DIO 3 expressi on is to regulated by retinoids but not by estradiol 37\" These findings are consistent with the presence of DIO 3 in other tissues of ectodermal or igin such as the skin and the nervous system 4041 The role of thyroid hormone metabolism on human tumorigenesis has been largely debated 10 In breast cancer previous studies showed that higher levels of the thyroid hormone recept or alpha were an in dependent prognostic fact or for in creased overall survival 42 More recently high levels of the thyroid hormone recept or beta in breast tumors were also as sociated with in creased breast cancerspecific survival 43 In basal cell carcinom as BCC for in stance a DIO 3 mediated decrease in T 3 levels relates to in creased cell proliferati on 31 Similarly in colon cancer cells DIO 3 knockdown and consequent in creases in T 3 levels are as sociated with reduced cell proliferati on and in ducti on of differentiati on 44 High levels of DIO 3 expressi on in primary PTC tumors were as sociated with advanced disease at the diagnosis 30 Some data in deed suggest that T 3 can contribute to tumor growth in breast cancer cells in a 0 vitro 17 while a micro environment with low T 3 levels could facilitate in vasiveness and dedifferentiati on However in agreement with our data in breast cancer similar levels of DIO 3 m RNA are observed in glioblastoma and liver carcinom as as compared to respective normal tissues 45 These differences could be at tributed to the tissue embryological or igin since the tissues of ectodermal or igin seem to mainta in DIO 3 expressi on during adulthood while DIO 3 gene is subject to imprinting in other tissues Loss of DIO 3 expressi on was as sociated with tumor aggressiveness in colon cancer and also in thyroid cancer DIO 3 ex", "weight daily represents the best the rapeutic regimen In general Triacsensitive cases of TH resistance are caused by mutations in the carboxyterminal regi on of the T 3 binding FIG Chemical structure of some active thyroid hormone metabolites that have been used in patients or in animal models of human disease See text for further detailsdoma in while mutations located close to the hinge regi on donot respond to Triac No positive response to Triac has beenreported in TRa mutations so far A different cause of reduced sensitivity to TH is represented by mutations in MCT 8 a T 3 T 4 transporter that isthe major pathway mediating T 4 and T 3 uptake in the centralnervous system The clinical syndrome as sociated with MCT 8 mutations is known as the Allan\"Hernd on\"Dudley syndrome The MCT 8 gene is located on the X chromosome and the refore virtually all patients are male Diagnosis is suspected in the presence of high T 3 with low to normal T 4 and low to normal TSH as sociated with congenital brain hypothyroidism The phenotype is variable depending on the locati on and type of the mutati on Symptoms usually in clude cognitive impairment as sociated with congenital hypotonia and weakness which mayprogress to spasticity Paroxysmal dyskinesi as and seizuresmay also occur Per ipheral hyperthyroidism often causestachycardia muscle wasting and progressive body weightreducti on \"Since it has been observed that cellular Triac uptake doesnot depend on MCT 8 a clinical trial has been under taken with this endogenous TH analogue in patients with amedian age of years The", "focusing on patients with distant metastases [ ] In the daily practice it is wellknown that microscopic RAIavid lesions are morelikely cured than macroscopic ones eg lung miliary vslung macronodules However no studies have specified the prognostic role of tumor burden estimated usinghighresoluti on imaging techniques both in the setting of distant metastases and lymphnode disease The aim of the study was to as sess the correlation of PD tumor burden with the ATA riskstratificati on system and its impact on response to initial therapy and outcome We hypothesized that patients presenting postoperatively a low tumor burden of PD would have better response to in itial the rapy and better clinical outcomes than patients havinghigh tumor burden Patients The records of consecutive patients with DTC referred to our in stituti on for postoperative RAI treatment between January and February werereviewed For the purpose of the study patients wereriskstratified according to the ATA guidelinesbased on pathological and surgical data available after totalthyroidectomy and before postoperative RAItreatment postoperative risk stratificati on [] Dataavailable in the preoperative period such as imagingstudies showing distant metastases were also used to inform ATA risk stratificati on In contrast postoperative serum thyroglobul in Tg level was not used to drive RAI treatment in these patients managed before and no diagnostic RAI scintigraphy was per formed before RAI treatmentrh TSHPostoperative RAI treatment All patients were administered an RAI regimen \u00b1 weeks after total thyroidectomy Patients were prepared after either thyroid hormone with drawal THWinjections of recombinant human or after two imthyrotrop in Thyrogen Genzyme Corp Cambridge MA USA as previously described [] TSHlevel was measured the day of RAI treatment and was m UIl in all patients The RAI activity or GBq and the preparati on modalities were decided byour multidisciplinary committee All patients under wenta post R", "VEGFR 2 VEGFR 3 PDGFRb and Raf Two large in ternational multi center clinical trials SHARP and Asian Pacific have proved that sorafenib can suppress tumor progressi on and prolong OS in patients with advanced HCC 102103 These trials showed that sorafenib can in crease PFS and OS by months in patients with advanced HCC in Western countries As the first generati on of targeted drugs for HCC sorafenib has been used for over a decade During this time many patients have benefitedthough others quickly developed resistance to sorafenib 104 Lenvatinib Lenvatinib is becoming available for HCC patients whodevelop sorafenib resistance Lenvatinib is an oral tyrosine kinase in hibitorinhibiting VEGFR 1\" FGFR 1\" PDGFR RET and KIT In August the FDA approved lenvatinib for firstline treatment of patients with unresectable HCC after lenvatinib was proved to be noninferi or to sorafenib in the phase REFLECT trial 105 Median OS in the lenvatinib arm and sorafenib arm was months and months HR CI respectively The adverse effectswere hypertensi on diarrhea and decreased appetite with lenvatinib and palmarplantar erythrodysesthesia diarrhea decreased weight hypertensi on and decreased appetite with sorafenib Donafenib Similar to sorafenib donafenib is a novel multikinase in hibitortargeting RAF kinase and various recept or tyrosine kinases RTKs in cluding VEGF recept or VEGFR and BRAF 106 According to the report from In ternational Conference of the American Society of Clinical On cology CSCOdonafenib significantly improves OS over sorafenib versus months with fewer side effects and higher patient to lerance for advanced HCC patients in its phase IIIII label trial 107 The grade and above adverse reacti on rates for donafenib and sorafenib were and respectively Thus donafenib was recommended as the firstline the rapy in the CSCOguidelines for HCC"], "answer": "Insufficient evidence in provided documents."}
{"question": "Are there strategies to overcome resistance to targeted therapies in thyroid carcinoma?", "contexts": ["For many years doxorubic in was the only US Food and Drug Administrati on FDA\"approved treatment for patients with advanced thyroid cancer however response rate in patients with MTC is up to with significant to xicity \" Recently in advanced MTC several TKIs such as axitinib cabozantinib gefitinib lenvatinib imatinib motesanib sorafenib pazopanib sunitinib and vandetanib have been studied in phase I IIand III clinical trials Vandetanib an oral in hibit or of VEGFRvascular endothelial growth fact or recept or RET and EGFRepidermal growth fact or recept or was approved by the FDA in April after a phase III trial demonstrated improvedmedian progressionfree survival PFS compared to placebohazard ratio CI \" and overall response rate of Cabozantinib an in hibit or of hepatocyte growthfact or recept or MET VEGFR 2 and RET was approved bythe FDA in after a phase III trial demonstrated improvedmedian PFS of months relative to months in the placebo group The impact of to xicity on patientsw as clearly in dicated and for cabozantinib of patientsrequired dose reductions and required dosing delays The refore to xicity of FDAapproved TKI agents limits their usein patients with small volume as ymptomatic or in dolent disease Furthermore no clear data exist from these studies thateither agent impacts overall survival In additi on RETspecific TKIs in development are Selpercatinib previously LOXO 292 and Blue 667 with more specific RETtargeting activity The seagents have demonstrated evidence of efficacy in early trial", "in cancer tissues [ ] Yu Xiao [] conducted a clinical studycomparing the level of serum lept in in PTC patientsincluding patients with lymph node metastasis and thyroid adenoma patients in Dalian China and foundth at patients with lymph node metastasis have a higherlevel of lept in than those without lymph node metastasis Lept in can in duce the expressi on of vascular endothelialgrowth fact or and promote neovascularizati on in tumortissue [] In additi on it can also in hibit the apoptosisthrough Bcl 2 dependent mechanism Meanwhile leptinrecept or exists in all thyroid cancer cells It is over expressed in PTC and is in volved in tumor in vasi on and lymph node metastasis [ ] Thus lept in may be in volved in the tumorigenesis and metastasis of thyroid cancer through a complex pathway and a monitoringmay have some significance Due to the absence of directevidence elevated lept in levels can also be caused by thyroid carcinoma The cause and effect relationship between lept in and thyroid carcinoma are unclear now and need further studies Compared to lean women over weightobese womenhad lower serum adiponect in levels and this differenceh as statistical significance [] In additi on adiponectinis negatively as sociated with a variety of benign and malignant tumors especially those as sociated with obesity and in sulin resistance such as leukemia [] renal carcinoma [] gastric carcinoma [] and colon cancer[] Moreover the as sociati on of adiponect in with potential tumorlimiting functions has been widely proposed []Otvos L Jr [] tried in vitro experiments and proved that adiponect in can in hibit the metastasis of cancer cells Mitsiades N [] measured circulatingad iponect in levels in ptaients with PTC and found thatit is in dependently and in versely as sociated with the risk of thyroid cancer As the recept or that binds to adiponect in for biological effects adiponect in recept or hadbeen reported closely correlated with the development of PTC Adiponect in recept or 1 a", "in cancer tissues [ ] yu xiao conducted a clinical studycomparing the level of serum lept in in ptc patientsincluding patients with lymph node metastasis and thyroid adenoma patients in dalian china and foundth at patients with lymph node metastasis have a higherlevel of lept in than those without lymph node metastasislept in can in duce the expressi on of vascular endothelialgrowth fact or and promote neovascularizati on in tumortissue in additi on it can also in hibit the apoptosisthrough bcl 2 dependent mechanism meanwhile leptinrecept or exists in all thyroid cancer cells it is over expressed in ptc and is in volved in tumor in vasi on and lymph node metastasis [ ] thus lept in may be in volved in the tumorigenesis and metastasis of thyroid cancer through a complex pathway and a monitoringmay have some significance due to the absence of directevidence elevated lept in levels can also be caused by thyroid carcinoma the cause and effect relationship between lept in and thyroid carcinoma are unclear now and need further studiescompared to lean women over weightobese womenhad lower serum adiponect in levels and this differenceh as statistical significance in additi on adiponectinis negatively as sociated with a variety of benign and malignant tumors especially those as sociated with obesity and in sulin resistance such as leukemia renal carcinoma gastric carcinoma and colon cancer moreover the as sociati on of adiponect in with potential tumorlimiting functions has been widely proposed otvos l jr tried in vitro experiments and proved that adiponect in can in hibit the metastasis of cancer cells mitsiades n measured circulatingadiponect in levels in ptai ents with ptc and found thatit is in dependently and in versely as sociated with the risk of thyroid cancer as the recept or that binds to adiponect in for biological effects adiponect in recept or hadbeen reported closely correlated with the development of ptc adiponect in recept or 1 and are higher expressi on in p", "Characteristics of patients The study group in cluded papillary thyroid cancers PTC follicular thyroid cancers FTC and poorlydifferentiated thyroid cancers PDTCThere were women and men The mean agew as \u00b1 years Three hundred and seventytwo patients were prepared with rh TSH stimulati on Eightytwo patients presented positive Tg Ab at the time of postoperative RAI treatment In the postoperative setting prior to RAI administrati on patients were at low risk LR at in termediaterisk IR and at high risk HRaccording to the ATA risk Per sistent disease and tumor burden Overall PD was detected in patients Their characteristics in terms of ATA risk RAI preparati on modality PD sites and RAI or 18 FDG uptake arepresented in Table Of patients had very smallvolumelargevolume smallvolume and PDFigure shows two points First the rate of PDincreased from in LR patients and in IR to in HR patients p Second the per centage of patients with largevolume PD in creased with risk stratificati on from LRIR to HR patients and respectively p Table Characteristics of patients according to the ATA riskstratificati on system in the postoperative setting Mean age \u00b1 SD yrs Sex ratio Female Mean tumor size \u00b1 SD mm Histology PTCFTCPDTCAggressive pathological subtypes No Yes Extrathyroidal extensi on Minimal Gross T status TNM T 1 a T 1 b T 2 T 3 a T 3 b T 4 a T 4 b N status TNM Nx N 0 N 1 a N 1 b M status TNM M 0 M 1 Positive Tg Ab level Stimulated Tg level at RAI treatment", "we used the Gene Expressi on Profiling In teractive Analysis database to verify the expressi on of key genes in PTC and adjacent tissues The overall survival and diseasefree survivalanalyses were per formed by Kaplan\"Meier plots for these PTCrelated hub genes Genetic alterations of hub genes in PTC and their correlations with other genes were analyzed utilizing the c Bio Portal for Cancer Genomics Hub genesrelated to clinicopathological features were analyzed using the on line database UALCAN httpualcanpathuabedu[] The correlati on of ADORA 1 APOE and LPAR 5 expressi on with the immune in filtrati on level in PTC and the expressi on of these three genes in different kinds of cancers was per formed using the Tumor Immune Estimati on Resource database []For q RTPCR analysis total RNA was isolated from normal and cancerous papillary thyroid samples utilizing TRIzol reagent Qiagen Valencia CA USA c DNA was synthesized with RNA reverse transcripti on kit TIANGENBIOTECH Beijing China q RTPCR was per formed with an ABI Real Time PCR System Applied Biosystems Life Technologies USA The expressi on of the genes of in terest was normalized to actin The primers for ADORA 1 APOE LPAR 5 and actin are shown in Table For Western blot RIPA buffer was used to extract prote in from four pairs of tissue from PTC patients and the prote in concentrations were measured via BCA Differentially expressed genes screening based on RNASeq To screen out the genes or modules that may play a role in promoting cancer in papillary thyroid carcinoma weperformed RNASeq experiments on four pairs of thyroid cancer tissues and their matched paracancerous tissues to obta in differentially expressed genes After RNASeq we acquire \" milli on reads for each sample The fold changesbetween PTC cancer tissues and matched paracancerous samples were calculated Setting the cutoff criteri on as Pvalue and a fold change there were upregulated and downregulated genes These DEGswere considered to be candidate genes for", "IO 3 m RNA was found to be upregulated in MCF 7 cells and downregulated in MDAMB 231 cells when compared to the nontumoral cell line MCF 10 A cells DIO 3 mediated T 3 deiodinati on also occurs in MCF 7 cells In these cells DIO 3 expressi on is to regulated by retinoids but not by estradiol 37\" These findings are consistent with the presence of DIO 3 in other tissues of ectodermal or igin such as the skin and the nervous system 4041 The role of thyroid hormone metabolism on human tumorigenesis has been largely debated 10 In breast cancer previous studies showed that higher levels of the thyroid hormone recept or alpha were an in dependent prognostic fact or for in creased overall survival 42 More recently high levels of the thyroid hormone recept or beta in breast tumors were also as sociated with in creased breast cancerspecific survival 43 In basal cell carcinom as BCC for in stance a DIO 3 mediated decrease in T 3 levels relates to in creased cell proliferati on 31 Similarly in colon cancer cells DIO 3 knockdown and consequent in creases in T 3 levels are as sociated with reduced cell proliferati on and in ducti on of differentiati on 44 High levels of DIO 3 expressi on in primary PTC tumors were as sociated with advanced disease at the diagnosis 30 Some data in deed suggest that T 3 can contribute to tumor growth in breast cancer cells in a 0 vitro 17 while a micro environment with low T 3 levels could facilitate in vasiveness and dedifferentiati on However in agreement with our data in breast cancer similar levels of DIO 3 m RNA are observed in glioblastoma and liver carcinom as as compared to respective normal tissues 45 These differences could be at tributed to the tissue embryological or igin since the tissues of ectodermal or igin seem to mainta in DIO 3 expressi on during adulthood while DIO 3 gene is subject to imprinting in other tissues Loss of DIO 3 expressi on was as sociated with tumor aggressiveness in colon cancer and also in thyroid cancer DIO 3 ex", "of which are reported as hypocalcemia in Table One study found that total thyroidectomy central and bilateral neck dissecti on Graves\u2122 disease and malignancy were risk factors for hypocalcemia after thyroid surgery 3 In this cohort postoperative hypocalcemia was noted more in malignant cases but it failed to reach statistical significance Moreover there was no significant difference between benign and malignant cases in terms of mean age gender distributi on recurrent laryngeal nerve in jury or overall complications a finding that was reported previously 26 Multiple studies in recent years have found an in verse relationship between surge on volume and complicati on rates 2728 but similar data in the pediatric populati on is lacking One study found that highvolume endocrine surgeons have better outcomes and shorter lengths of stay and lower costs after thyroidectomy and parathyroidectomy in children compared to pediatric surgeons general surgeons or otolaryngologists 29 Scheumann and colleagues also concluded that a collaborative approach between pediatric and endocrine surgeons would have better outcomes This has led other authors to suggest that a combined approach with endocrine and pediatric surgeons in additi on to pediatric endocrinologists may optimize the care of children with surgical thyroid disease given the low number of pediatric patients 4 Our data do not allow for comparisons of different approaches given the late adopti on of the combined approach The recurrence rate for thyroid cancer in children after thyroidectomy has varied widely in reported studies ranging from to while it was in this cohort Only a few studies explored the predictors of recurrence Lymph node in volvement multiple nodules male gender younger age histologic subtype and advanced tumor stage were risk factors as sociated with recurrence 17233033 In this study of patients with malignant lesions received RAI Although there are conflicting data regarding the in dications of postoperat", "weight daily represents the best the rapeutic regimen In general Triacsensitive cases of TH resistance are caused by mutations in the carboxyterminal regi on of the T 3 binding FIG Chemical structure of some active thyroid hormone metabolites that have been used in patients or in animal models of human disease See text for further detailsdoma in while mutations located close to the hinge regi on donot respond to Triac No positive response to Triac has beenreported in TRa mutations so far A different cause of reduced sensitivity to TH is represented by mutations in MCT 8 a T 3 T 4 transporter that isthe major pathway mediating T 4 and T 3 uptake in the centralnervous system The clinical syndrome as sociated with MCT 8 mutations is known as the Allan\"Hernd on\"Dudley syndrome The MCT 8 gene is located on the X chromosome and the refore virtually all patients are male Diagnosis is suspected in the presence of high T 3 with low to normal T 4 and low to normal TSH as sociated with congenital brain hypothyroidism The phenotype is variable depending on the locati on and type of the mutati on Symptoms usually in clude cognitive impairment as sociated with congenital hypotonia and weakness which mayprogress to spasticity Paroxysmal dyskinesi as and seizuresmay also occur Per ipheral hyperthyroidism often causestachycardia muscle wasting and progressive body weightreducti on \"Since it has been observed that cellular Triac uptake doesnot depend on MCT 8 a clinical trial has been under taken with this endogenous TH analogue in patients with amedian age of years The", "suggest that Raman spectroscopy may over come the limits of current diagnostic tools Detecti on of nodular thyroid pathology is in creasing worldwide paired with an in creased number of thyroid cancer diagnosis 1 Whether this \u0153epidemic\u009d spread is real or is due to an exaggerated use of imaging tools in clinical practice is object of a vivid debate with in the scientific community Anyway management of patients with thyroid nodule causes a clinical problem and a social burden as well 2 To avoid over diagnosis and over treatment of these patients physicians need additional in formati on about the biology of each thyroid nodule In particular there is need for a tool able to distinguish between benign and malignant follicular lesions and between in dolent and aggressive tumors 3 The genomic profile of thyroid tumors has been extensively in vestigated 4 and several immunocytochemical and molecular markers have been proposed for a more accurate classificati on of thyroid nodules 5 However none of these markers reaches a reliable sensibility and specificity to be routinely used in clinical setting 6 Moreover although the major genetic alterations of thyroid tumors are known only little in formati on if any is available about changes in prote in lipids and other cellular constituents due to thyroid on cogenesis To correctly manage patients with thyroid nodules and to avoid unnecessary surgery we strongly need a method of analysis that over comes the limits of current diagnostic tools by identifying specific tumoral markers possibly with high spatial resoluti on and low impact on the patient Cells and tissues are characterized by a specific biochemical compositi on Each pathology or cellular abnormality is accompanied by biochemical molecular changes Optical and spectroscopic techniques that correlate the biochemical compositi on molecular structure and their variations with the morphological alterations represent a powerful diagnostic and potentially clinical tool 8 Among", "Papillary thyroid carcinoma PTCis acomm on thyroid malignancy accountingf or about of systemic malignancies 1 PTC is currently characterized by a highincidence and low mortality 2 clinical Recentimprovements in highfrequencyultrasonic diagnostic technologies and the applicati on of ultrasoundguided puncturetechniques have led to an apparent in crease in the in cidence of PTC year by year 3\"Regardingthyroidtumors the palpati on detecti on rate for thyroid microtumors in the general populati on is about compared with as high as to for highfrequency ultrasound 6 which has thus greatly improved disease diagnosisdiagnosisthe of Surgical resecti on is a routine treatmentf or thyroid tumors but the recurrence rateis usually high and the consequent reducti on in thyroid functi on can seriously affect the patient\u2122s quality of life 7 As sociated with the in creasing detecti on rate of thyroidtumors and the pursuit of minimally in vasive treatments radiofrequency ablati on RFA has been gradually applied in the clinic RFA uses local hyperthermia to cause tissue necrosis The the rmal effectsdo not depend on the tissue type and most lesions can be completely eliminated by RFA 89 RFA has thus become a novellocal treatment for tumors The clinical diagnosis of benign and malignant thyroid tumors currently depends on the clinical manifestations and pathological examinations However the clinicalmanifestations are mostly derived from involvessubjective empirical analysis while a finalpathological diagnosisinvasiveprocedures with lesssatisfactory specificity It is the refore necessary to identifyappropriatepredictivetum or markersdiagnosticandforimplications The collagenases matrix metalloproteinase MMP 2 and MMP 9 can degradetype IV collagen in the basement membrane with importanttumorangiogenesis and tumor cell in vasi on and metastasis 10 MMP 2 and MMP 9 expressi on levels were found to be upregulated in thyroid cancer tissue 11 however the sestudies mostly examined pathological tiss"], "answer": "Insufficient evidence in provided documents."}
{"question": "What targeted drugs are evaluated in differentiated thyroid cancer?", "contexts": ["For many years doxorubic in was the only US Food and Drug Administrati on FDA\"approved treatment for patients with advanced thyroid cancer however response rate in patients with MTC is up to with significant to xicity \" Recently in advanced MTC several TKIs such as axitinib cabozantinib gefitinib lenvatinib imatinib motesanib sorafenib pazopanib sunitinib and vandetanib have been studied in phase I IIand III clinical trials Vandetanib an oral in hibit or of VEGFRvascular endothelial growth fact or recept or RET and EGFRepidermal growth fact or recept or was approved by the FDA in April after a phase III trial demonstrated improvedmedian progressionfree survival PFS compared to placebohazard ratio CI \" and overall response rate of Cabozantinib an in hibit or of hepatocyte growthfact or recept or MET VEGFR 2 and RET was approved bythe FDA in after a phase III trial demonstrated improvedmedian PFS of months relative to months in the placebo group The impact of to xicity on patientsw as clearly in dicated and for cabozantinib of patientsrequired dose reductions and required dosing delays The refore to xicity of FDAapproved TKI agents limits their usein patients with small volume as ymptomatic or in dolent disease Furthermore no clear data exist from these studies thateither agent impacts overall survival In additi on RETspecific TKIs in development are Selpercatinib previously LOXO 292 and Blue 667 with more specific RETtargeting activity The seagents have demonstrated evidence of efficacy in early trial", "Characteristics of patients The study group in cluded papillary thyroid cancers PTC follicular thyroid cancers FTC and poorlydifferentiated thyroid cancers PDTCThere were women and men The mean agew as \u00b1 years Three hundred and seventytwo patients were prepared with rh TSH stimulati on Eightytwo patients presented positive Tg Ab at the time of postoperative RAI treatment In the postoperative setting prior to RAI administrati on patients were at low risk LR at in termediaterisk IR and at high risk HRaccording to the ATA risk Per sistent disease and tumor burden Overall PD was detected in patients Their characteristics in terms of ATA risk RAI preparati on modality PD sites and RAI or 18 FDG uptake arepresented in Table Of patients had very smallvolumelargevolume smallvolume and PDFigure shows two points First the rate of PDincreased from in LR patients and in IR to in HR patients p Second the per centage of patients with largevolume PD in creased with risk stratificati on from LRIR to HR patients and respectively p Table Characteristics of patients according to the ATA riskstratificati on system in the postoperative setting Mean age \u00b1 SD yrs Sex ratio Female Mean tumor size \u00b1 SD mm Histology PTCFTCPDTCAggressive pathological subtypes No Yes Extrathyroidal extensi on Minimal Gross T status TNM T 1 a T 1 b T 2 T 3 a T 3 b T 4 a T 4 b N status TNM Nx N 0 N 1 a N 1 b M status TNM M 0 M 1 Positive Tg Ab level Stimulated Tg level at RAI treatment", "henhua []tissue TNF\u03b1 tumor necrosis factora DTC differentiated thyroid carcinoma IL 6 in terleuk in 6 PTC papillary thyroid carcinoma FTC follicular thyroid carcinoma AT Canaplastic thyroid carcinoma MTC medullary thyroid carcinoma WDTC welldifferentiated thyroid carcinoma FNAC fine needle as pirati on cytologynodular goiter PTCQuality of in cluded studies The quality as sessment of these studies is as sessed bythe NOS and the resultis shown in Supplemental Table Five or more scores are determined as highquality Two studies conducted by Cao G in [] and L Kayser in [] only get two scoresshowing a poor quality in methodology The rest studies are as sessed as high quality TNF\u03b1 and thyroid carcinoma Twelve studies reported the expressi on of TNF\u03b1 both in patients with thyroid carcinoma and control subjects[\" \" ] Among these sevenstudies [ ] had tested the level of serum TNF\u03b1 two studies [ ] had tested the expressi on of TNF\u03b1 in tissues and the ratio of TNF\u03b1 immunoreactivity was tested in four studies [ ] Firstly fixedeffect model is used to merge the SMDvalues of serum TNF\u03b1 level however a large heterogeneity is found by the heterogeneity analysis heterogeneity test Chi 2 P I 2 and itmay be due to the different units differenttesting", "of clinical studies provide evidence for basic research simonovic sz evaluated cytokine profiles determined in supernatants obtained from whole blood cultures in patients with dtc before and days after radioactiveiodine 131 itherapy and control subjects and found that the expressi on of tnf\u03b1 in dtc patients ishigher than control subjects and it showed a decreasedlevel after 131 i the rapy than those before the rapy however no statistical difference found for the limited sample size another study conducted by kobawala tp with more patients patients with benign thyroid disease ptc patients and healthy in dividuals determined the circulating levels of tnf\u03b1 and it wasfound that the serum level of tnf\u03b1 was significantlyhigher in ptc patients than benign thyroid disease patients and the later was also significantly higher thanhealthy in dividuals furthermore serum tnf\u03b1 was reported to be a significant prognosticat or for overall survival in ptc patients it is a pity thatopposite result wasreported in a casecontrol study that in cluded dtccases and matched cancerfree cohort participantswhich found that tnfa was not as sociated with thyroidrisk in either gender based on current evidence our meta analysis suggeststh at tnf\u03b1 exhibit a strong as sociati on with thyroid carcinoma it may because that elevated tnf\u03b1 may in volved in the tumorigenesis and development of thyroid cancer another possible reas on is that the tnf\u03b1 decreased with tumor cells less resulted the activati on ofthe immune system by thyroid carcinomathereforemore clincal studies and basic reseaches should be conducted in the futureil 6 a multifunctional cytokine plays important roles in different types of cells in cluding tumor cells it", "we used the Gene Expressi on Profiling In teractive Analysis database to verify the expressi on of key genes in PTC and adjacent tissues The overall survival and diseasefree survivalanalyses were per formed by Kaplan\"Meier plots for these PTCrelated hub genes Genetic alterations of hub genes in PTC and their correlations with other genes were analyzed utilizing the c Bio Portal for Cancer Genomics Hub genesrelated to clinicopathological features were analyzed using the on line database UALCAN httpualcanpathuabedu[] The correlati on of ADORA 1 APOE and LPAR 5 expressi on with the immune in filtrati on level in PTC and the expressi on of these three genes in different kinds of cancers was per formed using the Tumor Immune Estimati on Resource database []For q RTPCR analysis total RNA was isolated from normal and cancerous papillary thyroid samples utilizing TRIzol reagent Qiagen Valencia CA USA c DNA was synthesized with RNA reverse transcripti on kit TIANGENBIOTECH Beijing China q RTPCR was per formed with an ABI Real Time PCR System Applied Biosystems Life Technologies USA The expressi on of the genes of in terest was normalized to actin The primers for ADORA 1 APOE LPAR 5 and actin are shown in Table For Western blot RIPA buffer was used to extract prote in from four pairs of tissue from PTC patients and the prote in concentrations were measured via BCA Differentially expressed genes screening based on RNASeq To screen out the genes or modules that may play a role in promoting cancer in papillary thyroid carcinoma weperformed RNASeq experiments on four pairs of thyroid cancer tissues and their matched paracancerous tissues to obta in differentially expressed genes After RNASeq we acquire \" milli on reads for each sample The fold changesbetween PTC cancer tissues and matched paracancerous samples were calculated Setting the cutoff criteri on as Pvalue and a fold change there were upregulated and downregulated genes These DEGswere considered to be candidate genes for", "IO 3 m RNA was found to be upregulated in MCF 7 cells and downregulated in MDAMB 231 cells when compared to the nontumoral cell line MCF 10 A cells DIO 3 mediated T 3 deiodinati on also occurs in MCF 7 cells In these cells DIO 3 expressi on is to regulated by retinoids but not by estradiol 37\" These findings are consistent with the presence of DIO 3 in other tissues of ectodermal or igin such as the skin and the nervous system 4041 The role of thyroid hormone metabolism on human tumorigenesis has been largely debated 10 In breast cancer previous studies showed that higher levels of the thyroid hormone recept or alpha were an in dependent prognostic fact or for in creased overall survival 42 More recently high levels of the thyroid hormone recept or beta in breast tumors were also as sociated with in creased breast cancerspecific survival 43 In basal cell carcinom as BCC for in stance a DIO 3 mediated decrease in T 3 levels relates to in creased cell proliferati on 31 Similarly in colon cancer cells DIO 3 knockdown and consequent in creases in T 3 levels are as sociated with reduced cell proliferati on and in ducti on of differentiati on 44 High levels of DIO 3 expressi on in primary PTC tumors were as sociated with advanced disease at the diagnosis 30 Some data in deed suggest that T 3 can contribute to tumor growth in breast cancer cells in a 0 vitro 17 while a micro environment with low T 3 levels could facilitate in vasiveness and dedifferentiati on However in agreement with our data in breast cancer similar levels of DIO 3 m RNA are observed in glioblastoma and liver carcinom as as compared to respective normal tissues 45 These differences could be at tributed to the tissue embryological or igin since the tissues of ectodermal or igin seem to mainta in DIO 3 expressi on during adulthood while DIO 3 gene is subject to imprinting in other tissues Loss of DIO 3 expressi on was as sociated with tumor aggressiveness in colon cancer and also in thyroid cancer DIO 3 ex", "Papillary thyroid carcinoma PTCis acomm on thyroid malignancy accountingf or about of systemic malignancies 1 PTC is currently characterized by a highincidence and low mortality 2 clinical Recentimprovements in highfrequencyultrasonic diagnostic technologies and the applicati on of ultrasoundguided puncturetechniques have led to an apparent in crease in the in cidence of PTC year by year 3\"Regardingthyroidtumors the palpati on detecti on rate for thyroid microtumors in the general populati on is about compared with as high as to for highfrequency ultrasound 6 which has thus greatly improved disease diagnosisdiagnosisthe of Surgical resecti on is a routine treatmentf or thyroid tumors but the recurrence rateis usually high and the consequent reducti on in thyroid functi on can seriously affect the patient\u2122s quality of life 7 As sociated with the in creasing detecti on rate of thyroidtumors and the pursuit of minimally in vasive treatments radiofrequency ablati on RFA has been gradually applied in the clinic RFA uses local hyperthermia to cause tissue necrosis The the rmal effectsdo not depend on the tissue type and most lesions can be completely eliminated by RFA 89 RFA has thus become a novellocal treatment for tumors The clinical diagnosis of benign and malignant thyroid tumors currently depends on the clinical manifestations and pathological examinations However the clinicalmanifestations are mostly derived from involvessubjective empirical analysis while a finalpathological diagnosisinvasiveprocedures with lesssatisfactory specificity It is the refore necessary to identifyappropriatepredictivetum or markersdiagnosticandforimplications The collagenases matrix metalloproteinase MMP 2 and MMP 9 can degradetype IV collagen in the basement membrane with importanttumorangiogenesis and tumor cell in vasi on and metastasis 10 MMP 2 and MMP 9 expressi on levels were found to be upregulated in thyroid cancer tissue 11 however the sestudies mostly examined pathological tiss", "and dose reducti on while the target populati on for thyroid cancer or hepatocellular carcinoma that showed efficacy for lenvatinib was first line setting 20 this study targeted patients receiving salvage line the rapy most patients with metastatic colorectal cancer in the salvage line setting had grade or proteinuria and hypertensi on at baseline because of the long term prior treatment with anti vegfvegfr treatment where as the occurrence of grade hypertensi on was significantly higher compared with that of regorafenib in a similar study populati on in the correct concur and consign trials 7 it was manageable by dose reducti on or in terrupti on but it may be necessary to consider the starting dose in the future although palmar plantar erythrodysesthesia is a not life threatening to xicity these adverse events have a significant impact on treatment schedules and quality of life in treated patients grade \u2030\u00a5 palmar plantar erythrodysesthesia has been observed in and of patients treated with lenvatinib in this study and the select japanese populati on 15 respectively while in patients treated with regorafenib in the correct japanese populati on 16 to date the clear mechanism of palmar plantar erythrodysesthesia by vegf recept or tyrosine kinase in hibitors is not known but it has been reproduced that palmar plantar erythrodysesthesia by lenvatinib is well to lerated overall it is suggested that lenvatinib might be a favourable treatment opti on in terms of to xicitiesseveral preclinical studies demonstrated that vegf targeted treatment affects immune suppressi on by promoting the expansi on of suppressive immune cell populations such as regulatory t cells and myel", "suggest that Raman spectroscopy may over come the limits of current diagnostic tools Detecti on of nodular thyroid pathology is in creasing worldwide paired with an in creased number of thyroid cancer diagnosis 1 Whether this \u0153epidemic\u009d spread is real or is due to an exaggerated use of imaging tools in clinical practice is object of a vivid debate with in the scientific community Anyway management of patients with thyroid nodule causes a clinical problem and a social burden as well 2 To avoid over diagnosis and over treatment of these patients physicians need additional in formati on about the biology of each thyroid nodule In particular there is need for a tool able to distinguish between benign and malignant follicular lesions and between in dolent and aggressive tumors 3 The genomic profile of thyroid tumors has been extensively in vestigated 4 and several immunocytochemical and molecular markers have been proposed for a more accurate classificati on of thyroid nodules 5 However none of these markers reaches a reliable sensibility and specificity to be routinely used in clinical setting 6 Moreover although the major genetic alterations of thyroid tumors are known only little in formati on if any is available about changes in prote in lipids and other cellular constituents due to thyroid on cogenesis To correctly manage patients with thyroid nodules and to avoid unnecessary surgery we strongly need a method of analysis that over comes the limits of current diagnostic tools by identifying specific tumoral markers possibly with high spatial resoluti on and low impact on the patient Cells and tissues are characterized by a specific biochemical compositi on Each pathology or cellular abnormality is accompanied by biochemical molecular changes Optical and spectroscopic techniques that correlate the biochemical compositi on molecular structure and their variations with the morphological alterations represent a powerful diagnostic and potentially clinical tool 8 Among", "of oral contracept ive In the patient was directed to psychiatry for suspected cognitive impairment In she had severe microcytic and hypochromicanemia and was treated with saccharized ferric oxide Gynecological ultrasound without major changes and occultstool was negative After hematological research clinical research von Willebr and\u2122s disease was excluded in the blood In she was admitted to endocrinology due to changes in thyroid analytical parameters TSH and T 4 and 5 cm thyroid nodule in the left lobe An ultrasoundw as per formed which identifies a 56 cm hypoechogenicnodule and anecogenic areas the largest with cm Subsequently she per formed a fineneedle biopsy andw as diagnosed with follicular lesi on of undetermined significance FLUS Bethesda category III After a multidisciplinary meetingit was decided to in tervene the patient with total thyroidectomy In September she under went g total thyroidectomy and was diagnosed with papillary carcinomasolidtrabecular variant Fig Concomitantly she per forms ablative the rapy with MBq m Ci of I 131 and is treated with levothyroxine and calcium In January research scintigraphy after 24 h oral I 131 wasadministrati on of MBq m Ci of Fig Solidtrabecular variant of papillary carcinoma Welldefined tumor with trabecular pattern a composed by follicular cells with nuclearfeatures of papillary carcinoma b and expressi on of TTF 1 c 0 c Miguelote World Journal of Surgical On cology Page of Fig a Right breast lump b Radiological image of the breast lesionconducted revealing anteri or cervical uptake focus compatible with"], "answer": "The targeted drugs evaluated in differentiated thyroid cancer include several tyrosine kinase inhibitors (TKIs) such as axitinib, cabozantinib, gefitinib, lenvatinib, imatinib, motesanib, sorafenib, pazopanib, sunitinib, and vandetanib. Specifically, vandetanib and cabozantinib have been approved by the FDA after demonstrating improved median progression-free survival in clinical trials. Additionally, RET-specific TKIs like Selpercatinib and Blue 667 are also in development for their efficacy in targeting RET in advanced medullary thyroid carcinoma (MTC)."}
{"question": "Which gene-expression signatures are associated with thyroid cancer survival?", "contexts": ["we used the Gene Expressi on Profiling In teractive Analysis database to verify the expressi on of key genes in PTC and adjacent tissues The overall survival and diseasefree survivalanalyses were per formed by Kaplan\"Meier plots for these PTCrelated hub genes Genetic alterations of hub genes in PTC and their correlations with other genes were analyzed utilizing the c Bio Portal for Cancer Genomics Hub genesrelated to clinicopathological features were analyzed using the on line database UALCAN httpualcanpathuabedu[] The correlati on of ADORA 1 APOE and LPAR 5 expressi on with the immune in filtrati on level in PTC and the expressi on of these three genes in different kinds of cancers was per formed using the Tumor Immune Estimati on Resource database []For q RTPCR analysis total RNA was isolated from normal and cancerous papillary thyroid samples utilizing TRIzol reagent Qiagen Valencia CA USA c DNA was synthesized with RNA reverse transcripti on kit TIANGENBIOTECH Beijing China q RTPCR was per formed with an ABI Real Time PCR System Applied Biosystems Life Technologies USA The expressi on of the genes of in terest was normalized to actin The primers for ADORA 1 APOE LPAR 5 and actin are shown in Table For Western blot RIPA buffer was used to extract prote in from four pairs of tissue from PTC patients and the prote in concentrations were measured via BCA Differentially expressed genes screening based on RNASeq To screen out the genes or modules that may play a role in promoting cancer in papillary thyroid carcinoma weperformed RNASeq experiments on four pairs of thyroid cancer tissues and their matched paracancerous tissues to obta in differentially expressed genes After RNASeq we acquire \" milli on reads for each sample The fold changesbetween PTC cancer tissues and matched paracancerous samples were calculated Setting the cutoff criteri on as Pvalue and a fold change there were upregulated and downregulated genes These DEGswere considered to be candidate genes for", "henhua []tissue TNF\u03b1 tumor necrosis factora DTC differentiated thyroid carcinoma IL 6 in terleuk in 6 PTC papillary thyroid carcinoma FTC follicular thyroid carcinoma AT Canaplastic thyroid carcinoma MTC medullary thyroid carcinoma WDTC welldifferentiated thyroid carcinoma FNAC fine needle as pirati on cytologynodular goiter PTCQuality of in cluded studies The quality as sessment of these studies is as sessed bythe NOS and the resultis shown in Supplemental Table Five or more scores are determined as highquality Two studies conducted by Cao G in [] and L Kayser in [] only get two scoresshowing a poor quality in methodology The rest studies are as sessed as high quality TNF\u03b1 and thyroid carcinoma Twelve studies reported the expressi on of TNF\u03b1 both in patients with thyroid carcinoma and control subjects[\" \" ] Among these sevenstudies [ ] had tested the level of serum TNF\u03b1 two studies [ ] had tested the expressi on of TNF\u03b1 in tissues and the ratio of TNF\u03b1 immunoreactivity was tested in four studies [ ] Firstly fixedeffect model is used to merge the SMDvalues of serum TNF\u03b1 level however a large heterogeneity is found by the heterogeneity analysis heterogeneity test Chi 2 P I 2 and itmay be due to the different units differenttesting", "of clinical studies provide evidence for basic research simonovic sz evaluated cytokine profiles determined in supernatants obtained from whole blood cultures in patients with dtc before and days after radioactiveiodine 131 itherapy and control subjects and found that the expressi on of tnf\u03b1 in dtc patients ishigher than control subjects and it showed a decreasedlevel after 131 i the rapy than those before the rapy however no statistical difference found for the limited sample size another study conducted by kobawala tp with more patients patients with benign thyroid disease ptc patients and healthy in dividuals determined the circulating levels of tnf\u03b1 and it wasfound that the serum level of tnf\u03b1 was significantlyhigher in ptc patients than benign thyroid disease patients and the later was also significantly higher thanhealthy in dividuals furthermore serum tnf\u03b1 was reported to be a significant prognosticat or for overall survival in ptc patients it is a pity thatopposite result wasreported in a casecontrol study that in cluded dtccases and matched cancerfree cohort participantswhich found that tnfa was not as sociated with thyroidrisk in either gender based on current evidence our meta analysis suggeststh at tnf\u03b1 exhibit a strong as sociati on with thyroid carcinoma it may because that elevated tnf\u03b1 may in volved in the tumorigenesis and development of thyroid cancer another possible reas on is that the tnf\u03b1 decreased with tumor cells less resulted the activati on ofthe immune system by thyroid carcinomathereforemore clincal studies and basic reseaches should be conducted in the futureil 6 a multifunctional cytokine plays important roles in different types of cells in cluding tumor cells it", "IO 3 m RNA was found to be upregulated in MCF 7 cells and downregulated in MDAMB 231 cells when compared to the nontumoral cell line MCF 10 A cells DIO 3 mediated T 3 deiodinati on also occurs in MCF 7 cells In these cells DIO 3 expressi on is to regulated by retinoids but not by estradiol 37\" These findings are consistent with the presence of DIO 3 in other tissues of ectodermal or igin such as the skin and the nervous system 4041 The role of thyroid hormone metabolism on human tumorigenesis has been largely debated 10 In breast cancer previous studies showed that higher levels of the thyroid hormone recept or alpha were an in dependent prognostic fact or for in creased overall survival 42 More recently high levels of the thyroid hormone recept or beta in breast tumors were also as sociated with in creased breast cancerspecific survival 43 In basal cell carcinom as BCC for in stance a DIO 3 mediated decrease in T 3 levels relates to in creased cell proliferati on 31 Similarly in colon cancer cells DIO 3 knockdown and consequent in creases in T 3 levels are as sociated with reduced cell proliferati on and in ducti on of differentiati on 44 High levels of DIO 3 expressi on in primary PTC tumors were as sociated with advanced disease at the diagnosis 30 Some data in deed suggest that T 3 can contribute to tumor growth in breast cancer cells in a 0 vitro 17 while a micro environment with low T 3 levels could facilitate in vasiveness and dedifferentiati on However in agreement with our data in breast cancer similar levels of DIO 3 m RNA are observed in glioblastoma and liver carcinom as as compared to respective normal tissues 45 These differences could be at tributed to the tissue embryological or igin since the tissues of ectodermal or igin seem to mainta in DIO 3 expressi on during adulthood while DIO 3 gene is subject to imprinting in other tissues Loss of DIO 3 expressi on was as sociated with tumor aggressiveness in colon cancer and also in thyroid cancer DIO 3 ex", "Characteristics of patients The study group in cluded papillary thyroid cancers PTC follicular thyroid cancers FTC and poorlydifferentiated thyroid cancers PDTCThere were women and men The mean agew as \u00b1 years Three hundred and seventytwo patients were prepared with rh TSH stimulati on Eightytwo patients presented positive Tg Ab at the time of postoperative RAI treatment In the postoperative setting prior to RAI administrati on patients were at low risk LR at in termediaterisk IR and at high risk HRaccording to the ATA risk Per sistent disease and tumor burden Overall PD was detected in patients Their characteristics in terms of ATA risk RAI preparati on modality PD sites and RAI or 18 FDG uptake arepresented in Table Of patients had very smallvolumelargevolume smallvolume and PDFigure shows two points First the rate of PDincreased from in LR patients and in IR to in HR patients p Second the per centage of patients with largevolume PD in creased with risk stratificati on from LRIR to HR patients and respectively p Table Characteristics of patients according to the ATA riskstratificati on system in the postoperative setting Mean age \u00b1 SD yrs Sex ratio Female Mean tumor size \u00b1 SD mm Histology PTCFTCPDTCAggressive pathological subtypes No Yes Extrathyroidal extensi on Minimal Gross T status TNM T 1 a T 1 b T 2 T 3 a T 3 b T 4 a T 4 b N status TNM Nx N 0 N 1 a N 1 b M status TNM M 0 M 1 Positive Tg Ab level Stimulated Tg level at RAI treatment", "ocalcemia transient per manent and Table Thyroid pathology in the patients Pathologyn Benign Normal thyroid tissue Colloid nodule Cyst Adenoma Thyroiditis Graves\u2122 disease Thyroid cancer Papillary Follicular Medullary Hurthle Anaplastic Total Data are number Table Benign and malignant lesions in patients Benignn 37 Malignantn 66 P value Age meanyears Gender malefemale Presence of nodule Hypocalcemia Recurrent laryngeal nerve palsy Bleedinghematoma Wound in fecti on Tracheal in jury Overall complications Mean length of stay days MEN recurrent laryngeal nerve palsy transient per manent all were unilateral Table Of patients with malignant lesions had lymph node metastasis and patients had distant metastases to the lung None of the patients developed postoperative bleeding wound in fecti on or tracheal in jury Patients were followed up for a mean of months median range months radioactive iodine treatment was delivered to patients with malignant lesions patients had recurrences were local recurrences and were local and distant recurrences to the lung Three cases received radioactive iodine RAI before and after recurrence One case was low risk before recurrence so did not receive RAI until after recurrence One case had medullary thyroid cancer so did not receive RAI In the remaining five cases there was no clear data whether those patients received RAI before or only after a recurrence All local recurrences under went resecti on except for one patient who was lost follow up There was no mortality in this study", "In order to achieve the best chance of cure and effective disease control thoroughness of dissecti on has to betaken into account We prospectively per formed comprehensive CND for PTC patients who under went thyroidectomy and CND In additi on data were analyzed for PTC patients to in vestigate the clinicopathologic characteristics for LNCM metastasis The occurrence rate of LNCM was and of the patients harbored metastatic LNCM In total the positiverate of the LNCM was In this studymultivariate analysis revealed that a primary site in the in feri or pole ETE level III and level IV metastasis were of higher LNCM metastasis rate which was consistent with the findings by the previous report of lymph node 0 c Yuan Journal of Otolaryngology Head and Neck Surgery Page of Table Univariate analysis of demographic and clinicopathologic factors for patients who had lymph nodes in LNCM compared to those who did not Variables Age mean \u00b1 SDAbsent n Present n P value\u2030\u00a4 Gender Female Male Tumor size cm \u2030\u00a5 cm Coexistent thyroid Nodular goiter Yes No Toxic goiter Yes No Hashimo to\u2122s disease Yes No Tumor focality Multifocality Unifocality Tumor locati on In feri or porti on Upper Middle porti on Extrathyroidal extensi on Yes No Central cervical metastasis Yes No Lateral cervical metastasis Level IIYes No Level IIIYes No Level IVYes No LNCM Lymph Node between superficial layer of deep Cervical fascia and deep fascia of in frahyoid Musclesmetastasis", "For many years doxorubic in was the only US Food and Drug Administrati on FDA\"approved treatment for patients with advanced thyroid cancer however response rate in patients with MTC is up to with significant to xicity \" Recently in advanced MTC several TKIs such as axitinib cabozantinib gefitinib lenvatinib imatinib motesanib sorafenib pazopanib sunitinib and vandetanib have been studied in phase I IIand III clinical trials Vandetanib an oral in hibit or of VEGFRvascular endothelial growth fact or recept or RET and EGFRepidermal growth fact or recept or was approved by the FDA in April after a phase III trial demonstrated improvedmedian progressionfree survival PFS compared to placebohazard ratio CI \" and overall response rate of Cabozantinib an in hibit or of hepatocyte growthfact or recept or MET VEGFR 2 and RET was approved bythe FDA in after a phase III trial demonstrated improvedmedian PFS of months relative to months in the placebo group The impact of to xicity on patientsw as clearly in dicated and for cabozantinib of patientsrequired dose reductions and required dosing delays The refore to xicity of FDAapproved TKI agents limits their usein patients with small volume as ymptomatic or in dolent disease Furthermore no clear data exist from these studies thateither agent impacts overall survival In additi on RETspecific TKIs in development are Selpercatinib previously LOXO 292 and Blue 667 with more specific RETtargeting activity The seagents have demonstrated evidence of efficacy in early trial", "thyroid carcinoma PTC tissues elevated PDLIM 5 expressi on promotes the migrati on in vasi on and proliferati on of PTC cells by activating the RASERK pathway Wei PDLIM 5 may the refore serve as a the rapeutic target in a variety of cancers It can promote the in vasi on and metastasis of cancercells Genotyping chip detecti on experiments have shown that PDLIM 5 is over expressed in prostate cancer tissue Koutros and some studies have proved that the utility of serum and urine PDLIM 5 levels as in dicators for auxiliary diagnosis of prostate cancer with potential value in predicting the risk of progressi on in advanced prostate cancer PCA Ma PDLIM 5 plays a key role in regulating the proliferati on in vasion and migrati on of malignant tumor cells by binding to AMPK and regulating its activati on and degradati on Liu PDLIM 5 may the refore act as an on cogene in the development and progressi on of PCAIn view of the important role of PDLIM 5 in cancer somestudies have in dicated that it is in volved in the growth of gastriccancer cells and suggested that PDLIM 5 silencing through theuse of small in terfering RNAs si RNA may be a potentialstrategy for the treatment of gastric cancer Li In additi on Edlund found that the in creased expression of PDLIM 5 is related to high tumor proliferati on rates in nonsmall cell carcinoma Edlund Steroids such as corticosteroid medications play an important role in the development of cancer it has been reported that singlenucleotide polymorphisms SNPs in PDLIM 5 in teract with steroids thus aecting the occurrence and development of cancer Wang The above findings show that P", "Papillary thyroid carcinoma PTCis acomm on thyroid malignancy accountingf or about of systemic malignancies 1 PTC is currently characterized by a highincidence and low mortality 2 clinical Recentimprovements in highfrequencyultrasonic diagnostic technologies and the applicati on of ultrasoundguided puncturetechniques have led to an apparent in crease in the in cidence of PTC year by year 3\"Regardingthyroidtumors the palpati on detecti on rate for thyroid microtumors in the general populati on is about compared with as high as to for highfrequency ultrasound 6 which has thus greatly improved disease diagnosisdiagnosisthe of Surgical resecti on is a routine treatmentf or thyroid tumors but the recurrence rateis usually high and the consequent reducti on in thyroid functi on can seriously affect the patient\u2122s quality of life 7 As sociated with the in creasing detecti on rate of thyroidtumors and the pursuit of minimally in vasive treatments radiofrequency ablati on RFA has been gradually applied in the clinic RFA uses local hyperthermia to cause tissue necrosis The the rmal effectsdo not depend on the tissue type and most lesions can be completely eliminated by RFA 89 RFA has thus become a novellocal treatment for tumors The clinical diagnosis of benign and malignant thyroid tumors currently depends on the clinical manifestations and pathological examinations However the clinicalmanifestations are mostly derived from involvessubjective empirical analysis while a finalpathological diagnosisinvasiveprocedures with lesssatisfactory specificity It is the refore necessary to identifyappropriatepredictivetum or markersdiagnosticandforimplications The collagenases matrix metalloproteinase MMP 2 and MMP 9 can degradetype IV collagen in the basement membrane with importanttumorangiogenesis and tumor cell in vasi on and metastasis 10 MMP 2 and MMP 9 expressi on levels were found to be upregulated in thyroid cancer tissue 11 however the sestudies mostly examined pathological tiss"], "answer": "Insufficient evidence in provided documents."}
{"question": "What factors predict recurrence in papillary thyroid carcinoma?", "contexts": ["ocalcemia transient per manent and Table Thyroid pathology in the patients Pathologyn Benign Normal thyroid tissue Colloid nodule Cyst Adenoma Thyroiditis Graves\u2122 disease Thyroid cancer Papillary Follicular Medullary Hurthle Anaplastic Total Data are number Table Benign and malignant lesions in patients Benignn 37 Malignantn 66 P value Age meanyears Gender malefemale Presence of nodule Hypocalcemia Recurrent laryngeal nerve palsy Bleedinghematoma Wound in fecti on Tracheal in jury Overall complications Mean length of stay days MEN recurrent laryngeal nerve palsy transient per manent all were unilateral Table Of patients with malignant lesions had lymph node metastasis and patients had distant metastases to the lung None of the patients developed postoperative bleeding wound in fecti on or tracheal in jury Patients were followed up for a mean of months median range months radioactive iodine treatment was delivered to patients with malignant lesions patients had recurrences were local recurrences and were local and distant recurrences to the lung Three cases received radioactive iodine RAI before and after recurrence One case was low risk before recurrence so did not receive RAI until after recurrence One case had medullary thyroid cancer so did not receive RAI In the remaining five cases there was no clear data whether those patients received RAI before or only after a recurrence All local recurrences under went resecti on except for one patient who was lost follow up There was no mortality in this study", "Characteristics of patients The study group in cluded papillary thyroid cancers PTC follicular thyroid cancers FTC and poorlydifferentiated thyroid cancers PDTCThere were women and men The mean agew as \u00b1 years Three hundred and seventytwo patients were prepared with rh TSH stimulati on Eightytwo patients presented positive Tg Ab at the time of postoperative RAI treatment In the postoperative setting prior to RAI administrati on patients were at low risk LR at in termediaterisk IR and at high risk HRaccording to the ATA risk Per sistent disease and tumor burden Overall PD was detected in patients Their characteristics in terms of ATA risk RAI preparati on modality PD sites and RAI or 18 FDG uptake arepresented in Table Of patients had very smallvolumelargevolume smallvolume and PDFigure shows two points First the rate of PDincreased from in LR patients and in IR to in HR patients p Second the per centage of patients with largevolume PD in creased with risk stratificati on from LRIR to HR patients and respectively p Table Characteristics of patients according to the ATA riskstratificati on system in the postoperative setting Mean age \u00b1 SD yrs Sex ratio Female Mean tumor size \u00b1 SD mm Histology PTCFTCPDTCAggressive pathological subtypes No Yes Extrathyroidal extensi on Minimal Gross T status TNM T 1 a T 1 b T 2 T 3 a T 3 b T 4 a T 4 b N status TNM Nx N 0 N 1 a N 1 b M status TNM M 0 M 1 Positive Tg Ab level Stimulated Tg level at RAI treatment", "Papillary thyroid carcinoma PTCis acomm on thyroid malignancy accountingf or about of systemic malignancies 1 PTC is currently characterized by a highincidence and low mortality 2 clinical Recentimprovements in highfrequencyultrasonic diagnostic technologies and the applicati on of ultrasoundguided puncturetechniques have led to an apparent in crease in the in cidence of PTC year by year 3\"Regardingthyroidtumors the palpati on detecti on rate for thyroid microtumors in the general populati on is about compared with as high as to for highfrequency ultrasound 6 which has thus greatly improved disease diagnosisdiagnosisthe of Surgical resecti on is a routine treatmentf or thyroid tumors but the recurrence rateis usually high and the consequent reducti on in thyroid functi on can seriously affect the patient\u2122s quality of life 7 As sociated with the in creasing detecti on rate of thyroidtumors and the pursuit of minimally in vasive treatments radiofrequency ablati on RFA has been gradually applied in the clinic RFA uses local hyperthermia to cause tissue necrosis The the rmal effectsdo not depend on the tissue type and most lesions can be completely eliminated by RFA 89 RFA has thus become a novellocal treatment for tumors The clinical diagnosis of benign and malignant thyroid tumors currently depends on the clinical manifestations and pathological examinations However the clinicalmanifestations are mostly derived from involvessubjective empirical analysis while a finalpathological diagnosisinvasiveprocedures with lesssatisfactory specificity It is the refore necessary to identifyappropriatepredictivetum or markersdiagnosticandforimplications The collagenases matrix metalloproteinase MMP 2 and MMP 9 can degradetype IV collagen in the basement membrane with importanttumorangiogenesis and tumor cell in vasi on and metastasis 10 MMP 2 and MMP 9 expressi on levels were found to be upregulated in thyroid cancer tissue 11 however the sestudies mostly examined pathological tiss", "were in dependently determined by two qualified pathologists without any prior knowledge of the patients\u2122 clinical data Data collecti on and statistics analysis To determine the relati on between LNCM metastasis and clinicopathologic factors such as age sex primary tumorsite lateral cervical lymph node metastasis level VI metastasis the chisquare test and Fisher\u2122s exact test were used as appropriate Multivariate logistic regressi on analysisw as per formed to identify risk factors for LNCM metastasis of PTC P was considered statistically significant All calculations were per formed using SPSS for windows Postthyroidectomy hypocalcemia lasting for morethan months was considered as per manent VCP All patients were followed up every \" months postoperatively Patients detected with LNCMAfter reviewing patients who under went thyroidectomy plus CND with or without lateral neck dissection from January to January patients were detected with LNCM and patients wereabsent of LNCM The average tumor size of LNCM was cm and the mean number of lymph nodes sampled from LNCM was ranging from to Table shows the comparis on of clinicopathologic characteristics between the present LNCM group and the absent group In univariate analysis Hashimo to\u2122s disease p multifocality leisions p the tumor located in inferi or porti on p extrathyroidal extensi on ETE p central cervical metastasis p level III and level IV metastasis p were significantly as sociated with high prevalence of LNCM Patients with metastatic LNCMAmong a total of patients with LNCM metastatic LNCM was found in patients Table compares the clinicopathologic characteristics between the metastatic LNCM group and the nonmetastatic LNCMgroup Three hundred eightythree patients were confirmed free of LNCM metastasis of the mwith clinically negative node per formed p CND and of them with clinically positive per formed t CND All the patients in the metastatic LNCM group per formedt CND Lateral neck dissecti on was per formed in cases i", "henhua []tissue TNF\u03b1 tumor necrosis factora DTC differentiated thyroid carcinoma IL 6 in terleuk in 6 PTC papillary thyroid carcinoma FTC follicular thyroid carcinoma AT Canaplastic thyroid carcinoma MTC medullary thyroid carcinoma WDTC welldifferentiated thyroid carcinoma FNAC fine needle as pirati on cytologynodular goiter PTCQuality of in cluded studies The quality as sessment of these studies is as sessed bythe NOS and the resultis shown in Supplemental Table Five or more scores are determined as highquality Two studies conducted by Cao G in [] and L Kayser in [] only get two scoresshowing a poor quality in methodology The rest studies are as sessed as high quality TNF\u03b1 and thyroid carcinoma Twelve studies reported the expressi on of TNF\u03b1 both in patients with thyroid carcinoma and control subjects[\" \" ] Among these sevenstudies [ ] had tested the level of serum TNF\u03b1 two studies [ ] had tested the expressi on of TNF\u03b1 in tissues and the ratio of TNF\u03b1 immunoreactivity was tested in four studies [ ] Firstly fixedeffect model is used to merge the SMDvalues of serum TNF\u03b1 level however a large heterogeneity is found by the heterogeneity analysis heterogeneity test Chi 2 P I 2 and itmay be due to the different units differenttesting", "in cancer tissues [ ] yu xiao conducted a clinical studycomparing the level of serum lept in in ptc patientsincluding patients with lymph node metastasis and thyroid adenoma patients in dalian china and foundth at patients with lymph node metastasis have a higherlevel of lept in than those without lymph node metastasislept in can in duce the expressi on of vascular endothelialgrowth fact or and promote neovascularizati on in tumortissue in additi on it can also in hibit the apoptosisthrough bcl 2 dependent mechanism meanwhile leptinrecept or exists in all thyroid cancer cells it is over expressed in ptc and is in volved in tumor in vasi on and lymph node metastasis [ ] thus lept in may be in volved in the tumorigenesis and metastasis of thyroid cancer through a complex pathway and a monitoringmay have some significance due to the absence of directevidence elevated lept in levels can also be caused by thyroid carcinoma the cause and effect relationship between lept in and thyroid carcinoma are unclear now and need further studiescompared to lean women over weightobese womenhad lower serum adiponect in levels and this differenceh as statistical significance in additi on adiponectinis negatively as sociated with a variety of benign and malignant tumors especially those as sociated with obesity and in sulin resistance such as leukemia renal carcinoma gastric carcinoma and colon cancer moreover the as sociati on of adiponect in with potential tumorlimiting functions has been widely proposed otvos l jr tried in vitro experiments and proved that adiponect in can in hibit the metastasis of cancer cells mitsiades n measured circulatingadiponect in levels in ptai ents with ptc and found thatit is in dependently and in versely as sociated with the risk of thyroid cancer as the recept or that binds to adiponect in for biological effects adiponect in recept or hadbeen reported closely correlated with the development of ptc adiponect in recept or 1 and are higher expressi on in p", "we used the Gene Expressi on Profiling In teractive Analysis database to verify the expressi on of key genes in PTC and adjacent tissues The overall survival and diseasefree survivalanalyses were per formed by Kaplan\"Meier plots for these PTCrelated hub genes Genetic alterations of hub genes in PTC and their correlations with other genes were analyzed utilizing the c Bio Portal for Cancer Genomics Hub genesrelated to clinicopathological features were analyzed using the on line database UALCAN httpualcanpathuabedu[] The correlati on of ADORA 1 APOE and LPAR 5 expressi on with the immune in filtrati on level in PTC and the expressi on of these three genes in different kinds of cancers was per formed using the Tumor Immune Estimati on Resource database []For q RTPCR analysis total RNA was isolated from normal and cancerous papillary thyroid samples utilizing TRIzol reagent Qiagen Valencia CA USA c DNA was synthesized with RNA reverse transcripti on kit TIANGENBIOTECH Beijing China q RTPCR was per formed with an ABI Real Time PCR System Applied Biosystems Life Technologies USA The expressi on of the genes of in terest was normalized to actin The primers for ADORA 1 APOE LPAR 5 and actin are shown in Table For Western blot RIPA buffer was used to extract prote in from four pairs of tissue from PTC patients and the prote in concentrations were measured via BCA Differentially expressed genes screening based on RNASeq To screen out the genes or modules that may play a role in promoting cancer in papillary thyroid carcinoma weperformed RNASeq experiments on four pairs of thyroid cancer tissues and their matched paracancerous tissues to obta in differentially expressed genes After RNASeq we acquire \" milli on reads for each sample The fold changesbetween PTC cancer tissues and matched paracancerous samples were calculated Setting the cutoff criteri on as Pvalue and a fold change there were upregulated and downregulated genes These DEGswere considered to be candidate genes for", "IO 3 m RNA was found to be upregulated in MCF 7 cells and downregulated in MDAMB 231 cells when compared to the nontumoral cell line MCF 10 A cells DIO 3 mediated T 3 deiodinati on also occurs in MCF 7 cells In these cells DIO 3 expressi on is to regulated by retinoids but not by estradiol 37\" These findings are consistent with the presence of DIO 3 in other tissues of ectodermal or igin such as the skin and the nervous system 4041 The role of thyroid hormone metabolism on human tumorigenesis has been largely debated 10 In breast cancer previous studies showed that higher levels of the thyroid hormone recept or alpha were an in dependent prognostic fact or for in creased overall survival 42 More recently high levels of the thyroid hormone recept or beta in breast tumors were also as sociated with in creased breast cancerspecific survival 43 In basal cell carcinom as BCC for in stance a DIO 3 mediated decrease in T 3 levels relates to in creased cell proliferati on 31 Similarly in colon cancer cells DIO 3 knockdown and consequent in creases in T 3 levels are as sociated with reduced cell proliferati on and in ducti on of differentiati on 44 High levels of DIO 3 expressi on in primary PTC tumors were as sociated with advanced disease at the diagnosis 30 Some data in deed suggest that T 3 can contribute to tumor growth in breast cancer cells in a 0 vitro 17 while a micro environment with low T 3 levels could facilitate in vasiveness and dedifferentiati on However in agreement with our data in breast cancer similar levels of DIO 3 m RNA are observed in glioblastoma and liver carcinom as as compared to respective normal tissues 45 These differences could be at tributed to the tissue embryological or igin since the tissues of ectodermal or igin seem to mainta in DIO 3 expressi on during adulthood while DIO 3 gene is subject to imprinting in other tissues Loss of DIO 3 expressi on was as sociated with tumor aggressiveness in colon cancer and also in thyroid cancer DIO 3 ex", "of oral contracept ive In the patient was directed to psychiatry for suspected cognitive impairment In she had severe microcytic and hypochromicanemia and was treated with saccharized ferric oxide Gynecological ultrasound without major changes and occultstool was negative After hematological research clinical research von Willebr and\u2122s disease was excluded in the blood In she was admitted to endocrinology due to changes in thyroid analytical parameters TSH and T 4 and 5 cm thyroid nodule in the left lobe An ultrasoundw as per formed which identifies a 56 cm hypoechogenicnodule and anecogenic areas the largest with cm Subsequently she per formed a fineneedle biopsy andw as diagnosed with follicular lesi on of undetermined significance FLUS Bethesda category III After a multidisciplinary meetingit was decided to in tervene the patient with total thyroidectomy In September she under went g total thyroidectomy and was diagnosed with papillary carcinomasolidtrabecular variant Fig Concomitantly she per forms ablative the rapy with MBq m Ci of I 131 and is treated with levothyroxine and calcium In January research scintigraphy after 24 h oral I 131 wasadministrati on of MBq m Ci of Fig Solidtrabecular variant of papillary carcinoma Welldefined tumor with trabecular pattern a composed by follicular cells with nuclearfeatures of papillary carcinoma b and expressi on of TTF 1 c 0 c Miguelote World Journal of Surgical On cology Page of Fig a Right breast lump b Radiological image of the breast lesionconducted revealing anteri or cervical uptake focus compatible with", "Calciton in and CEA decreased in of patients and one of the sepatients had complete regressi on of detectable liver metastasis and reducti on of pulmonary lesions A phase I study using the heatkilled yeast CEA vaccine GI 6207 was per formed at the National Cancer In stitute NCI A total of patients wereenrolled in a classic phase I design at dose levels One patient with MTC had a significant 'amm atory response at the sites of her tumors and a substantial and sustained antigenspecificimmune response Furthermore the relatively low to xicity profile of the rapeutic cancer vaccines could be advantageous compared to approved tyrosine kinase in hibitors TKIs for some patients with in dolent recurrent or metastatic MTC Here we presenta case of a patient with recurrent MTC who was enrolled ona clinical trial with yeastbased vaccine targeting CEA Uponsurgical resecti on after vaccine his tumor was found to expressprogrammed deathlig and PDL 1 which may expla in the patient\u2122s subsequent reponse to a PDL 1 in hibit or CASE PRESENTATIONWe report a 61 yearold male who in itially presented with anenlarging anteri or neck mass that was biopsied and found tobe consistent with the diagnosis of MTC no known somatic ermline mutati on of the RET protooncogene Subsequentlyhe under went a total thyroidectomy with bilateral neck lymphnode dissecti on He then had multiple local recurrences resulting in a total of five neck surgeries the last one occurring years after diagnosis Based on the elevated CTN levels and persistent local recurrence he then started systemic treatment with olabel sunitinib years after diagnosis While on sunitinib his CTN levels nadired to pgml reference pgml down from pgml months after startingtreatment He continued for years and then stopped due to side eects His CTN levels after discontinuing sunitinib rose to pgml On followup imaging studies there was no evidence of distant metastases and he presented to the NCI with diseaseinvolving his thyroid bed and cervical"], "answer": "Factors predicting recurrence in papillary thyroid carcinoma (PTC) include:\n\n1. **Risk Stratification**: Patients categorized as high risk (HR) according to the ATA risk stratification system have a higher rate of persistent disease (PD) compared to low risk (LR) and intermediate risk (IR) patients (Context 2).\n\n2. **Tumor Characteristics**: Larger tumor size, extrathyroidal extension (ETE), and aggressive pathological subtypes are associated with increased recurrence risk (Context 2, Context 4).\n\n3. **Lymph Node Metastasis**: The presence of lymph node metastasis (LNCM) is significantly associated with higher recurrence rates (Context 4).\n\n4. **Age and Gender**: Younger age and female gender may also influence recurrence, although specific data on these factors is not detailed in the provided contexts (Context 2).\n\n5. **Biomarkers**: Elevated levels of certain biomarkers, such as leptin, have been linked to lymph node metastasis and may indicate a higher risk of recurrence (Context 6).\n\nInsufficient evidence in provided documents."}
{"question": "Are calcitonin or thyroglobulin used as prognostic biomarkers in thyroid cancer?", "contexts": ["henhua []tissue TNF\u03b1 tumor necrosis factora DTC differentiated thyroid carcinoma IL 6 in terleuk in 6 PTC papillary thyroid carcinoma FTC follicular thyroid carcinoma AT Canaplastic thyroid carcinoma MTC medullary thyroid carcinoma WDTC welldifferentiated thyroid carcinoma FNAC fine needle as pirati on cytologynodular goiter PTCQuality of in cluded studies The quality as sessment of these studies is as sessed bythe NOS and the resultis shown in Supplemental Table Five or more scores are determined as highquality Two studies conducted by Cao G in [] and L Kayser in [] only get two scoresshowing a poor quality in methodology The rest studies are as sessed as high quality TNF\u03b1 and thyroid carcinoma Twelve studies reported the expressi on of TNF\u03b1 both in patients with thyroid carcinoma and control subjects[\" \" ] Among these sevenstudies [ ] had tested the level of serum TNF\u03b1 two studies [ ] had tested the expressi on of TNF\u03b1 in tissues and the ratio of TNF\u03b1 immunoreactivity was tested in four studies [ ] Firstly fixedeffect model is used to merge the SMDvalues of serum TNF\u03b1 level however a large heterogeneity is found by the heterogeneity analysis heterogeneity test Chi 2 P I 2 and itmay be due to the different units differenttesting", "of clinical studies provide evidence for basic research simonovic sz evaluated cytokine profiles determined in supernatants obtained from whole blood cultures in patients with dtc before and days after radioactiveiodine 131 itherapy and control subjects and found that the expressi on of tnf\u03b1 in dtc patients ishigher than control subjects and it showed a decreasedlevel after 131 i the rapy than those before the rapy however no statistical difference found for the limited sample size another study conducted by kobawala tp with more patients patients with benign thyroid disease ptc patients and healthy in dividuals determined the circulating levels of tnf\u03b1 and it wasfound that the serum level of tnf\u03b1 was significantlyhigher in ptc patients than benign thyroid disease patients and the later was also significantly higher thanhealthy in dividuals furthermore serum tnf\u03b1 was reported to be a significant prognosticat or for overall survival in ptc patients it is a pity thatopposite result wasreported in a casecontrol study that in cluded dtccases and matched cancerfree cohort participantswhich found that tnfa was not as sociated with thyroidrisk in either gender based on current evidence our meta analysis suggeststh at tnf\u03b1 exhibit a strong as sociati on with thyroid carcinoma it may because that elevated tnf\u03b1 may in volved in the tumorigenesis and development of thyroid cancer another possible reas on is that the tnf\u03b1 decreased with tumor cells less resulted the activati on ofthe immune system by thyroid carcinomathereforemore clincal studies and basic reseaches should be conducted in the futureil 6 a multifunctional cytokine plays important roles in different types of cells in cluding tumor cells it", "Papillary thyroid carcinoma PTCis acomm on thyroid malignancy accountingf or about of systemic malignancies 1 PTC is currently characterized by a highincidence and low mortality 2 clinical Recentimprovements in highfrequencyultrasonic diagnostic technologies and the applicati on of ultrasoundguided puncturetechniques have led to an apparent in crease in the in cidence of PTC year by year 3\"Regardingthyroidtumors the palpati on detecti on rate for thyroid microtumors in the general populati on is about compared with as high as to for highfrequency ultrasound 6 which has thus greatly improved disease diagnosisdiagnosisthe of Surgical resecti on is a routine treatmentf or thyroid tumors but the recurrence rateis usually high and the consequent reducti on in thyroid functi on can seriously affect the patient\u2122s quality of life 7 As sociated with the in creasing detecti on rate of thyroidtumors and the pursuit of minimally in vasive treatments radiofrequency ablati on RFA has been gradually applied in the clinic RFA uses local hyperthermia to cause tissue necrosis The the rmal effectsdo not depend on the tissue type and most lesions can be completely eliminated by RFA 89 RFA has thus become a novellocal treatment for tumors The clinical diagnosis of benign and malignant thyroid tumors currently depends on the clinical manifestations and pathological examinations However the clinicalmanifestations are mostly derived from involvessubjective empirical analysis while a finalpathological diagnosisinvasiveprocedures with lesssatisfactory specificity It is the refore necessary to identifyappropriatepredictivetum or markersdiagnosticandforimplications The collagenases matrix metalloproteinase MMP 2 and MMP 9 can degradetype IV collagen in the basement membrane with importanttumorangiogenesis and tumor cell in vasi on and metastasis 10 MMP 2 and MMP 9 expressi on levels were found to be upregulated in thyroid cancer tissue 11 however the sestudies mostly examined pathological tiss", "ocalcemia transient per manent and Table Thyroid pathology in the patients Pathologyn Benign Normal thyroid tissue Colloid nodule Cyst Adenoma Thyroiditis Graves\u2122 disease Thyroid cancer Papillary Follicular Medullary Hurthle Anaplastic Total Data are number Table Benign and malignant lesions in patients Benignn 37 Malignantn 66 P value Age meanyears Gender malefemale Presence of nodule Hypocalcemia Recurrent laryngeal nerve palsy Bleedinghematoma Wound in fecti on Tracheal in jury Overall complications Mean length of stay days MEN recurrent laryngeal nerve palsy transient per manent all were unilateral Table Of patients with malignant lesions had lymph node metastasis and patients had distant metastases to the lung None of the patients developed postoperative bleeding wound in fecti on or tracheal in jury Patients were followed up for a mean of months median range months radioactive iodine treatment was delivered to patients with malignant lesions patients had recurrences were local recurrences and were local and distant recurrences to the lung Three cases received radioactive iodine RAI before and after recurrence One case was low risk before recurrence so did not receive RAI until after recurrence One case had medullary thyroid cancer so did not receive RAI In the remaining five cases there was no clear data whether those patients received RAI before or only after a recurrence All local recurrences under went resecti on except for one patient who was lost follow up There was no mortality in this study", "Characteristics of patients The study group in cluded papillary thyroid cancers PTC follicular thyroid cancers FTC and poorlydifferentiated thyroid cancers PDTCThere were women and men The mean agew as \u00b1 years Three hundred and seventytwo patients were prepared with rh TSH stimulati on Eightytwo patients presented positive Tg Ab at the time of postoperative RAI treatment In the postoperative setting prior to RAI administrati on patients were at low risk LR at in termediaterisk IR and at high risk HRaccording to the ATA risk Per sistent disease and tumor burden Overall PD was detected in patients Their characteristics in terms of ATA risk RAI preparati on modality PD sites and RAI or 18 FDG uptake arepresented in Table Of patients had very smallvolumelargevolume smallvolume and PDFigure shows two points First the rate of PDincreased from in LR patients and in IR to in HR patients p Second the per centage of patients with largevolume PD in creased with risk stratificati on from LRIR to HR patients and respectively p Table Characteristics of patients according to the ATA riskstratificati on system in the postoperative setting Mean age \u00b1 SD yrs Sex ratio Female Mean tumor size \u00b1 SD mm Histology PTCFTCPDTCAggressive pathological subtypes No Yes Extrathyroidal extensi on Minimal Gross T status TNM T 1 a T 1 b T 2 T 3 a T 3 b T 4 a T 4 b N status TNM Nx N 0 N 1 a N 1 b M status TNM M 0 M 1 Positive Tg Ab level Stimulated Tg level at RAI treatment", "IO 3 m RNA was found to be upregulated in MCF 7 cells and downregulated in MDAMB 231 cells when compared to the nontumoral cell line MCF 10 A cells DIO 3 mediated T 3 deiodinati on also occurs in MCF 7 cells In these cells DIO 3 expressi on is to regulated by retinoids but not by estradiol 37\" These findings are consistent with the presence of DIO 3 in other tissues of ectodermal or igin such as the skin and the nervous system 4041 The role of thyroid hormone metabolism on human tumorigenesis has been largely debated 10 In breast cancer previous studies showed that higher levels of the thyroid hormone recept or alpha were an in dependent prognostic fact or for in creased overall survival 42 More recently high levels of the thyroid hormone recept or beta in breast tumors were also as sociated with in creased breast cancerspecific survival 43 In basal cell carcinom as BCC for in stance a DIO 3 mediated decrease in T 3 levels relates to in creased cell proliferati on 31 Similarly in colon cancer cells DIO 3 knockdown and consequent in creases in T 3 levels are as sociated with reduced cell proliferati on and in ducti on of differentiati on 44 High levels of DIO 3 expressi on in primary PTC tumors were as sociated with advanced disease at the diagnosis 30 Some data in deed suggest that T 3 can contribute to tumor growth in breast cancer cells in a 0 vitro 17 while a micro environment with low T 3 levels could facilitate in vasiveness and dedifferentiati on However in agreement with our data in breast cancer similar levels of DIO 3 m RNA are observed in glioblastoma and liver carcinom as as compared to respective normal tissues 45 These differences could be at tributed to the tissue embryological or igin since the tissues of ectodermal or igin seem to mainta in DIO 3 expressi on during adulthood while DIO 3 gene is subject to imprinting in other tissues Loss of DIO 3 expressi on was as sociated with tumor aggressiveness in colon cancer and also in thyroid cancer DIO 3 ex", "we used the Gene Expressi on Profiling In teractive Analysis database to verify the expressi on of key genes in PTC and adjacent tissues The overall survival and diseasefree survivalanalyses were per formed by Kaplan\"Meier plots for these PTCrelated hub genes Genetic alterations of hub genes in PTC and their correlations with other genes were analyzed utilizing the c Bio Portal for Cancer Genomics Hub genesrelated to clinicopathological features were analyzed using the on line database UALCAN httpualcanpathuabedu[] The correlati on of ADORA 1 APOE and LPAR 5 expressi on with the immune in filtrati on level in PTC and the expressi on of these three genes in different kinds of cancers was per formed using the Tumor Immune Estimati on Resource database []For q RTPCR analysis total RNA was isolated from normal and cancerous papillary thyroid samples utilizing TRIzol reagent Qiagen Valencia CA USA c DNA was synthesized with RNA reverse transcripti on kit TIANGENBIOTECH Beijing China q RTPCR was per formed with an ABI Real Time PCR System Applied Biosystems Life Technologies USA The expressi on of the genes of in terest was normalized to actin The primers for ADORA 1 APOE LPAR 5 and actin are shown in Table For Western blot RIPA buffer was used to extract prote in from four pairs of tissue from PTC patients and the prote in concentrations were measured via BCA Differentially expressed genes screening based on RNASeq To screen out the genes or modules that may play a role in promoting cancer in papillary thyroid carcinoma weperformed RNASeq experiments on four pairs of thyroid cancer tissues and their matched paracancerous tissues to obta in differentially expressed genes After RNASeq we acquire \" milli on reads for each sample The fold changesbetween PTC cancer tissues and matched paracancerous samples were calculated Setting the cutoff criteri on as Pvalue and a fold change there were upregulated and downregulated genes These DEGswere considered to be candidate genes for", "were in dependently determined by two qualified pathologists without any prior knowledge of the patients\u2122 clinical data Data collecti on and statistics analysis To determine the relati on between LNCM metastasis and clinicopathologic factors such as age sex primary tumorsite lateral cervical lymph node metastasis level VI metastasis the chisquare test and Fisher\u2122s exact test were used as appropriate Multivariate logistic regressi on analysisw as per formed to identify risk factors for LNCM metastasis of PTC P was considered statistically significant All calculations were per formed using SPSS for windows Postthyroidectomy hypocalcemia lasting for morethan months was considered as per manent VCP All patients were followed up every \" months postoperatively Patients detected with LNCMAfter reviewing patients who under went thyroidectomy plus CND with or without lateral neck dissection from January to January patients were detected with LNCM and patients wereabsent of LNCM The average tumor size of LNCM was cm and the mean number of lymph nodes sampled from LNCM was ranging from to Table shows the comparis on of clinicopathologic characteristics between the present LNCM group and the absent group In univariate analysis Hashimo to\u2122s disease p multifocality leisions p the tumor located in inferi or porti on p extrathyroidal extensi on ETE p central cervical metastasis p level III and level IV metastasis p were significantly as sociated with high prevalence of LNCM Patients with metastatic LNCMAmong a total of patients with LNCM metastatic LNCM was found in patients Table compares the clinicopathologic characteristics between the metastatic LNCM group and the nonmetastatic LNCMgroup Three hundred eightythree patients were confirmed free of LNCM metastasis of the mwith clinically negative node per formed p CND and of them with clinically positive per formed t CND All the patients in the metastatic LNCM group per formedt CND Lateral neck dissecti on was per formed in cases i", "For many years doxorubic in was the only US Food and Drug Administrati on FDA\"approved treatment for patients with advanced thyroid cancer however response rate in patients with MTC is up to with significant to xicity \" Recently in advanced MTC several TKIs such as axitinib cabozantinib gefitinib lenvatinib imatinib motesanib sorafenib pazopanib sunitinib and vandetanib have been studied in phase I IIand III clinical trials Vandetanib an oral in hibit or of VEGFRvascular endothelial growth fact or recept or RET and EGFRepidermal growth fact or recept or was approved by the FDA in April after a phase III trial demonstrated improvedmedian progressionfree survival PFS compared to placebohazard ratio CI \" and overall response rate of Cabozantinib an in hibit or of hepatocyte growthfact or recept or MET VEGFR 2 and RET was approved bythe FDA in after a phase III trial demonstrated improvedmedian PFS of months relative to months in the placebo group The impact of to xicity on patientsw as clearly in dicated and for cabozantinib of patientsrequired dose reductions and required dosing delays The refore to xicity of FDAapproved TKI agents limits their usein patients with small volume as ymptomatic or in dolent disease Furthermore no clear data exist from these studies thateither agent impacts overall survival In additi on RETspecific TKIs in development are Selpercatinib previously LOXO 292 and Blue 667 with more specific RETtargeting activity The seagents have demonstrated evidence of efficacy in early trial", "suggest that Raman spectroscopy may over come the limits of current diagnostic tools Detecti on of nodular thyroid pathology is in creasing worldwide paired with an in creased number of thyroid cancer diagnosis 1 Whether this \u0153epidemic\u009d spread is real or is due to an exaggerated use of imaging tools in clinical practice is object of a vivid debate with in the scientific community Anyway management of patients with thyroid nodule causes a clinical problem and a social burden as well 2 To avoid over diagnosis and over treatment of these patients physicians need additional in formati on about the biology of each thyroid nodule In particular there is need for a tool able to distinguish between benign and malignant follicular lesions and between in dolent and aggressive tumors 3 The genomic profile of thyroid tumors has been extensively in vestigated 4 and several immunocytochemical and molecular markers have been proposed for a more accurate classificati on of thyroid nodules 5 However none of these markers reaches a reliable sensibility and specificity to be routinely used in clinical setting 6 Moreover although the major genetic alterations of thyroid tumors are known only little in formati on if any is available about changes in prote in lipids and other cellular constituents due to thyroid on cogenesis To correctly manage patients with thyroid nodules and to avoid unnecessary surgery we strongly need a method of analysis that over comes the limits of current diagnostic tools by identifying specific tumoral markers possibly with high spatial resoluti on and low impact on the patient Cells and tissues are characterized by a specific biochemical compositi on Each pathology or cellular abnormality is accompanied by biochemical molecular changes Optical and spectroscopic techniques that correlate the biochemical compositi on molecular structure and their variations with the morphological alterations represent a powerful diagnostic and potentially clinical tool 8 Among"], "answer": "Insufficient evidence in provided documents."}
